,title,rating,pros,cons,company
0,"""Good""",5.0,Systematic working environment with safe care.,Good care and patient management,HCA Healthcare
1,"""RN experience""",4.0,Great staff and flexible with scheduling.,Short staffed at times.,HCA Healthcare
2,"""Committed to improving patient care and staff.""",4.0,"Back to school assistance, Loan repayment, scholarships for children","Meditech, security/safety in parking garage of hospital, supply shortages.",HCA Healthcare
3,"""Welcoming culture, relaxed environment, and""",4.0,Upper management is very open and responsive to employee concerns gives positive feedback for hard work. They will always check in on their employees and upward mobility is very possible.,Change within a department may take a longer time than expected.,HCA Healthcare
4,"""Good Place to Work""",5.0,"Health Benefits, Education Assistance, Good Team around me","Performance Culture, Data is everything, many competing metrics",HCA Healthcare
5,"""Great company""",5.0,Decent benefits. Paid tuition. Steady work and reliable. Pay is good.,Takes time to get promoted.,HCA Healthcare
6,"""Great Compant""",5.0,I feel like they appreciate their employees and recognize your hard work if you want to grow and succeed in the company.,"The only con that I can really think of is the long and drawn out process of getting new hires on -boarded. In cases where people quit or terminated, it leaves the rest of the staff struggling to cover.",HCA Healthcare
7,"""Good place""",4.0,nice company to work for,none that i can think of,HCA Healthcare
8,"""great place to work as a nurse""",5.0,great place to work as a nurse,the nurse management that I have seen is subpar,HCA Healthcare
9,"""Good Company and Flexible Work/Life Balance""",4.0,The culture is great and projects are challenging. Compensation is fair and leadership is strong.,"401K Match policy could be better, initial PTO accrual rate is a little low, and more flexible work from home policy.",HCA Healthcare
10,"""It was okay for a first job""",3.0,New nurse orientation helpful,"Poor management Money focused, not patient care focused",HCA Healthcare
11,"""Not paid enough""",3.0,Multiple locations to transfer to. Highest paying hospital in Nashville,Don’t get paid enough to live in Nashville. Get paid less than most other cities in the United States,HCA Healthcare
12,"""Just ok""",3.0,Seems to be lots of opportunities for growth,It's like working in a high school,HCA Healthcare
13,"""Pleasant place to work""",4.0,Benefits Teamwork Feels like family Small hospital,Understaffing Management Shared governance Staff meetings Not much change,HCA Healthcare
14,"""Patient care tech""",5.0,"Flexible, good management, good managers",Better teaching Before going on floor,HCA Healthcare
15,"""HCA""",4.0,"student loan repayment, 401 k matching",There is a waiting period for health insurance and other benefit.,HCA Healthcare
16,"""Great people!""",5.0,Everyone is extremely nice. Great environment.,Lower Pay than other hospitals,HCA Healthcare
17,"""Nice Company""",3.0,Flexible schedule and management is very helpful with accommodating for life situation (Family).,"Very heavy workload, very consistent addition to workload but not much financial compensation added",HCA Healthcare
18,"""A lot to learn when you're over-worked""",3.0,"Developed many hard skills, such as Meditech software",This is a for-profit hospital.,HCA Healthcare
19,"""Eh could be better""",3.0,"As a whole the company is great, pay is good, benefits are okay.","Delay in continuing of education, Proper training not provided, management promotes growth but doesn’t follow through",HCA Healthcare
20,"""Not satisfied""",2.0,Very knowledgeable team members Hard working staff Team work,Pay Work conditions (old equipment/broken) Understaffed Very acute patients,HCA Healthcare
21,"""Great""",5.0,"Great place to work, great staff",I have no cons for working here,HCA Healthcare
22,"""Organized clinic""",5.0,Friendly staff Organized Great physicians,Low pay rate Not enough hours,HCA Healthcare
23,"""Great Place to Work. Lots of opportunity.""",4.0,Many opportunities to advance career. Benefits are above industry standards.,Fast Paced Environment. Stress runs high in Healthcare Industry.,HCA Healthcare
24,"""HCA""",5.0,Large based hospital nation wide.,None at the very moment.,HCA Healthcare
25,"""Good staff, OK pay.""",4.0,"This will vary by location, but I liked my co-workers.",Pay is low as a new nurse. There are a lot of travelers.,HCA Healthcare
26,"""ER Paramedic""",3.0,"Transferability, opportunity, decent starting pay","Strict rules from mgmt and corporate, very strict dress code and no tattoos",HCA Healthcare
27,"""benefits""",4.0,"Good health insurance, good PTO accrual","working hours, pay, life/work balance",HCA Healthcare
28,"""Great Company - Too many moving parts""",4.0,Great atmosphere and coworkers.,Care more about the bottom line than tenured loyal employees.,HCA Healthcare
29,"""A Lot of work""",3.0,They have locations all around the country so moving and staying with the same company is easy,"The workload is very heavy, but I feel the base pay doesn't match how much work you put In",HCA Healthcare
30,"""Review""",4.0,"Incredible staff, educational opportunities, advancement opportunities",Lack of resources and staff,HCA Healthcare
31,"""Great benefits and organization""",5.0,Opportunities of promoting within Benefits Salary Adequate Resources to perform role duties,Leadership Politics Lack of Constructive Feedback and professional growth empowerment,HCA Healthcare
32,"""Run if you are the ATL location""",1.0,"The opportunities, benefits and pay.",This company doesn't care about their employees nor patients. They do a lot of things there that could cause you your licence and cause your family member their life if operated on. HCA might be good but the ATL location near Dunwoody is HORRIBLE!!,HCA Healthcare
33,"""Therapy Department""",3.0,"Overall, hours and benefits seem to be good. Company seems to care about employees.",Therapy department didn't seem to have good communication with each other.,HCA Healthcare
34,"""Enjoyed co workers and ER Manager""",3.0,Great coworkers and our manager was always looking out for our best interest.,The hospital as a whole was just worried about making money,HCA Healthcare
35,"""Great Vision, Poor Implimentation""",3.0,"Stable pay, benefits, patient focused care while care is being performed.","Poor communication up and down the chain of command, especially for recently acquired offices or those not near the central office. Inability of practice level leadership to adequately hire and retain their employees, inability of practice level leadership to promote exceptional employees without clearance (that will never come). Difficulty for physicians to give the care they want due to corporate guidelines.",HCA Healthcare
36,"""HCA""",3.0,Good people to work with. Company is focused on the patient.,Low pay for the industry. Benefits are not the greatest. Not much opportunity for advancement.,HCA Healthcare
37,"""PRN Phlebotomist""",5.0,Really nice company to work for,Transitioning from a old system to a new system- Moby lab,HCA Healthcare
38,"""Well organized company with a myriad or resources""",5.0,Able to travel within the 180 hospital structure for Interim assignments,Myst he willing to travel within the USA,HCA Healthcare
39,"""Good teamwork with ancillary staff. Great support between providers. Poor management.""",3.0,Great orientation for New Grad Providers. Other providers really try to help you out as you are finding your footing. Great training opportunities.,"Increase of pay to a provider role doesn't not provide enough to compensate for the cost of health insurance in addition to student loans. Awful. Can't seem to hold onto MAs or Xray techs. Many times one center of 6 will have ONE Xray tech, forcing patients to go to other locations!! An MA AND an Xray tech should be on property at all times. Seems management is more concerned about money for the company versus sending employees home early and forcing patients to go to other locations- which from a patient perspective is bad business.",HCA Healthcare
40,"""Expect to work hard""",2.0,Large network that encourages transferring within the company Decent benefits,For profit health organization = primary focus is the bottom line Employees feel like just a number Patient ratio expectations unreasonable,HCA Healthcare
41,"""For profit healthcare""",2.0,Quality- at least at my facility,For profit. They make money off sick people.,HCA Healthcare
42,"""Technical Analyst""",3.0,Good place to start career.,No opportunities after starting. No where to go.,HCA Healthcare
43,"""HCA Las Palmas El Paso TX **The Worst**""",1.0,"There are no ""Pros"" as a Registered Nurse with organization.","They lure you in with a huge sign-on bonus... all upfront on first paycheck. They say all the right word during classroom orientation. Once you hit the floor the nightmare begins. No lunches, no breaks, 12 hour shifts become 14-15 hour shifts. Youre forced clock in/out by your preceptor even though you've not sat down to take a sip of water or a bite of food. They push and pull patients all day even if it stresses their already stressed staff. By the end of a shift you could have had up to 14 patients with all the transfers and discharges. They took me off orientation during my third week and gave me a full load of patients due to the unit being short staffed. As soon as you start asking questions or engage their first and second year nurses about the unsafe work conditions...you are out! And I mean out! They make up ICARE violation allegations against you...suspend you...then you are made to sit thru a hostile human resources meeting with no actual proof or documentation, youre not provided access to patient names or charts, there no written complaints or statements made by the patients My questioning being pulled off orientation three weeks early was considered unprofessional behavior...wtf??? I've been a nurse for sometime now and never have I ever felt so dehumanized and exploited.",HCA Healthcare
44,"""HCA""",3.0,"team, patient care, mission, vision and values","pay, work/life balance, pto accrual is low",HCA Healthcare
45,"""Great place to work""",5.0,"Great Benefits, competitive pay, great people",I truly have not found any.,HCA Healthcare
46,"""Worst company Ever""",2.0,"Great benefits, tuition reimbursement","CEO doesn’t care about his staff, MD’s unreliable, terrible pay and raises.",HCA Healthcare
47,"""Closed practice with minimal notice""",2.0,Benefits pretty good. Facilities up to date,"Difficult contracting issues, and recruitment slow",HCA Healthcare
48,"""Benefits""",5.0,"This company has fantastic benefits, education tuition reimbursement",No Cons to report at this time,HCA Healthcare
49,"""Mercy hospital HCA""",3.0,"Benefits, job security, good travel opportunities, location, directors are caring and understanding","Salaries are below market value across the board. Unfair/unsafe patient ratios in both medsurge and critical care environments, HR is always rude, always looks to brush things off and push you away with a “deal with it” or “go figure it out yourself” attitude; not helpful at all!",HCA Healthcare
50,"""5 stars""",5.0,Great teamwork from all levels,Demanding job but rewarding too,HCA Healthcare
51,"""Not a Company you want to work for""",1.0,Insurance is great. People are friendly.,Several parts of the job are outside of the purview of AP responsibilities. Some of the supervisors are not knowledgeable. The work is like chasing your tail around in circles. You have to touch invoices several times before processing.,HCA Healthcare
52,"""Good company with opportunity for advancement""",4.0,- Good Leaders - opportunity to advanced and grow - good benefits - working remotely,"- Although co-workers and staff are nice, our customers (Nurses/Doctors) can be rude - pay could be better",HCA Healthcare
53,"""Do not sign contract with HCA""",1.0,Self scheduling Can’t think of anything else,High ratios No techs Burnt out coworkers Makes you sign a contract to work there as a new graduate and then will try and make you pay back even though you receive NO bonus or anything- just being allowed to work there and the awful 4 week training course,HCA Healthcare
54,"""Age Discrimination""",3.0,"Co-workers,free coffee,good before Parallon took over.","Small raises,age discrimination,every move and action measured to back up small raises.",HCA Healthcare
55,"""Great place to work""",5.0,"awesome work-life balance, and interesting projects",a lot of tribal knowledge to learn,HCA Healthcare
56,"""good pay""",2.0,great pay and flexible hours,"unpleasant experience with manager, bad communication",HCA Healthcare
57,"""Building block""",4.0,Camaraderie Health benefits Work/life Team work Team building Felt like family,Pay Patients are always right even when they’re wrong Not many,HCA Healthcare
58,"""Not worth your time""",1.0,"Pay is not bad, insurance is also good, everything else ...","not a good floor model for any hospital, especially a non profit one. Had I known what I know now. I would have never accepted a job from them.",HCA Healthcare
59,"""Somewhere that genuinely cares about staff and patients alike""",4.0,Tuition Reimbursement Certification Fee Reimbursement Generous PTO Contributions Good benefits Flexible work environment,Not always comparable to other companies salary-wise,HCA Healthcare
60,"""CNA""",4.0,"Great staff, regular raises, all the o.t. you want",Added responsibilities constantly and frequent turn over,HCA Healthcare
61,"""Great Company to work for""",5.0,They encourage promotion within company,Nursing staff runs short on occasion,HCA Healthcare
62,"""Great Company and Great People""",4.0,Love the company and most people that work there.,They protect terrible managers and directors that have made sexist and racist statements.,HCA Healthcare
63,"""No room for growth""",1.0,They have good benefits,There is no room for growth in this company. And they give 35 cents raises or less. They micromanage everything you do.,HCA Healthcare
64,"""StarN""",2.0,Free ACLS and BCLS,short preceptorship corrupt leadership all preceptors have less than 3 years of experience on my unit,HCA Healthcare
65,"""HCA is hit or miss - depends on the location.""",4.0,I work on a great unit. Love going to work. Great managers and co-workers.,Pay could be a lot better. Need more staff.,HCA Healthcare
66,"""Surgical services was a great place to work""",5.0,Good schedule. PTO accumulated fast,In need of more staffing during peak times,HCA Healthcare
67,"""Great place to work across all service lines""",5.0,Everyone cares as a family and make it known,As with any hospital staffing at times is tight but job gets done,HCA Healthcare
68,"""Eh""",2.0,Large Company with ok perks,"No growth, nepotism. ICARE standards not followed.",HCA Healthcare
69,"""Cath lab""",5.0,"Great manager, good schedule, great team",Call can be hard on family,HCA Healthcare
70,"""Can be stressful!""",4.0,"Benefits are great, including 401K",Lots of changes going on in healthcare.,HCA Healthcare
71,"""Unhappy employees""",3.0,Benefits are the only pro,"Almost everything elses, most of the management, employ satisfaction.",HCA Healthcare
72,"""Room for growth""",2.0,Goal to be patient centered; Most nurses and nurse management work hard to provide quality care to patients,"Staff support & flexibility, scheduling conflicts with 3rd party staffing company (Workforce), micromanaging nursing staffs numerous tasks unrelated to prioritization of actual patient needs, penalizing nursing staff related to time management (clocking in/out) due to unrealistic expectations related to patient care",HCA Healthcare
73,"""Bad news not enough staff""",2.0,Lots of overtime actually too much,Everything else is absolutely horrible,HCA Healthcare
74,"""Good place to work""",5.0,Benefits People you work with Flexible schedule,Little in house promotion Salary may be a little low,HCA Healthcare
75,"""Always short staffed""",2.0,Self scheduling and that's it!,Nurse to patient ratio Patient turnover Manager support Wages Raises Promotions Poor Moral,HCA Healthcare
76,"""Great place to work.""",5.0,Great place to work welcoming.,None that I can think of.,HCA Healthcare
77,"""Job review""",4.0,The team work is good,Pay isn’t so great Here,HCA Healthcare
78,"""Great work environment""",5.0,"Great management, great coworkers, great work culture.",The onboarding process wasn't totally smooth.,HCA Healthcare
79,"""Big deal in Nashville""",4.0,Lots of opportunities and good benefits if you plan on staying with the company for a long time,"2% annual raise, only management gets bonuses",HCA Healthcare
80,"""Southland Primary Care""",3.0,Culture of workplace environment is friendly.,Typical Upper management ties middle managements hands,HCA Healthcare
81,"""Great culture and competitive compensation""",5.0,"Great work-life balance, compensation is competitive for the area and there are various professional development opportunities",Some areas can be quite political but overall expected,HCA Healthcare
82,"""Medical Office Specialist""",5.0,Working hours are good. Benefits are very good for one person.,Benefits for part time are very high.,HCA Healthcare
83,"""The worst.""",2.0,At least you know you won’t go out of business as they’re committed to the quality of the patients ability to pay.,"HCA has got to be the most ignorant company I’ve ever worked for. They took over our hospital and had no idea what they were doing with a hospital with over 600 beds. They treat their nurses like total CRAP and do not reward for overtime. All incentives have been pulled unless we’re critically low that day. And if they treat the nurses like that, can you imagine how they treat their techs?! The PCTs were left out of our new epic training and thrown to the wolves. They e NEVER been offered any incentive to pick up OT. They aren’t even offered shift diffs that make it worth it. I will NEVER work for an HCA facility again.",HCA Healthcare
84,"""Lots of hours""",3.0,Pay is pretty good. 401k plan seems good,The number of hours for covering uncovered shifts without come time off.,HCA Healthcare
85,"""Great Nursing Opportunity""",5.0,Leaders believe in living the mission statement and the commitment to quality patient care is outstanding.,No opportunity to stay with organization with advanced degree,HCA Healthcare
86,"""High turn over rate for nurses""",3.0,Great place to work All staff works well together as a team,Low Pay No growth Benefits aren't great Nurses don't tend to stay that long,HCA Healthcare
87,"""Nursing unit supervisor""",1.0,Coworkers and team... but not much else,"HCA has reduced clinical staff so staff to patient ratios are unsafe. Compensation is not adequate for the area. They fired all our outstanding security and outsourced security to Allied so we lost our tenured, outstanding de-escalators and gained underpaid and rather clueless guards. It’s just dangerous now. Eventually there will be a sentinel event and maybe things will shift back. HCA has terrible business strategies - I’m shocked actually. You’d think they’d at least have streamlined processes.",HCA Healthcare
88,"""Do more with the absolute minimum""",2.0,They fix things that are broken and buy equipment that is needed to do the job.,Logistics of stock to do job is terrible!,HCA Healthcare
89,"""Great work life balance""",4.0,Work from home. Leadership.,Pay could be better,HCA Healthcare
90,"""Overall satisfied""",4.0,Family like atmosphere. Friendly. Nice perks to help with lower pay,Lower pay scale. Can be long hours in PACU,HCA Healthcare
91,"""ok place to work""",2.0,Flexible hours when lower management approves it.,Management worries more about money than their employees.,HCA Healthcare
92,"""Great company""",5.0,flexible work environment with competitive benefits,large company so sometimes getting changes made is long and arduous,HCA Healthcare
93,"""Awesome Place""",5.0,The entire job is a pro,Healthcare environment in general is volatile,HCA Healthcare
94,"""A Career you can be proud of""",5.0,Strong Mission and Values drive a good culture in the Information Technology Group. Large number of people who have made their career here. Strong Leadership team. Continuously Investing in the future.,Poor technical leadership pipeline/career path. Struggling to mature in Agile and DevOps cultures.,HCA Healthcare
95,"""good""",4.0,"flexible, fair scheduling for the holidays, employee appreciation",i have not encountered any yet.,HCA Healthcare
96,"""8+ years in a great culture""",5.0,"The culture is great, the people are great, and the pay is pretty good.",The pay is middle of the road for the amount of work you do as a manager.,HCA Healthcare
97,"""Great Company, Just Not Perfect""",4.0,"Paid Time Off, Hope Fund, Benefits",What is needed to progress and get a raise is different in the eyes of each manager. Too much left of for interpretation.,HCA Healthcare
98,"""NA""",5.0,Lots of Learning in different areas,Not enough support and limited resources,HCA Healthcare
99,"""Have worked with eldery and have alot of communication skills""",4.0,Cheering people up makin them smile,"Trying to help people out of thier sadness, depression. Making them feel better about themselves",HCA Healthcare
100,"""Good company but be prepared to work REALLY hard and more than 50hours a week.""",3.0,large healthcare system with a lot of career development opportunities,no work life balance. expected to work 50-60hours a week and if you do not it is frowned upon. make you feel bad when taking time off.,HCA Healthcare
101,"""No training""",1.0,Autonomous work and freedom to complete work. Work from home if needed,No training No actions on findings to make changes needed to improve,HCA Healthcare
102,"""Marketing Director""",3.0,"Good benefits, good work-life balance.","Unethical leadership, good ol' boys mentality. No bonuses!",HCA Healthcare
103,"""Over all a good place to work""",3.0,Pay is just above local average. Negotiate! Goal setting and professional development support. Those you work with are outstanding! Relatively flexible place to work depending on position and supervision. Leadership is Quality and for profit driven which leads to improved pt care and improved money in everyone’s pockets.,"PTO sucks! Hands down worst benefit HCA has and it is not negotiable. Depending on your supervisor, performance improvement plans are a joke. More like prepare to be fired plans. Saw several employees fired too quickly without real use of performance improvement. 30-45 days for some. Up to 13 months for others! No standard just based on who ever your supervisor is and their style.",HCA Healthcare
104,"""Good environment""",5.0,"Great people, helpful and caring management",very low pay compared to places in the same area,HCA Healthcare
105,"""Salary""",3.0,"Flexibility, peer support, management support","wages, cap on salary for RN's",HCA Healthcare
106,"""Sourcing Specialist""",1.0,Compensation was average. Care at hospitals was excellent.,"Do not value employees, more concerned with revenue. Culture is horrible. No growth opportunities.",HCA Healthcare
107,"""Executive leadership only care about the metrics, not you.""",2.0,Great benefits and good people overall.,You mean nothing if your metrics don't measure up.,HCA Healthcare
108,"""So thankful""",5.0,"Work from home , benefits and Pay",I don’t have any cons,HCA Healthcare
109,"""Excellent Company For Which To Work, Politics Excepted""",4.0,"Good pay, good benefits, low turnover. For the most part the people are great to work with.",There is an under current of politics which can cause disruptions from time to time. You need to learn and relate well to those who are important.,HCA Healthcare
110,"""Over worked, under paid, favoritism, bad management""",2.0,It is not difficult to get a full time job at HCA healthcare. If you are a young white cisgendered republican conservative male with a tech degree and are willing to cast aside your self respect and dreams of a meaningful career this is the place for you.,"Women, queer people, those with self respect and big dreams of making a difference in the world need not apply. You will be pigeon holed and abused, over worked and punished for trying to achieve better than the bare minimum. They only allow their favorite boys to job shadow and get training experience. Only the favorites get to attend the all hands meetings and trainings. Only the favorites get 9-5 schedules, everyone else gets insane swing shifts.",HCA Healthcare
111,"""Good benefits""",3.0,"Good benefits, flexible schedule","Short staffed, poor management",HCA Healthcare
112,"""Corporate""",4.0,Great insurance for employees and families,"Corporate makes all the decisions, for everyone and not every hospital is the same.",HCA Healthcare
113,"""Worst Place I have ever worked""",1.0,Being off for four days a week and not having to be subjected to the horror in that place.,"There are many - the pay is poor, the management is worse than awful. The patient care is shameful - never send your loved ones there. They are all about the money and do not care about their employees or their patients. There is favoritism and lack of communication. Employees throw things, pitch fits, use fowl language and act like they are out of their minds. Reporting it does no good as admin, HR and management do nothing , probably because they cannot keep employees (the turnover rate is astronomical) . Hostile work place is an understatement",HCA Healthcare
