,title,rating,pros,cons,company
478,"""Best job I ever had""",5.0,"I am very pleased with my position, upon hire I was able to choose a schedule that fit my family. I have the ability to pick up hours or drop hours for added flexibility. My manger and coach are both awesome. I love the contests and games and opportunity to make more money based on sales","Potentially allow more flexibility to go full time. Not really a con, but that’s all I can think off",American Express
479,"""My last review""",4.0,Great Company to work for,A lot of silos to deal with,American Express
480,"""Not bad - would not turn it into a career""",4.0,American Express is a great place to work. As for the position it is high stress and all about production as any sales job would be. You do have the ability to create your paycheck although they are scaling that back at an alerting rate.,This particular position has a low retention rate. They change the pay structure very frequently and it never benefits the consultant. The location of the office is quite far. You have to wait 18 months before switching roles. Micromanagement does happen.,American Express
481,"""Working at American Express""",5.0,American Express has a strong commitment to employee growth and devotes a lot of resources to training and career development. Also the corporate culture puts a strong emphasis on work life balance.,Having to follow bank regulations can make change more difficult but the company has made major improvements in speed of decision making in recent years.,American Express
482,"""Great company!""",5.0,Customer obsessed Great work life balance,"Sometimes political, Doesn't move super fast",American Express
483,"""Very old structure""",2.0,"Work Life balance, good employee offers",Management structure is quite old,American Express
484,"""Slow growth - Risk Management""",3.0,"Reputable company, friendly culture, WFC location, lots of focus on customer experience","Depending on the team, many mid level managers don’t have a vision. When you actually accomplish something, they want take all the credits and make sure you are not at the table when it is presented. Good luck if you want to advance fast through solid work",American Express
485,"""Good company to work for""",4.0,"Great work life balance, flexible schedule",Who you know is more important for growth than what you know,American Express
486,"""Financial Analyst""",4.0,"PTO, other benefits, ability to move within company",Experience highly depend on particular team,American Express
487,"""Finance Administrator""",5.0,Working environment and role itself,None really - great place to work,American Express
488,"""AMEX""",4.0,"Good people, feels well paid compared to other places in the area, great benefits - family leave, PTO, etc.","Office is downsizing, not a lot of room for growth.",American Express
489,"""Good Company""",4.0,"Good salary, opportunities for developing your skills",Too much number crunching in assessment of job performance. Quantity not quality rewarded,American Express
490,"""Great Company""",5.0,Great benefits love it there,Little work life family balance,American Express
491,"""Corporate Travel Agent""",5.0,"Great management, and benefits",only hired on a full time basis,American Express
492,"""Quality Control - Corporate Services""",4.0,Good work culture. You are treated like a human being with respect and some care. The pay is fair and the benefits are good. Decent work-life balance.,They don't like too much cultural diversity (I don't mean race as much as beliefs).,American Express
493,"""Inside Sales Corporate card""",1.0,Nothing. Awful place to work,"Everything..From upper management who are a bunch of liars, steal your commission and give bigger accounts to their favorites. One of the worst place I have ever worked for.",American Express
494,"""Csr""",3.0,Pay benefits they offer are good,Stats was to much they need to revamp some stat requirements,American Express
495,"""Great place to work, but lacked innovation spirit in 2015""",5.0,"Great people, package, benefits, locations. You will learn and learn and learn in this environment.","The company was a slow moving ship back then, getting things done was far more effort than it needed to be.",American Express
496,"""Good for working mothers""",4.0,Amazing maternity leave policy. Good work/life balance.,"Lots of internal politics to navigate. Difficult to get promoted. Culture built on networking, rather than merit/work effort, which means leaders often play favorites.",American Express
497,"""Very Good""",4.0,"There is a lot of under mgt growth available at AXP. As a technical person you can do great things, learn new technologies, get real hands on practical experience. This is a great place to groom your skills, grow your wings, and learn what you want in your career. AXP is always looking for fresh talent to fill roles in the private cloud space and in sourcing support.","Once you get to a leadership role the rapid development and progress halts. There is a very strict type of person that gets to go much further then Director or VP level at AXP. The CIO and EVP are hand-in-hand the organization setters and is their way or the highway. There has been lots of attrition since these two joined the company and they have been 'cleaning house'. Most leaders can't stand them, some respect them, some 'respect' them out of fear as they wait for their options to vest. There has been a massive talent drain from AXP in the past few years and many that have left have been much more successful at other companies. I have seen Directors go to SVPs at other banks in just a few years. That is a signal of how much talent suppression goes on at AXP and many realize to get promoted or to succeed they need to leave.",American Express
498,"""Business Travel Consultant""",2.0,Overtime benefits vacation work from home,Inexperienced managers micromanagement unrealistic goals too many calls,American Express
499,"""Marketing Manager""",4.0,Great opportunities for development Strong corporate culture,Processes can be cumbersome Limited opportunities to work virtually in some business units,American Express
500,"""Business Analyst""",4.0,"The company has good coworkers, and space to have fun",environment the building is old,American Express
501,"""A good place to work""",5.0,Very flexible working hour and good work from home policy,Can't think of any on this.,American Express
502,"""Platinum Customer Care Professional""",3.0,Benefits- PTO/Sick/401K/Medical/Dental/Vision/Legal/Corporate Discounts and many more..,Just another number sitting providing customer service and offering (sales) to cardmembers - not valued as a CCP.. even if meeting metrics..,American Express
503,"""Travel Counsleor""",4.0,"Good pay, benefits and time off","You are one of 50,000. Basically, you don’t matter.",American Express
504,"""Nice pace""",5.0,Learning opportunities are great for new staff.,No cons at all all positive,American Express
505,"""Great Company""",4.0,"Good pay, Great location and Friendly Environment.",Schedule changes yearly...... Shift Bids.,American Express
506,"""Manager""",5.0,very good work life balance,no specific cons for me,American Express
507,"""Project manager""",4.0,Very accommodating culture. Career advancement can be found at any level and at any pace. Compensation competitive. Very modern infrastructure.,Culture is overly accomodating and can be difficult to find a perfect fit without compromising a little. A lot of management turnover.,American Express
508,"""Finance Internship""",4.0,"good learning environment, great people, interesting projects",average full-time salary and benefits,American Express
509,"""Would definitely recommend working here..""",3.0,Employee friendly Flexibility to move around the company to various departments Lots of opportunity for growth Lots of avenues for educating yourself with what is new,"Too many changes, can leave employees in a confused state a lot Communication from senior leadership takes time to trickle down",American Express
510,"""Senior specialized travel consultant""",4.0,Ongoing education. Great clients. Ability to work virtually.,Changes to business structure and merging with other management companies.,American Express
511,"""TLS Platinum""",2.0,"A lot of time off, 401k match up to 6%, nice co workers.",The booking tool Encore that has been implemented is AWFUL. Constantly on the phone with card members using tools that don't work. Metrics to bonus are unobtainable due to inaccurate RTF surveys and systems constantly not working . Salary seems ok when hired until you realize ALL the job entails. Health benefits are awful for such a large company.,American Express
512,"""Good company.""",4.0,Good package compared to other IT companies in USA,No work life balance. No flexible timings,American Express
513,"""Great company, benefits - Low salary""",4.0,The people and culture is the best thing about American Express. It's a friendly environment that encourages work life balance.,Salaries are absolutely lagging behind market average,American Express
514,"""Transaction Analyst""",5.0,"Good work environment, great company culture.",It's such a large company they won't think twice about how many people they put out of jobs if they decide to offshore a department to save money.,American Express
515,"""Senior Manager""",5.0,American Express is People centric organization,Within American Express Growth is slow,American Express
516,"""Broken company with issues""",1.0,The most talented and knowledgeable set of travel agents in the world.,"Working weekends, holidays. Raises don't happen. Blame the agent for every error and company takes no initiative to fix the issues. No in house/regional back office support. No one takes responsibility for anything. Computer systems are always crashing and sending simuls. Ticketing in India will let things sit and let fares expire and then you have to call the customer and tell them your previous quote was false. They care about shareholders, not employees. Constantly hiring because they can't keep anyone.",American Express
517,"""Business Development Manager""",1.0,"Unexpected clawing back on bonus checks and little to know answers on why! If you like and depend on bonuses this is always a uncertainty, with such a low base pay without bonuses, you’re not going to be happy!",Solid Brand it sells itself to the right customer.,American Express
518,"""Manager HRBP""",4.0,Great introduction to HRBP roles,Not many HRBP roles available.,American Express
519,"""Manager insights""",3.0,Great company with a lot of potential,"Leadership is horrible with positions given to ""friends"" who are not qualified",American Express
520,"""director""",3.0,there is a decent life-balance,"as is the case with large companies, political environment",American Express
521,"""Working at American Express""",3.0,Flexibility - Ability to work remotely ; 35 hour week and summer flex days,Limited career opportunities and development,American Express
522,"""Great culture and robust leadership""",4.0,"Very people centric organization, you can build a career here with the right sponsorship. It is encouraged to look internally for roles that enable professional growth","Slow moving or you can say that every decision is very thoughtfully made which leads to lags and delays. If you do not have the right sponsors in the company, you cannot move forward.",American Express
523,"""Marketing Analyst""",2.0,"Talent within teams with clear goals, but at times not attainable. Flexibility with work arrangement",Leadership and management - lack training and development - compensation,American Express
524,"""Outsourced Program Manager""",4.0,Great flexibility since role is in a virtual environment. You can steer your development.,Networking is vital and can be difficult at times. Salary flexibility can vary and stack ranking utilized.,American Express
525,"""Customer Service""",5.0,Fantastic work environment great benefits,lots of sitting could be a downside to a more active person,American Express
526,"""Researcher""",3.0,It is an interesting place to work,There is nothing to complain about it,American Express
527,"""This is the WORST job I have ever had in my life""",1.0,None that I can mention for you,"micromanagement, lack of support, lies about shift bid, lies about bonuses, impossible metrics",American Express
528,"""Travel Counselor""",4.0,PTO &amp; Benefits were great. Worked with some nice people.,"Call center work can be frustrating. Had many cardmembers, especially during weather issues around the country, call in angry. Also, had to meet the metics they provided.",American Express
529,"""Contractor vs employee""",3.0,Flexibile and accommodating for work life,If you are an contractor you don’t really have mich input and your thoughts don’t matter,American Express
530,"""Senior Manager""",5.0,Amex is a great company to work with. Great benefits and opportunities to grow your career in the company within the US or in International markets,Due to it size something can move a little slower.,American Express
531,"""Training Specialist""",2.0,Great Benefits. Work from Home.,Horrible leader. Company no longer respects employees with tenure. Was amazing for 28 years. The 29th year was HORRIBLE!,American Express
532,"""Good place to learn. Not a rewarding career.""",3.0,Work hours are very relaxed. Pretty good benefits.,Product teams controls most decisions. Not a lot of innovation.,American Express
533,"""Employment""",5.0,Company is serious about career development opportunities,Lack of agility can be frustrating at times,American Express
534,"""Account Security Representative""",4.0,"Great Pay, Lots of Vacation Days, Flexible Schedules, Lots of Support, Good Benefits","They have stats that make you rush the callers off of the phone while trying to give them excellent Customer Service, Too much change too often.",American Express
535,"""You'll succeed here if you're part of the good ol boys club""",1.0,"Very generous PTO, fitness center and wellness centers on site, on site cafeteria","Health benefits are a joke with high deductibles that continue to increase each year. Doesn't matter if you report sexual harassment or sexual assault, as long as you don't go public with it, they don't care about your well-being. The classic over-worked and under-appreciated scenario, no matter how many times you show your hard work. Unless you're part of the good ol boys club. You'll get a raise and promotion. They definitely don't live up to their so-called ""Blue Box values.""",American Express
536,"""Great company to work for!""",5.0,"Benefits, people, company is amazing",None really- had an awesome experience,American Express
537,"""My experience as an entry level RIsk Manager""",2.0,"Its got relaxed, laidback work culture.",There is not much to do so don't expect a lot of growth.,American Express
538,"""Engaging Workplace""",5.0,Excellent team ethics Work From Home encouraged Great work life balance,Less growth opportunities Not competitive pay,American Express
539,"""Past Experience""",4.0,"Good renumeration, work ethics and the workflows",Some leaders does not follow the ethics outline,American Express
540,"""Great Work Life Balance""",3.0,"Great work life balance, people are nice",You can get stuck in a job you don't want and never applied to due to constant restructuring that occurs there,American Express
541,"""Travel analyst""",5.0,Great work experience. Best company in Travel industry.,No Cons in the company.,American Express
542,"""Senior manager""",3.0,Work life balance if you are not in risk,Keep recruiting ppl and laid off,American Express
543,"""Financial Analyst""",2.0,It has a good global outreach,Decentralization of executive decision-making creates biased decision making,American Express
544,"""Fraud Prevention Agent""",4.0,Great benefits for full and part time,Shift changes every 6 months,American Express
545,"""Laid off by Amex""",2.0,"While I worked for Amex (2010-2015) I had full benefits, plenty of vacation &amp; sick time, and very good pay. The direct leaders were generally pleasant and nice to deal with. Unfortunately upper management screwed it all up.","They will lay people off at the drop of a hat. Not just people, but entire departments. Feels like a slap in the face when the company literally says ""We would rather pay someone in India or the Philippines $8 an hour than pay you a decent wage"". Also, like other reviewers have stated, the environment can get a bit toxic. Not in a ""there's alt-right trolls up in here"", but more of a ""management makes incompetent decisions that makes everyone feel nervous/uneasy"". While I was there, one of my co-workers pointed out to management that the monthly performance goals seemed to be shifting based on employee performance. What this means is that management would look at the previous month's results and shift the monthly goals based on that. This would create scenarios where ""low performing employees"" who were trying to make an effort to improve their stats (harder than it sounds) would still be considered ""low performance"" and be fired with no severance or benefits. Overall it was not a happy experience.",American Express
546,"""Travel Counselor""",2.0,Potential to grow in the company 401k company match GREAT employees! Got along really well with everyone,"Position wears too many hats for too little pay Is not the fun role they made it out to be Training essentially made it seem like you would simply be recommending travel plans by using extensive destination knowledge, however in this role you are primarily an order taker; someone calls in and you will only be ""taking their order"" for hotel, flight, and car arrangements If I knew it was going to be so boring AND difficult (no room for mistakes), I would have never applied",American Express
547,"""Senior Manager""",2.0,"Good brand, professional environment, good work/life balance","Not innovative, slow to market, highly political environment",American Express
548,"""Director of Engineering""",1.0,"Like people who are doers at working class level, and engineers.","Palo Alto office only hiring their relatives, friends who has no knowledge in the areas of expertise of technologies. Old school thoughts. One hand the leadership says business projections on track on another had they say quality is bad. No direct correlation. Please leaders by giving fat data meaningless that no one captures in software delivery for cloud tech stacks. Lack of leadership. Any one questioning “status quo” gets into bad politics. Many smart people left or got laid off because they spoke to make improvements or challenge old school thoughts. Very bad Leaders making hostile environment where you can not say anything. You lose your brightness abilities working with dumb old school thoughts. You work long hours literally 7 days a week for releases that is meaninglessness. Bringing contractors without interviews, knowledge. Looks some personal scam going on where management are making money, keeping in their pockets. Some ethnically issues going on. Talk to any doers they all feel this. Fix gaps with modern work culture.",American Express
549,"""DIrector of Engineering""",4.0,Great culture. Fantastic pay and benefits,"Highly political. This is a plus, if you know to navigate the company and get things done.",American Express
550,"""software engineer""",5.0,good benefits grate co-workers,Not an IT company it is a bank.,American Express
551,"""More issues than a teenage emo""",1.0,"Good benefits, some scope to work remotely","Long hours, thankless responsibilities, endless problems to address",American Express
552,"""Information security analyst""",3.0,"Name on resume, job titles","Parking , work space very tight",American Express
553,"""Back office""",5.0,"Many. Benefits were great, pay too!",Overload of work. Expected to work at a robotic pace.,American Express
554,"""Easy Place to Work""",4.0,"Technology organization is on the right track, changing to meet the demands of both the hiring market and the customer.",A bit of a commute.,American Express
555,"""Great Work Culture""",3.0,People are very friendly and out going. Great environment to meet people and build strong working relationship,Alot of bureaucracy when it comes to promotions,American Express
556,"""Real Review""",2.0,Pay scale above average best thing about the company,Not a transparent place to work,American Express
557,"""Good experience, but don't be a lifer.""",3.0,"It's a great place to get experience or try something new, very flexible structure, you're encouraged move around.","Too focussed on fluff like marketing, powerpoint presentations, politics, groupthink, where you went to school, etc. Inefficient structure, thinks it's a marketing company when it's really tech. Compensation is lagging.",American Express
558,"""good""",5.0,good service good people good pay good hours be true,okay lunch bye to the manager the world knows its okay to be okay she she is amazing,American Express
559,"""Best Company to work""",4.0,"Best compensation , policies","Politics at all level ,no rotation policy people not moving from one position for many years causing issues",American Express
560,"""Senior Manager""",3.0,Good work life balance in company,"Need networking to move around, not a fair policy",American Express
561,"""Small Business""",5.0,Excellent Company to grow your career.,Salary for Small Business Consultant very low.,American Express
562,"""Customers care professional""",3.0,Great benefits and bonus clean environment,"Lots of stress, unrealistic metric criteria",American Express
563,"""software engineer""",3.0,"benefits, health, medical, dental, 401k","politics , management issues, changes, communications issues, slow pace",American Express
564,"""Good colleagues, but very political culture""",3.0,Work-life balance Great people/team Flexibility/Great work from home policy Benefits (401k match),"Low pay Very political-you will not get promoted if you don't network and set up coffee chats with the right people Very slow decision-making I had a terrible boss who should not have been a people manager, but the rest of the team was great.",American Express
565,"""18 years thrown away""",1.0,work from home helps avoid the political games in the office,it became extremely political/ assembly line/none caring about the client/ its all about share holders,American Express
566,"""Eh""",3.0,"great work life balance, great location",too much office politics leads to too many incompetent employees that bypass company policies.,American Express
567,"""Working @ American Express""",5.0,Great work environment Flexible work hours Excellent learning and growth opportunities,No major cons that I can think now,American Express
568,"""Great parental benefits, but not agile""",4.0,Amex offers great parental benefits snd a great work-life balance overall. The office location is fantastic with access to a lot of amenities inside Brookfield Place. The culture is very much focused on relationship building and the workforce professional and smart.,Amex has an agility problem and is often times more process than result oriented. Career advancement is very dependent on the direct leadership which can be problematic when there are organizational changes. Displacements are a frequent measure to right size.,American Express
569,"""Great""",4.0,There was great team work and communication,Not enough time off and required too much,American Express
570,"""Business Consultant""",5.0,Great pay great job,None that I can think of,American Express
571,"""Not a customer service company they only care about sales""",1.0,Make a lot of money,"It's all sales driven. There is no customer service anymore. Reps are required to sell or upsell clients on products they don't need. You are also graded on surveys you get, but you can get a bad survey even if you did not speak to the customer, such as if a different department asks you for help you can get a survey and the company just says oh well as a way to not pay you bonus",American Express
572,"""Good Company""",5.0,Good Working Environment and Personal Life and Professional Life Balance,None that can be highlighted,American Express
573,"""Great, till it is not""",4.0,Brand name; move jobs internally; work-life balance; generous parental leave; 401K match; Dr. on site; matches donations,"Basic salary and insurance benefits are lower than the market; promotion heavily dependent on senior leaders' sponsorship, constant reorgs, candid feedback on employee pulse survey can badly backfire on employees sometimes",American Express
574,"""Struggle in Technology""",3.0,"Good benefits, flexible working hours.","Software Development process is a mix of waterfall and scrum. No real product development, more project oriented.",American Express
575,"""Great place to start your career""",4.0,Work life balance depending on which team you join. You can change roles and jobs every 18 months to 2 years,Work load varies depending on the season. You will need to manage office politics if you want to grow your career here. It’s about who you know. Relationships matter!,American Express
576,"""Customer Service Manager""",4.0,"Friendly colleagues, good benefits, (401k, etc)",Certain managers are a little clueless,American Express
577,"""Benfit""",4.0,"Benefit is good,401 company contribution rate is good.",Medical insurance is not good,American Express
578,"""Product Manager""",4.0,"Lots of structure, learning and ability to network. It's a place where work/life balance is very important and one can move (laterally usually) every 18 months.","Promotions are difficult unless you're someone's ""golden child"". It's more about Neopotism than merit. Salaries are on the low end in FinTech.",American Express
