,title,rating,pros,cons,company
0,"""Great place to work part time""",5.0,A great place to work,You are just a number here,Walt Disney
1,"""Great time""",5.0,Work life balance was great and manageable,Needs more Challenge in the tasks that are required,Walt Disney
2,"""Great Experience""",5.0,Friendly company with a great sense of community,No cons to report on,Walt Disney
3,"""Great Place to work""",4.0,Benefits are excellent and the company is very generous with perks.,sometimes the work-life balance is thrown off when you have to do more with less,Walt Disney
4,"""Postive just could use a little improvment""",4.0,You are trusted with the magic. Pay is better than most retail jobs,Late hours. Guests can be rude or demanding. Management doesn't always listen.,Walt Disney
5,"""Great Place""",4.0,"Great work environment, friendly management","Long hours, under appreciated by guests",Walt Disney
6,"""Wish I could still work there""",5.0,Fun part time job to get you though college. Decent starting pay $15 for a position that requires 0 experience and 0 education.,"Rude guests, low raises, and lazy co workers",Walt Disney
7,"""love working for the companyu""",4.0,very humble and nice staff,unfortunate that they do not offer bonuses to the lower titles,Walt Disney
8,"""Great environment to work in. Hit or miss managers""",4.0,Extremely flexible and fun. Available sick time and grievance pay. Amazing 401k matching program for even part time castmembers,Managers are a hit and miss. Some are very competent and go out of their way to make sure everyone is doing well. Some fall very behind on even walking out their office door only to come greet you with a half smile and complain about something or never respond to your concerns or requests.,Walt Disney
9,"""Hard Job""",3.0,Mostly morning shifts. Not a lot of Guest contact.,Alone all day. Long hours.,Walt Disney
10,"""Job environment""",5.0,- Motivated by working with the smart people across the company. - Good Benefits,"- Like other big companies, Networking is essential to move up. - Pay may not be as high as competitors",Walt Disney
11,"""Not as magical as you'd think""",3.0,Overall benefits and success of the company,"Salary, and no room for growth",Walt Disney
12,"""Excellent company""",5.0,"Best Health insurance, good salary, free Theme Park admission, good management and environment.","Guests can be mean and annoying, but that is something that we will find at any customer service job.",Walt Disney
13,"""One of the best work places""",4.0,"Benefits, salary, perks, experience, Teamwork","Schedule, hours worked, systems are outdated",Walt Disney
14,"""Overall Ok-ish""",3.0,Free admission Some super sweet people who love the company Training is thorough and fully prepares you,"Don’t expect to feel special, it’s a big company Hours are exhausting closing one day, opening the next. Sometimes just barely 8 hours in between shifts",Walt Disney
15,"""Kicking it off!!""",5.0,Creative arts is the best industry!,Sonetimes the hours can be long!,Walt Disney
16,"""Good Company, returning to it's old roots""",4.0,"Great people, Great benefits and great location",coming out of a period where management was missing the mark. They have made great changes though.,Walt Disney
17,"""Great benefits, but overall frustrating work.""",3.0,"-Great benefits (free park tickets, discounts, previews, healthcare) -Generally happy workplace -Lots of opportunities / work locations","-Tightening budgets makes the workload, even for customer-facing roles, increasingly frustrating. Most locations feel drastically under-staffed -Poor communication between leadership team. -Guests talk to you terribly, at points you wonder if they remember you're even a human being.",Walt Disney
18,"""LOVE MY JOB""",5.0,There is no better company to work for other than Disney,Sometimes its more about who you know and not what you know,Walt Disney
19,"""Great place to work!""",4.0,"Good benefits, free park pass, friendly people, and great content.","When I worked there, they had office cliques.",Walt Disney
20,"""The best company to work with""",3.0,The best company to work with,Low salary range. So negotaite well and keep the salary range in mind,Walt Disney
21,"""Amazing""",5.0,"Friendly environment, great connection with everyone",Nothing is really wrong at all,Walt Disney
22,"""Cast Member""",3.0,"Fun and enjoyable, fun perks",Disney look is a little out of hand,Walt Disney
23,"""Great Company to Work For""",5.0,"Flexible Hours, Great Pay, Supportive Management",It is difficult to get a job and it’s very competitive,Walt Disney
24,"""Good""",3.0,They give you a lot of hours.,The management is pretty uptight.,Walt Disney
25,"""Quick Service Food and Beverage Cashier""",2.0,Good benefits and company culture,"Overworked and underpaid, very hard to move up",Walt Disney
26,"""Okay job""",3.0,"Free park tickets for you and your family, option to take up to an hour lunch, 6 weeks of paid training, If you are a frequent visitor to the parks this is the job for you.","Very low pay, average health care plan nothing special, dress code is fairly relaxed except for the (NO TATTOOS ) Disney policy even in the call centers they must be covered up at all times. No healthy options in the cafeteria.",Walt Disney
27,"""Great Company to work for""",4.0,Diverse group of people to be around. Good hours,Management are a hit or miss.,Walt Disney
28,"""Pay""",4.0,Good pay and benefits and nice people,Long hours And no grow available,Walt Disney
29,"""Great Company, Fun People""",5.0,Flexible scheduling for part time employees. You get to meet a huge variety of people from all around the world. Looks great on a Resume because Disney is known for their values in customer service. Taught me great life skills,The pay was kind of low,Walt Disney
30,"""Childish Managers""",2.0,"Awsome benefits, and park tickets","Poor management, work during breaks",Walt Disney
31,"""Eh""",4.0,"Great opportunities, good pay, lot of new faces to meet",A company that boasts about family but fires you for putting family first,Walt Disney
32,"""Amazing Brand, Great Memories, Finance culture has room to improve""",4.0,Second to none in terms of brand recognition Solid discounts on merchandise and free access to theme parks Tangible product with a business model that's easy to grasp Some pockets / teams have a great culture Orlando has cheap cost of living and favorable weather Great name to have on your resume,"Current finance leadership is very hit or miss Parks &amp; Resorts ""strategy"" is very much finance-driven which often leads to short-sided decision making on cost cutting measures (infamously known as gap) Culture of long working hours is encouraged, expected, and often used as a measuring stick from upper management (quite amusing) Talent recruitment is pushing towards mediocrity for what the company can actually get; recruiting efforts are restricted to universities that executives attended Hiring freezes happen every 6 months so movement / growth is often stagnant Only way to get a pay increase above 3% is to wait for a new position to open up (no promotions in place), No bonus compensation and pay is middle of the road for market Company is sound financially but layoffs happen in large waves and can be very unpredictable (even in upper level roles) Outside of G&amp;A roles, your skill set becomes very niche and hard to translate outside of theme parks",Walt Disney
33,"""Security Host Job""",5.0,"Pay, Environment, Benefits, Training,","Management, Health Of Officers, Point System.",Walt Disney
34,"""Great work environment! The happiest place on earth, but some pretty boring jobs.""",4.0,Amazing company culture. Awesome people. Interesting potential projects. Interns are given actual work to do.,Tons of red tape to get anything done. Very strict appearance/grooming guidelines. Some tasks can get to be very monotonous. Tough to get promoted.,Walt Disney
35,"""Great place to work""",3.0,Great benefits for full time employees,Work/life balance is not ideal,Walt Disney
36,"""Loved working here, great culture very collaborative""",5.0,"Everyone is kind, people work hard, love free tickets to disney","people sometimes are overworked, stressed",Walt Disney
37,"""Love this Company!""",5.0,"Great benefits and learnings opportunities, fantastic collaborative and kind culture.",Teams are small for the amount of work being done,Walt Disney
38,"""Great Company""",5.0,"Fun and relaxed atmosphere, love it.",none this place is amazing since I work from home,Walt Disney
39,"""Great company and great job! I've been there for almost 25 years.""",4.0,Great wages! Great benefits and open opportunities.,"Nowadays, most hiring are seasonal or part-time.",Walt Disney
40,"""Great Culture""",4.0,Great culture and learning experience,Can feel like a small part of big machine,Walt Disney
41,"""Great Company""",5.0,"Culture, team oriented, great benefits",No significant cons at Disney.,Walt Disney
42,"""Loved working at Disney!""",5.0,Great flexibility (at least in the ABCOTV group) and work home life balance. Their salaries were very competitive and when you add on the Long Term Incentive program it starts adding up quick. They also supply a great 401k that is matched as well as a separate retirement fund that is 100% from Disney. I believe it's 15% of your salary 4 times a year. That adds up really quickly as well. The benefits are really nice as well. I was able to work from home a few days a week and was also given an orca card that covered my bussing unlimited. Each quarter you were given 10 valet passes that you could use to drive in and have your car parked for you directly under the building. I loved this because it allowed me to do things after work once in awhile without having to take a bus all the way back to my car first. Disney in my eyes and experience was top notch!,Not a lot of cons other than the commute to downtown for me was a little much but of course Disney alleviated that by allowing me to work from home a few days a week or more. So kind of a con but not really.....,Walt Disney
43,"""Great place, lots of hours""",4.0,"The Benefits, tons of behind the scenes, passes and special events and planning others vacations",The mandatory 10-20 hours a week in overtime for 5-8 months a year,Walt Disney
44,"""Retail Cast Member""",5.0,"Fantastic training, everything I learned from in Disney has helped me in all aspects of my other jobs.",Can be very stressful and strict.,Walt Disney
45,"""Magical I guess""",3.0,Beautiful Atmosphere Ability to train in many positions and places throughout park Union Okay Pay Experience Career Growth Minimum Wage higher than State minimum,"Pay Can be toxic Full time can be impossible to get Union Does not provide livable wage, can work years at Minimum Wage without opportunity for wage growth",Walt Disney
46,"""Great""",5.0,Great company to work with Good benefits,The Pay could be better,Walt Disney
47,"""memory maker""",5.0,Disney world is the happiest place over the world.And the benefit for cast member is good,If you can not deal with the sun in Florida then this is not for you .,Walt Disney
48,"""Loved the perks""",4.0,Awesome cast member very supportive,Manger were involved and they cared,Walt Disney
49,"""Money Hungry""",4.0,Have a routine down with set protocols Good training,Different departments don’t run the same,Walt Disney
50,"""Hope you’re dealt a good hand.""",4.0,If you’re assigned to a good area you’ll have a lot of independence and meet great people.,If you’re in the wrong area management can be terrible. The role can be isolating because the work is so individualized.,Walt Disney
51,"""Not the happiest place on earth!""",1.0,Great benefits and perks. Good company wide communication,"Huge company, not great for career advancement",Walt Disney
52,"""Good place to work at""",2.0,"Pension, RSUs, Great 401k Match","Low pay not industry standard, too process driven, too much organizational politics",Walt Disney
53,"""Draining""",1.0,"You can get yourself into the parks free most of the time, and you'll probably have at least one positive memorable guest experience.","Management and the company do not care about you if you work on the front line. You are very aware that you are just a number. You will also endure a lot from guests and management will just look the other way. Common in the service industry, but situations are amplified here. If you've ever worked in a theme park, you know. The turnover is astronomically high. Job satisfaction is low amongst CMs. This is a summer job at best.",Walt Disney
54,"""Fun and rewarding job""",5.0,The most fun I've ever had in a job. Caring people everywhere. You get to make so many memories that will last a lifetime.,Pay isn't the best.,Walt Disney
55,"""SSA""",4.0,It's Disney and yet it's not. Off property at the reservation center.,It's Disney and yet it's not. You're removed from the Magic and the senior staff are given free reign.,Walt Disney
56,"""Too old school""",3.0,"Great office, amazing perks(if you like theme parks), nice people, ppl all want to see their product do great","Work/life balance isn't the best, people just sit around even if they don't have much to do, no chance of promotions, low pay, not as modern as other companies are now day(ie working remotely, ect)",Walt Disney
57,"""Great company, not all departments created equal""",4.0,"Great company to work for, industry leader, opportunity to work on the best titles and products in Entertainment","Internal career progression is painfully slow, promotions are rare, length of tenure prevents staff from moving up within the company - you may have to leave and come back at a higher level",Walt Disney
58,"""Turtle Talk With Crush""",4.0,Great experience in performance and digital puppetry,Not paid union wage rate,Walt Disney
59,"""Excellent""",4.0,They have a Very good pay rate,They are short on hours,Walt Disney
60,"""Fun work place pay doesn't seem to match the work load in some locations""",4.0,"Fun work environment, fun co-workers, good managers","rude guests, lower pay,",Walt Disney
61,"""Phenomenal Company""",5.0,Great Leadership Superb benefits Fair and caring Employer,Hours Occasionally amount of work necessary to obtain needed results,Walt Disney
62,"""film maker""",3.0,"It was collaborative with creatives, however I needed a change",I needed a job closer to home.,Walt Disney
63,"""I'm just doing this review so I can see other reviews""",4.0,"Great college job, cool sign-ins","California is hot, and the costumes don't help that much. Also, get used to crowd control",Walt Disney
64,"""Excellent work life balance""",5.0,"Park perks, Excellent management training, Positive environment",Large company so sometimes things move slow,Walt Disney
65,"""Vacation planner - ticket booth sales""",5.0,love being able to talk to guests,long shifts and not a lot of area to cross train,Walt Disney
66,"""server""",4.0,very nice i kniw,very nice good people in general,Walt Disney
67,"""Versatile Work Place""",4.0,"Hours, perks, coworkers, atmosphere is great.","Hours, sometimes who you know basis to become trainer, etc.",Walt Disney
68,"""Nat Geo Sales Coordinator""",3.0,"Benefits, working for most respected company industry, most followed brand on Instagram, you learn alot,","Working at warp speed, very big, care more about customers",Walt Disney
69,"""merchandise and stock""",5.0,fun environment and kind cast members,hours were hard to workout,Walt Disney
70,"""its okay""",1.0,fun place to work that's about it,guest are rude and will get you in trouble. leaders don't lead,Walt Disney
71,"""Great opportunity""",4.0,Great opportunity to learn how a top-notch company establishes protocols and processes.,It's hard to make change or an impact.,Walt Disney
72,"""Great company to work for.""",4.0,"Great benefits, great people, wonderful company to work for.",Sometimes hard to move up.,Walt Disney
73,"""Production Assistant""",5.0,It was a great learning environment. It's an amazing opportunity to get your foot in the door.,"It's long hours and unpredictable schedules, but that's the industry. Don't go into journalism if you want consistency.",Walt Disney
74,"""The least happy place on earth.""",1.0,Working for thee Disney Company.,"Worst place I've ever worked, including the Weinstein Company.",Walt Disney
75,"""Loved Working for this Company""",4.0,Great place to meet friends and fun experience,Pay and hours were long and rough,Walt Disney
76,"""No internal mobility for minorities""",2.0,"Benefits, interesting projects, work life balance",If you stay longer than 3 years expect to get promoted with $3k increases. Merit increases hive around 2 percent worse than the cost of living. If you are a director or above none of what I just said applies unless you are a minority. They love to hire externally and when they do make sure you negotiate high because that’s your baseline for as long as you are with the company My advice to you if work and leave after 3 yrs and come back if you want to jump in rank and salary it is the ONLY way to do it unless you are fortunate enough to ha e a champion in the company and there are some but very few of them,Walt Disney
77,"""Honestly an incredibly Toxic and Helpless Job""",2.0,"Pretty cool perks of Disney, good company name on your resume, good pay, nice co-workers, hopefully you get lucky and are on a team with great management.","Management, Bias, Sexism, Continuous brushing off and pacifying if you go to your management when you have any large concerns, Supervisors, Toxic work environment,",Walt Disney
78,"""Ok company""",3.0,Good benefits and free park tickets,Not enough hours And too many drivers,Walt Disney
79,"""Pros and Cons for working with Disney""",5.0,You build many great long lasting relationships among other cast members and guests.,You deal with many guest concerns but will do whatever you can to alleviate their anger.,Walt Disney
80,"""Love it""",5.0,Flexible Great work environment New experience every day,Some things just don't make sense.,Walt Disney
81,"""A teuly great organization!""",5.0,"Corporate responsibility, competitive pay and amazing perks!",I can’t think of any at this time.,Walt Disney
82,"""POS Support""",3.0,"its Disney, fun people, outdoors",as together as much as you would think,Walt Disney
83,"""Great place to work in Orlando.""",5.0,"Benefits, nice enviroment, discounts, tickets, great team","third shift, lower salary, harder to change internal job",Walt Disney
84,"""Disney is not the happiest place to work for""",2.0,Perks on going to the parks and being able to take 3 other people,"Management, workload, slow software, transition from California to Florida, work equipment, ability to move up",Walt Disney
85,"""Eh""",3.0,"Discount , magical , channel your inner Disney geek often","Management issues , at location , Un-welcoming management",Walt Disney
86,"""Good company to work for""",4.0,Being part of the magic,Occasional weekend work is a downside.,Walt Disney
87,"""Location/Team is EVERYTHING""",4.0,"Perks, Benefits, Great People to build relationships","Pay, Time Off, Budget Cuts",Walt Disney
88,"""Incredible unique job""",5.0,Portofolio of brnads that span acorss various different industries,You are a number to the senior leaders so you have to try hard to stand out,Walt Disney
89,"""Great teams""",4.0,Everyone i worked with was always a pleasant experience,lots of managers cause alot of miscommunication and confusion,Walt Disney
90,"""Do Not Work Here!""",1.0,Offered some meaningful friendships alongside fellow ushers,"Management consistently bullies employees, leaving many with extreme anxiety and even panic. Management has no issue ganging up on people, as well as partaking in different forms of bullying, even if it is homophobic, racist, or misogynist.",Walt Disney
91,"""Nice place to work and play.""",4.0,"Great benefits, awesome people and job opportunity.","It's not what you know, but who you know.",Walt Disney
92,"""Easy money""",4.0,"$15/hour park wide, benefits and discounts",hours can be scarce as a part-timer,Walt Disney
93,"""Overall fun""",5.0,The job was overall fun. I had a great time,"It was always packed, but that’s what you get when you sign up for this job.",Walt Disney
94,"""A company doesn’t care about young employees whatsoever""",1.0,"Reputation, good exit opportunity if you have Disney on your resume.","1. NYC campus/technology is not on par (like you are in 1980’s) with similar companies. Commute is nightmare. 2. You can survive here if you ask for lower than market salary, work 9-6:30pm a day, stay at same position for 10 years (true for 2 out of 5 ppl in my team). 3. Saddest coworkers ever... and management doesn’t care. 4. Not great benefits/perk, just average. 5. HR is slow.... and your case/request always get lost somewhere. Nothing ever completely in one pass in my experience.",Walt Disney
95,"""Too much work for little pay""",3.0,Its disney so get to meet many different kind of people from all over the place,For so little pay and weird hours (until 3am) its not worth it,Walt Disney
96,"""Attractions Host""",5.0,-Leadership -Environment -Culture -Active -Fun -Impact made on guests experience,-Long Hours -Hard Work -Can be thankless,Walt Disney
97,"""Fun job to work if you are a student""",2.0,The free pass to get in,pay was horrible and hours weren't the best,Walt Disney
98,"""Great company with room for growth""",5.0,Lots of personal perks. Cutting edge technology. Room for professional growth,"Long hours. Underpay by 20%, overall a good learning experience and looks good on resume",Walt Disney
99,"""Love it!""",5.0,"I love the company, the brand and the way they take care of their cast!",i have nothing bad to say..,Walt Disney
100,"""Good People!""",4.0,My cohorts and direct supervisor were top notch. They were all caring and supportive people.,"As is true of many work environments, there was an element of immediacy for all needs and therefore there were many moments of high tension and stress",Walt Disney
101,"""Balloon Sales and Entertainment""",4.0,Becoming super involved with so many people from across this world.,"Not everyone is very nice to you, and its something you have to learn to respect.",Walt Disney
102,"""A fun part time job""",5.0,Free park admission Flexible hours Likable coworkers,"strict ""disney look"" guidelines have to be in a good mood a lot or get called out",Walt Disney
103,"""Highly recommend""",5.0,"The perks, the ideals, the magic",Hours can be all over the place,Walt Disney
104,"""Culture lacks transparency of communication and safe environment to push back against sr leadership""",4.0,Great fringe benefits via Parks and Resorts. People who care about company and their role.,"Deference based, risk adverse, command and control.",Walt Disney
105,"""Poor Ethics""",1.0,"Fun environment, discount on other amusement parks","they cut hours, didnt care if I was in school",Walt Disney
106,"""Happiest Hell on Earth""",3.0,"Perks like tickets, paid weekly, and occasionally you got food.","Poor management, managers played favorites, hours were random. I had coordinator yell at me on stage until i cried once.",Walt Disney
107,"""Love the company""",4.0,"Park entrance for free, great networking","Horrible hours, semi-consistent schedules but not really",Walt Disney
108,"""The best company ever!""",5.0,"The meeting of new people, while they are on vacation. Just being able to change how good their stay is, is wonderful.","You can't always make people happy, but you can certainly try",Walt Disney
109,"""Awful""",1.0,Hours You can leave early and still get paid 8 hours,Expectation way too high Hard on your body,Walt Disney
110,"""Lots of learning experience""",4.0,"Exposes you to all the abc shows Work with large cross-functional teams Great perks including learning panels, medical dental insurance, and Disneyland!",Will go through extremely busy seasons and also some very quiet seasons - wish there was a balance!,Walt Disney
111,"""Great Benefits, but Middle Management...""",5.0,Great benefits and great family policies.,"Lower/Middle Management is very much a crapshoot; some are great, and some are terrible. Opportunities for advancement are very limited.",Walt Disney
112,"""Amazing Culture""",5.0,Disney handpicks some of the best people on the planet. You will make lasting personal and professional relationships.,Guest Research is saddled with a quota system which is a rough adjustment,Walt Disney
113,"""Disneyland custodial""",4.0,I like the guest interactions and time managing myself,Working long and late long hours,Walt Disney
114,"""Reservation Sales Agent""",3.0,Great benefits &amp; Perks; Good Commission; No Cold Calling;,Hours; Rate of Pay; Management;,Walt Disney
115,"""Great for college kids and people who don't know what they want to do yet""",2.0,"You get into the parks for free, discounts on merch and food, pretty flexible for the most park on scheduling","overworked like crazy (12-14 hour work days), Disney ""politics""....there are definitely gems working for the mouse but there's way too much gossip, drama, etc.. this isn't high school",Walt Disney
116,"""Good benefits too much politics""",2.0,"Good benefits, casual atmosphere",Too many politics; employees need more opportunities for internal advancement,Walt Disney
117,"""Great Company!""",4.0,"Laid back environment, excellent people to work with.","It is a big company, there is a lot of red tape.",Walt Disney
