,title,rating,pros,cons,company
1492,"""Decent place - not an ideal culture""",3.0,Great internal mobility and smart people all around.,"-Comp and bonus are well below industry, coupled with brutal hours and little work life balance. -Can be a hostile environment for external joiners.",Morgan Stanley
1493,"""analyst""",5.0,"great people, great organization, great culture and many opportunities to various products.",very long hours and very strict promotion period.,Morgan Stanley
1494,"""Equities tech-driven bank""",5.0,"More highly technical colleagues than in the other 5 large IBs I have worked over. Turn over among mid level and senior manager is at a healthy enough level to maintain the culture the bank values so much: ""doing the right thing"". Heavy investment on technology at all levels: hardware, software and people. Critical to join a group where you get to prove yourself woking for a fair and technical manager that has a solid relationship with the business; it is the best way to achieve a sense of stability and fulfillment, and every extra mile you give will get recognized and valued.","Firm and organization wise, none. It really boils down to granularity, i.e. to the group you get to be part of and your direct manager(s). In my case, I'm very pleased. Total compensation can be in average 25% higher in a top hedge fund, but base on my experience, the culture and commitment to technology investment at MS are very hard to match.",Morgan Stanley
1495,"""Associate""",4.0,Good culture and teamwork experience.,Overhead is bit heavy and pay is not competitive to hedge funds,Morgan Stanley
1496,"""Associate""",5.0,"High responsibility from day 1, has great on the job training and rewards high achievers. Vacation days arelated good and not a cut throat culture.","Some issues with retention due to workload, also difficult to move internally without having a pre existing connection in the company.",Morgan Stanley
1497,"""Market risk""",4.0,"Good work culture, talented people, opportunities to learn, good career advancement, management encourage certifications",Depends on team some working hours could be overwhelming. Not so much process and documentation oriented and have to pick up with on job learning,Morgan Stanley
1498,"""Resume Builder""",3.0,Morgan Stanley looks great on a resume and has the resources/breadth to expose its employees to a variety of topics.,"Morgan Stanley is generally a bureaucracy and not a meritocracy. Given its long history, it has established requirements for promotion and pay raises, there is very limited ability to reward someone for the work that they have done recently; employees must hope/believe their reward will come later down the road.",Morgan Stanley
1499,"""Morgan Stanley""",5.0,Great company to work for. I would definitely recommend it to anyone looking to get a job in finance.,There were no real cons that I can think of while working for Morgan Stanley. I truly enjoyed every day going into work.,Morgan Stanley
1500,"""Procurement Operations manager""",4.0,Good atmosphere. Smart people. Learned allot about the business.,Salary is a hit or miss. Not much bonuses in my field.,Morgan Stanley
1501,"""great""",5.0,Great people to work with,Don't see any right now,Morgan Stanley
1502,"""Worth it but only for a couple of years""",3.0,Great exposure to interest clients,Hours were way too long and had adverse health effects ojn many,Morgan Stanley
1503,"""Business Intern""",5.0,Great company and the atmosphere in the office is intense/fun. You never know what will happen to the market.,"Intense environment and involves other people's money, so you don't want to mess up. Also long hours!",Morgan Stanley
1504,"""financial advisor""",5.0,great platform and very helpful staff,long working hours and competitive environment,Morgan Stanley
1505,"""Not a place for growth""",1.0,Get to learn corporate structure. Is a good name to have on your resume. You get used to a fast paced environment.,"Poor life/work balance. Need to work overtime, on weekends and sometimes in the middle of the night. Don't expect to get overtime pay. Most of your coworkers are consultants from India that you never get to see. If you are young, forget about having peers you can hang out with which means that yo will not be building a strong network. Almost all the people are old and or consultants from India. You are going to be using a lot of old technologies and giving mostly support, even when you are a developer. You will be fixing a lot of bugs and touching up very old code. The worst of all is that you are treated very badly by business employees and the technology department is actually a cost center... in other words you are a cost to a revenue so job security is very very fiddle. You will get very little respect.",Morgan Stanley
1506,"""Good place to start career""",5.0,"Not micromanaged, given room to grow and expand knowledge","Doesn't pay enough, more support for lower level employees needed",Morgan Stanley
1507,"""Nice place to work""",4.0,-great benefits and Paid time off and sick leave,-low pay -amount of work was too much for one person,Morgan Stanley
1508,"""Business Manager""",3.0,workings with high character professionals at the top of their skills,"difficult process for pay increases, advancement is difficult from within the firm. It is easier to be hired into a high paying officer role than it is to be promoted from within",Morgan Stanley
1509,"""Good place to work""",4.0,"Do your job well, put in effort & you will succeed.",Some micromanagement - take it in stride.,Morgan Stanley
1510,"""Financial Advisor""",4.0,"Great benefits, excellent opportunity, excellent training",Long hours to establish business; longer time to establish clientele would be helpful.,Morgan Stanley
1511,"""Business Analyst""",4.0,Great people to work with. Very nice team.,"They don't provide health care plan, or social benefits to contractors.",Morgan Stanley
1512,"""Total jerks to employees""",1.0,"Corporate bravado in everything around, not sure if it is good though","No regard to employees, corporate bravado above all!",Morgan Stanley
1513,"""Challenging work environment""",4.0,"Challenging work environment, great co-workers, very competitive","Horrible work-life balance, lots of politics",Morgan Stanley
1514,"""Morgan Stanley Novus Financial""",5.0,"Terrific Benefits Very team oriented at least in my division encouraged us to constantly learn and take classes, seminars",Very large organization--you can sometimes feel like a number not a person Communication at times lacking between Sr management and staff At times bit too authoritative in their management,Morgan Stanley
1515,"""Vice President""",4.0,"Equal opportunity employer, culture and values","work life balance, IT underappreciated",Morgan Stanley
1516,"""Morgan Stanley""",4.0,"Great culture, red tape is manageable.","Conservative culture, you need to know people to get things done.",Morgan Stanley
1517,"""N/A""",3.0,"Professional environment, experienced employees and opportunities for advancement.","No regard for loyal, high performing employees with over 10 years experience at the firm. Bonuses/salaries are not competitive with other firms. Support staff is kept to a minimum, which is not advantageous for either employees or clients of the firm.",Morgan Stanley
1518,"""Financial Advisor Associate""",4.0,Flexibility. Working here all depends on your manager and your department. You can have a manager that's flexible with work/life and others that are very rigid.,Poor training. If you don't already have a big book of business you will not be in the eye sight of management.,Morgan Stanley
1519,"""Review""",5.0,Great people to work with. Will do anything to help you. They really do a lot to make sure their employees are prepared and ready for their clients.,There are long work hours.,Morgan Stanley
1520,"""A good place to work""",4.0,"nice environment, not that difficult in terms of work load. lots of smart people you can learn from.","lots of time is actually spent on talk to other teams for support/help/clarification. Especially for teams in India, time is not fit. Frequently for a small issue, you need to wait for another day because of time difference.",Morgan Stanley
1521,"""Morgan Stanley Revie""",4.0,Almost every one of my coworkers was great to work with. The office environment was very friendly and everyone was willing to help.,Many of the systems as well as the way the business was conducted was very inefficient. There seemed to be much room for improvement from an operational standpoint.,Morgan Stanley
1522,"""Associate""",3.0,Great brand value; Talented people all around,Hard to grow given the # experienced people; very bureaucratic.,Morgan Stanley
1523,"""IT Project Manager""",5.0,Opportunity to work on cutting edge technologies.,Bottom line business where IT is treated as second class citizens.,Morgan Stanley
1524,"""Outstanding company""",5.0,Great leadership and direction from management.,To many regulatory restrictions.,Morgan Stanley
1525,"""Loved working at MS""",4.0,"Very diverse work force and lots of women at the top level, good salary and pleasant work environment.",I felt stifled there in a lot of ways- pressure not to speak out loud and to be quiet. Most employees make a show of not eating lunch in the cafeteria or taking breaks. This was a turn off for me.,Morgan Stanley
1526,"""Morgan Stanley""",4.0,Opportunity for growth Multiple locations and ability to move A lot of training,Lack of communication from mgmt,Morgan Stanley
1527,"""Review Ops""",3.0,Great area to learn a lot and gain knowledge and help in customer service. Work hours are ok and employees are willing to help each other,Pay is not good and there is no work/life balance. Employees are not recognized for hard work at year end. Morale is low,Morgan Stanley
1528,"""Operations Associate""",3.0,opportunities to network and move within the firm,long hours and poor management,Morgan Stanley
1529,"""Project manager""",4.0,"Benefits, vacation time, people and culture are best in class",Promotion can take years to achieve,Morgan Stanley
1530,"""What you would expect from an I-Bank""",3.0,Full spectrum of corporate cash and non-cash compensation,First and foremost it's an I-Bank and proprietary trader. All other business units are secondary at best.,Morgan Stanley
1531,"""Market Risk Controller, RWA reporting, Balance Sheet reporting, Credit Risk.""",5.0,"Good culture, management care. Allow mobility and actively encourage international transfers. Managers take time to manage careers of reports. Global presence is advantageous.","Don't have any real concerns, obviously been difficult time for banks and compensation has been impacted mover last several years meaning even top performers are not being rewarded.",Morgan Stanley
1532,"""Senior Manager""",3.0,Employees are smart and there is work life balance,Compensation is on the low end,Morgan Stanley
1533,"""Finance Analyst""",3.0,"Great starting point, great people","Compensation, promotion process, some managers",Morgan Stanley
1534,"""Great environment""",5.0,smart people beautiful building great projects motivating environment,long hours middle of times square,Morgan Stanley
1535,"""VP -IT review""",4.0,Great work culture ... top technology .. diverse work force ... good benefits 401k medical insurance etc,Career growth opportunities not that straight forward,Morgan Stanley
1536,"""Better comp""",3.0,Highly skilled employees. Offers opportunity for significant professional growth.,"Salary increases are small and infrequent. Bonus goes down each year for most, even on up years for the firm.",Morgan Stanley
1537,"""Back office""",2.0,Lots of learning opportunities and potential for mobility within finance.,"No work-life balance, you are doing the same task over and over. Salary increases are a joke. Employees are not valued.",Morgan Stanley
1538,"""Good Experience""",4.0,Experience will enrich everything you bring from the university into real world application so basically its a good launching point.,Workload is high and it is difficult to strike your own work life balance that we all so desperately seek.,Morgan Stanley
1539,"""Associate Fixed Income S&T""",4.0,"Great place to begin a career, make connections and gain experience.",Could be more competitive with pay,Morgan Stanley
1540,"""PWM Sales Associate""",3.0,"It all depends on which team you work for. Some have great hours and pay well, others not so much.",You could get stuck with a team who doesn't appreciate you and not pay well,Morgan Stanley
1541,"""Great Experience""",4.0,Thought me to proof my work for perfection ever time.,Close The Significant Age Gap,Morgan Stanley
1542,"""Decent hours but not a long term career destination""",3.0,You work with a few smart and driven ppl in some areas. Work life balance is relatively better and benefits are not too bad. 3 yr 401k vesting with 4% match and health care and family benefits decent,"At the top levels you see a clear pattern of non diversity. They have few females but mainly for window dressing. This is an equity shop and won't get paid in any other division. If you are not in front office, your compensation will stagnate each year irrespective of firm performance Most functions are very siloed for cost reasons and cross department or function learning non existent Internal mobility is not easy as they say",Morgan Stanley
1543,"""Banking Culture""",3.0,Good Compensation and benefits Smart people,Value is created by making your boss look good rather then the Firm,Morgan Stanley
1544,"""review""",4.0,"work environment, atmosphere, colleagues, peers, industry","salary, career growth, location, sponsorshi",Morgan Stanley
1545,"""Associate""",3.0,"Good place to learn, perfect for graduates",Management & employee unstability and non-multicultural environment,Morgan Stanley
1546,"""Analyst""",5.0,Enjoyed working with very talented people.,Working late four times a month.,Morgan Stanley
1547,"""Great Manager""",4.0,"With any company, its all about who you work for. I had a great manager. He pushed for you to succeed and created opportunities for you to grow within the firm whether you wanted them or not. He was flexible with vacations and work from home. The maternity leave policy is also one of the best and I was able to extend my time off without and issue.","Salary and bonus' are not great. Sometimes years salary increases are nil. The company is also very political, you have to network all the time and brown nose if you want to advance.",Morgan Stanley
1548,"""Awesome internship""",2.0,High-quality experience; lots of exposure on global deals,"Working hours are terrible, much worse than the US.",Morgan Stanley
1549,"""Investment Banking Analyst""",2.0,"Prestige, smart analysts, exit opportunities, free dinner (because you work all night), taxi rides home after 10pm","No work-life balance, long hours, grunt work, poor culture, firm doesn't care about its people",Morgan Stanley
1550,"""Associate""",4.0,"Work-life superior, Military Supportive, Pay and benefits excellent. Many opportunities for growth and moving around business units. Ability to work independently as well as within teams.","High stress, evaluations not often delivered, lack of communication regarding career advancement opportunities.",Morgan Stanley
1551,"""Overrated""",2.0,"Work with very smart people Get the name of a Wall St firm on resume Teams motivate to constantly improve skills (Excel, ppt, VBA, etc)","Management is terrible Management has no vision/outline for your career path Very cut-throat Wall St mentality ""face time"" extremely important",Morgan Stanley
1552,"""Morgan diverged from Stanley""",2.0,CEO is visionary. Business is well connected with Policy makers so can survive any recession. Business can pretty much manage without IT. Very good in managing PR and branding. Excellent place to learn corporate politics.,There are 2 organization inside Morgan & Stanley both terrible however one is worse than other. Your experience depends on which part you belong. IT is more like a toilet in a mansion. There is profiling everywhere & no place to dissent. Management culture like my way or highway no discussion on critical issues. High velocity ZERO displacement workplace. Open culture is hollow & only exists on paper. Titles are just eyewash don't count on it it means NOTHING of course it comes for free from management point of view. Thousands and thousands of Executive/Managing Directors are there to just say YES BOSS with no voice of their own. Internal culture is SICK. Your have been warned join at your own risk.,Morgan Stanley
1553,"""compliance""",3.0,"people, cooperation, attempts to portray a good image, experience completely depends on department and role","hierarchy, decrease in benefits, cost cutting, red tape, insecurity, lack of recognizing talent, promotions are political, merit doesn't mean much",Morgan Stanley
1554,"""Avoid At All Costs!""",1.0,"Good Benefits Package, Easy Commute To Fells Point","Terrible Work Life Balance, Constantly Changing Management, Unbelievable Employee Turnover",Morgan Stanley
1555,"""Operations Associate""",4.0,Good Culture People were friendly and helpful,Compensation is not competitive Should be more transparent,Morgan Stanley
1556,"""Good company...but could be much better.""",3.0,Prestige - Morgan Stanley has a great reputation within the private wealth management industry Autonomy - You have the freedom to chart your own path,"Total Lack of Support - Unless you join a team, you're entirely on your own. New FA's, tasked with quickly bringing in millions of dollars in new assets to keep them in the program, are also burdened with doing all the administrative and regulatory work involved with maintaining client accounts, which significantly reduces time for prospecting.",Morgan Stanley
1557,"""Analyst""",3.0,The people you work with (if you're so lucky to sit near or work with great people)....rolling the dice here. Hope to get a great & understanding manager.,Disconnect from upper level management. Job security is unknown.,Morgan Stanley
1558,"""vp""",2.0,big name wall street company great company motion the right choice for a select few,for the majority of employees once your in you'll never see a raise or bonus beyond the first year,Morgan Stanley
1559,"""Financial Advisor""",5.0,Good work environment and positive support staff,Less opportunities to transfer to other positions,Morgan Stanley
1560,"""Nothing Great""",3.0,Terrific name to use as an entry in any door. U have everything u can possibly need ....from product to top Traders to Helplines.,Payout is low. Getting someone to help is tough sometimes. It is a big place. U can get lost.,Morgan Stanley
1561,"""Fair, but quite impersonal""",4.0,"Left alone to do your job, people are hard working, motivated, and do the right thing. Overall a pretty good environment.","Treat employees like commodities, i.e. - as if they are fungible. Management continuously looks for ways to make their advisors take a haircut on comp. and the advisor committees don't stand up for the people they allegedly represent.",Morgan Stanley
1562,"""What's the future of MS?""",3.0,"Company still has vestiges of it's vaunted culture in place, but that is changing. Compensation is good upon entry.","Strategy very unclear, and once you are in the door, be prepared to be paid down for the rest of yoyr career.",Morgan Stanley
1563,"""Summer Intern to 2 Advisors""",3.0,Encouraging and engaging work environment. I learned a lot about the daily grind of a wealth manager.,"Not as stimulating as I would have hoped, I was hoping to do more technical analysis. Other than that it was a great experience.",Morgan Stanley
1564,"""Morgan Stanley""",4.0,Great Environment and people. Opportunity to learn new and exciting financial IT initiatives.,Little people too people interaction and between groups.,Morgan Stanley
1565,"""Operations Associate""",3.0,"Learn a lot, good stepping stone, some good people","Dead end, no real progression, no incentive to work hard just empty promises",Morgan Stanley
1566,"""Great for building relationships but...""",3.0,Really great group of really intelligent people. Emphasis on community and relationship building.,Salaries not up to industry standard. Politics hinder progress or promotions.,Morgan Stanley
1567,"""Equity Research""",4.0,Focused on quality work as a research team. High level of rigor applied to anything that gets published.,Changing management that had way too many metrics they wanted teams to hit (amount of calls and amount of reports),Morgan Stanley
1568,"""Client service associate""",3.0,1. Everyone is knowledgeable 2. Morgan Stanley on your resume,1. Internal Technology is abdominal. 2. Salary is not competitive 3. Benefits are not competitive. 4. Management is part of CYA. Too much red tape. 5. Culture isn't great 6. Offices outdated 7. Non ergo friendly - branch is cheap,Morgan Stanley
1569,"""Overall great place to work""",4.0,"Very busy place in which you're always learning something new. Opportunity for advancement within the firm or transfers. With the right manager, work/life/family balance is possible.",Sometimes guilt over having work/life/family balance. Sometimes too much is taken on without having the proper resources.,Morgan Stanley
1570,"""Great Culture""",4.0,I have experience working at other bulge bracket banks and found MS to have some of the smartest people I have worked for.,Like any large bank it is very bureaucratic. Nothing is centralized and everything requires sign off from senior management or compliance.,Morgan Stanley
1571,"""Manager""",4.0,"Co workers are nice and smart, Office is nice, benefits are reasonable for market, location is great and office is centrally located","Work life balancen isnt great, expected to work 10 hours minimum and live for thr company Red tape Salary is low",Morgan Stanley
1572,"""Operations Analyst""",4.0,Learn a lot. Good place to start a career!,Very difficult to move internally in the company,Morgan Stanley
1573,"""Great starting block""",4.0,The company has great benefits and a good work to life balance. Management makes it easy to get things done timely.,"The technology for the firm needs to be updated with the times, too many glitches which makes it hard to get timely items complete.",Morgan Stanley
1574,"""CFP at Morgan Stanley""",5.0,Best house on the street,red tape / versus RIA,Morgan Stanley
1575,"""Good Perks""",4.0,Good office environment and friendly teams,Multitasking and spanish requirement can be overwhelming at times,Morgan Stanley
1576,""".""",1.0,Fed us a lot of food,Don't expect to be able to move up in the company.,Morgan Stanley
1577,"""equity research intern""",4.0,It was an open culture with lots of learning opportunities. Good place to grow with lots of smart people. huge learning curve with fundamental analysis,Hierarchy present thats apparent. Can be distracting since you're your own boss. no one will tell you what to do and how to react to circumstances. you are your own boss.,Morgan Stanley
1578,"""Analyst, Investment Banking""",5.0,"Collaborative, exposure to largest deals on the street, steep learning curve and overall good place to learn about working at a large, institutional firm.",Work hours can be long.,Morgan Stanley
1579,"""Good times at the wrong price""",2.0,They are greedy like the rest of Wall Street. Given the opportunity they will overcharge clients and underpay the help. Skip it if you can.,The cons are the same as the pros. The greed knows no limit and if you like to overpay for advice you've come to the right place.,Morgan Stanley
1580,"""Financial Advisor Associate""",4.0,"ample of resources available, great learning curve.",Only 10% success rate to get out of FAA,Morgan Stanley
1581,"""Feckless remaining leadership""",3.0,"Quality of life still strong, yet weakening brand. Good esprit de corps at mid and lower levels. They just don't know any better as they learn their craft.","Not the MS IT of old. Regulation and risk aversion have driven out the Vision, innovators, risk takers, and Einsteins. Spontaneous collaboration to ""do the right thing"" replaced with rigid chains of command. Everyone is keeping their heads below ground. The last of the folks that led during the go go years are all gone.",Morgan Stanley
1582,"""Associate""",3.0,The Firm encourages learning and mobility. It is a welcoming environment and promotes team collaboration.,There isn't much flexibility for work-life balance. it is a standard 8-6pm time frame at your desk the majority of the day.,Morgan Stanley
1583,"""Fantastic""",5.0,"Investment banking gets a bad rap, but it's an unparalleled learning experience -- Morgan Stanley has best combination of top performance/respect and nice culture.","Long hours, but that's what you should expect from banking -- in exchange, you get a lot of responsibility and great learning experience.",Morgan Stanley
1584,"""Great place""",4.0,"Awesome people, great learning overall","Hours can be long, but worth it in the end",Morgan Stanley
1585,"""Good company""",3.0,Great benefits Great work life balance Ability to work with and meet amazing people Smart coworkers Many employee perks Learn new products and services,"Small raises No bonuses No recognition for support staff Assistants get left out a lot No team events, no team building",Morgan Stanley
1586,"""Rewarding for achievers""",4.0,"Competitive salary, 4 weeks of paid vacation",Medical benefits are very expensive,Morgan Stanley
1587,"""vice president""",3.0,coworkers are fun and interesting.,management was constantly giving you the same old routine about bonus and layoffs.,Morgan Stanley
