,title,rating,pros,cons,company
532,"""Excellent company""",5.0,Upward mobility Excellent culture Great learning environment with peers that challenge you to think strategically They take work life balance seriously Employees are given ownership of their work and flexibility within reason how it’s completed Strong emphasis on ethics,Stressful at times Technology system issues Continuously rolls out new system and technology before the platform is ready. Limited technology training in the field,Morgan Stanley
533,"""Fraud Prevention""",5.0,Management (LOVE my boss!) Pay Office environment Location High-end equipment,Long commute Expensive parking Small selection in the cafe Mandatory 2-week vacation Needs more site events,Morgan Stanley
534,"""Vice President""",5.0,Great Company to work for,There are no cons at MS.,Morgan Stanley
535,"""Relationship Manager""",3.0,"Great people, very structured, organized, resources available","Bad management, promote people who have been there longer rather than who is experienced",Morgan Stanley
536,"""intern""",3.0,high salary nice smart colleagues,long hours very high pressure,Morgan Stanley
537,"""Technology Director""",5.0,"There is a lot of opportunity to be innovative with technology, people and organizational solutions to problems and a good degree of autonomy is allowed for executing those ideas. Talent management is strong with reviews including 360 peer reviews and employee satisfaction surveys (the results are reviewed and action taken !) and mobility opportunities abound.","It is difficult to remain close to technology as a career progresses to more senior levels, as most of the time is spent on managing risk, people, vendors and budgets.",Morgan Stanley
538,"""Typical corporate culture. A lot of wage differences in the same roles.""",4.0,Lots of benefits and volunteer opportunites,Don't expect HR to help you if you have an issue,Morgan Stanley
539,"""Financial Advisor""",4.0,Great company reputation. Management strives to make employees happy and comfortable.,There should be more advertising by the company to help get the name out to the public.,Morgan Stanley
540,"""Associate Model Risk Management""",3.0,"Good brand, newly renovated offices, overall good benefits. People are ok but could be better.","Pay substandard compared to industry, ""you get paid in brand prestige"". Causes a lot of Analyst - VP to drop off to competitors. Hours are front office long for 6+ months for the year. Might as well be in front office and get twice the pay then.",Morgan Stanley
541,"""Project Manager""",4.0,There is so much opportunity to learn and grow. The internal mobility is also great so if you feel like you have exceeded everything there is to know in your current role there are people who will help you move around the company so you can do what you want.,Very political in my team. It is a toxic work environment and a lot of people are unhappy and don't say anything to senior management because of the politics.,Morgan Stanley
542,"""Good for getting your Series 7, but leave after""",1.0,"Pay you to get your Series 7 and 66 licenses Nice name to put on your resume Mutual Fund vendors bring in breakfast and lunch quite often Get to study in your own office for your licensing Pays much better than Edward Jones, includes benefits","Doesn't care about the associate or the clients, only revenue Churn and burn non-""daddy's book"" legacy FA's, essentially throwing young advisors against a wall and hope they stick The FAs are nothing special, the older ones get the books handed down to them from their daddy or a buddy who's retiring but they don't know anything more than the lower end brokerage advisors Charge an arm and a leg for crappy investment advice, and MS takes most of the commission from it; they take from their clients and their advisors, as long as they get their pound of flesh they don't care what happens to either previously mentioned party",Morgan Stanley
543,"""Director""",4.0,"Endless opportunities for career advancement, Good benefits, great career experience.","Stressful at times, long hours",Morgan Stanley
544,"""Trainer""",3.0,Good benefits and wonderful people,Long hours and bad work life balance,Morgan Stanley
545,"""Vice President at Morgan Stanley""",4.0,Working with really smart people,Workload can be demanding at times,Morgan Stanley
546,"""Depends on your group but my group was a nightmare""",1.0,"The salary, the name, (in theory) the ability to internally transfer, many really smart, nice, kind normal people in other parts of the companies.","People were such bullies in certain groups to the extent that, having worked at multiple companies before, it seemed impossible that they worked at ""Morgan Stanley"" and not ""Rikers"" Sexual misconduct was swept under the rug/you could be called a liar for reporting it (and if it was recorded anyway too bad, because that's illegal in a bank aka the ultimate Catch 22 and people will not come forward to back you up if you do report it). On the other hand, still record everything you can because there's a weird group mentality (again, in some groups), where people will literally flat out lie and it will be used against you. Moreover, your group's leader might retaliate and bully you because people lacked emotional control to the extent that it was shocking (like people over 40 with kids). ED suggested (illegally) that chronic illness could result in firing or other adverse action in a private in person meeting but refused to write this down in an official write up, probably because it's, you know, illegal. In general, some people got by by being veterans in a middle office position (aka not revenue generating) so they could do the bare minimum or be completely bad at their jobs and still sort of coast because the nature of the company.",Morgan Stanley
547,"""Desk Strategist""",2.0,Prestigous bank with long history,Support roles have no visibility and upside,Morgan Stanley
548,"""great place""",3.0,nice people to work with,it was a long commute for me,Morgan Stanley
549,"""Derivative Analyst""",3.0,excellent quant. team to work with,work culture is not good,Morgan Stanley
550,"""Financial Advisor Associate""",5.0,"Get to study for Series 7, Series 66, and Life Insurance Exam while working. The do a good job to prepare you with material to study with.",Depending on your experience/education the Series 7 can be challenging for it's a lot of material to digest in two months.,Morgan Stanley
551,"""Not too bad to work with""",5.0,"Good benefit, Good culture, Career development","Extensive working hours, Peer pressures",Morgan Stanley
552,"""Research""",4.0,Limitless exposure to projects and supervisors,Too many Time tables,Morgan Stanley
553,"""Morgan Stanley Works You Hard""",3.0,I really like the corporate training I am given,I am unable move to another office,Morgan Stanley
554,"""Credit Risk Associate""",3.0,"Nice company, if you can secure the right position.","Politics are horrendous, pay is average, company wants to outsource as many jobs as possible to India.",Morgan Stanley
555,"""Analyst""",4.0,"Professional environment, great back office support",Very long hours and little time for personal life,Morgan Stanley
556,"""FAA PROGRAM IS BROKEN""",1.0,"They provide a phone and a desk, that’s about it.","70% failure rate for a reason. Place is a revolving door on all levels. Rewards people churning their own accounts or family member’s accounts for revenue. Doesn’t value real relationships - model is based on revenue not AUM. Myopic, not big picture. Hypocrisy across the board. 3 pillars of culture - do the right thing, build relationships, give back - all a bunch of corporate rhetoric - they didn’t do the right thing by me, my family or my clients, and if your revenue doesn’t meet expectations they certainly don’t care about yourrelationships. One of the worst experiences ever. Stock is at $39 for a reason !",Morgan Stanley
557,"""Wealth management marketplace shrinking, must adapt to sustain""",2.0,Nice people but turnover so high they 'look through' you until you have been there a year.,Training is you are on your own...good luck,Morgan Stanley
558,"""Look Elsewhere""",1.0,Good place to start a career if you can get licensed,To many older MDs who are unreceptive to recognizing and rewarding talent for top performance. HR has to much power and influence and is not a true partner.,Morgan Stanley
559,"""Team Financial Advisor""",1.0,none. none. I had to type 5 words.,"service calls . wanna be broker- advisors. stick to IB and the field accounts MS branches. Nothing going in the CAC (pheonix/Tampa) side. 10yrs behind FIDO , Etrade, Merrill Edge. Fire Jamie. deceit. fraud . failures. Utah branch closed similiar to Colombus few years earlier , same will happen PHX&gt; then TAMPA team FA's and or ""dedicated"" fa's, go Fido if you want this wirehouse route or got RIA or Indy.",Morgan Stanley
560,"""Solid Employer Who Cares""",4.0,Enjoyed my colleagues and felt that the company took material steps to improve culture and working experience.,Working in finance was not my cup of tea,Morgan Stanley
561,"""Private Wealth intern""",4.0,Learnt a lot from management Got a full insight on how a company like Morgan Stanley works,Little responsibilities given to interns,Morgan Stanley
562,"""Fun place to work""",5.0,HR was a great division to work in that was very successful and supportive,"not many cons, it was great pay and cool people",Morgan Stanley
563,"""Open Structure Opportunity to Build a Business""",5.0,Freedom Incredible Opportunity for Growth Agency in how you work As long as you produce no one cares what you do,Lack of Structure No one telling you what to do,Morgan Stanley
564,"""Good Company""",4.0,"good work life balance, room for career growth",must relocate for substantial career growth,Morgan Stanley
565,"""Good Support, Bad Benchmarks""",4.0,Support from within the company was very positive and always felt at my back,Inflexible performance benchmarks forced me to leave. Goals should be set by area and not nationally so as to allow new employees a chance to grow at a reasonable rate.,Morgan Stanley
566,"""Financial Manager""",3.0,good brand and great location,poor management. No process review,Morgan Stanley
567,"""Client Service Associate""",3.0,Work with high net worth clients and top advisors with a range of services. This will give you lots of exposure to wealth management.,"No room for company growth within this position, unless you are planning to be a financial advisor.",Morgan Stanley
568,"""Tech Summer Analyst""",4.0,Lots of networking chances with high up execs.,Experience as an intern really depends on your manager. I didn't have a lot of work to do. Neither did many of my peers.,Morgan Stanley
569,"""Mediocre middle-level people ruin the place for the top and bottom""",3.0,Decently high-caliber people running the firm. Smart high-achieving fresh grads at the bottom doing the work. Analyst class camaraderie is great. Exits for analysts to PE/VC are awesome.,"The middle-level people, like bad associates and VPs, truly ruin the experience for all involved. They kiss upwards and grind downwards, burning resources and goodwill.",Morgan Stanley
570,"""Morgan Stanley Technology""",3.0,Life work balance is decent,work long hours and there is no ethnic diversity at all unless you're in technology,Morgan Stanley
571,"""Great place to start""",4.0,"You learn a lot really fast, but you are given time to grow and are able to work with a lot of really cool and fun people.",Pay is not that great and you will soon feel over worked and under paid.,Morgan Stanley
572,"""Operations Analyst""",3.0,Good atmosphere and working environment. Opportunities for progression and learning.,Role is not overly challenging and tasks can be repetitive. True of all operations role rather than just Morgan Stanley.,Morgan Stanley
573,"""Analyst""",1.0,"The name of the company, some departments are good, training opportunities","Serious issues with harrassment within the company in some groups. If you make the mistake of reporting to HR, get ready to be ousted from the company. Similar issues across groups if alumnae from my college are to be believed.",Morgan Stanley
574,"""Financial Advisor""",4.0,"Good employees, freedom to work, products and services.",The pay and benefits could be better.,Morgan Stanley
575,"""Financial Advisor""",4.0,"Large company, great name recognition.",Very little support in business building.,Morgan Stanley
576,"""Financial Advisor""",3.0,Flexibility to set your own hours and appointments,You only eat what you kill. Don't expect any warm leads.,Morgan Stanley
577,"""Investment Banking Analyst""",4.0,"Hard work, great learning experience",Long hours and high-pressure environment,Morgan Stanley
578,"""Financial Analyst Intern""",5.0,"Great work environment, great way to get some experience!",Nothing really stands out as a Con,Morgan Stanley
579,"""Corporate""",4.0,Discounts and perks available such as gym membership,Not able to increase salary each year unless you leave for competitor,Morgan Stanley
580,"""Associate""",5.0,Great overall culture and great investment platform,Having a tough time adapting to changing market,Morgan Stanley
581,"""Equity Research""",5.0,One of the best places to do equity research on Wall St. You are with a great group of intelligent people. Highly professional. You contribute and you learn.,Equity research is not a revenue generating role so it's not as valued as other areas of the firm. This is not MS specific however; it's industry wide.,Morgan Stanley
582,"""Petty, Pathetic and Politics""",1.0,Nothing good to say abt,"Politics at all level ..People follow email culture of naming and shaming infact becomes shameless &amp; totally unprofessional . Thikos are made managers and their only goal is to save their a by emailing only . Just check once , there are more VPs than associates . If you think you are smart , look elsewhere and save yourself , you wont grow here ,just get frustrated in few months. Layoffs are real , check their Chicago office.",Morgan Stanley
583,"""Intern""",5.0,Learned way more than in any class about investments and certain aspects of the investment field.,"It is a big company, working in a smaller office allowed me to make lasting relation with people.",Morgan Stanley
584,"""Senior Complex Risk Officer""",5.0,Never a same day twice,High Stress and high demand,Morgan Stanley
585,"""good""",4.0,salary is great and has no cap,hours per week are outrageous,Morgan Stanley
586,"""CSA""",5.0,- Great learning opportunity for young employees,- None to Report at this time,Morgan Stanley
587,"""Financial Adviser""",1.0,Fancy offices. Prestigious name to have on your resume.,"There's really nothing special or different about Morgan Stanley. It's a place that charges more than Schwab and gives worse service. No training, just pure sales. if you're greedy and are willing to sacrifice your morals to make money, this is the place for you!",Morgan Stanley
588,"""Great Company""",4.0,Good culture and pay.,The relationship between junior staff and senior management needs improvement.,Morgan Stanley
589,"""Dissapointing""",1.0,Great Benefits and Employee Perks,Poor Management with poor personalities,Morgan Stanley
590,"""Predatory Book Aquisition is the culture of this company - Beware""",1.0,Good Technology and good alternative investment line up.,"Promises, promises, promises that never came to fruition. Buyer beware if you have a book of business. They will bring you over, throw teams on your largest clients, and then try to smoke you out.",Morgan Stanley
591,"""Portfolio Manager""",3.0,Worked with Senior Executives and very entrepreneurial culture.,Needs improvement on technology resources and tools,Morgan Stanley
592,"""Bad culture""",2.0,Great pay and great reputation,"Long hours, no growth",Morgan Stanley
593,"""Love it""",5.0,"enviornment, people and the way you are treated","time, nothing else this is great",Morgan Stanley
594,"""Quick review of MS""",4.0,Work life balance is good Friendly coworkers,Pay is lower than average,Morgan Stanley
595,"""Intern""",5.0,The name of the company resume builder,not many assigned projects to do,Morgan Stanley
596,"""Financial Advisor""",2.0,Flexibility is great you can build your practice accordingly.,Cut throat work environment,Morgan Stanley
597,"""FAA Training Program""",5.0,"Excellent firm to work for, great working atmosphere.",No cons that I can think of,Morgan Stanley
598,"""Great company in a crazy industry""",4.0,"Great company, culture and clients. Overall this is a tremendous firm.",the industry is stifling and it's becoming more and more impossible to do business easily,Morgan Stanley
599,"""Morgan Stanley Gan Loss Department""",2.0,Nice people. Good Training Very very very few pros Free Coffee,"Long hours, Overtime pay only available after 6 months Training schedules are thrown out the window to favor the work queue Pay is terrible 20 Per hour for 18 months then maybe conversion to full time Full time pay of managers is 22 per hour Management comunication is terrible Group huddles intrupt work Managers improvise too much No really amazing talent in the department.",Morgan Stanley
600,"""Wonderful place to thrive""",5.0,"Incredible people, great compensation and benefits, and fantastic culture","I have no cons, I love it.",Morgan Stanley
601,"""Good People, decent culture, good training ground""",4.0,- good group of smart people that generally work well together -,- getting IT tickets addressed was difficult; - lots of bureaucracy - promotion path is difficult,Morgan Stanley
602,"""Financial Advisor""",3.0,Good base pay and hours are based off personal effort primarily.,Stuck in cold calling era,Morgan Stanley
603,"""Management can do better""",3.0,"Benefits, work, culture, people, profitable","Flexibility , Cafeteria, mid level management, silo mentality",Morgan Stanley
604,"""IT associate""",5.0,good and talent team members,I didn't find any Cons yet,Morgan Stanley
605,"""Financial Advisor""",5.0,Learned a lot about the industry and worked with a great group of people,Was not necessarily the environment I was looking for,Morgan Stanley
606,"""Great Environment""",5.0,Great culture. Good boss guides you.,Not many chance to learn about core business quickly.,Morgan Stanley
607,"""Wealth Advisor Associate""",4.0,"Great culture, most advisers are willing to help teach you the ropes","Some of the advisers might try to take advantage of your time when you're in the program as well as when you become a Financial Advisor Associate. Thresholds for success as a Financial Advisor Associate are quite high, so have a solid game plan and look for partnership opportunities.",Morgan Stanley
608,"""Great Place""",4.0,Collegial place to work at,Huge organization to work in,Morgan Stanley
609,"""Intern for Wealth Management division""",2.0,can work your own schedule,they rather you work more hours,Morgan Stanley
610,"""Great place to be""",5.0,"Extremely smart people, fast paced work environment, big learning curve","Long hours, sink or swim culture, mostly Asians",Morgan Stanley
611,"""Great place to learn, old school""",4.0,"- exposure to every part of the WM business - highly transferrable skills, great place to learn - huge business - high impact projects","- bureaucracy - very rigid hierarchy, hard to advance in certain groups, lots of politics - extremely traditional environment - experience depends almost entirely on team management",Morgan Stanley
612,"""Wealth management intern""",3.0,"competitive pay, on the job training","Interesting company culture, difficult to access management",Morgan Stanley
613,"""Analyst""",5.0,Great environment to work in,very stressful at times,Morgan Stanley
614,"""Client Service Associate""",2.0,"Great salary, Great health coverage",When you first begin your new job they give you no time off and there is a horrible work life balance. There is no fitness benefit/ commuting benefits,Morgan Stanley
615,"""Great Company, Troubling IB Industry""",3.0,The highest caliber of professionalism (at the senior level),"At the junior level, professionalism is lacking. Attacks on my character, inappropriate questions, uncomfortable comments have continually been made to me. Higher management doesn't always care to respect your time (industry wide issue)",Morgan Stanley
616,"""Executive Director""",2.0,"Opportunity to take on different roles, allows you to be innovative.","Pay increases little or non existant since Gorman has been there for most staff even during profitable years. Company will use that as basis for not increasing salaries during average years but will not give increases during profitable years either. When you sign on, make sure you get as much base pay as possible because rarely increase your base pay each year.",Morgan Stanley
617,"""strong company, brand""",4.0,"fast paced, challenging, opportunities to explore many aspects of financial services",teamwork culture not as strong as one might think,Morgan Stanley
618,"""Excellent Company, great Career potential""",5.0,"Great working environment, great culture, challenging work, career growth","Long hours, hard deadlines",Morgan Stanley
619,"""Great""",4.0,Good Pay. Great people around you.,Lack of Exciting Work in office.,Morgan Stanley
620,"""onsite admin""",3.0,Friendly people great people and good pay.,"No benefits. Ex, Dental, Health",Morgan Stanley
621,"""Morgan Stanley""",4.0,"Work hard, play hard environment.",Management could do a better job of supporting teams.,Morgan Stanley
622,"""Summer Branch Analyst""",4.0,Good culture and easy to talk to people,Hectic and can get very stressful,Morgan Stanley
623,"""Summer Intern""",5.0,Great place to work. Learned a lot.,None that I can think of.,Morgan Stanley
624,"""Executive assistant""",5.0,Great work life balance.,Things could be repetitive,Morgan Stanley
625,"""Outsource, Offshore, Nearshore""",3.0,Legacy of innovation Support for community involvement Good benefits,No Infrastructure investment Push to cut costs above all Expensive benefits,Morgan Stanley
626,"""Registered Client Service Associate""",3.0,Great company and opportunity to get your Series licenses.,Not much growth opportunity. Tough to move between different departments and line of business.,Morgan Stanley
627,"""Associate Vice President""",3.0,Benefits are good and Advisor focuses,Industry is losing pricing power and income growth is impeded by not having a la carte pricing.,Morgan Stanley
628,"""good""",5.0,"the pros: money, culture, coworkers,",the cons are mainly hours,Morgan Stanley
629,"""Good job""",5.0,Fun work environment. Made good friends.,Not a lot of vacation time,Morgan Stanley
630,"""Summer Analyst""",3.0,Great company to start a career in banking off at.,"Salary is not great, and promotion is based primarily on time of service.",Morgan Stanley
631,"""Good enough for what it is""",3.0,"Brand name &amp; reputation are strong enough to get you out quick, great CEO",Focus on cutting costs underrides morale and tendency to lay off key beacons of the culture. Lower pay than competitors. Try to bill internal mobility options but truly comes down to politics,Morgan Stanley
632,"""Good""",3.0,Good culture in organization overall,Limited opportunity for advancement in role,Morgan Stanley
633,"""Great company""",5.0,"Great company to work for - great on your resume; hard working, intelligent and motivated people; in a fast paced learning environment",Work life balance - but as expected for industry,Morgan Stanley
634,"""Client Service Associate""",4.0,Great network of individuals and amazing people to learn from,"hours can be tough, culture is intense",Morgan Stanley
635,"""Terrible""",1.0,"Great Benefits, a lot of pto","Pay sucks, management sucks, terrible",Morgan Stanley
636,"""Great company to kick off your career""",5.0,"Collaborative culture, great talent, nice gym and cafeteria, 401k match, upward and lateral mobility, lots of exit opportunities.",Some amount of red tape due to size of firm.,Morgan Stanley
637,"""Grt place to work""",4.0,"Good mgmt, good work life balance","Ok pay, not grt bonus",Morgan Stanley
638,"""great company""",5.0,"amazing people, driven to do well","fast paced, can be a tough culture",Morgan Stanley
639,"""Great place""",5.0,Awesome place to work. Great structure,No real cons it’s a great place to work,Morgan Stanley
640,"""Customer Service Representative""",2.0,They pay you well for the work you do and benefits package is very nice. This is a good job for individuals that just finished college and need an entry level position.,Theres is not any work life balance with this job. You come to work stress and leave stress. Managers are always in meetings and never on the floor. No opportunity to learn from Senior management because all of the managers are so new. Rules are always changing and it is never consistent.,Morgan Stanley
641,"""Best place to work for the fresh graduates in Montreal""",5.0,Technical training provided to new grades with all the expenses covered by the company. Opportunity to choose between various teams. Competitive salary and bonuses for the fresh graduates. Yearly increments and great opportunity to learn and grow.,"Less perks, no opus card, time to time team lunches and gatherings will be good .",Morgan Stanley
642,"""FAA Program""",1.0,Ok Salary and resume builder,No support Ridiculous numbers Everything comes out of your own pocket Nepotism,Morgan Stanley
643,"""Diversity""",4.0,Generouus 401k plan Mobility opportunities Community giving Employee perks,Yearly raises not as competivive,Morgan Stanley
