,title,rating,pros,cons,company
1495,"""Package Handler""",3.0,It is a stable job.,No cons. job is explained in the interview process.,Fedex
1496,"""It is what you make it""",5.0,Good starting pay. Benefit are great. Great job for anyone. You can grow or stay content in one spot,Depending on area working in it may be hard to get good hours.,Fedex
1497,"""Solid Company""",5.0,Benefits Tuition Assistance Job Security Friendliness Laid back supportive Growth & Learning,slower-paced lots of separation between value delivered and recognition,Fedex
1498,"""Courier""",2.0,Meeting/Networking with people that you deliver to !,Damage body from jumping in and out of trucks,Fedex
1499,"""Courier""",4.0,Great pay and benefits,Management only cares about themselves,Fedex
1500,"""Package Handler""",5.0,"Wonderful hours, great people, wonderful company",I would love more hours!,Fedex
1501,"""FUN WORKING ENVIRONMENT""",5.0,Good pay and benefits,Sometimes you don't get home until really late,Fedex
1502,"""Best in USA""",5.0,I mean it's FedEx. Every year named top 20 employer in the country.,"Medical Benefits declining, shoe benefit is at $100 I usually spend $150 to $180",Fedex
1503,"""Customer service rep""",5.0,Nicest managers and coworkers great culturr,None really and that is after 10 years,Fedex
1504,"""FedEx Inside Sales Account Executive""",3.0,"Really fun people with a company that really does care about its employees. If you're willing to move, FedEx will treat you right and you'll move up.","If you aren't willing to move, there isn't a lot you can do. Your bonuses are based on the performance of your territory, which is out of your hands to a large extent.",Fedex
1505,"""Fedex Services""",1.0,If you like stress and being overworked - this place is for you.,"Mgmt-Dog and pony show. Pretend to help wmployees, but really just about them.",Fedex
1506,"""Hourly rate""",4.0,The supervisors are very cooperative,I wish there were more working hours,Fedex
1507,"""Group Home Manager""",5.0,Enjoy working in any environment. Very fast learner at anything and complete all my tasks in a timely manner. Very easy to get alone with.,Don't like to be distracted when on the job. Like for my job duties to be explained to me as correctly as possible. Don't like working in an unhealthy environment.,Fedex
1508,"""Driver""",5.0,There are several pros. One of these is the excellent pay and a great team.,Just like any job there are always some cons as well. One of the cons is the long hours during holidays like Christmas. Also you will probably be working with a contractor. If this is the case risk of being dropped if freight falls off is great.,Fedex
1509,"""Packaging""",3.0,Plenty of opportunity to move up. Always stresses safety above all things.,"Job security is very little to none. New hires are always quitting, can't keep people to stay there. Communication on important changes can be lacking at time",Fedex
1510,"""really really good job everything""",4.0,really really good job at everything,i have nothig negative to say,Fedex
1511,"""Two years at FedEx while going to school""",4.0,Great shipping discounts. Very on top of employee rights as far as pay and pay benefits went.,"Very quickly lost much of its culture. Demanding and stressful. Very little or no fun as a team off-the-clock. Not a good part-time job, they want lifers.",Fedex
1512,"""Package handler""",3.0,It's constant steady work with a flexable work schedule,Not enough hours to make it a full-time job,Fedex
1513,"""Best company on the planet""",5.0,"Great people, fantastic opportunity to grow and move up",nothing to add to this,Fedex
1514,"""Fedex Review""",5.0,"The people that I worked with, I had a great team.",It would have been great to earn more money for the work.,Fedex
1515,"""Customer service""",4.0,You can learn a lot . Good company to work for . Employees are very nice . Management is well organized .,I didn't find any cons. They just need to hire more people for getting jobs done on time . Some locations have heavy work load .,Fedex
1516,"""na""",4.0,Ok company to work for.,No benifits offered if your a contract driver,Fedex
1517,"""No work/life balance below Center Manager""",3.0,The front line team members made going to work a little easier.,No development strategy in place. Stores are so short staffed that training is very tough to accomplish.,Fedex
1518,"""Good pay and benefits but job can be very physically demanding""",4.0,"Great pay and raises, room for advancement, benefits are pretty good even for entry level workers and advancement isn't too bad","Can be extremely physically demanding at times as a package handler, hours are weird and you cant really take many days off",Fedex
1519,"""sr. importt cord""",3.0,good company with good benefits,"weird ppl, nothing to do",Fedex
1520,"""Great Company""",4.0,"Company culture is great, they really care about the employees and it shows. The benefits are fantastic. Good work/life balance.",Tough to find answers sometimes. Different messages from direct management and upper management. Internal systems and processes need work.,Fedex
1521,"""Package Handler""",4.0,Night job. Flexible for a student,"part time. Limited hours, can not make lots of money",Fedex
1522,"""Courier""",4.0,Great company job security,High paste always want more,Fedex
1523,"""Good Work Environment""",4.0,"It is a good workplace if you are FedEx hired,managers are really good to you,I was in the headquarters of FedEx and the view where i stayed was really good,it was a short-term assignment and i had positive experience","If you are working as a vendor they see you as guests who are not paying,they treat you good but there will be a difference.",Fedex
1524,"""good place to work""",4.0,"good place to develop and expand your knowledge on maintenance techniques, fabrication, welding, electrical and anything maintenance related. weekend off at most stations.",do not expect to get much on an annual raise.,Fedex
1525,"""High Level IC""",5.0,"Get to work with the latest technologies, good heath care plan, the culture supports a Living (PSP) or People, Service, Profit mentality.","As with most large organizations sometimes you can ""feel"" like a number. It is important to move around on a regular basis taking on different responsibilities to keep everything fresh",Fedex
1526,"""Upload""",4.0,"Flexible hours, motivation, teamwork, focus","slow, careless, picky, overwork, and work tooo hard",Fedex
1527,"""Freight handler""",3.0,"Good benefits, good training and bonuses","Poor management, not enough hours during low peaks",Fedex
1528,"""Great Company""",5.0,Great company with great benefits even for part time.,Work hours can be hectic and vary by location.,Fedex
1529,"""Loader""",5.0,LOVE TO WORK AND MAKE GOOD BENEFIT,Work hard and help other,Fedex
1530,"""Package Handler""",5.0,"Benefits, quick shift, weekly paychecks","Early morning shifts, constanct moving",Fedex
1531,"""Anonymous""",5.0,"Benefits- Medical, Dental, Vision, 401k match, Vacation, Career Advancement, Investment in employees, great pay, bonus, treated with respect.","none, it is a great place to work.",Fedex
1532,"""Glad to be here""",5.0,"Great company, great benefits, good people, interesting and challenging work",None that come to mind,Fedex
1533,"""Signs and graphics was an awful experience""",1.0,"No pros here, nothing good to say",You cannot make in mistakes on their error prone order entry system.,Fedex
1534,"""package handler""",4.0,"Part-time job leaves a lot of extra time for other daily things , good starting pay , a lot of room for advancement ,benefits , paid holidays, paid time off","lots of physical labor ,very early mornings , so your sleep patterns will change , very fast pace for slow moving people , very loud and dusty environment",Fedex
1535,"""FedEx""",3.0,"weekly pay, get exercise, can move up fast, value of teamwork","strenuous, long hours, heavy boxes",Fedex
1536,"""FTN Memphis""",5.0,The office atmosphere is great! Most people in the office are very friendly and professional. The work is interesting and the pay rate is decent.,"Not everyone is in the same office building, so at times, it is necessary to commute a few blocks away to attend meetings. It's inconvenient.",Fedex
1537,"""Senior csr""",2.0,"Great benefits, stability, hour are ok.","No advancement, pay is low",Fedex
1538,"""Mid-management Position/Hard to get things done/Close Minded""",3.0,"- Tuition Reimbursement, decent pay, - Some opportunities for advancement, but only if you know how to play the political game - Active in the community","- Salary range just the average even if you are a rock star. - So many restrictions to avoid lawsuits often impossible to get things done and can't get paid what you're worth. I had a 'lifer' who would literally sleep at his desk and I still couldn't fire him. - Reached a point that they were no longer innovative. After Amazon was on 60 mins saying they were looking at using drones to deliver packages in the future, the next day top leadership literally started a company-wide meeting by joking about how stupid of an idea it was (who's laughing now?)",Fedex
1539,"""Diverse work place, friendly peiok""",3.0,Challenging work and good coworkers,Management needs better leaders and not just bosses.,Fedex
1540,"""Financial advisor""",4.0,"Good Work life balance, family oriented, great compensation and benefits, quality driven management, people first culture, growth opportunities across different career fields, good training,","Bureaucracy, old fashioned, too many people just doing status quo, innovation is slow due to size and slow integration of acquisitions",Fedex
1541,"""Delivery reliability""",5.0,"Very efficient, courteous and helpful",Could give better thought to redirection of package when not at home,Fedex
1542,"""Customer Service""",3.0,Fedex is a great company to work for. They have great benefits for their employees. The company gives back to the community.,There is nothing wrong with the company. There is a lot wrong with management. Management needs improvement. Advancement with the company needs improvement also.,Fedex
1543,"""Great benefits. horrible leadership.""",2.0,"This company has great minds at the very top that are responsible for the direction of the company. This being said, Frontline, operational managers are terrible... they have no operational awareness, are often promoted due to seniority (not ability), and have a work ethic honed by years of doing the bare minimum possible.",Lower level management are quite unprepared and unable to preform their duties.,Fedex
1544,"""FedEx Rating""",5.0,Great Benefits and a world class company,Slow work and constant change,Fedex
1545,"""Loader""",3.0,Short hours and sometimes you get cut.,"Hard work, not enough pay.",Fedex
1546,"""Dock worker""",5.0,The benefits and pay are great,It's only part time is the only downside,Fedex
1547,"""They suck""",3.0,Good Benita for school and housing,They suck so I quit from that place,Fedex
1548,"""Okay""",3.0,good job for college attendants/ people who need health benefits generally nice people to work with if u can work hard it should not be too bad,not a place for advancement usually care more about diversity than actual skill sometimes not a huge issue but can get slightly annoying,Fedex
1549,"""Company Too HR detailed and not enough Employee relations""",3.0,Company was great to work for and had excellent benefits. I thought they really cared until I came to realization that I'm just another number.,Too many policies to follow and not enough comradery or teamwork. They are very HR oriented which means they do every single thing by the book with no compassion toward individuals and their specific circumstances,Fedex
1550,"""Great company to work for!""",5.0,"I've worked for FedEx for five years, many of my colleagues have worked for the company over 15 years (and I have one who's been with FedEx 40 years!). I feel my pay is commiserate to my job title, our health benefits are excellent (coverage and cost) and we have a generous pension and 401(k) opportunity. My work / life balance is what I'd expect for a full time corporate level position and I have the opportunity to learn and explore new challenges.",In my department opportunities for advancement are limited (but not at the company as a whole). And we have a low morale issue due primarily to poor vendor management and a few very very negative employees (they are never happy).,Fedex
1551,"""Ramp Rat""",3.0,Great benefits and retirement plans,Working in a cold environment,Fedex
1552,"""It's OK""",3.0,"Turion assistance, healthcare , higher starting pay","Can't keep anyone always short handed, the worst raise system I've ever seen, seriously been here 2 years only about 60 cent raise",Fedex
1553,"""Package handlee""",5.0,They take care of their employees and care about safety of the employees,Its a hard physical fast paced job which you must be able to keep up with,Fedex
1554,"""I have had my ups and downs. One of my 1st jobs... in my 6 years a lot has changed within the company it self ...""",5.0,Pay . Uniforms are stylish. Peak season $$. 401k Medical benefits Paid vacation Sick time Floaters and personals Opportunity to grow and move up within the company,Corrupted management ... it's who you know ... lots of favoritism . Part time hours suck! Slow season sucks work gets slow.,Fedex
1555,"""Senior Import Coordinator""",4.0,It's a great place to work and advance,Working with people who don't appreciate having a job,Fedex
1556,"""Highly efficient company with proven leaders.""",4.0,"Great benefits, amazing paid time off and very well structured.",Must have 4 year degree in anything in order to advance within.,Fedex
1557,"""Courier""",5.0,Fantastic benefits and a fun job,It's hard work...not for the weak,Fedex
1558,"""delivery driver""",5.0,Comfortable. .good salary. .strong company .free on weekends. Maching my edge,Making me more confident of getting good jobs in good company and flexible schedule,Fedex
1559,"""Ops Admin""",5.0,New experience and systematic logistical information to discover.,This is position is not permanent.,Fedex
1560,"""Lucky""",4.0,"Job security, great pay, best work/life balance and A lot of PTO",IT - a lot of changes to internal systems for sales and doesn't seem to enhance the life of AEs. Sales has plumeted and doesn't recognized it has anything to do with all the IT changes that are HORRIBLE!!!,Fedex
1561,"""Unloaders""",4.0,Give you great hours if wanted. Not on a point system . Give you opportunities to bid on a different job description to work your way up with the company. Offer car insurance .,No 401k plan an less your management . Work becomes very physical becomes hard on your body.,Fedex
1562,"""Customer service""",3.0,This company has Good health care benefits,Advancement is according to seniority. Slow growth,Fedex
1563,"""Customer Service""",3.0,Lots of room to grow and expand. People are like family,Management more concerned about making numbers than employees,Fedex
1564,"""Account Executive - Market Development""",5.0,Geographical Territory Home-based Office Excellent Pay and Bennefits Flexible Work Schedule (healthy work/life balance) Job Security,No Cons No Cons No Cons No Cons No Cons,Fedex
1565,"""Package Handler""",3.0,"Steady work, management listens to your needs.","Hard to go full time or move up from this position. Full time necessitates a sleep schedule that can accommodate working at 4am and pm in the same day, all week.",Fedex
1566,"""Operations Support""",5.0,Great place to work. Benefits are great and work environment clean and safe.,There is no overtime in our office.,Fedex
1567,"""Review Title""",2.0,The crew are easy to work with,The hours are not negotiable,Fedex
1568,"""Not What you may thing""",1.0,"You work part-time and have decent benefits but the Med, Dental and vision is not much different from most major companies.","Terrible Management, They give this illusion that they are such a great company but they really are no different from any billionaire company.",Fedex
1569,"""review""",5.0,it was fun and exciting,some of the delays were bad,Fedex
1570,"""Performance Engineer""",5.0,"We can work at FedEx, as it is showing good opportunities and also more skills will be developed","The drawbacks of working in a tech startup, and any startup, are generally related to short term risks.",Fedex
1571,"""Salary Helper""",4.0,"Very dynamic company to work for while learning and growing everyday. Professional environment, team work but also independently responsible for lots of responsibilities. Diverse company with lots of growth potential.",Interview process was a little difficult but I guess that's to weed out the good from the bad. Communication with boss a little challenging often times because they're extremely busy. Fast pace environment (which can also be a good thing) ... lots of processes change daily so it can be difficult to grasp onto methods with them constantly becoming new. Not much bad about this company though. All cons can be easily perceived as pros!,Fedex
1572,"""Package Handler""",4.0,"Hard work, but it can be worth it for the right people.",You obviously move boxes all day so you better stretch from time to time.,Fedex
1573,"""Ok But Not Long Term""",4.0,Weekly Check And A Good Work Out Plus Benefits,Hot and cold working environments No room for advancement,Fedex
1574,"""Fedex""",4.0,Great company to work for,advancement opportunities generally includes relocating,Fedex
1575,"""No review""",5.0,"Great benefits, clean environment, overtime great. Management does a well job with getting coaching and development done.",Have not ran into any cons yet. I have been with the company for a short period of time. So that this time I have no cons.,Fedex
1576,"""Driver""",4.0,Very nice job with pretty good benefits.,Weather can be very harsh in the winter.,Fedex
1577,"""Former worker @ mphs hub""",3.0,Good paycheck. Its enough money to support if you are leaving with someelse.,Manager and staff can be two faced.,Fedex
1578,"""Order Processor / Planner""",4.0,FedEx is a great place to work.,There is a limited amount of advancements.,Fedex
1579,"""manager""",5.0,good company work not hard,slow pay raise working nights,Fedex
1580,"""Driver""",1.0,There is always work to be done and the training is mostly adequate,"little to no time off, management will not budge to accommodate personal matters",Fedex
1581,"""Slave Work""",1.0,They pay 12.60 an hour,Your shift is only for 4 hours and most of the time they don't even need you for the full 4 so you're getting sent home. It's back breaking work and the managers won't let you switch departments or shifts.,Fedex
1582,"""Great benefits""",3.0,Good benefits and work life balance,Lacking in corporate culture that other large originazations have implmeneted,Fedex
1583,"""Sales""",5.0,"Great people, wonderful leadership teams, work- life balance, great compensation ( salary, health benefits, pension, 401k etc ) and the company lives by the people service profit philosophy in all aspects.",Relocation is a must for advancement more often than not.,Fedex
1584,"""I enjoy driving and being on the road.""",4.0,"Good pay, early work. I enjoy meeting new people everyday on different routes. The people and energy around me is great. Im looking for a permanent position.",Working in the rain could be difficult. Working late hours its hard to see the house numbers in dark areas. And sometimes the traffic can be frustrating.,Fedex
1585,"""Great Company, Good Environment""",4.0,"Good working environment, decent pay and will afford you time-off as needed. Plenty of overtime. Great opportunity to learn and get exposure other governmental agencies.",Work with US Customs and have to be flexible to the various changes as they occur. Overtime is required and limited growth within sub-company.,Fedex
1586,"""Sort manager""",4.0,Benefits are amazing. Room to grow in the company. Plenty of locations. Employee discounts.,Quality of life is definitely affected during key holidays.,Fedex
1587,"""Was better before the politics kicked in but it's still a great place to work""",3.0,"401K, employer contributions, competitive pay, hours available if you're willing to stay, overtime per day after 8 worked hours and double time after 12, nice place to meet every type of person possible.","Minimal hours unless you're trained but training is available, hard work depending on the operation, lots of complaining kids working for the first time and retirees doing the bare minimum.",Fedex
1588,"""Customer service rep""",3.0,"Good benefits, nice working environment, vacations.","Very rude customers, you have to listen to people yelling and cursing at you all day.",Fedex
1589,"""Excellent Company To Work For""",5.0,"Good flexibility with Work and Life Balance, great salaries, friendly diverse work staff. Flexible in allowing some work from home.",You will need to try to have as much education and experience coming in the door.,Fedex
1590,"""FDX Memphis HQ""",5.0,"The HQ facility is very impressive, and I believe helps to foster a professional and friendly environment.","Like any organization the size of FedEx, there can be bureaucratic tendencies that are frustrating.",Fedex
1591,"""Sr. Disbursement Agent""",5.0,Fed Ex culture is wonderful. The company gives to charities around the world plus they provide assistance when any disaster occurs. They have team building activities a few times a year and casual Fridays for employees. Health care is very affordable and local FedEx Clinics are discounted.,Pay could be a little better and vacation should turn into PTO along with paid holidays and personal days plus sick leave. This would follow other like companies in PTO time instead of qualifying the time off you take.,Fedex
1592,"""Package Handler""",3.0,Keeps you in shape. They will give you benefits after a year. Education benefits. Other company benefits listed on the websites. Struggling to think of pros.,"I don't enjoy getting hurt and receiving cuts and bruises on my body on a daily basis. No matter how safe I try to be, It happens. I don't care if it's minor cuts and bruises here and there. I didn't like this job because I didn't like the lifting, as a former UPS employee, I found that working at the unloading area at their ""new state of the art building"" was more difficult than the much older UPS ups hub.",Fedex
1593,"""Great Company""",5.0,Great workplace environment and fellow coworkers were awesome to be around,None I can think of. Wish I could have stayed longer.,Fedex
1594,"""Fantastic company to work for""",5.0,Great culture and strong management team.,No cons. Typical corporate processes,Fedex
1595,"""Miserable pay""",2.0,None ... .... ..... ..... ..... ..... .....,"-They don't care much about their employees, only about production. -Not much room to grow as an employee. -Strenuous on the body -under staffed and cant keep people because the pay is miserable.",Fedex
1596,"""Outside Sales""",4.0,"Pay, benefits, working out of the office",Former manager was prejudice,Fedex
1597,"""Delivery""",4.0,"Well maintenance equipment, clean. Has good contact with dispatch. Safety Bonus","Physically demanding, fast past. Can stretch into long hours.",Fedex
1598,"""Hard workers never recognized""",1.0,Great benefits and some of the great people to work with!,"Hard working employees are never recognized by the management. Managers take all the credit for their team members work and management doesn't make an effort to find and reward the people who do the actual work. Also in their zealousness to encourage diversity, they discard and disregard people who have been working with them for years, just because their fault is they belong to the ""Majority"" so there is a culture of rewarding someone from a different background even though that person is a non-performing member.",Fedex
1599,"""Package Handler @ 8951 Yosemite Street Henderson, CO 80640""",1.0,-You get paid every week -Flexible hours -Initial training program was nice (it's a shame nobody actually uses what they teach in these programs),"-They will work you until you faint -Managers tried to stop me from hydrating myself on several occasions -The job description is a lie, they will make you handle packages heavier than 100 pounds by yourself -Coworkers have no respect for management and vice versa, show up late and under appreciate the work coworkers do -Environment is dirty and unsafe, had a rat problem, trash piled up in areas -Managers create an unfriendly environment with their inappropriate language and intimidating behavior -Did not pay enough and sorely lacked staff -Broken equipment and facility was falling apart -Would not allow phones in facility (wonder why... could it be they don't want people taking pictures/recording video?) -NOBODY FOLLOWED POLICY!!!! (stepped on boxes, sorted incorrectly, drug use, etc.)",Fedex
1600,"""Driver""",4.0,"great benefits, always wanted to work for you guys",hard to get my foot in the door,Fedex
1601,"""Good place to work for""",4.0,"Stable, large company, relaxed work environment, training",slow to adopt to latest technologies,Fedex
1602,"""Compensation""",5.0,Even at Part Time- you have the ability to work additional hours through the Ahead system and often come close to or past a 40 hour week. Especially during Peak. If your willing to work they are willing to pay. If you work a day that's not on your schedule it's time 1/2.,"Very difficult to find an open full time position. When the jobs do come available, there's usually several people with more time in than you bidding.",Fedex
1603,"""Mixed Bag..""",4.0,No lay-off policy for most employees.,Age discrimination when it comes to advancement.,Fedex
