,title,rating,pros,cons,company
708,"""Team memeber""",5.0,I really liked the company /benefits,They hire a lot of seasonal and so they don’t keep a lot of people,Nike
709,"""Demand Planning Manager""",4.0,Work life balance is a plus at nike,athletes get a lot of preferential treatment,Nike
710,"""Sales""",5.0,"Good employee benefits, most product discounts","questionable management sometimes, high turnover rate",Nike
711,"""Nike sales""",5.0,Excellent benefits as far as discounts and team,Pay not much if hours are not aplenty,Nike
712,"""Great company to work for""",5.0,Free lunch discount on shoes,Hours schedule pexpletive thank bad,Nike
713,"""Director""",2.0,Primarily the brand from a consumer perspective,"Culture and operations, heavily old school hr, finance, IT; afraid of change, mediocrity",Nike
714,"""great place of employment""",5.0,pleasant and friendly management staff that is helpful and want the best for you and have high expectations for job quality.,immaturity levels of some of the employees and organization and communication is not the greatest between managers and employees.,Nike
715,"""Packers Sports balls""",5.0,"Great leaders, team players, well organized","Alot of walking, alot of picking and packing",Nike
716,"""Nike Athlete""",3.0,"Great Coworkers, Uplifting environment, Good managers, great dsicount","Very low compensation for what is asked, low pay increases for better performance",Nike
717,"""Coach""",4.0,"Free staff dress every quarter, bonus and benfits",Human Resources and Loss Prevention department,Nike
718,"""Good""",4.0,The discounts for clothes is a plus.,Didn't get paid enough for work.,Nike
719,"""Overall OK.""",3.0,Great swoosh discount and definitely great coworkers,Pay is almost minimum and the yearly CFE doesn’t give you any big raise even if your rated highly successful.,Nike
720,"""Actually pretty good""",3.0,"Discount, friendly coworkers, cool managers",Very strict about what you wear,Nike
721,"""Sales Associate""",5.0,- Flexibility - Comfortable clothing during work - Co Workers - Discount,There was no cons during my work experience,Nike
722,"""Part time in a college town""",5.0,"coworkers, hours, management, pay, ""uniform""","hours, political, store manager, nothing else really",Nike
723,"""Retail Manager""",4.0,"Positive, safe environment putting athletics and Athletes* at the forefront.","Behind it all, the retail environment is all about sales - the constant push to sell lost the authenticity for me.",Nike
724,"""Not like any other retail job I’ve worked before.""",5.0,"I love putting people in the right gear they need for whatever their activity, even if they’re just walking around at work.",Sometimes customers are rude and terrible. If it gets slow the day can drag on.,Nike
725,"""Nike Footwear""",4.0,Great Product. Great People. Incredible Campus atmosphere.,As the biggest sportswear company there is A LOT of work. Because of this a work life balance is not possible.,Nike
726,"""Experience varies team to team""",4.0,"I love the people I work with, they care about the work, are passionate and are skilled. The environment is supportive and I enjoy going to work most days.","Environment varies team to team and, as at any workplace, a lot of your experience is determined by your manager or department.",Nike
727,"""NA""",3.0,environment and easy days off,late hours and holidays,Nike
728,"""Atlete""",3.0,Very caring company. They care about values,Don’t give a lot of hours. Also they have restrictions to work schedule,Nike
729,"""Manager""",4.0,"The company as a whole really values its employees. If you are on the ""right"" team it is an Awesome place to work, if you are on the ""Wrong"" team you will encounter favoritism, negativity, and a can't do anything right attitude.","Clicky, alot of politics needed to get a position at the corp. office.",Nike
730,"""PT Athlete""",5.0,"-30% off in store -40% off online (for self, parents, siblings,etc) -Great customer service experience",-Have to be available too many hours -Pay is only $10/hr -Cheap penny pinchers,Nike
731,"""Nike Athlete""",1.0,Discount Coworkers Options for overtime,Management is terrible Favoritism Always busy Too many hours for part time (36),Nike
732,"""Full timer""",2.0,"Benefits, discounts, the culture the store created for the consumers, easy hiring process, the uniforms, great overtime opportunities, hours, coworkers","Work environment is like high school environment, employees are scared to speak up when managers are involved with part timers and then often get promoted because of their referrals. Unfortunately most of the athletes that get promoted from doing nothing, let the power go to their head and create a unenjoyable hostile work environment.",Nike
733,"""Former Employee""",4.0,Great Discount Interesting culture Exposure to new product,Uppity Management staff Unnecessary rules and restrictions,Nike
734,"""Solid Company""",4.0,Laid back atmosphere Awesome product Work-life balance,Limited upward mobility in certain areas,Nike
735,"""Sports Mecca, Cream of the Crop""",5.0,Great campus. Great product and marketing. Company is growing. Company makes great business decisions.,Lots of people on our team that really do not appreciate working for a great company and do not put forth a solid effort. This is a problem if you thrive in a team environment.,Nike
736,"""Nike Design""",4.0,Amazing talent. Global reach. Solid compensation and benefits.,Too many opinions. Not enough career opportunities.,Nike
737,"""Management""",4.0,My co workers were great and work was very easy. Just walked around and assisted customers. Work went by fast when it was packed too. Discount was also great.,New management was terrible. Has a fixated mindset and very closed minded. Not willing to work with their “athletes”.,Nike
738,"""Great experience""",5.0,Stable stable stable stable stable,"Low pay, low pay, low pay",Nike
739,"""Great company that provides a freshness to the retail industry.""",3.0,"High energy, growth opportunities, employee discount","Diversity, upper management, fair treatment, store management, harassment, human resource response",Nike
740,"""Account Executive""",3.0,Co-workers are super helpful and welcoming,There are too many politics and people moving their friends into roles,Nike
741,"""Area Manager""",3.0,Plenty of opportunity to get involved with the business.,Not valued for your efforts.,Nike
742,"""Sales Associate""",4.0,"Great Discounts, Flexible Hours..","Low hours, low pay, hard to move up in position",Nike
743,"""Corporate Sales Director""",4.0,The benefits of quality of life and work balance. Being able to utilize the fitness facilities. The brand strength and access to Nike products.,Too much top down decision making. Leaders &amp; designers do not lean in on managers and directors enough to get a true pulse of the business.,Nike
744,"""Sales associate""",4.0,Easy to get along with people there. Energetic staff.,The Hours they gave and salary.,Nike
745,"""Finance Director""",5.0,"Great campus, work life balance, collaborative environment","Complex org, too many meetings",Nike
746,"""Company Review""",3.0,Great benefits packages Great Employee Stock plans Great product discounts,Lack of leadership support Lack of work life balance Mediocre Pay,Nike
747,"""Footwear Sales""",5.0,Working for NIKE you get tons of merchandise for free and at a discounted price. Great environment.,Retail becomes stressful during holidays.,Nike
748,"""Athlete""",5.0,"The discounts, the open air of the job",No real route to moving up in the company,Nike
749,"""Better side of retail""",5.0,"It's a cool place to work, and is pretty relaxed. The discounts are great, and the 40% you get can extend to your family; even online shopping.","It's a retail job, so the hours can be tedious.",Nike
750,"""Part Time Retail Employees""",4.0,"For young professionals wanting to simply get a job or get their foot in the door, Nike was a great first step for me in retail. As a part time Nike Factory Store employee, you meet all kinds of characters throughout your time on the sales floor. Employees who generally see success in this entry level position are those who provide genuine customer service and work hard for customer satisfaction. It's not a difficult job, just one that requires effort.","You are on your feet a lot, so be prepared to stand, walk, move, and lift light loads.",Nike
751,"""Picker""",5.0,"Weekly pay, easy job. 3 breaks? It was 15 min 15 min and 30min i believe.","Huge factory long walks, long periods of time on your feet.",Nike
752,"""Great place to work""",4.0,Always collaborating and driving in the right direction,Sometimes work can be a bit disorganized,Nike
753,"""Running Floor Coach (Assistant Manager)""",4.0,"Great training and development plan, great perks (free Nike paraphernalia, cups, books, etc), staff dress/ clothing allowance, affordable healthcare",Childlike work environment. Undertrained leadership,Nike
754,"""Overall beneficial""",5.0,They work together at Nike and enjoy teaching everyone. It's a perfect job for a student.,Sometimes growth to high levels can be political.,Nike
755,"""Getting better and better.""",4.0,* Great culture * Good pay * Fantastic brand * Lots of things to learn * Willingness of people to teach,* Very clique-y * Hard to get promoted,Nike
756,"""Team Lead""",5.0,Great place to work! Awesome benefits,The customers are demanding when working at outlets but thats customer service,Nike
757,"""Not sure""",5.0,Very nice company to work,Nothing that I can think of,Nike
758,"""Head Coach""",2.0,"Top notch product and technology. Nike is first with everything, everyone else follows.","What you have heard and read about the bully culture is absolutely true. If you don't fit the mold, you will be fighting a losing battle with the cliques that form. HR issues will be ignored if that employee was a ""favorite"". Some RDD's (Retail District Directors) will make up their own rules and policies that are not Nike's and only enforce said policies on managers who do not fit the above mentioned mold (this happened to 4 Head Coaches in the district). Compensation and benefits are great, but the culture of favoritism is not conducive to a business and the high pay is not worth the stress and anxiety.",Nike
759,"""Great job while in school""",5.0,"Employee oriented, good management, and great company","Open late nights, weekends, and holidays",Nike
760,"""Growth is stagnant""",3.0,Work life balance is good,There is very slow career growth,Nike
761,"""Athlete""",3.0,"Relationships you make, Depending how long your shift you get 3 breaks, the discount is amazing","No scheduling flexibilty, work-life balance, scheduling app is down",Nike
762,"""Nike GC is coexisted with opportunity and challenge""",4.0,Great company with good market position and strategy,Company culture is weak in GC for all employees feeling belonged.,Nike
763,"""Bully Culture if You're Not one of the ""chosen ones""""",2.0,"Great Fringe Benefits, flexible work schedule, Summer Fridays, discounted products, Great Product, Getting to be around sport","Believe the news. It's 100% a bully culture. People get promoted based on their friends and not on their merits. It's a mean-spirited back stabbing culture. The gossip that happens in the office (from Management) is unbelievable. For a company that screams ""Be True"" ""All Inclusive"" really has a good smoke screen up when it comes to their internal culture. More often than not you will work with an extremely immature management (I mean we have VP's commenting mean things on Instagram to competitive rivals for crying out loud). The amount of drinking and partying that happens in the office is reminiscent of my college fraternity days.",Nike
764,"""Challenging, exciting, and fun. Surrounded by passionate and conscientious people.""",5.0,"Challenging, meaningful work. Highly collaborative. Extremely positive work culture, beautiful campus with world class sports fields and gyms. Fun and great work life balance. A company that wants to make the world a better place and has purpose greater than just making a profit.",Challenging data environment. Slow decision making processes. Often unclear and overlapping ownership of key decisions.,Nike
765,"""Head Coach""",4.0,"The commitment to the people- our customers and team members. The focus on training and development and the drive to always evolve with the current market. Change is never easy but I appreciate the focus on making the right changes. As retail goes, it is an honor to work here!","I think working towards making it easier for an external hire to come in and assimilate is needed. Because we have so many people with many years' tenure and so many people that work their way up, I think someone coming in as a leader from another company has to work hard to learn ""the Nike Way"". When you come in as a Head Coach vs. an athlete, the development path is different. There is not a specific training process on the store level for upper management. I think there is a large variance from District to District. Mastering this would make working here a 5/5!",Nike
766,"""Nike is the chillest job ever.""",5.0,"Discount, flexible, work attire gym clothes, and sports","Not enough pay, well you part time over as a position but has no substance, it’s not what you do it’s who you know.",Nike
767,"""Sales Manager""",2.0,Great gyms and fields to work out on.,Substandard team members. Very much a good ol boy network. Does not value diversity.,Nike
768,"""Great company""",5.0,"Pay, benefits, discounts, scheduling, staff dress free! Upper management has great vision for builing the business. Professional athlete endorsments.","Rampant favortisim, middle management doesnt care, HR dept sucks no help at all with any issues, department needs a serious overhaul.",Nike
769,"""Sales associate""",5.0,"learn more about sales, marketing and customer service. discounts on garments. networking and connections",pay for seasonal job was not too good,Nike
770,"""Cook""",1.0,I got half off for the beer which was nice. I got to have unlimited food which was even better.,The money isn't very good there and the tips are kinda poor. Management never had a set schedule either which made me mad because I always had to make sure work came before family time.,Nike
771,"""North America Digital Brand""",2.0,• You receive fantastic experience. Mainly because we are so understaffed and are expected to stretch into every role possible.,"• Zero work-life balance. • The buddy system lives on in North America - “promote your friends, qualifications don’t matter.” • Leadership consistently makes promises they don’t plan on keeping. • No opportunity for career growth. • It’s an every man for themselves environment, with no support.",Nike
772,"""Nike Review""",4.0,Hard to get Nike Contract,Great Working Culture at all the levels,Nike
773,"""great work culture""",4.0,great work culture in the company,should have equal pay for both men and women,Nike
774,"""Great Experience""",4.0,Great benefits. Always something interesting happening on campus. Diverse workforce.,Food is expensive. Gym membership isn't free.,Nike
775,"""Good company""",4.0,"Inspiring mission, goals, and culture",Management can greatly affect the culture at stores,Nike
776,"""S&amp;R""",3.0,"Good discounts, flexible schedule","Management is bad, pay is bad for the amount of money the company makes. High turn over rate.",Nike
777,"""Working for Nike Full Time""",5.0,Great learning opportunities and positive environment,Working in the retail stores can get busy,Nike
778,"""sales associate""",1.0,Good environment good co workers,Not fun every day is same,Nike
779,"""Good work environment, terrible pay""",3.0,"Friendly atmosphere, 30% discount, basically free uniforms, constant recognition",Low base pay for what is expected of you,Nike
780,"""Full time athlete""",3.0,"PTO, healthcare, stock plans, 401k","No set schedule, management issues",Nike
781,"""Nike Athlete""",2.0,"good discount, good co workers","horrible retail management, don't expect time off",Nike
782,"""Customer Service""",5.0,The team environment helped make working in a retail store much more enjoyable.,Management wasn't always approachable but it was understandable during busy days.,Nike
783,"""sales lead""",5.0,"nice people, fast paced, flexible schedule",not to many maybe the overnight,Nike
784,"""Assistant Manager""",5.0,"Culture, Prouduct, Atmosphere, Team Work, High Volume","Work Load, Late Nights, Stock Room, Nothing really else.",Nike
785,"""Great place to work""",5.0,Benefits starts from the moment you start. 40-50% discount on majority product. They give away free clothes twice a year to full time employees. They give back to the communities through volunteering.,"It takes a long time weave the bad apples out which affects the morale of the better workers, that’s all I have.",Nike
786,"""Solid""",4.0,"Great environment, good benefits, local","lack of guidance, little training",Nike
787,"""Environment""",5.0,Great work environment that promotes collaboration amongst its employees.,You often feel like a small fish in a giant cooperation,Nike
788,"""I don’t know much""",5.0,Fun cool chill funny ehhh,Retail sucks I don’t like it anymore,Nike
789,"""Nike""",5.0,The job is what you make it,Ambiguity in roles and responsibilities,Nike
790,"""Sales Associate""",4.0,"discount, pay, people, environment, discount","hours, benefits, customers, loyalty, nothing",Nike
791,"""sales associate""",5.0,Great staff and team oriented,time consuming looking for back house shoes,Nike
792,"""Retail Marketing Specialist""",5.0,Work life balance is great,Highly Competitive in certain markets,Nike
793,"""9 years as manager.""",2.0,"You get to wear shorts, t-shirts and sneakers.",They will lie to you and BS you to get you out the door. They closed my store and made me do several interviews to try and keep my job then layed me off.,Nike
794,"""n/a""",4.0,discount was good enough for myself,customers are very messy and move things around,Nike
795,"""Nike athlete""",3.0,"Family environment, team is nice, free clothes and a pair of shoes every once in a while","none, everyone is really nice",Nike
796,"""Nike Global Merchandising Associate""",4.0,"Teams, work environment, wellness facilities.","Matrix can be difficult to navigate, strategic decisions based on politics not biz needs.",Nike
797,"""sales associate""",3.0,swoosh account and crazy discounts were really the only pros,inconsistent hours and little opportunity to move up,Nike
798,"""Great company""",4.0,Great environment Relatively easy job,Can be hard to get weekends off,Nike
799,"""Fun company, don't feel valued""",4.0,"- Opportunity to work with great people, especially if you are interested in the sportswear market - Great discount, good benefits - Definitely can be a higher end big chain retail job","- Don't feel very valued, hollow developmental plans that seems to be catered more towards developing the manager rather than the employee - Lack of incentives that make employees care about their work",Nike
800,"""PCO""",3.0,Rotating 12 hour schedule Good for students due to schedule,"low pay, not much structure when it comes to training.",Nike
801,"""Athlete""",5.0,Fun young college environment Good pay Accessible easy to talk to managers,It was sometimes hard to get weekends off,Nike
802,"""Its a great place to work""",5.0,There is more room for growth,Seeking something more challenging and ambitious,Nike
803,"""Nike Athlete""",4.0,Great work environment excellent discount,No raise with promotion,Nike
804,"""Customer service rep""",4.0,Nike was a great place to work while at school!,I don’t have anything negative to say,Nike
805,"""Fun place to work at, but just work""",5.0,"The discounts great 40% online and at non factory Nike stores (north park), and 30% at outlets. Everyone is fun to work with and the location I was at was packed with students like me in college or about to be.",Due to some friend circles being made occasionally drama arises in the store between employees. Sometimes I’d still get scheduled against my availability even though I submitted a sheet and spoke with shift manager.,Nike
806,"""Nike is a great company to work with but it’s who you work with that makes the experience great or horrible.""",2.0,"You really have good customers who appreciate your time, care and passion to help them find and buy what they need or wanted. You get recognized by the good reviews and you get awarded either from the customers or from your team. You experience the love with certain employees who actually cares about you and your outside life.","Management team never did their job. Certain managers put medical or car issues or even funerals in your par knowing that it’s out of your control but still blames you. If you take your 15min break and use the bathroom but you were “busy” using the bathroom and you stayed an extra 5mins, they will put that in your par. There’s a lot of favoritism and a lot of “butt” kissing just for you to even be recognized of your hard work and wanting to move up. Managers talks a lot about employees personal business while on the job. If your part time they don’t respect you, but if your full time they treat you like one of the managers. I started working at Store 88, June 2017 and I resigned in April 2018. I resigned because they saw my hard work but someone just had to pick at me and I gave up because there’s no fairness with a “team” and apparently if you’re using the bathroom too long how about you check up on me to see if I’m okay or not.",Nike
807,"""Great""",5.0,Fun place to work and great people,Low pay but a great starter job,Nike
808,"""Great""",5.0,great great great great,lack of flexibility and process of getting time off,Nike
809,"""Coach""",3.0,Fun environment A lot of career opportunities,District management doesn’t care about issues within stores unless HR gets involved,Nike
810,"""NIKE""",4.0,"Talented workforce, global reach, solid work/life balance, good pay.","Difficult place for career growth, stifling creative process",Nike
811,"""Nike Employee""",4.0,"Benefits, 401K, access to cool events in Oregon, gym membership, childcare, even the cafeterias are good.","Oregon's competitive culture can create an environment of corruption, big business stagnation pains.",Nike
812,"""Seasonal Athlete""",4.0,"Lots of hours and an enthusiastic employees, discounts","Understaffed, poor management at the outlet store that I was located",Nike
813,"""Not a Good Time For This Company, Dont let the NYSE Fool You""",1.0,- College Atmopshere i guess if thats a good thing,- Degrading upper managment that doesnt care about you,Nike
814,"""Wonderful experience""",5.0,"Discounts, fun and enthusiastic work environment and thorough training.",Weekend rush of customers and can be chaotic at times,Nike
815,"""Lots of changes""",5.0,"Benefits and salary are pretty good. Access to employee prices at Converse, Nike, and Hurley. Employee Stock Purchase Plan. Regular events to celebrate sports, thursday night campus happy hours during the summer, Summer Hours (work your time during the week and then leave at 12 on Friday....the list goes on and on.","It's a complicated time right now - massive reorgs and leadership changes, sagging US sales, and resurgent Adidas. People are in transition and that's hard. They'll get past it though.",Nike
816,"""Inbound Planning Manager""",5.0,"Great Company, Great Benefits, Low workload","Hire Overqualified People, that later can not be promoted or adjusted",Nike
817,"""Swoosh gang""",4.0,Keeps you motivated to live a healthy lifestyle. Be one of the first to know about special events and new products.,"Can be very competive for recognition and promotions. Always active, so if you’re lazy don’t apply.",Nike
818,"""Great Company!""",4.0,The benefits are amazing and you really can't help wanting to become a better athlete being in the sportswear field. They are also very deep rooted in sporting goods and bring the history to life whenever they can. There is an amazing shift in culture also happening out at WHQ and trickling out to the field offices!,"You are just a number sometimes. The previous re-org, just cut people with not much basis. Many great people lost their jobs. Never get comfortable in the job you are in.",Nike
819,"""Ecommerce manager""",4.0,"Very positive culture, encourage employees to get healthy life","salary is slightly lower than market, due to there are other benefits non-cash",Nike
820,"""Sales Associate""",3.0,The Discount was what made it worth staying,rude managers and they did not show a sense of concern for employees,Nike
821,"""Great company, enjoyed time working here.""",4.0,Great company to work for.,Did not get a ton of hours while working here.,Nike
822,"""You’ll love it here!""",5.0,"By far the best company I’ve worked for! Great pay even just starting out, great benefits once you work your way up, and they encourage you to speak up, whether you have new ideas or a concern.","It’s retail, so never a set schedule. Days are gone if having a closing shift of course. Inventory day isn’t great either.",Nike
823,"""Nike cville""",2.0,"Discount, learning about different products and working with fun people.","Management shows favoritism to particular athletes &amp; micromanages every little thing you do. No upward mobility. Part-time under employees have no flexibility with hours, we are expected to work every shift that is on our availability because the turn over rate is so high no one stays long enough to give other employees a break. Long hours on the floor.",Nike
