,title,rating,pros,cons,company
560,"""Courier""",3.0,"Good people work there. It’s a growing company in a growing industry, and there are opportunities.","Too many to list all: Inadequate, outdated, poorly kept, and run down resources. When your competition runs a business better than the very one you started-You know it’s bad. Company founded by a marine corps pilot=company run like its the military-assignments with tons of responsibility-yet no, limited, or poor resources provided to get the job done. Employees are expected to use personal cell phone as a job aid, yet the company offers no reimbursement for the use of a personal item for company business. Heath insurance is the worst. Provider is Cigna, which is also the worst. Vision is Davis Vision, again the worst-you’re better off going to drug store glasses-less brain damage. Package cars are filthy. Drivers leave food in them and the rats come in the middle of the night and eat it. I’ve seen droppings in the trucks.",Fedex
561,"""Material Handler""",5.0,"Good management, great teams Great insurance and good pay",If you are a hard worker the cons wont be noticeable.,Fedex
562,"""Great Place To Work and Grow""",5.0,Health Care benefits are great. Flexibility to grow into any career within the company.,Bring back jump seating. That was a plus benefit to fly around the world for cents on the dollar.,Fedex
563,"""FedEx Delivers""",5.0,Great culture that supports employee development.,It’s so big that sometimes it is very hard to get things done.,Fedex
564,"""Good Job""",5.0,You get paid every week.,No minimum hours to work. Depends on how much volume there is.,Fedex
565,"""Lack of character""",2.0,"Full time, vacation, semi decent benefits",Management - free for all as there is no one overseeing how this remote office is ran - male dominated - no respect for coworkers and issues brought to their attention - hr communicates via phone - NEVER show up. It’s laughable,Fedex
566,"""Package Handler""",4.0,"Health benefits, do your job and manager is great",working overnight can hurt your work / life balance,Fedex
567,"""so hsard""",2.0,pay is good benifits are ggod,slave plant is to hard on back,Fedex
568,"""World Class Company""",5.0,Culture of people first and respect,Limited opportunity for advancement if unable to relocate,Fedex
569,"""Good""",5.0,"Good people, good pace.",No work sometimes end up leaving early.,Fedex
570,"""No benefits, no time off, just say no.""",1.0,Getting let go after not missing a day of work in over 4 years.,"Complete sham of an operation, from top to bottom. Most trucks are woefully under maintained. Fed Ex management preaches one thing and the contractors preach the opposite. You're nothing more than a rented mule.",Fedex
571,"""Not a great company to work for""",1.0,"Good benefits Some nice people to work with for the most part They got rid of the person in charge that was ruining the company, sent her to Hawaii","Pay is not that great for all the work we have to do and things we have to know Raises are very low, few and far between' Recognition doesn't happen much Poor choice for people chosen as managers and team leads Morale is non-existent",Fedex
572,"""FedEx sales""",4.0,Good company that cares about their employees. Most employees stay long term and management listens,Too many different layers of sales which leads to mis-aligned accounts. Poor operations support can lead to lost bui,Fedex
573,"""Director""",5.0,"Great culture, Diversity of thought, Able to make meaningful contributions to the Company.",No real cons to speak of,Fedex
574,"""Bigots""",1.0,None that I can think of.,"98 percent of the employees there are Racist, The 2 percent are the result of affirmative action.",Fedex
575,"""About being a truck driver""",3.0,It is ok for the most part,Having to cover other people's routes,Fedex
576,"""Hard work fast paced good people""",4.0,Lots of hrs good pay,Very hard work temp can be crazy,Fedex
577,"""Legal Assistant""",5.0,One of the best reasons to work at FedEx is that it is a Fortune 500 company that provides each of its employees a chance to make a difference.,One of the downsides of working for FedEx is that it can sometimes be a challenge to balance life and work.,Fedex
578,"""Great company""",5.0,Great team environment and nice starting pay,None so far. Great company,Fedex
579,"""Package Handler""",5.0,Very fast paced fun job. Great coworkers. Team environment.,Adjusting to climate. Staying hydrated,Fedex
580,"""Toxic work culture""",2.0,Excellent benefits even for part time employees. Very easy to employ process due to high demand.,"Terrible management, plays favorites. They preach that you can promote within the system but unless you're buddy buddy with upper managment you don't have a chance. Poor work balance which leads to high turnover. Peak season is complete chaos.",Fedex
581,"""Ops admin""",5.0,There are great medical dental and vision benefits,You only get 6 paid holidays,Fedex
582,"""Sales""",5.0,Phenomenal culture and great place to work,"No complaints, great company to work for",Fedex
583,"""High turnover""",3.0,Easy job to get easy interview process,"Manual labor gets tiring, resulting in high turnover",Fedex
584,"""Great Benefits""",5.0,Full-time benefits for part-time workers.,Haven't been around long enough to notice any,Fedex
585,"""Operations manager""",1.0,Provide opportunities to be active,"Not employee sensitive, careless about employee wellbeing. No longterm employee planning",Fedex
586,"""Not good""",1.0,None this place sucks don’t work here,Slavery terrible working conditions,Fedex
587,"""great company""",5.0,"good hours, good people, great management",no cons what so ever,Fedex
588,"""Customer service""",5.0,Great people atmosphere and wonderful benefits,Same problems day after day with customers upset about package not delivering,Fedex
589,"""HR""",4.0,Great company to work for,Great company to grow with,Fedex
590,"""Sales""",5.0,"Great Coworkers, good collaboration, work life/ balance",award sales with bigger commision,Fedex
591,"""Great""",5.0,Great place to work I love it,Thad’s is nothing that I don’t like,Fedex
592,"""RTD Driver""",1.0,Horrible place to work.,"If your under 10 years with the company you have no seniority. When you turn in your vacation forget about summers. You get split days off. No balance with work and home life. If you call out sick your manager for sure will ride you when you return. If you get into an accident and you hurt someone your fired. If you have 3 related vehicle accidents, or any ocurrence with your vehicle your fired. Managers reviews don't mean a thing. If your part time you can be sent home after 3 hours. people transfering in your department from other department will bump you after six months so if your new forget it. Managers are uneducated locker room mentality idiots. No continuous education for upper level staff. Trucks are terrible and unsafe. Tractor trailers are old seats with terrible springs and air. Lots of problems with back and knees.",Fedex
593,"""Intl Acct Exec Los Angeles""",4.0,"Fantastic stability, corporation very healthy financially, exec level very innovative",processes in place manage to the weakest link on the team so some activities a waste of time,Fedex
594,"""Great Company""",5.0,"Work Life Balance, Benefits, 401k match","Salary, Process congestion, No holiday celebrations",Fedex
595,"""Package handler""",1.0,Great pay Great benefits,"Teamwork not always to help other Some mangers and team leaders were poor decision, not helpful, not supporting to everyone. Upper manager never come visit or feedback from us.",Fedex
596,"""Sales manager""",5.0,"Great people, good salary and benefits",Too much travel required at timed,Fedex
597,"""Great Company""",5.0,"Easy access to managers, a lot of guidance for interns",Can't think of any,Fedex
598,"""Manager""",5.0,I worked with good people there,Some people i worked with were mean,Fedex
599,"""Great Place to Work""",5.0,Endless opportunity to advance. Diverse works force. No day is ever the same,Holiday Season can be very hectic,Fedex
600,"""Service Agent""",5.0,"Always busy, great people",working during the Holiday rush - crazy busy,Fedex
601,"""Lead consultant""",4.0,Good pay and good team,There is nothing bad to say,Fedex
602,"""Analytics intern""",5.0,"Great company, enjoyed people i worked with",Not many cons at all. Enjoyed my time there,Fedex
603,"""Internal auditor""",5.0,Good culture and always put people first,Not competitive with the benefits and perks that are offered in the pittsburgh market. Little flexibility in work from home.,Fedex
604,"""Was good pay and always just enough hours""",4.0,"Steady work, very good manager","Hot in summer, cool in the winter , hard labor some boxes are very heavy",Fedex
605,"""Program Advisor""",3.0,Solid company that has a history of very few layoffs.,Difficult to move around in the corporation as people have been with the corporation for their entire careers and the jobs that are posted internally are usually filled before the interviews are conducted. They do not get rid of the dead weight. It is one thing to be loyal to the employees it is another to not get rid of the ones who are not contributing.,Fedex
606,"""Center consultant""",2.0,There are no pros. Hard labor,Ghetto workers. Not clear on expectations. Asst managers and managers are poor examples of what to do or not do!!,Fedex
607,"""Dock Worker""",4.0,"Great Hours, People i worked with was great","Management, Weird Schedule times",Fedex
608,"""Great benefits""",3.0,"The benefits, hourly pay isn't too bad","Not many hours, not enough people on my van line ever, packages are often pushed out in large numbers at once, making it rough on the loaders/tuggers",Fedex
609,"""Sales""",5.0,Great Company to work for with great benefits.,None that i can remember,Fedex
610,"""Great Company!!!""",5.0,Great work life balance and people culture,Opportunities for advancement seem to come with little to no heads up,Fedex
611,"""Great Company""",5.0,"A world wide respected organization, great benefits, fair treatment by management, great team atmosphere, loved working there.","Customer Service department can be ineffective at resolving issues and then the sales team ends up being the customer service team and therefore not selling. Payroll increases are kept in check and no one really gets ahead financially; however, benefits are great. Promotions are hard to obtain even if you are a high performer.",Fedex
612,"""Great  Part-Time Job""",5.0,Perfect for those going to school or transitioning out of the service.,Low Hours and repetitive work,Fedex
613,"""Center Consultant""",1.0,"benefits, vacation and sick time","low pay, over worked, heavy lifting",Fedex
614,"""I really liked working there""",4.0,"My ideas are different than most...I didn’t mind the cold or heat. I didn’t mind the hours, the rest of my day was clear. The pay rate was good.","I didn’t mind working with no heat or AC...dress accordingly. Having to be there at 3-4 a.m . The majority of the other employees are grumpy and rude. Management was hard to find. If you did something wrong, mgmt did t say anything, the drivers would. If you do something right or are proactive to a situation, don’t look for mgmt, ask your drivers. If you have to take a couple days off because you’re sick, etc...I guess they think that’ll be your in for quitting,,,they don’t care",Fedex
615,"""Sales Executive""",3.0,Good environment Good Pay One of the few companies still giving pension,You are not promoted for a great job it's who you know Management gossips FedEx limits growth if you are not a favorite,Fedex
616,"""great place""",5.0,easy but busy place be prepared to work hard,very very busy sometimes too busy,Fedex
617,"""It was okay but incredibly lacked safety""",2.0,"Benefits are nice, staff is nice also","Too much work for little pay, uncoordinated hours, and unsafe environment because people don’t care.",Fedex
618,"""Handler""",3.0,The job was easy work and easy to get the hang of,Very very active and work in weather conditions bad or good,Fedex
619,"""My time at the hub in memphis""",4.0,Good benefits Good starting pay Meet new people,Depending on the area...too much work Not enough hours,Fedex
620,"""Manual Labor""",3.0,-good pay -choose your own shift,-those who work harder and have a higher scan rate aren't compensated more than those who have extremely low scan rates -expected to pick up the extra slack,Fedex
621,"""Great place to work""",4.0,"Good pay, good benefits, stable employment","I worked night and weekend shifts, which made it difficult to attend social and family events.",Fedex
622,"""Fedex is a wonderful company to work for. The culture, the benefits, the people… All make for a wonderful environment.""",4.0,"Flexibility, benefits, work life balance, vacation days, nice corporate environment.","Many of the processes at Fed Ex Are complex and need to be leaned out. Getting anything approved seems to take forever. Managers still like to get involved in day-to-day work and many of them won’t allow the teams to shine, instead they want the visibility of the team success on them.",Fedex
623,"""Package handler""",4.0,Pretty good pay with hours,Different shifts may not be for everyone,Fedex
624,"""Material warehouse handler""",3.0,Steady easy work. Great conditions and safe.,Long hours. At times very boring.,Fedex
625,"""Handler""",5.0,great company to work for,bad hours might have split shifts,Fedex
626,"""Driver Helper""",3.0,Fun people to work with every day.,Not the best money unfortunately.,Fedex
627,"""Packages and Rashes""",1.0,Fast paced thousands of packages working arm scanners,Very few English speaking coworker,Fedex
628,"""FedEx""",3.0,"Good Benefits, Health insurance Salary Co workers helpful Monday thru Friday work week",Management Long breaks with no pay You will work other job title s Old trucks Long days,Fedex
629,"""Retail Marketing""",3.0,"6 years with the company * Good work-life balance * Slow and steady pace. FedEx Services like you to operate at 60% capacity so mistakes won't be made * Unless you steal from them or spend their money without permission, you'll never be fired",* Working at 60% capacity means a lot of free time at the office. It's also boring. * Advancement is imposible,Fedex
630,"""CSA""",4.0,Excellent vacation package and holiday pay,Working on Christmas Eve and day after Christmas,Fedex
631,"""Hard Work""",4.0,Good entry level pay with health benefits,"Hard physical work, no 401K options,",Fedex
632,"""FedEx Air""",4.0,"Outstanding benefits, seasoned drivers understand new team members will require help to learn all the details to perform their duty and willingly do so no questions asked. Holiday seasons overtime is always available. Once your route becomes second nature you become immune to the demands you do your best and that’s all you can do.",Hitting the delivery times are difficult to sustain per the system driven requirements … real life road conditions and out dated mapping is an obstacle in itself.,Fedex
633,"""Great job""",5.0,It's great to work there lots of great people,It's hot then it's to cold poor leadership,Fedex
634,"""Great job""",5.0,Management really patient with teaching,Small quarters at times,Fedex
635,"""Part-time employee experience""",3.0,"Large company expansion in Lehigh Valley, promising growth and advancement opportunities.",Hours expected to work are stated at the minimum level with finishing times always changing (meaning you never know when you can leave until told to do so) There are no breaks and no lunches as a part timer (some days can go as long as 8 hrs).,Fedex
636,"""Great Company to Work For""",4.0,The culture at FedEx is great.,"Location is not the best, but it's doable.",Fedex
637,"""Hard Work but Good Pay""",4.0,"Good pay (12hr), shifts go by fast, great interactions with management","Hard work, extremely structured shifts",Fedex
638,"""Operations manager""",5.0,"Benefits, People Company, Promote from within, Can relocate","Poor..Work.Life Balance. Hire inexperienced peers, desperate for mgmt",Fedex
639,"""Great part time gig""",5.0,Benefits and employee discounts are great!,Peak seasons can be very demanding!,Fedex
640,"""Account Executive""",2.0,Work from home. Decent benefits,No room for advancement. Sales and company headed away from mission statement.,Fedex
641,"""Sr. ECO Import Coordinator""",3.0,- lots of overtime opportunities - great insurance - multiple work hour options depending on dept.,- never know when you will leave work,Fedex
642,"""Material Handler""",4.0,"Amazing benefits go well beyond health care, includes 24/7 Nurse on call. Also work/Life Balance counselors. Too much to list here. Retiree benefits are also wonderful as long as you are 55 yrs. and have 20 yrs with company. Make a career with FedEx and you can be financially secure when you retire. Part time employees entitled to healthcare benefits, 401k, pension and life insurance just as full time employees. Great opportunity for growth and movement throughout the company and the country should you ever want to relocate.","Shift work in certain positions that can be very disruptive to healthy sleep. No time off during ""Peak"" season. Generally Dec 1, through Dec 26. Also when you have off for a Holiday, generally scheduled to work much earlier the day after because freight is behind by a day. If you are young and looking for a career with security, growth and very fair wages, FedEx is worth looking in to. Older people and disabled not so much.",Fedex
643,"""Shipper""",2.0,"Flexible hours, small raise every few months","Hard work, impossible to move up, sketchy people",Fedex
644,"""Material Handler""",1.0,It's affordable for management and full time employees.,They're in such chaos their is no time to explain benefits and for those who ever never had insurance you're made to feel inferior. Not enough time to opt out of insurance and it's completely unaffordable if you have kids and this is the only house income you have. I've searched for days on how to get to the page to opt out of insurance without finding anything. Everytime I get to work their is such chaos I forget to even ask for help. When I do management says come back later and we will go over it. Then we both forget.,Fedex
645,"""Package handler.""",4.0,"Quick and easy pay, inviting workers.",Slow opportunities to rise in company.,Fedex
646,"""Technical quality advisor""",5.0,One of the best companies to work for. Best people and technology. Great chances of grooming the career.,I don't see any as such.,Fedex
647,"""Eco team lead""",4.0,"Lots of room for advancement, locations throughout the us for transfers, management willing to work with you",Pay and raises could be better,Fedex
648,"""Data Analyst""",4.0,"work and life balance, good management team in general",Memphis isn't that ideal fun place for singles,Fedex
649,"""Driver""",3.0,Plenty of Job opportunities as long as you have the skill and the credentials,Horrible pay and Medical benis are watering down by the minute.,Fedex
650,"""Good Enough""",2.0,"Work life balance is required, most managers are really nice and understanding. Benefits are good, standby flight benefits on all airlines.","If you are unable or don’t want to move from Dallas, consider your career dead. There are virtually no positions to promote to, and too many politics and higher ups with power struggles. Unable to control your numbers, it seems like they draw names from a hat to see who gets a bonus, internal issues are unreal for a company this size. The director is a nightmare, she is anti-family, anti-team work, if she had it her way we would be glued to our desks all day. They also changed the bonus payout and they don’t care how that money affects our families.",Fedex
651,"""Account Executive""",4.0,The people I work with are great. The company is very stable. The officers are very forward thinking and seem to be ready for opportunities around the world.,Salaries seem to lag behind many opportunities.,Fedex
652,"""Promote from within""",4.0,FedEx promotes from within the company and really helps advancement within the organization,Hours can sometimes be tough,Fedex
653,"""Associate Engineer""",5.0,"Fantastic culture, opportunity for growth, welcoming environment",Subject to lots of change,Fedex
654,"""District Manager""",4.0,Good work life balance and a great team,High pressure to meet metrics,Fedex
655,"""Handler""",4.0,It is a good starter job.,There are not enough hours if working the night shift.,Fedex
656,"""Good Employer""",4.0,"Fair pay, virtual position good benefits.","Political environment, long hours, poor life balance",Fedex
657,"""Package handler""",1.0,"None, none, none none. None. Those are the five required words.","Slave work, no breaks, hot, dusty, yelled at all the tine",Fedex
658,"""Underpaid Over worked""",2.0,Use of Interline discount travel benefit,Vindictive Mgt. who treat employees like cattle,Fedex
659,"""If you are ambitious or career oriented person stay away !!""",1.0,You are employed and are paid decently. People around are friendly. Work is easy and relaxed. Lot's of time for doing your personal work,"Work is mundane and uninspiring. You'll need to learn the systems which are pretty old, dated and don't interact well with each other. As a fresh graduate and strictly from a learning and development perspective, this is one of the worst jobs you could have. Your learning is limited to making systems talk to each other. There is hardly any strategic or analytical work going around. Most of the people have given up learning or adopting changes and counting want to retire for the retirement package. If you are seeking challenging quality work or seeking to develop your career, as mentioned by other reviewers STAY AWAY from this place.",Fedex
660,"""Account Executive""",4.0,Make your own schedule. The people,Systems are not very Intuitive,Fedex
661,"""operations""",4.0,"Great working conditions, very comfortable","Advancement was based on popularity, not performance",Fedex
662,"""Package handler""",2.0,Steady pay check and decent managers.,Bad hours and difficult labor,Fedex
663,"""Director of Customer Support""",4.0,Great place to work with great benefits,salary was lower than I think it should have been.,Fedex
664,"""fedex""",3.0,Easy work in a group environment,bad hours only time slots are third to morning and afternoon to third.,Fedex
665,"""Great company, good benefits and good opportunities.""",4.0,"Training, pro-employee policies and benefits.",Less cohesion across operating companies.,Fedex
666,"""Courier""",4.0,Work life balance. Pay. Benefits,Not a full time position,Fedex
667,"""Package Handler""",5.0,"Good pay, good working hours, great management.",I don't think there is any cons about my job.,Fedex
668,"""Material handler""",5.0,It's a very easy job. The people are nice. Good work environment,"We worked till finish, sometimes you work till 4:00 in the afternoon and then they wanted you back that night @11:30.",Fedex
669,"""operations""",4.0,"stability, opportunity &amp; open door policy",work life balance no longer exist,Fedex
670,"""Consistent Hours""",3.0,Consistent demand for employees means plenty of work to go around.,Work can be tough if you are not able to lift heavy objects frequently.,Fedex
671,"""OPS Manager""",4.0,Fedex is a Great Company,You work very Long hours,Fedex
672,"""Quality Engineer""",5.0,Interview Process was very encouraging. People oriented company Lot of growth opportunities Culture is great.,None that i can think of.,Fedex
673,"""Delivery driver""",2.0,"Great pay , good management, listen to your situation","No benefits, unreliable trucks, no a/c",Fedex
674,"""Business advisor""",5.0,"Great work life balance, good pay in local",Didn’t find any cons at all,Fedex
675,"""Package handler""",4.0,The pay is good Great company,High physical demand No work life balance,Fedex
676,"""Package""",3.0,"Pretty simple job, training is quick","Boring, repetitive work. Can be physically straining",Fedex
677,"""Excellent""",5.0,Work hard don't stop and good staff.,Endurance strength stay hydrated all the time.,Fedex
678,"""Package Handler""",4.0,"Great Benefits, Good People, Decent Pay. I have worked there for a couple years now. There are opportunities for advancement as well.","When you accept the job, you need to realize that it’s hard work under sometimes extreme conditions.",Fedex
679,"""Operations Administrator""",3.0,Great benefits and annual earn vacation.,No time of between mid November and until Christmas due to peak season.,Fedex
680,"""Corporate Initiatives Intern""",5.0,"Culture, people, work, management and fun",Compensation should be on par with the market,Fedex
681,"""Great company!""",5.0,"FedEx offers some of the best benefits around. Opportunities to move around the country and also up in the company. Invests heavily in employees, and technology.",Tight deadlines everyday. Not everyone gives 100 percent.,Fedex
682,"""Great experience""",5.0,Full benefits for part time employees. Friendly managers. Frequent raises. Advancement opportunities.,Very fast pace. Very physically demanding.,Fedex
683,"""Package Handler""",4.0,The people are great. The hours are not bad if you have other employment.,The shift is stated as being from 3:30-7:30am and they get annoyed when you cannot stay later.,Fedex
684,"""Decent culture with modest pay""",4.0,"Casual work environment, decent benefits package",Antiquated programs for such a high-volume customs brokerage operation. Frequent overtime due to staffing problems,Fedex
