,title,rating,pros,cons,company
0,"""Nike Farmington Review""",5.0,Work environment is like a second home. Coworkers and managers are caring and helpful.,I don't have any cons for this job.,Nike
1,"""NIKE is a lifestyle. It’s fast , it changes , it challenges you . So be ready !!""",5.0,Good pay in comparison to others . Good benefits,"There is always a mountain of work , which can be good and bad .",Nike
2,"""Great part time job""",5.0,"Culture was great, discount was amazing",pay was not the highest,Nike
3,"""Great company to work for""",4.0,work life balance amazing people lots of perks good benefits,the analytics group if fractured with lots of 'in' fighting,Nike
4,"""Great company to work with great benefits""",5.0,"Great benefits, some of the best I have had anywhere I worked. Retirement, stock options, Clothing - Great Brand - Shoes - Meet great people - Work in the community","You can end up just a number, they are also a very very politically correct company.",Nike
5,"""Overall great place to work""",4.0,"Friendly people, decent work / life balance.",Moving up in the company can be hard and take a lot of time.,Nike
6,"""Back of house""",4.0,Great discount and work environment,No room to move up in company.,Nike
7,"""Great place to work""",5.0,Excellent culture and beautiful work environment.,Layoffs can happen unexpectedly in any department.,Nike
8,"""athlete""",4.0,The people and work environment and being able to go out and do community service. Very fun place to work.,There are no cons. Everything was great.,Nike
9,"""Amazing Job""",5.0,Great working environment. The company really cares for its employee.,Very competitive in moving up in the company.,Nike
10,"""Good Job""",4.0,"Good Discount, Great Co Workers Keeps You Entertained","Low Wages, Inconsistent Scheduling and Hours",Nike
11,"""Nike Rocks""",5.0,Good management and great benefits,Not much that I can really think about,Nike
12,"""Awesome""",5.0,It is a family-like environment. The management is very understanding and helpful.,well.... the normal struggles of retail,Nike
13,"""Summer associate""",4.0,Flexible shifts chance of promotion,long shifts long hours,Nike
14,"""Fun retail environment""",4.0,It is a fun retail environment,Sometimes understaffed and lack of communication between management and employees,Nike
15,"""Neanderthal Micromanagement""",5.0,Employee Store is a blast,"Calls in the middle of the night, loss of sleep, scowly faced managers",Nike
16,"""Part time athlete""",5.0,I am a people person,Great benefits and great pay,Nike
17,"""Good as long as you're ""In Favor""""",3.0,"An incredibly creative and educational place to work. You learn so many business and communication skills, while managing the coolest projects in the world. These are certainly covet-worthy jobs. Great benefits and perks.","Game of Thrones is real, and it is called Nike. This company is extremely bureaucratic, with too many hoops to jump through for any decision. If you're not part of the favored group, you're made to less than - Indespensible, of no value on your own, and like you should be happy to just have a job. Over the years it became more of a popularity contest vs spotlighting real talent. Work/life balance is extremely poor. Great internal culture is talked about, but not carried through by team leaders.",Nike
18,"""Best company to work for""",5.0,75k people organization constantly innovating and killing it,Portland can feel remote from major hubs,Nike
19,"""Great surroundings""",4.0,Good managers Easy schedule changes Great environment and coworkers,Low pay Short breaks Lazy managers,Nike
20,"""Not Worth It.""",2.0,You get the employee discount ( 50% off ),"You only get paid minimum, You don't get very many opportunities to advance in the company, It's very competitive, You get treated like children, Managers Micromanage you all day. The managers swear that their employees are #1 to them but we're not.",Nike
21,"""Decent Retail Job""",3.0,Pros are that they do emphasize on bringing premium service to the consumer. Direct deposit every 2 weeks and they pay your training that they refer to as RTC or Rookie Training Camp as well as any training or store meeting which is pretty early hours. You'll love coming to work to see your co-workers and some consumers make your day when you're able to talk to them on slow days. Management can definitely improve on deferring from favoritism and only picking on those who are not. They can also work on having the leads actually contribute to the sales floor and not just micromanage or walking around ordering people to do minimal tasks they're capable of. They're big on receiving feedback referred to as pulse shout outs which are then read out loud the following day so make sure you make an effort to give good service and get recognized by the consumer filling that survey out. They also do tend to use gift cards and food or additions to the break room as incentives to win contests such as being the store that sells the most gift cards during holiday season or who can keep up perfect attendance meaning punch in on time and be on the floor ready on time. This is a great job for students and people who are hesitant on retail because I found this retail job to be less strenuous than what I heard most retail jobs are and a decent pay. You get to say you work for NIKE which is a great accomplishment seeing their applications and interview hiring process is competitive.,"Again, favoritism plays a big role depending on which store you are at. As much as they emphasize on premium service, they are always either out of sizes or don't sell the merchandise consumers come in. You'll get reprimanded by the coaches or leads if you come in with dirty sneakers, not the right uniform or if you're not in the zone you're assigned. Really hard to grow and stand out in retail if you want to grow within the company. Again, it's about favoritism over professionalism in some stores. Seems to be more geared towards sneaker culture and folks who want to use their employee discount to get some new sneakers and less on the sports/athlete environment.",Nike
22,"""Nike Dallas NorthPark""",5.0,"Really fun, high energy work environment.",Hourly / Annual wage is a little low.,Nike
23,"""Prepare to drink the Koolaid""",3.0,Ability to grow; fairly good pay; great vacation benefits (although you don't get to use them),"Sycophancy is a requirement for long-term success. Incompetent leaders; favoritism; long hours; no loyalty to employees; culture of arrogance; ageism is rampant except in upper management, where old-boy's network is entrenched; ""dive and catch"" superstars are rewarded at the expense of dependable workers, even when they create the emergencies they solve at the last second.",Nike
24,"""Very fun and exciting place to work""",5.0,"Fun atmosphere, good deals, flexible scheduling",On your feet a lot,Nike
25,"""Great""",5.0,The discount was great to have,The hours were too long,Nike
26,"""Nike was a great experience""",4.0,Culture and brand name were great for me.,Managers are heavily biased towards particular employees and gave them more leeway.,Nike
27,""".""",4.0,Positive work environment and fun job,Too structured/closed towards new talent with previous work experience,Nike
28,"""Direct""",5.0,"Friendly environment, and welcoming culture. flexible with scheduke","standing all day, retail pay is never good.",Nike
29,"""A Great Company, that doesn't pay well but has many perks.""",4.0,"Great Atmosphere, Great Discounts and knowledge.","Every employee starts as seasonal and then the staff decides if you get ""Kept"" after your 90 day probationary period. There is limited opportunity for lateral growth within the brand.",Nike
30,"""Nike Part Time Sales Associate""",4.0,"Awesome coworkers and discount, it's a really cool company with an interesting background. Nike does a lot for the community, and their program with children is so fun and just awesome in general.","Understaffed, sometimes expect you to do way more than you should be, cliquey management",Nike
31,"""Company Values""",5.0,I love the work ethics that surrounds the company’s values. It begins with the history and continues through all locations to this day.,There honestly aren’t any cons associated with this company.,Nike
32,"""Great company""",4.0,Great discounts and benefits.,Long shifts for part time position.,Nike
33,"""I was an ETW through a third-party employer.""",3.0,Salary. Experience. Network. Some perks.,Commute was bad. Department I worked for had very poor leadership and poor communication. Too many unproductive meetings. Leadership was unorganized and overstretches.,Nike
34,"""Good job if in school""",3.0,"Diversity, Coworkers, Benefits, Can be fun, Culture","Management, Scheduling, Under Staff, Lack of communication,",Nike
35,"""awesome""",5.0,"great management , great staff, comfortable environment",nothing bad to say about this company,Nike
36,"""None""",5.0,"Benefits, workplace environment, people and opportunities","Pay, management, competitive and traffic",Nike
37,"""Great Environment""",5.0,"Great people, community involvement, amazing discount, good hours","Minimum wage job, quick turnover rate",Nike
38,"""Typical retail job""",4.0,Discount was awesome and the company culture was fun,Store gets too busy on the weekends and cleaning up after people wreck the store gets repetitive and stressful.,Nike
39,"""Good overall""",4.0,My coworkers were great. I also enjoyed the clothing perk.,"The pay could be higher, but overall I thought it was fair for the industry.",Nike
40,"""Great group of co-workers, crazy business days (Department Store)""",3.0,"coworkers are fun, good discounts on Nike gear.","i was ""part time"" and would be scheduled as close to 40 hours every week as possible without actually giving me 40. every manager had a different management style and made every day different. Some would nit-pick/micro manage every little thing happening in the store during the day and others would just the athletes do their job. pay honestly wasn't great, 10/hr. The weekends/holidays would be INSANE and you would be forced to work. Friday-Sunday are mandatory work days basically but people always have things to do so people call off every weekend. They would force you to be available for a *minimum* of 30+ hours a week and would not accept your availability otherwise. Management was primarily concerned with performance marks in membership sign ups/online sales rather than letting the employee just do their job.",Nike
41,"""It has been a journey with lots of changes and learnings""",4.0,The perks of products and the sports connections,Hard to move around and get new job opportunities,Nike
42,"""Love the brand""",4.0,Great place to work if you are a fan of Nike and love to work with others that share the same passion.,Pay is only minimum wage.,Nike
43,"""Like 'the Firm' movie""",2.0,"Compensation, benefits, brand itself. Full of inspiring and smart people.","When it's great, it's amazing. When it's bad it destroys lives. NIKE is governed by an executive leadership team that has absolutely no idea what is happening on the ground due to the internal censorship. All very bright people but removed from NIKE's reality. Below them is a layer of VPs - my advice for anyone who wants to succeed at NIKE is to focus on making their VP like them, as opposed to simply doing an excellent job. It's an adult's popularity contest essentially. Most employees are miserable at NIKE and while they are investing millions in implementing work aimed at changing the culture, I (along with the many I know still there) can't see this happening. If you are lucky enough to have a good manager NIKE can be great but unfortunately they are few and far between. The sexism prevails but the male managers have become cleverer and are finding different channels to continue with their bad behaviors. NIKE should come with a warning sticker: NO EQUALITY, ANYWHERE.",Nike
44,"""Just getting access""",5.0,Grat company to work for,Poor quality of engineering practices,Nike
45,"""Solid Work Experience""",4.0,Friendliness of staff Benefits Ease of Job,Pay Scheduling Flexibility Management Turnover,Nike
46,"""Nike""",3.0,Work with cool products everyday.,Long hours. Not always compensated appropriately.,Nike
47,"""Great place to work""",5.0,Great people and great energy,Can’t think of any at all,Nike
48,"""It all depends on your direct manager...""",3.0,"The benefits are very competitive. If you are on a good team, it's one of the best places to work. Make sure your manager is a good person to work for, there are talented workers that don't always make good managers, so be wary of people that were promoted without the proper screening. Unique sports and health forward environment. Fun company-wide events on the HQ campus. Internships are hard to come by, but if you can get in, you will have a pretty smooth career if offered a job at the end. Employee store discounts and sample sales are very nice.","Cutthroat working environment. (relative to less aggressive companies in the same industry) Just because it is a sports/athletics company, it still functions like a blue-chip capitalist corporate company. Like many companies, promotions are rarely given on merit. HR and the employee relations team is toothless when advocating for employees not in management positions. (See Trevor Edwards scandal for just one easy example). Nike pretends to be one of those ""woke"" companies but operates behind the scenes in quite the opposite way. The stifling political correctness of Portland often seeps into the culture.",Nike
49,"""Great perks""",4.0,DISCOUNT! Family style leadership with coworkers that are easy to relate to. Good structure for employment.,Questionable management personalities (racial microaggressions included). Some workers are too competitive. Willing to throw you under the bus and cut losses quickly.,Nike
50,"""Retail""",5.0,Great place for a first job Good work environment Management on top of things,There tends to be some micromanaging,Nike
51,"""Good High school job!""",4.0,Good Discount at store! Friendly environment and high pace!,"Hours fluctuate, don't get weekends off!",Nike
52,"""Unprofessional""",3.0,"Company events, Benefits, Discount, Staff dress, 401k plan",Management is unprofessional and no structure.,Nike
53,"""Sales Associate""",5.0,Employee discount Fulfilling work with good managers,Tiring work with customers Long Hours,Nike
54,"""Why Nike is great""",5.0,"Great co-workers, flexible working schedules, and amazing pay.",On your feet majority of the day,Nike
55,"""Internship""",5.0,Good place to work. Nice pay.,Usually Busy with trivial things.,Nike
56,"""Great place to work &amp; grow""",5.0,Great perks and work-life balance in most cases You will get the opportunity to partner with some great talent Your voice will be heard,The work culture can get overwhelming at times,Nike
57,"""Great benefits, Demeaning Culture, Biased Management""",2.0,"Benefits, some of the best in the US. Maturity and paternity leaves are beyond generous. Great 401k options and ROIs, strong profit sharing and vesting schedules.","Management (Executive, Senior &amp; Middle) are far below Fortune 500 level. Given my former roles proximity to these groups, I viewed management’s handling of grievances, promotion criteria and handling of discriminatory occurrences where too often favoritism was the deciding factor vs. considering facts, integrity, HR standards, merit or impact to corporate culture. Morale and corporate culture are complete opposite of what the brand claims to support (empowering minorities, merit based promotions and/or hires, etc).",Nike
58,"""Great""",5.0,"Fun, easy, awesome, enjoyable, good pay","No time off, no phone, short breaks, mean managers",Nike
59,"""Great Part Time Job""",3.0,Really loved my co workers. Super fun job for a part time opportunity,Pretty low pay. Brutal Retail hours,Nike
60,"""Sales""",5.0,Great and flexible hours for working in retail,I can say it’s very long hours but great pay,Nike
61,"""Sales Associate""",5.0,Good discounts for employees,Sometimes fast-paced but manageable,Nike
62,"""Great opportunity for growth""",4.0,Great co workers. Beautiful campus,Management is poor. Long hours.,Nike
63,"""Loved processing freight. Management made it impossible to enjoy the job.""",2.0,Awesome discount. 4 am shift was good.,Hard to move up. Mandatory 1 hour lunch. Attendance infraction occurred at 1 minute before/after scheduled time. Cliquey management after take over.,Nike
64,"""Great place to work if you're ""in"" with the right people""",4.0,"Great perks including employee store offering 40% to 50% off all Nike product, fabulous gym facilities, lots of employee events.",Male dominated culture that unfortunately discriminates against females.,Nike
65,"""Great work environment""",4.0,Great schedule flexibility in company,Hours scheduled aren't set and make 3 weeks in advance,Nike
66,"""Good job for young people""",4.0,Flexibility with school and other things.,Have to work lots of weekends.,Nike
67,"""An amazing company - it's on you to make it work for you""",4.0,"Bright minds; inspiring work to be done. Free gym membership to some of the best sports facilities there are. New buildings, huge range of delicious food options. A culture of coaching and developing employees. It has all the things.","WHQ is GIANT. You can easily get lost in the machine. It can be complex, overwhelming, and feel so big as to be impersonal. Lots of busy people packed in back-to-back meetings, bustling around trying to impress one another and forgetting to be personal and human. It's up to all of us to create the culture we want.",Nike
68,"""Hit and Miss""",3.0,Good benefits. And the work was occasionally interesting. A variety of teams--and team dynamics--to pick from. Some are truly amazing.,Remnants of systematic sexism are alive and well. Sr Management in my department was more concerned with hierarchy and PowerPoints than actionable insights.,Nike
69,"""Perfect ""after school"" Job""",5.0,Team environment Management support (in store),Employees who don't care about their jobs,Nike
70,"""Great working environment""",5.0,Great work life balance,Commute can take a long time,Nike
71,"""Love Nike""",4.0,Great company and innovate product,Pay was low and the hours were inconsistent,Nike
72,"""Great company, horrible factory stores""",4.0,Company events Employee discount,Management was trash Lack of development,Nike
73,"""Awesome Job""",4.0,"Work life balance, social involvement, salary, benefits",Turned into more of a process-driven role than the consulting-type role I had expected,Nike
74,"""Great environment""",5.0,Great management and great people to work with,hours always vary depending on business needs,Nike
75,"""Organizational churn, but it works.""",4.0,Fun work environment. Employee appreciation.,A lot of organizational churn. Disappointing leadership.,Nike
76,"""Nike is great""",5.0,Great work life balance Great atmosphere Amazing campus Talented people,Ambiguous work Constant re-org can be stressful,Nike
77,"""HR Manager""",5.0,"Executive leadership admits when and where change/agility is needed an takes counsel from the lower level SME’s! I was told on my first day by from an executive leader that I was hired for my expertise, experience and knowledge so I should question things that don’t seem efficient. That was a first in my career! Great compensation and growth opportunities! I pinch myself everyday over the fact that I was given the opportunity to work for this amazing organization!",There does seem to be a fairly high tolerance for the underperforming associates.,Nike
78,"""Nike Seasonal Sales Associate""",5.0,The discounts are really good!,You don’t get a lot of hours.,Nike
79,"""Very fun""",5.0,Very fun environment and usually cool customers Cool coworkers Competitive Cool stores,No commission on sales Low starting pay,Nike
80,"""Exciting work, challenging work environment""",4.0,"Nike is a very exciting company to work at. They are always innovating, always pushing the edge, and they have the funding available to do exciting projects. Some positions are able to travel quite a bit also.","The environment is extremely political, especially in Digital. Many employees feel they cannot be their authentic selves lest they be blacklisted somehow or even quietly moved out of their positions and into a lesser role. Focus on hierarchy, way too many Sr Directors and VP's, and an overly matrixed environment leads to confusion with 10 bosses thinking they're in charge and confusion ensuing at the individual contributor level. This makes it challenging to actually GET any of that exciting work DONE at Nike. They really are their own worst enemy.",Nike
81,"""Great place to start, especially if you love the brand""",4.0,"- Work environment and culture - Employee discount - Overall good management, in my experience, they want to see you succeed - Time and a half on holidays and even hurricane days","- Working at one of the business Nike Outlets, the traffic can be overwhelming - Holiday hours were crazy, but we did get time and a half. - You see the worst during Black Friday and holiday season - Full-time athletes seemingly had management responsibilities at times, obviously without the same compensation",Nike
82,"""Dope place, dope people""",5.0,Everyone is pretty chill. Its a big family.,They could micromanage at times but not a big deal.,Nike
83,"""Nike Clearance Store""",5.0,Good and fun job. Can also be fast paced,Sometimes cut down on hours,Nike
84,"""Nike Sales Associate""",5.0,"great people, fun environment, good energy",not enough hours for part timers,Nike
85,"""Good company, nice benefits but...""",3.0,"-Nike has a great hype and a cool company culture, if you are part of the right organization, you really get to experience all of it. -Nike has great benefits but, you really need use all the benefits they offer to make up the disparity in salary with other companies in Portland. -You get to work on really cool stuff and get to work with some great partners. -The gyms are now free for all FTE employees","-Coming from an ETW to FTE, recruiters will not negotiate with you on compensation; you come in lower than you hope to and they cite all the benefits you get to keep you low. Whether this is a purely a recruiting issue or a message from the hiring manager; if you don't give people the right compensation, they are bound to leave when a better offer comes along. Nike can no longer use the excuse that, we are Nike and will underpay people because of our perks/name. -Re-orgs are frequent and unfortunately, are not done with much thought. Many of the choices are distracting and do not help the organization or the business level up. -Lots of turn over -Organizations promote people into leadership roles that do not want to be there and prefer to continue to do individual contributions.",Nike
86,"""Boring""",1.0,Discounts are very good when working for Nike,Managers can abuse their power,Nike
87,"""Horrible management""",1.0,Discount on just about everything,Coworkers and management Not caring about each other,Nike
88,"""It was OK""",4.0,"Fun team, good perks, good salary","Corporate giant, didn’t care about employees as much as it says",Nike
89,"""Nike""",4.0,"Great culture, passionate like-minded co-workers",Nike becomes life. It is your priority,Nike
90,"""Nike Sales Associate""",5.0,"The Benefits, people you meet, and the culture.","High turnover rate, hours, and it's retail.",Nike
91,"""Great place with fantastic benefits""",5.0,"Competitive pay, fantastic benefits, fun work environment",none to share with people,Nike
92,"""Good experience, not good long term""",3.0,I learned a ton and got to travel the world. It definitely boosted my career in ways I couldn't have imagined.,"If your manager doesn't have your back, you can get caught in the swirl of politics and the mass layoffs that happen every 5ish years. Depending on the department, you're also managing a ton of very large egos.",Nike
93,"""Good PT""",4.0,"Laid back, great discount, fun","Micromanaging, low hours, lots of drama",Nike
94,"""Trash company""",1.0,There are no pros it is horrible,You need a job and can’t leave,Nike
95,"""Fun and Interesting Place to Work""",4.0,Lots of great coworkers and fun product to work with.,Managers don't always treat the retail employees with the most respect.,Nike
96,"""Fantastic""",5.0,"Great environment, everyone is ncie",I can't think of any,Nike
97,"""Check out their website to see if they're hiring""",5.0,"- Discount - Nice Environment - 2 short breaks, 1 hour lunch - Work experience",- None that I can think of right now,Nike
98,"""Good Job for college students""",4.0,Good Discount Cool people Fun envrionment,Managers can micromanage at times. Hours can be difficult to get if your not full-time or liked by the scheduling managers.,Nike
99,"""Great summer job""",4.0,"Really good benefits, discount is amazing","Can get boring at times, unorganized management, they play favorites",Nike
100,"""Good place to start a career""",5.0,"Friendly atmosphere, potential for advancement, discounts","Low hourly pay, often have to start part-time",Nike
101,"""Great place to work""",4.0,"Training were fun, learning new products. Private events and modeling product was amazing for other colleagues. Great discount !",I wish Niketown never closed down,Nike
102,"""Not bad!""",3.0,Gaining Experience Being a part of the industry,Pay Don't receive commission Standing a lot,Nike
103,"""It's a cool place""",3.0,"Nike Brand, Sport Moments, Product","Matrix, Managers with no competence, Getting passed over",Nike
