,title,rating,pros,cons,company
1920,"""athlete""",4.0,customer service work good work fun experience,standing long hours work pay environment,Nike
1921,"""Working at Nike""",5.0,I felt respected and it was a great working environment,"It was more of a personal con, I would struggle to get there on time because I was placed in location further from my home",Nike
1922,"""Great Management""",5.0,I worked at the Nike Outlet store in Grove City at the outlet mall. Pros- great management. Got the job done while making work enjoyable. You feel very much part of a team when working here.,"In the summer, in-between semesters at school, I would want to switch to full time but it was not allowed. Over-time was strictly avoided as well. I wish there was more of and opportunity for some extra work.",Nike
1923,"""Athlete""",5.0,It was a really great team atmosphere as well as good energy and passion. All of your coworkers really made it feel like you were a family.,Sometimes we would be understaffed but that was mainly because we were way busier than we were supposed to be,Nike
1924,"""Flatiron store review""",5.0,"Great time working at the Flatiron store - really caring and reasonable managers, and I enjoyed working w the other employees","The shifts were at difficult times to make work with other things - for example the closing shift began at 1pm but didn't end until 10pm. I wish there had been a shower in the store bc many of the employees worked out during lunch, but thats tough to do without a way to wash off afterward",Nike
1925,"""Great work life balance""",4.0,Great work life balance is the only reason I give them such a high rating.,-PTO hours aren't that great for such a successfully large corp. -A lot of unnecessary politics in Nike's software engineering community.,Nike
1926,"""Great Part time job""",4.0,"Flexibility, fun environment to work at, learn about new products, the discounts are amazing","Dead end, manager typically don't stay in one location too long and are typically not athletes like the brand wants",Nike
1927,"""Sales Associate""",4.0,Great experience with nike! Discounts and good co workers to work with.I had a great time while working there.,It can get really busy.,Nike
1928,"""After a while it becomes apparent that Nike Corporate is the focus, leaving Retail frustrated & unable to perform.""",2.0,"Team is passionate Company mission statement is inspiring Focus on volunteering in the community Enticing employee discounts Advanced, innovative products","Management team is not unified Very few opportunities for upward mobility Pay does not best reflect job responsibilities and experience Inconsistent Training opportunities Many job training, career advancement, and hr tools are accessible only by management Very high turnover rate",Nike
1929,"""Great culture, poor leadership""",3.0,Unbelievable opportunity working with athletes and sports,"Big company, matrix organization, lots of passive-aggressive behavior by leadership",Nike
1930,"""If you aren't in it for the long term, they will ignore you.""",3.0,"The Discount, co workers are nice enough,",Management will either completely ignore you or throw you under the bus to move up higher to get to HQ.,Nike
1931,"""Sales""",5.0,Very easy to work their and great to know more about the products. I enjoyed helping people when they needed help.,Some people you deal with won't be that easy to work with just like anywhere else but overall their aren't a lot of cons.,Nike
1932,"""S&R Lead""",4.0,"Benefits, discount, stocks, 401k, profit sharing",Smaller stores have a hard time moving up.,Nike
1933,"""Ehhh""",4.0,The discount is really good. Worth while. Some of the other people who worked there were really nice.,Not enough pay for the amount of work done. Lots of favoritism with managers and certain athletes.,Nike
1934,"""Worker""",4.0,Great co-workers and team to work with!,Working graveyard on weekends and non-negotiation on wage.,Nike
1935,"""Lead""",3.0,"Great benefits, amazing company, and great products","Retail is a tough job, no work/life balance. Pay wasn't what I was expecting.",Nike
1936,"""Athlete""",3.0,Comfortable work attire and good training,"Poor management, would sometimes have to wait lengthy times before leaving the building after the fact that you've clocked out, due to waiting for a manager to be available for a bag check.",Nike
1937,"""How it feels to be an athlete""",4.0,"Mostly everyone at Nike parties and they're pretty fun to work with, you get 2 shorts a shirt and 1 shoe under 84.99 every 6 months and when you start and sweats are an option also.","Long days, low pay about $11-12 but I started off at 10.52 and they up it by like 60 cents everytime",Nike
1938,"""Great Brand, Huge Matrix, Fantasic Work/Life Balance""",5.0,"Fun, energy brand made up of truly intelligent people. Work/Life Balance is not an issue and team members are encouraged to take personal work-out, fitness, hobby, family, etc. time when desired. End of year goals are huge and all are encouraged to hit the numbers aggressively, therefore, thinking outside the box is often required.","Huge matrix of people and therefore, some narrow job roles are commonplace. You must move up to work in a broader realm or you can get 'typecast' in one area forever! Targets are set extremely high and expected to be achieved, no matter what. It is a complete corporate environment, therefore, you must like acronyms, corporate speak, back to back meetings...",Nike
1939,"""Great""",5.0,"Discount, the best part was the discount.",Working on the weekends and working on holidays.,Nike
1940,"""Prog Mgr""",4.0,Culture is awesome You get to work on some really cool things Great perks,Leadership issues...inexperienced in many places made it nearly impossible to be doing the right thing and stay agile.,Nike
1941,"""IT Professionals Should Avoid Nike""",1.0,Lots of free time No Drug Testing VERY flexible work hours Relaxed Working Environment,"Background: Nike was apparently instructed by the Board of Directors in 2012-ish to go into the IT industry and recruit IT experts. This was to support a huge iniative to bring innovation, advancement and a ""fresh"" culture into Nike IT. With this big push (e.g., Blackhat, etc.) they attempted to hire in external experts and did a good job - initially. However, Nike over promised and under delivered on all their verbal promises during the employment phases. Results: You would think that if the ""Nike Lifers"" couldn't deliver in 25yrs yet the external experts delivered in two the Board of Directors would take note. This group of individuals not only changed the entire company (IT) around, they fixed a multitude of contractual, vendor relationships, IT production and IT security problems - that existed for decades! With such a dramatic and noticeable turn around in 2-3 yrs (vs. 25yrs) you would think the Nike board would praise and promote the external experts. Nothing could be further from the truth. The Nike Lifers have targeted all the external talent and are gradually removing them from employment. Internal efforts revolved around slander, defamation, creating mock-turmoil, etc. Recruiters: External recruiters fully admit to hire someone at Nike, in the IT field, is a ""daunting task"". Nike does not have a good reputation and they savage industry experts. Personal Note: This was one of the worse career decisions I have ever made for me and my family. I was told I could promote change, make a difference that there was nothing here ""a blank slate"" - which was very true. But once I started to innovate and make change the ""Lifers-fangs"" came out and the internal battle lines were drawn. I lost and so did my family. I wish someone would have wrote this on GD before I got employed. Be warned!!!!! In summary: - Nike lifers are threatened by outsiders - If you are over 40yrs old forget long term employment - IT Salary is below industry standards - Few people of color are actually employed at Nike (especially in executive positions) - Very high tech talent turn over rate w/in technology divisions - Senior Managers in IT are non-technical bureaucrats - Little (internal) career advancement opportunities for IT Pros - No outside career enrichment opportunities (e.g., training, speaking engagements, etc.) - Do not adhere to the Nike's ""11 Maxims"" (e.g., Evolve Immediately, Do the Right Thing, Simplify and Go, etc.) - Beware of the ""Dutch Mafia"" (Dutch hired in the '90s have evolved into an interconnected political powerhouse that protect each other. They will commit ""career-assassinations"" against anyone and all outsiders regardless of expertise to protect themselves and their jobs.) - Management retribution is common-place",Nike
1942,"""Athlete""",4.0,Free Clothes 30% Discount Converse Discount as well,I honestly can't think of any except micromanagement drama,Nike
1943,"""great""",5.0,great company - fantastic brand,low salary but good career track,Nike
1944,"""Great Company to work for.""",5.0,"Discounts, Work & life balance.",Sometimes the hours can slow but that's because its retail.,Nike
1945,"""Sales Associate""",4.0,It's a global company. You get to meet many people and actually help them with their day to day lives. The technology actually does make a huge difference. You also get a discount on shoes & gear.,Not a lot of stability as far as scheduling goes since there isn't much consistency in what times or days that you work. A lot of lifting and bending over.,Nike
1946,"""Wonderful!""",5.0,"Great management, awesome teamwork mentality. Everyone seemed to have a positive attitude towards helping customers and each other. We all got along really well and no one seemed to have a chip on their shoulder about doing their job. The managers really invested a lot of time in making sure that you as an employee felt cared for and were being trained and guided along a path towards becoming the best you could be.","Working holidays in any retail job can be a drag, and that was really the main drawback to this job.",Nike
1947,"""Nike Global Security""",2.0,"For the most part we have a great team, and we know our duties and understand the positions and posts, many of us are very happy to be here. The benefits the perks and the idea of being part of something such as Nike are awesome. There is a lot of potential to be happy at Nike even in the NGS Department.","The middle Management, from the Leads to the Manager; only a couple leads and Supervisors are respectful and attentive and know what they are doing as far as leading and being a part of a team. As for the others many of them do not condone a positive working environment and prefer to let people fail instead of succeed. Some of the leadership seems to be looking for a reason to get people to their last write up and all that does is put people on the fence. Many of the leadership maintain and enjoy that 'gotcha mentality' thus creating a hostile working environment in turn creating a unsafe working environment. It’s unfortunate to not be able to trust the people who are supposed to champion the workforce and provide support to the team. Obvious favoritism and behind the door prejudices are rampant, Not many minorities in positions of leadership and if the Manager does not like you it is blatantly obvious you will not be promoted. Fear of termination because you report things to HR and or stand up for yourself is becoming normal and accepted and should not be. I know in my heart we deserve better because we are Nike I hope this helps my team some way in the long run or my future team members.",Nike
1948,"""Know what you're getting into""",3.0,"Benefits, visibility of your work, inspirational work","Always on, frequent directional changes, burnout, big gender wage gap",Nike
1949,"""Factory Store Review""",3.0,Great company to work for.,Hard to move from in store to corporate level.,Nike
1950,"""Protect Nike Lifers at Expense of New Talent""",1.0,"Nike Brand Image, 50% off Nike goods and deferred compensation benefit if you qualify with a minimum salary. Glad to be out of such a fake culture where Nike Lifers are more concerned about getting a workout.","Anyone being recruited should STOP and first read Phil Knight's Shoe Dog. Nike hasn't changed much and all Hail the Nike Lifers. If you do come to Nike, DO NOT Over-Achieve as this will cause the Nike Lifers to classify you as not fitting into the Nike Culture. Ask around about when you are considered a Nike Lifer. Per one very senior Nike Lifer, I was told that if a person makes it past their 1st Year, they might make it to their 2nd Year. IF they make it past their 2nd Year, they might make it to their 5th Year. IF they make it past their 5th Year, they MIGHT be considered a Nike Lifer. Doesn't matter what you have in your goals as they don't matter. Near the end, I was informed that Nike's unwritten rule is for leaders to network the first 2 years in order to build political capital rather than focus on results. Don't uproot your family for this wasteful company. And if you do, then don't say I didn't warn you. Wish someone had posted this earlier for me.",Nike
1951,"""Summer intern""",4.0,"Great culture, collaborative environment, passion for sports/branding, Portland is great for outdoorsy stuff, not too hierarchical","Too many meetings, relatively flat organization has its downsides, work can be mundane depending on the group you're in (as is the case anywhere)",Nike
1952,"""Just Do It""",4.0,"The discount is by far the best part of working for Nike. It's even more awesome that you get discounts at Converse and Hurly as well. It's a basic retail job, but the technologies that each store has are ahead of most other retail companies which makes the job easier. In my 2 years with the company it was rare that people didn't get along.","Don't expect to move up in the company quickly. People who come to work here tend to stay here forever. In my 2 years of working for Nike I never met anyone who moved from a store to corporate, and less than a handful that moved from sales associate to store management.",Nike
1953,"""life as an operator""",5.0,management cares about its people and they treat you very well. Time off is good gets better the longer your there,could pay a little better,Nike
1954,"""Nike Chicago""",5.0,"Fun, life long friendships, involved in the community through activities. You get to meet a lot of athletes and just really Col people from all over he world","Late closes, weekend availability requirement, scheduling, if you can get past that the rest is all gravy",Nike
1955,"""Culture""",5.0,The facilities and people are top notch and focused. The culture creates an exciting and energetic atmosphere that drives the creativity and innovation.,The culture and pace also creates a sometimes overly competitive atmosphere that can stifle creativity and reduce critical thinking and communication.,Nike
1956,"""Retail Associate""",4.0,Flexible schedule with great benefits after a time. The company offers several events for individuals to participate in.,"It's retail so expect a high turnover rate. This applies to not only your coworkers, but management as well. This can be frustrating as you're constantly dealing with seasonal hires and the mentality of the store can change on the whim of new management.",Nike
1957,"""Honestly, I really enjoy going to work, which is something I never thought I would say.""",4.0,"Benefits, great atmosphere, salary, Discounts for days, able to grow through the company, if you are athletic you should be able to relate to the customer","Scheduling conflicts, unclear on certain procedures, inconsistent leadership, Taking time off is a huge hassle, giving you less hours than your job, say goodbye to weekends",Nike
1958,"""operations coach""",3.0,"fun sports oriented environment, ability to drive own success. good discount on clothes and family discounts as well. fast paced retail always keeps you busy","reactionary management in high positions, never had a full management team. huge jump in pay level from coach to assistant head coach with no real difference in responsibility.",Nike
1959,"""So-So""",3.0,40% Discount on Nike Clothes,Can get boring at times,Nike
1960,"""Not bad""",3.0,Good discount Nike events Great people,"If management wasn't cool with you, then you'd be stuck in the position you are in and wouldn't be able to participate in Nike events",Nike
1961,"""Don't focus on company""",2.0,Athletic and fun place to work if you are on the right team.,Teams are very political and the wrong manager makes it impossible.,Nike
1962,"""Nike Sales Associate""",5.0,"Nike is a great company to work for, there are many pros, some of which are, a great team like environment, learning good life skills and be exposed to awesome Nike product","To be perfectly honest when working for Nike it will be hard for you to find any cons at all, the only major thing is that there are some employees that do not work hard and are hard to interact with, but that is a problem that most jobs have",Nike
1963,"""Material Handler""",2.0,"Nike offers a free give away twice a year for full time permanent employees,also the store discounts that you can include your family on as well","Nike worked there employees 7 days a week with no off days most of the calendar year, the environment is uncomfortable no working air conditioner,slim chance for advancement",Nike
1964,"""Would of had a better experience if was different store""",2.0,*discount was great *the branding * you learn how to move volumes of product and do everything effienctly,Little opportunities to grow with company,Nike
1965,"""Nike Part-Time Athlete""",5.0,You will work with some of the best people! The Nike culture is amazing!,Should have more benefits for part-timers!,Nike
1966,"""sap technical lead""",4.0,Great org. to work for. Work-Life balance is great.,None to mention for this organization.,Nike
1967,"""Part-time over Athlete""",3.0,"People that you meet that are working with you are some of the best. I have made life time connections there for sure. You are in an environment with very passionate people, for the most part and you all have a love of sport in common.",Claim to hire from within but starting in retail it is a very selective few that move up. A lot of micromanaging and false hope. I know people who worked there longer than me that never had the opportunity to show their talents and skills in the work place.,Nike
1968,"""Merchant""",4.0,Great company. Love the atmosphere.,Excessive Meetings. Hard to sometimes climb the ladder.,Nike
1969,"""Athlete""",3.0,Constantly learning with all of their new technology and innovations,Strangers are constantly asking for perks,Nike
1970,"""No work life balance""",2.0,"Good benefits and discounts. Nike is excellent at selling themselves as a great company, but do not live up to that in the distribution center","Bad leadership, limited technology, poor working conditions, and no work life balance. I was hired out of town, and was not given the details of my work assignment until my first day. They placed me in a dates facility after touring me around their brand new facility.",Nike
1971,"""NIKE MOA""",3.0,Free clothing Easy job Decent pay Nice people,Management resorts to favoritism. Hours suck,Nike
1972,"""Pick, pack/ ship, receive""",5.0,It was a great experience learning to pick/pack and ship/receive products as needed,Standing 12 hours with short break periods,Nike
1973,"""Great company""",4.0,"Company values their employees, lots of employee apprication.",leadership quality and direction varies by business unit.,Nike
1974,"""Software Engineering @ Nike""",5.0,Great work-life balance. Amazing campus.,"Very happy with Nike, however, they could be more open with their tech vision / roadmap.",Nike
1975,"""NA Retail Marketing Manger""",4.0,"As a long term employee (18 years), the culture and people are pinnacle in the industry.","During rapid growth in staffing, elements of the true culture of Nike deteriorate, and evidence of individual success vs team success is prevalent in many ""newer"" employees, unfortunately.",Nike
1976,"""Systems Engineering Intern""",4.0,The internship program put together a ton of events for interns in addition to the events that were company. It's a really fun place to work with a beautiful campus.,"They call themselves a tech company but they really aren't, and they were too busy to help me get started for almost a month. Plus, they do everything through meetings and that can take up a lot of time",Nike
1977,"""Financial Analyst""",3.0,Great benefits. Fun culture. Learning from some of the best.,On-boarding process was painful. Cutthroat vibe around campus.,Nike
1978,"""great company with size oriented pain points""",4.0,"_team atmosphere _networking- surrounded by amazing people with amazing backgrounds _healthy campus: food, activities, fitness, etc. _large company with family-like values once you get into the details of your role _passionate workers _competitive",_matrix organization _the company will out-work you if you don't learn to out-work it _lots of large organizational changes requiring you to keep re-evaluating your current status _competitive,Nike
1979,"""Perfect Company!""",5.0,"Great work/life balance, Fridays in the summer are half days. Plenty of room for personal/career growth.",Work load gets hectic at times.,Nike
1980,"""Discounts!""",5.0,Love my freaking discounts man! I get everything except for new releases for mad cheap. Plus the pay is decent and there are the giveaways.,"It can get a bit stale working retail, especially when you on't have much room to move up. Also the discounts aren't consistent across stores which can be a hassle.",Nike
1981,"""Sr Project manager""",3.0,Nike has great working environment,Contract can be ended at anytime. It has nothing to do with your performance.,Nike
1982,"""Great place to work""",5.0,"Strong culture in a growing, well run global company",Heavily matrixed business requires a ton of internal coalition building to get anything done,Nike
1983,"""Fun""",5.0,Great job to have while you're in school. Very flexible with your schedule.,Not many opportunities for those who wants to grow within. Rules change frequently. Not very concrete with employee guidelines when it comes to what you can't do and what you can.,Nike
1984,"""Pros & Cons""",4.0,"They are very flexible with your schedule, I was 17 when I got hired and they worked around my high school schedule and never gave me a hard time. Approves time off if you request it in a timely fashion usually at least two weeks before.","Cons include some of the mangers are very uptight, if you don't speak multiple languages it can be a challenge as the Sawgrass Mills Mall see many many tourists.",Nike
1985,"""Sales Associate""",5.0,I loved working for Nike because of their teamwork and will to win each day! The products sell themselves. Communication and organization by the team leads made all the difference in the world. Great leadership.,I have no cons to say about working for Nike! Loved every minute of it. It's a fast-paced company and new products are constantly being introduced to the team.,Nike
1986,"""Nike""",4.0,"Lots of perks; happy hours, swag, athlete visits, etc.",Very corporate and not as laid back as you would think.,Nike
1987,"""Part Time Athlete""",4.0,"Very chill and relaxed managers. Depending on where you're working, it can be hectic all the time (registers) or really boring (shoes). Employee discount is amazing.","Only about 20 hours per week. Not much cons. Retail is still retail, so expect some crazy customers.",Nike
1988,"""Swoosh Athlete""",4.0,Nike does a fantastic job helping employees quickly adapt to their culture. As a life-long Nike fanatic I was able to fit right in and feel at ease while carrying out their mission statement.,Promotions within the company are hard to come by because of the competitiveness among employees.,Nike
1989,"""Sales Associate""",3.0,"work environment, great benefits, nice people","underpaid, too far, bad drinks",Nike
1990,"""Senior Administrative Assistant""",5.0,Everyone is helpful High level of autonomy Professional environment Room for growth,No cons experienced at the moment.,Nike
1991,"""Easy work just very time consuming""",4.0,great discounts and perks (depending on your store).,Its retail so not much you can say,Nike
1992,"""Manager""",4.0,"I love everything about the company, the people, the work environment, the energy we bring everyday.",It would be great and keep more great leaders of the pay was better.,Nike
1993,"""Retail""",3.0,Great apparel and a great company,Its sometime tough to balance work and personal life with their hours.,Nike
