,title,rating,pros,cons,company
510,"""Exec Director""",5.0,"Amazing product quality, great brand. Lots of opportunities across divisions, decent benefits, family oriented","Older company culture - its been around a long time, trying to change itself and be more attractive to new workforce needs",Walt Disney
511,"""associate""",3.0,"great atmosphere, friendly employees, enthusiasm","long work days, need a cover when calling out",Walt Disney
512,"""manager lead""",2.0,The product and the benefits,"too much pressure on sales, unprofessional store manager",Walt Disney
513,"""Part time? More like a hobby""",2.0,Perks. Park tickets Discounts Free tickets Discounted tickets And food Discounted retail and souvenirs,"Management. Management plays favoritism so much. Hours were cut under 3 hours, which I don’t even think is legal. Everything was just such a mess.",Walt Disney
514,"""Excellent place to work""",5.0,"Smart colleagues, Thoughtful Managers, Challenging Work.",No free Disney Passes for Contractors.,Walt Disney
515,"""Wonderful company.""",3.0,"I worked for TWDC for 10 years, and I learned many tools to help me suceed in my career path. Wonderful culture and you really feel like you're part of something great.",Low pay. I worked for the company for 10 years and barely got a bump in pay which led me to leave the company. I was getting too old to share an apartment with 3 other 30 somthings.,Walt Disney
516,"""Excellent Experience""",5.0,"You are able to create magic and truly change peoples lives and leave a footprint on their hearts. You learn incredible guest service if you apply yourself, and are able to connect with people from all around the world. It truly is a dream.","It is extremely hard to move up, a lot of negative experiences with politics with the company, and hard work isn't what will get you to the top.",Walt Disney
517,"""Amazing company....enjoy coming to work every day!""",5.0,"Great people, leadership is terrific, inspiring, positive culture, great development, growth, and collaboration. I love working there and am lucky to be part of a great organization like Disney. I hope to finish my career at Disney. Good benefits and soft perks overall. Great tuition program",The salary will likely be a little less than you can earn on the open market but the soft perks if you love Disney are exceptional. Wish they matched more on the 401k but the company provides great benefits overall for employees.,Walt Disney
518,"""Stores Lead""",4.0,"Great culture, very fun place to work","low pay, poor work-life balance",Walt Disney
519,"""Attractions Operator""",4.0,- Thorough and helpful on-boarding process - Stress-free interview - Accommodating management,"- Isolated, requires a long drive to get to the employee area unless you manage to live in the small communities nearby - Long hours",Walt Disney
520,"""Just average""",3.0,"Decent overall benefits and overall compensation. Healthy overall company culture. Constant free screenings of upcoming films and events/celebrations to encourage a healthy work environment. If workload permits, you can leave early and still get paid full time.","Few holidays in comparison to other large organizations. You get a couple comp days per year but if you’re hired on or after October first, you lose out on those the first year. They consider access to Disney parks as part of overall compensation but you don’t get to go where and when you want. They have blackout days and Disneyland park is relatively not accessible (with few exceptions). Employees have practically no access to the parks in November or December. Not really fair in my opinion to offer as part of compensation if you can’t really use it! Additionally, some departments have pretty bad management and lack of structure/oversight. This can be good or bad, depending on who you are as an individual. The vast majority of employees use windows machines and the only OS they support is STILL Windows 7!! Cant speak for the entire company but it seems that they are quite cheapskates around here; can be tough to get the resources/supplies you need and they tend to recycle hardware instead of acquiring new/modern equipment even if it’s not the most efficient way of moving forward with certain processes.",Walt Disney
521,"""Excellent place to work, if you like being treated like a child.""",3.0,"Free park access, and discounts were nice.","Insufficient training, and long hours with low pay. Would work 7 days in a row, have 1 day off, then work 4 more days. The scheduling was very unstable.",Walt Disney
522,"""Dancer""",2.0,Looks good on your resume,"Poor salary, huge time commitment",Walt Disney
523,"""Fun Time With a Fun Fast-Paced Company""",4.0,"You work at Disney, and they have a fun loving atmosphere. Lots of travel, and interesting people doing interesting things.","Very corporate approach to creativity at times, with many hoops to jump through",Walt Disney
524,"""Great Company""",5.0,"Good pay, great people and experience.","Long hours, and difficult to get to work.",Walt Disney
525,"""Not what it used to be""",2.0,Meet a lot of great people in parks in resorts.,Management does not communicate well with each other and sales team. Not much transparency and constant goal adjustments can make it difficult to succeed.,Walt Disney
526,"""Disney College Program""",4.0,"Park perks, fantastic co-workers, making people smile and kids believe in magic","It is ALL about location- if you get placed at a bad location you'll have a bad time on your program. The job type also doesn't matter, I was custodial then retail, my friends were QSF&amp;B. Custodial and QSF&amp;B are the ""worst"" jobs but most of us had a great time, the issue is the leadership at specific work locations.",Walt Disney
527,"""Ok Place to Work""",3.0,Sometimes you get once in a lifetime opportunities,Just another cog in the machine,Walt Disney
528,"""DCP Intern""",5.0,"Loved working with people may age, made so many friends, free admission to parks",Minimum Wage and long hours,Walt Disney
529,"""Not Great""",2.0,Having a main gate was nice and so were discounts during the hoildays.,Leadership was not great or consistent. Guests are extremely entitled and are never wrong. Coordinators were usually much better than the management team.,Walt Disney
530,"""QA Engineer""",3.0,It was a fun place to work,You need to know the right people to advance,Walt Disney
531,"""Amazing place and awesome people""",5.0,The pros are that you get to go to Disney for free and bring up to three guests in for free also,Little bit of hours in the beginning,Walt Disney
532,"""Got to tell stories""",5.0,"independence of creating good projects, concepts, stories, authority, development, learning of legal, international and domestic audiences, marketing, finamces etc","low salary, slow growth, experience over talent preferred",Walt Disney
533,"""Disney College Program""",2.0,Free entrance to parks Friends made,"Inconsistent hours Long/late hours Management never really stands up for you when guests get angry with you, regardless of the situation Very strict point system for needing days off If you're in the college program, you're basically the employee who gets no benefits and has to work the shifts no one wants while being paid the least",Walt Disney
534,"""None""",4.0,Contribute to a diverse company,Sometimes a little too large,Walt Disney
535,"""Working at the Disneyland Resort""",5.0,"The training that is provided by Disney will stick with you forever, as well as the people you meet. Working for Disney has taught me many things when it comes to hospitality.","Must be flexible to work holidays and weekends and sometimes five days a week even if you are taking summer classes. If applying, be sure to show that you are fully available as it will increase your chances of being hired.",Walt Disney
536,"""good place good people good food""",4.0,great tasks to work on all round,nothing bad to mention really,Walt Disney
537,"""Lead""",4.0,Fun! Always positive vibes :),None that I can think of,Walt Disney
538,"""Overall Positive""",4.0,"Highly Ethical and Socially responsible company, positive branding,","Can be a tough environment, extremely limited mobility",Walt Disney
539,"""Manager""",5.0,Great co-workers and amazing content.,On occasion an around the clock work schedule.,Walt Disney
540,"""Best Company to Work For!""",5.0,"Walt Disney is full of amazing benefits such as health care, 401 K, paid vacation/sick days, and an enormous amounts of perks.",It's a union based company so scheduling can be a hassle sometimes.,Walt Disney
541,"""Disney Review""",4.0,good benefits! better pay than most other theme parks.,"strict standards, not helpful if you want to more parks/positions",Walt Disney
542,"""Merchandise""",4.0,"Great environment , work team, great benefits, great company values",Schedules changes a lot,Walt Disney
543,"""Lack of direction - an internal mess""",3.0,"The people within Disney are some of the best, hardest working people I have ever met. The perks of Disney are great and it was a great experience.","However, internally everything is a mess. They will have layoffs with notice of a new direction, but months before that new direction is messaged. Months of employees in limbo. It makes for terrible morale, which is seemingly completely ignored by upper management. There is little to no transparency",Walt Disney
544,"""Good People, Good Perks""",4.0,Lots of fun perks working for Disney,Plenty of politics and zero promotions or raises.,Walt Disney
545,"""Program Manager""",3.0,great benefits and people to work with,no work life balance,Walt Disney
546,"""Enjoyable summer short term employment""",4.0,"Fun, Great workers, happy customers, decent benefits, good hours",Not a way to earn much money,Walt Disney
547,"""Good""",4.0,"Benefits, experience in customer service",Hours they make you work,Walt Disney
548,"""Not for everyone""",2.0,Good to have on your resume.,"Favoritism is rampant throughout. The tail wags the dog a good amount of the time. It's all about who you know and not your skill set. They say they want diverse personalities, but that's not the case. Senior leadership prefers those who know people as opposed to those who are good leaders with business acumen.",Walt Disney
549,"""Great Place""",4.0,"Everyone loves what they do here, and truly has a passion for their work",No room for growth for entry level positions,Walt Disney
550,"""ride operator""",3.0,fun people to work with. you get into disney for free. benefits are pretty good if you're full time. attractions were fun.,"pay sucks, hours suck if you are part-time . MGMT can be iffy, stressful during the holidays",Walt Disney
551,"""Sales Trainer""",5.0,"Best sales techniques in the world...Disney truly wrote the book. Everyone is nice, very comfortable work environment.",Not very high pay scales unless very high up into management. Not many options with regard to scheduling.,Walt Disney
552,"""Team environment varies...""",4.0,"Benefits, Schedule, location, free coffee",- Friendly environment varies between teams/departments - Low-Medium salaries (unless you are top management),Walt Disney
553,"""Great benefit - If you are salaried""",4.0,Great benefit when you are manager level. good amount of vacations,pay tend to lower than average,Walt Disney
554,"""Amazing""",3.0,It can be fun at some times,It can be boring doing deadlines,Walt Disney
555,"""Night Custodial""",5.0,Great Company to grow in.,The hours are rough on your body.,Walt Disney
556,"""Fixed Carts cashier""",4.0,"Complimentary tickets, getting family in for free, discounts, work experience, working for a big brand, don’t need to pay for uniform","Pay, hours, sonority, favoritisms, sour apples , entitled AP,",Walt Disney
557,"""Great Place""",5.0,"Opportunities to grow in the company Excellent benefits, and great atmosphere to develop skills and talent",I do not have any bad experience during the time I have been working for the company,Walt Disney
558,"""Best job""",5.0,Best job works welll and work is easy,Nonexistent nope not applicable and nonsense,Walt Disney
559,"""Heads on!""",3.0,"they actually make you do what they told you to do, no surprises","they make you do it with overtime (non negotiable), yes they pay you but you have no option",Walt Disney
560,"""Great company and benefits""",5.0,"Education reimbursement, endless discounts and perks","Political, hard to transfer sometimes",Walt Disney
561,"""Guest Experience Manager""",3.0,"Benefits, perks and discounts","Perks have been blocked out more and more. Pay, and the ability to grow.",Walt Disney
562,"""Prod""",5.0,Fun Company and cool name association,Long Hours but depends on your outlook,Walt Disney
563,"""Lead""",4.0,Free admission to Disneyland,"Hours scheduled, no benefits",Walt Disney
564,"""How was the working environment""",4.0,It's a very fun place to work at. Full of childhood cartoon characters,I don't have any negative things to say,Walt Disney
565,"""Direct-to-Consumer and International (formerly Disney-ABC Television Group)""",1.0,"Park admission, discounts, cool office.",No internal growth opportunity. Missed deadlines from dependencies. Bad work/life balance. Political. Mediocre pay.,Walt Disney
566,"""Good company""",4.0,Good company depending on where you work.,Starting to get cheaper and cheaper.,Walt Disney
567,"""Great company""",5.0,This company cares about its employees.,This company does a lot of restructuring.,Walt Disney
568,"""Working at Disney""",5.0,"Disney provides a respectful, pleasant work environment. Senior managers are encouraging, diplomatic and have my best interest in mind constantly. My skills are fully leveraged and the projects I am assigned are interesting and keep me busy. I am satisfied with my current role, but there are plenty of internal opportunities should I choose to pursue them. The company also provides me with great work/life balance, including a flexible schedule, work from home and plenty of time off.",I like everything about my job,Walt Disney
569,"""Sales""",1.0,"If you’re a mascachist and enjoy the fact that you sacrifice your own happiness for the happiness of the consumer, then I guess that’s a pro.","Absolutely the worst company to work for. I believe that Disney fosters an environment in which everyone behaves as their worst possible selves. Those who are in management positions act like inappropriate children who expect their assistants and coordinators to do their entire job for them while simultaneously treating them like sub-humans. I consistently was asked to do things outside of my job description and worked overtime yet was told I could not clock those hours. My manager constantly would comment on my appearance such as if I was wearing makeup or not and asked what my ethnicity was on my first day of work. Everyone was age obsessed and treated anyone under the age of 30 like they were children, yet the “millennials” were the ones working until 10 pm at night while management literally did absolutely nothing. I felt like I was a babysitter for immature ill-behaved children for most of my duration at the company. The phone booths were frequently occupied by crying employees. I had every intention in this being a lifelong career, but instead I counted down the days until I could leave as if it were a prison sentence. There is no room for growth opportunities. The joke of the company that managers would say is “the only way to move up is to leave and come back.” I would not wish on my worst enemy to work in such a vile and miserable hellfire sewer of a company.",Walt Disney
570,"""Inside the Magic""",4.0,"Name recognition, stellar reputation in Southern California, free Park admission",Strong reputation means they can pay about 20% less than market wages,Walt Disney
571,"""Great perks, low pay""",3.0,"Great people, great culture, great perks","Long hours, low pay, no gratification",Walt Disney
572,"""Club 33 Cast member""",4.0,The cast members and the guests,Difficult to take time off,Walt Disney
573,"""Working at Disney""",5.0,Great benefits given to the employees.,There are no cons in my opinion.,Walt Disney
574,"""Great place to work""",5.0,The people. The benefits.,The work life balance.,Walt Disney
575,"""Coordinator""",4.0,"Perks like entering the parks, discounts on merchandise and vacations","Disney is very money focused. This means low salaries and cutting the budget whereever they can, especially when it comes to their employees.",Walt Disney
576,"""Good""",4.0,All the benefits included once hired,"Administration, constant miscommunication, limited growth",Walt Disney
577,"""Amazing Expeience""",5.0,- The people - The atmosphere,- The hours - The heat - The transport to work,Walt Disney
578,"""Employee""",4.0,It’s a great opportunity to learn how a major company works and gives the experience of working with people from around the world,They don’t pay well,Walt Disney
579,"""Food and beverage""",4.0,They employed all race and creed with no discrimination and generally organized,Endless work it could get overbearing if not used to it,Walt Disney
580,"""Great Company""",5.0,"Great Benefits, Variety of job opportunities.",Have no Cons to report,Walt Disney
581,"""Incredible""",5.0,I participated in the Disney College Program and it was the most amazing experience of my life. I just wish I would have extended my program or applied to be full time.,Leaving is unbearable. You'll want to stay forever.,Walt Disney
582,"""Research Specialist""",1.0,"Good benefits, free admission and tickets, good discounts, special events","Bad management, favoritism, too much micro managing, politics, betrayal, low pay, not enough hours, work load way too heavy, no morale, no room for advancement",Walt Disney
583,"""Exciting and dangerous""",2.0,The pay is better than most.,The scheduling is horrendous. They will work you all hours of the day and night with no consistency. Your sleep pattern changes 3-4 times a week. Unhealthy for so many reasons.,Walt Disney
584,"""Title""",5.0,"Benefits, amazing people you meet, a job unlike any other",Low pay and sometimes no hours,Walt Disney
585,"""Lifeguard""",5.0,"fun, exciting and doesn't get old",none if you can handle the culture,Walt Disney
586,"""Cast Member""",2.0,free tickets to Disney and great discounts,I never felt like I got to be myself and I wanted to interact with guests more but my job didn't offer me that,Walt Disney
587,"""Attractions""",4.0,"Fun, fast paced, free pass, great perks","Long days, rude people, commute",Walt Disney
588,"""Cashier""",5.0,Good environment lots of room for advancement,Slow hours bad pay company doesn’t really care about employees,Walt Disney
589,"""The DCP Experience""",5.0,"You get to go to the parks on your day off, make amazing friends, and have life-changing experiences.","You have to work a LOT. I was scheduled to work 11 days in a row and almost 12 hours each day once. It's not always that crazy, but sometimes it is. It's not all magic and rainbows, so just know that before you go.",Walt Disney
590,"""F&amp;B Coordinator""",4.0,Great benefits like getting into the parks and health insurance.,Disney parks have horrible hours.,Walt Disney
591,"""Low pay""",3.0,"you get ""perks"" that they are slowly taking away",Low pay. It's not okay....,Walt Disney
592,"""Customer service""",4.0,Pay was decent for what the work is.,Hours. Expect to work on holidays.,Walt Disney
593,"""Sales""",5.0,"Good benefits, good opportunities, good work family",Hard work seems to get more complicated all the time,Walt Disney
594,"""Front Desk Manager""",3.0,"Well known throughout world for Hospitality, resume booster","Lot of pressure about meeting expectations. Decreasing emphasis on employees, reducing hours for hourly employees. High expectations from guests with low amount of employees for guests incoming",Walt Disney
595,"""College Program participant""",4.0,-great perks -great coworkers -great company culture,-strict management -confusing rules -difficult guests,Walt Disney
596,"""Depends on your department""",3.0,"Merch discount, parks access, movie screenings, discounts to other Disney experiences","Unable to grow within company despite preaching it, your experience really depends on what department you work in. Everything from zero work culture, micromanagement, inadequate unprofessional gossiping manipulative managers to departments where it’s a joy to be an employee with supportive growth centric supportive managers and a wonderful Disney work culture",Walt Disney
597,"""Once in a lifetime experience""",5.0,"Smartest, most talented managment team in existence. You’ll learn from the best. Visionaries abound.",Bureaucratic. Political. Zero workmlife balance at the executive level.,Walt Disney
598,"""Just Started""",4.0,"There are good benefits like free admission, health care, dental, vision, etc.",I've heard the hours can be long.,Walt Disney
599,"""My thoughts""",3.0,You meet a lot of great people and guests.,Management and point system can be excessive.,Walt Disney
600,"""Ok company with good benefits""",4.0,"Park entrance benefits, flexible, training, ability to move up, can pick up shifts","Scheduled at random times, can be extremely busy",Walt Disney
601,"""Work - Life balance good""",4.0,Work - Life balance good,too large to get to things flow fast,Walt Disney
602,"""College program""",3.0,"Great benefits, fun time, new experiences","Hard and long hours, treated like bottom of pile",Walt Disney
603,"""Working for the mouse""",5.0,get to enjoy the parks whenever,Treats college program participants unwell,Walt Disney
604,"""Ok place to work part-time""",1.0,Free theme park admission Great benefits,No career growth or development especially if you're a person of color.,Walt Disney
605,"""Horrible Place to work for""",1.0,"""Free"" Admission to the parks ""Free"" perks for snacks during the holidays ""Discounts"" on merchandise including a holiday discount ""Free"" parking. I'm putting ""Free"" in quotes because it isn't really free when you are putting your heart and soul into this company.",Long hours of overtime work Leaders who don't care about you Leaders who don't care about your health Huge turnover ratio You get written up over the tiniest thing You can't voice your opinion. Management doesn't listen to you You are left out in the sun for hours on end The clothing isn't right for Florida weather and isn't breathable. POLYESTER is not healthy for 80+ degree weather!!!!! You are just a number to this company. There is no employee engagement. You can't balance your work and personal life because you are always there. The guests treat you just as bad as the management. Management will not take your side if a guest gets upset or even assaults you. Management forces you to lie to the guests. VERY LOW PAY and not worth the pay or stress. High stress jobs. This is a customer-centric company not employee centric. No room for advancement unless you sleep with a manager or kiss up. Blackout dates for employees to the parks. Unprofessional managers and coworkers.,Walt Disney
606,"""Advance Sales Associate Cruise Team""",4.0,"Great benefits, co-workers, pay, travel perks, leaders","Decisions of management, budget cuts",Walt Disney
607,"""Working""",5.0,Being able to meet everyone from around the world meeting new friends,Not having time for family at home,Walt Disney
608,"""Financial Executives Are Deceiving, Untrustworthy""",3.0,"Potential opportunity to grow within, Certain Disney Perks","For a large company, 401K is weak; no matching until after first year of employment, charge for health coverage, no sense of work life balance",Walt Disney
609,"""Steward""",5.0,Opportunity for growth . Love it,"It’s ok, no problems",Walt Disney
610,"""Great Experience""",5.0,I use to work here and I had a great experience. I learned a lot but my position was only entry level.,I didn't have any room for growth,Walt Disney
611,"""Volunteer""",4.0,Free snacks and very fun,Long hours and always standing,Walt Disney
612,"""Great Experince""",5.0,"Friendly, positive, get to meet lots of people","Long hours, college program can sometimes make you feel like just a number",Walt Disney
613,"""Not great""",2.0,Nice perks and good exposure,"Horrible co workers, stressful, filled with anxiety",Walt Disney
614,"""Guest Services""",3.0,"Great Benefits (admission to parks), it's DISNEY!",Hours would be working past midnight then have to open the next day...that was a common thing they did.,Walt Disney
615,"""receptionist""",5.0,discounts for all cast members,hours for all cast members,Walt Disney
616,"""Great coworkers, but feel disposable""",3.0,"I worked part time at Disneyland in merchandise. The perks were awesome... getting into the parks anytime you'd like, discounts, passes to get your friends and family in, great coworkers,","I felt very disposable to management. I knew when I quit they wouldn't really care because they would already have someone lined up to replace me. The wage was not great, for the amount of work that goes into the job, the hours were unpredictable, and they never worked around my schedule. If you work at Disneyland it has to be your #1 and only priority. Some people are in school and make it work, but it's difficult.",Walt Disney
