,title,rating,pros,cons,company
1498,"""Working in Disney Corporate""",5.0,"Working at Disney was an invaluable experience because of how big the company is and the amount of networking and experience it can offer you at such a young age. It opens the door to learn and grow from some of the best people in the business. If you work hard, they will reward you and you will grow. Very friendly environment, great culture, amazing benefits and travel perks, and never worried about job security if you work hard and do what's best for the company. Amazing CEO!","Being a large corporation, it's sometimes tough to move up and not get caught up in the politics (i.e. raises only once a year, tenure, favoritism). Also, they don't pay nearly what you're worth but the experience makes it worth it.",Walt Disney
1499,"""Slide Operator""",4.0,Perks are great Picking up shifts and giving away shifts is easy Fun cast members,Managers sometimes play favorites,Walt Disney
1500,"""Great company, great experience, low pay, low room for growth""",4.0,"Great company to work for, and great brand to support. Flexible work options are company policy. A lot of opportunities to take development classes that are incredibly helpful.","low pay, no raises beyond annual 3-4%, very hard to grow in the company. hard work does not equal more pay or a higher title. often those who do less work get promoted, and those who do more dont.",Walt Disney
1501,"""The Walt Disney Company""",4.0,Great brand. World class environment. Very flexible. Training available. Lower salaries.,"High turnover, isolated from larger picture. Management doesn't value people with breadth of knowledge and experience. Many siloed systems",Walt Disney
1502,"""Systems engineer""",4.0,"Great work environment. Constantly working on one of a kind systems, so every day is dealinh with something new. Co-workers generally enjoy their job and as a result it is hard to find people who havent worked for the comany for the majority of their career",Disney is an entertainment company first and engineering company second. This can cause aggrivation when trying to get your job completed. There are no true merit raises. You recieve an annual raise that is calculated on your performance theough out the year.,Walt Disney
1503,"""Good Teams, Not Great Management""",3.0,"Lots of perks, lots of talented people.",Not a lot of mobility between teams.,Walt Disney
1504,"""Food & Beverage Intern""",5.0,Amazing company that has the best customer service in the world. No problem is too large and no solution is impossible.,"Felt like a number as an employee, very structured work.",Walt Disney
1505,"""Walt Disney Company""",5.0,"networking, connections, making magic, opportunities",need to start from the bottom and work your way up,Walt Disney
1506,"""Excellent Corporate Overlords""",4.0,Disney offer competitive pay and benefits,Money Decisions from far away force studio closures.,Walt Disney
1507,"""The Disney Experience""",4.0,Great brand and work/life balance is achievable for many. Positive opportunities to work with very smart and creative people. Unique perks such as pass for the parks and discounts are also a plus.,Internal mobility can be challenging and pay is not as competitive as others in today's marketplace. Some approaches to work are outdated.,Walt Disney
1508,"""Disney English Trainer""",4.0,Great Company with amazing opportunities.,You must be on at all times. It can be overwhelming.,Walt Disney
1509,"""Fun company""",4.0,Fun enjoyable great people to work with,Not big on new ideas hr change a lot and hours r being cut back a lot now,Walt Disney
1510,"""Guest Services""",3.0,"Fun people to work with, occasional magic with guests, lots of interaction with other departments","poor scheduling, weird hours, nothing is a guarantee, angry guests",Walt Disney
1511,"""Great place to work""",5.0,"Great environment, fun projects to work on ...",Can sometimes be hard to move into a higher position.,Walt Disney
1512,"""Entertaintment""",4.0,Great starting point to kick off career.,Pay is not very high.,Walt Disney
1513,"""Quick Service Food & Beverage""",4.0,Great exposure to learning about the Walt Disney Company and how it operates. Learned a lot about time management and teamwork.,Must has the work ethic to put in a lot of hours as you will work a lot.,Walt Disney
1514,"""Marketing manager""",4.0,"Great culture, benefits, and opportunity for growth and continuing your education",Stiff approvals through corporate and legal,Walt Disney
1515,"""Good temporary job""",3.0,Flexible schedule while in school Room for advancement Great customer service experience Sign-ins for family and discounts company wide,Must have open availability during holidays & peak season Pay is low A lot of favoritism,Walt Disney
1516,"""Guest Research Specialist""",5.0,"Energetic, organized, motivational. Fun job at the happiest place on earth","Rude guests, scheduling, not much room for immediate growth because of the sheer size of the company",Walt Disney
1517,"""salary""",5.0,"free park entry, free tickets, great coworkers, easy job","no free lunch, only ten dollars an hour which isn't terrible",Walt Disney
1518,"""Cool products but terrible work culture""",1.0,You get to work for a well respected brand name. Free park tickets plus other Disney discounts. Good work/life balance.,Lack of ownership of products. Info and designs are received top down not allowing for further discussions. Heavily contingent staff. Most folks just care about logging 8 hours of work instead of going above and beyond to make products better. Full time employees focus more on moving up the corporate ladder.,Walt Disney
1519,"""QA Lead""",1.0,Good benefits but this is because of the parent company and not because of the division.,Too much nepotism within the department.,Walt Disney
1520,"""Stop and Check before you Start!""",2.0,"Incentives, from benefits to passes, it could be worth wild.","management with in-proper training and lack of guidelines, giving Disney a bad reputation.",Walt Disney
1521,"""Great company, but unstable""",4.0,"Disney was a great place to work. Decent salary, but great benefits including free park admission among the regular health, dental, 401k, etc...","i worked in a small game studio that was bought by Disney to work on. Mobile games. 2 years later they restructured their gaming division and laid off everyone who they had working internally on mobile games, deciding to instead outsource then all. So my entire studio was laid off for no reason.",Walt Disney
1522,"""It was decent""",4.0,being around other talented people it's disney!,corporate therefore big and bulky,Walt Disney
1523,"""Great Place to work!""",4.0,Working with the guests. Making lasting memories. Disney.,"The heat, and not enough breaks.",Walt Disney
1524,"""Network Intern""",4.0,"Great people, great experience.",The resume review workshop could have been more helpful.,Walt Disney
1525,"""Data Analytics, Intern""",5.0,Great Company and great working environment,Late work hours and Intense working schedule,Walt Disney
1526,"""Short Sighted Decisions""",1.0,Excellent staff of dedicated and talented people trying to do their best in difficult circumstances.,Executive staff making short sighted decisions that affect operations and overall staff morale without consultation with the general management community.,Walt Disney
1527,"""golf course marshall""",3.0,liked joband hours were fine,pay could have been a litt higher,Walt Disney
1528,"""ABC Marketing Intern""",5.0,The people are amazing and they really make sure you're learning and gaining experience,There aren't many opportunities to work with other interns,Walt Disney
1529,"""Store Operations Lead""",3.0,lots of valuable experience in sales & customer service.,"late nights, little work around for school schedule",Walt Disney
1530,"""Sales Assistant""",2.0,Decent pay for amout of actual work done,"Too many different manager types (operations, sales...) trying to run things with different end goals",Walt Disney
1531,"""Global HR Ops""",4.0,Learned so much very organized program,"Streamlined work, call center, strange hours",Walt Disney
1532,"""Employee""",2.0,"Free Park Tickets, Cast discounts, the holiday copoun book, nothing of actual value.","The job itself, no room for growth or development, poor management, awful pay.",Walt Disney
1533,"""Good Company, Poor Fit""",3.0,"- Comp package slightly above industry average - Nice benefits/perks, including three weeks PTO, free entry to Disneyland/Disney World, 50% of Disney resorts and cruises, maternity/paternity leave - Passionate co-workers who truly care about the company, and view Disney as their dream job",- The sheer size of the company can make employees feel like expendable cogs in a huge machine - Hard to fit in if you don't drink the Disney Kool-Aid - Employer match on 401(k) is weak compared to competitors,Walt Disney
1534,"""Great company with many opportunities.""",5.0,In such a large company that has so many subsidiaries you well almost be guaranteed to find some pat of the company that is a good fit for you!,The only con would be too many friends wanting you to get them into the theme parks for free since that is one of your perks :),Walt Disney
1535,"""Disney in Bellevue""",4.0,"Great bunch of people, well oiled machine in terms of MAA1 that I got to work on. Lots of artistic talent and diversity, age, sex, and race, it was a great place to work. Disney is great at keeping all their companies informed of the state of the business, with monthly company wide meetings and bi monthly live company wide meetings. It was really quit impressive. Also the studio had free lunches which was also a great perk.","I guess in my position the con would be dealing with very talented people, they are often perfectionists and might get lost in their own subjectivity in their opinions of others work. But overall the intentions of everybody there always remained good.",Walt Disney
1536,"""Sr Brand Manager""",2.0,Great people to work with and learn from. Awesome benefits if you have a family and are a big Disney fan.,Interactive division has layoffs every 6 months attributed to constant lack of direction from leadership.,Walt Disney
1537,"""Pageant Helper""",4.0,I love my job. I get to talk to kids all day and work with a bunch of wonderful people.,"Since the company is so big, it can be hard to voice your concerns and actually have something get done.",Walt Disney
1538,"""Great place to work""",5.0,Free park entry and discounts,The Long and late hours,Walt Disney
1539,"""Photographer""",4.0,Get to meet people from all walks of life and share memories with them,They are constantly hiring more cast members so hours are not stable.,Walt Disney
1540,"""Food & Beverage cast member""",5.0,"potential to get promoted, warm working environment great co-workers had the chance to make other happy","I really want to say none, but the pay is a little bit lower than typical quick-food service restaurant. But the difference is nothing once you fall in love with this place",Walt Disney
1541,"""Stores hostess""",4.0,"Easy shifts, fun environment, friendly cast members, and great leads","Constantlyft needing to get a new costume for different locations, late shifts, and no holiday pay on all holidays depending on how long you've worked.",Walt Disney
1542,"""Guest service manager""",5.0,"Great people highly dedicated, wonderful staff","Low pay for hours worked, minimal resources yet you are expected to achieve greatness",Walt Disney
1543,"""Producer for Radio Disney""",2.0,Free entrance to the parks,Upper management would often pit employees against each other,Walt Disney
1544,"""Sucked the life out of me""",3.0,"Good colleagues, good benefits, free passes to Disneyland",Poor management. Poor management. Poor management.,Walt Disney
1545,"""Associate Manager""",5.0,Best team/company I've ever had the pleasure of working with. Like family. Very much of a culture shock to work anywhere else afterward.,"Constant political/executive leadership/structural changes. Constantly in fear of transition or layoffs every 6 months to a year. Unfortunately this has been my experience in most entertainment companies, however.",Walt Disney
1546,"""Wonderful company - crappy current corporate and leadership""",3.0,"-Amazing benefits including free access to the parks, discounts on food and merchandise, generous discounts on Disney cruise line and hotel stays, discounts on additional park tickets for family. -Yearly Christmas bonus in the form of more discounts and free stuff. -Awesome health, dental and vision insurance as well as company 401K. -Meet people from all over the world. -If you dislike your job it's easy to move around. -Disney University where you can take classes led by experts in the field. -Getting to work with amazing people. -Good work/life balance. -some roles allow the opportunity to pick up shifts and be trained in other areas. -Full timers who belong to the union are almost impossible to terminate. -many opportunities for auditions and work in other areas. -disney prefers to hire from within","-Current corporate is money and power hungry. Not holding Walts most cherished interests. -leadership in each area you work in is a hit or miss. -might be asked to work long hours. -extremely hot and stressful environments. -backstage areas will ruin the magic for you. -being from a different state, homesickness can get to you quick. -must stay in current role/area for minimum of 6 months. -Leadership promotes based on favorites, NOT how hard you work or how good you are.",Walt Disney
1547,"""Great company to work for""",5.0,"Everything here is great, I love it.","It's in an expensive area, living cost is high.",Walt Disney
1548,"""Best company ever""",5.0,"Loved the atmosphere, the corporate structure, and work life balance.",They closed the radio Disney portion of the company.,Walt Disney
1549,"""Cook""",3.0,Benefits and that's about it.,"Unclear communication, bosses not leaders, discipline is not properly distributed.",Walt Disney
1550,"""Great Perks, low pay!""",3.0,Discount at tons of area businesses Free park admission for you and three guests Opportunity to work at different parks,The heat and humidity during the summer make working outside awful The pay is far too low for the cost of living,Walt Disney
1551,"""Food And Beverage Intenship""",3.0,"Great Family experiences and you help create them, great employee benefits, good hours","Hours can be long, As an intern you work the hours regular employees do not want, leaders standards vary by location which can make work life confusing at times.",Walt Disney
1552,"""Internship""",5.0,Work environment - Salary - Interesting projects,Some may not like the location,Walt Disney
1553,"""Human Resources At Walt Disney World""",4.0,"strong leadership support, highly integrated HR culture, broad internal transfer/promotional opportunities",work life balance-high pressure case load,Walt Disney
1554,"""Good company but....""",4.0,Good pay and benefits. Great projects.,Too much favoritism and nepotism.,Walt Disney
1555,"""Nice People being subjected to constant layoffs""",2.0,The people I worked with there at the VR studio were brilliant. Lots of very smart programmers and some big name projects to work on.,I wouldn't recommend going to work here. Employees are brought on to work on a single project and laid off when that project ends. As soon as the project is done get your resume ready and bail out quickly. Management regards employees as a liability and you will live in your office cubicle. It's not a total nightmare but your time would be better spent somewhere else.,Walt Disney
1556,"""Research Analyst""",5.0,"Great people, beautiful campus, variety of projects and teams to work with.",Nothing so far! Really enjoying working here.,Walt Disney
1557,"""Content Producer""",5.0,"Great brand, part of the magic.",Is difficult to move up.,Walt Disney
1558,"""Häagen Dazs in Downtown Disney, CA""",4.0,"Fun, friendly environment and free ice cream. Love going to the parks without block out dates. Decent salary.","Constantly trying to maximize profits, even by taking away certain employee perks and benefits.",Walt Disney
1559,"""Great experience""",5.0,I met some amazing people and got access to one of the worlds largest broadcast news channels.,"Sometimes the work was a little slow, but the journalists on my team were always willing to help and give me projects.",Walt Disney
1560,"""Great Job""",4.0,"Tons of experience working as first response to incidents on the property. Work closely with APD and AFD, and there's nothing better than helping lost parents find their kids.","Management is bad. They pull management from other departments. Who wants a security manager who spent their time making pizza? Everyone is afraid of the computer system - if it says you did something bad, nobody questions it. Too easy to get fired (I didn't get fired)",Walt Disney
1561,"""Events""",4.0,Good benefits. Good training. Overall good experience and great people to work with. Lots of different opportunities.,Lower pay. Lots of employees means lots of competition for promotions. Lots of hoops to jump through sometimes.,Walt Disney
1562,"""Ineffecient""",3.0,"Consumer product, studio and theme park perks","Hostile, layoffs, unrealistically demanding. Does not treat employees as well as guests.",Walt Disney
1563,"""Sales Associate Cruise Team""",1.0,Got to see the world,Do not work here if you love Disney. Walt Disney would never hire half the people that work for DVC.,Walt Disney
1564,"""I love Disney""",5.0,They have always been so quick to deal with any conflicts and make sure their face characters are well taken care of and protected.,The environment can sometimes feel hostile when you are working with a bunch of twenty year old girls who bring their drama into the work place.,Walt Disney
1565,"""6 months Disney College Program""",5.0,Living and working a the most Magical place on earth!,Long late hours working in QSFB,Walt Disney
1566,"""Sales Manager""",4.0,Great company to learn Corporate America and business ways of working. Learned outstanding customer service and project management skills from strong and inspirational leaders. Excellent perks and park benefits with the ability to sign in friends and family.,"Pay is generally not as competitive as market value due to the ""Disney Difference"" of the other benefits you receive.",Walt Disney
1567,"""Good for the perks""",3.0,Love having sign ins for my family and getting to dance for work.,Don't pay well for how hard we work especially in extreme heat. Very small wage increases each yr based on performance.,Walt Disney
1568,"""Vacation Planner""",5.0,"Talking with all sorts of people, helping to dream vacations for families, working from home, flexible schedule","policies kept changing day by day, having to work holidays when nobody called in, having to work weekends (only time with husband and kids), to many people telling you what to do and getting different answers.",Walt Disney
1569,"""Not a dream come true on this engineering team""",2.0,"I was on the 'flagship' engineering team that develops the ABC experience for connected devices and platforms. Well, the situation of the client development group is not the rosy picture they paint for you.","Instead of developing applications for interesting platforms like iPhone, Apple TV, Android, and Android TV, you get to be project manager for developers in other countries who have more experience than you in streaming technology.",Walt Disney
1570,"""DCP Merc""",4.0,"Great perks, housing taken care of, and good job experience",Long hours during holidays and weekends,Walt Disney
1571,"""Character""",5.0,Great company to work for.,"long work days sometimes, but worth it.",Walt Disney
1572,"""The Perks Are Awesome""",4.0,Good health insurance and perks while you are working there and even after you retire. The co-workers and some leaders can be very good people as well,You are not compensated enough for your job. there are bonuses that you can get monthly based on your performance but it's chump change compared to the amount of money you bring in for the company.,Walt Disney
1573,"""Just Alright""",3.0,You get to work on some pretty cool properties. Good health benefits and free tickets to their parks. Access to some good training materials.,"It is a big company with lots of red tape for working with all those awesome properties. They aren't willing to take risks. Safe bets are the only bets they make. Creativity is great, so long as it fits within the red tape and is a safe bet.",Walt Disney
1574,"""Global HR""",3.0,"Casual dress, cross training and great benefits",Increased workload and no OT approval to be able to tackle all tasks.,Walt Disney
1575,"""Great company while it lasted.""",4.0,-Great team -Great atmosphere -Free snacks and drinks -Disney perks,Working under a corporate giant and getting closed down.,Walt Disney
1576,"""Project Manager""",3.0,Interesting projects and technical exposure.,Difficult to learn and navigate complex organizational groups and process.,Walt Disney
1577,"""Merchandise Sales Associate""",3.0,Theme park admission and merchandise discounts. Experience lots of different cultures. Seeing the smile on babies faces.,"Low pay, long and late hours, little recognition, rude entitled guest. Coworkers do not always do their job, and look for ways to get out of working.",Walt Disney
1578,"""Loved it!""",4.0,"Working at Disney is like working with family. People get on your nerves sometimes, but other times it is a lot of fun. I miss working there every day,",Budget issues due to Shanghai Disneyland. Put a negative strain on every level in the company. Made it hard to stay happy for our guests.,Walt Disney
1579,"""VP media relations""",3.0,"Exciting brands, good resources, competitive pay and benefits, people are generally smart and collegial","The bureaucratic red tape is mind numbing at times, but it's the nature of the beast",Walt Disney
1580,"""DI Production""",1.0,Free admission to the parks and discounts on resorts/hotels and products.,Extremely political environment that plays like a high school special. Re-orgs almost every quarter,Walt Disney
1581,"""Performer""",4.0,"You meet a lot of different people, get to portray different characters, magical moments with guests, lots of fun, and lots more pros.","Management is not always fair or caring. For a company very big on safety, they have work in unsafe conditions at times.",Walt Disney
1582,"""Little advancement opportunity""",3.0,"Depending on your supervisor, hours are not excessive",No promotion opportunity despite consistently strong performance evaluations,Walt Disney
1583,"""Vacation Advisor I""",3.0,"Most Holidays off (paid), admission to disney parks ( minus the blackout dates),","not very flexible on hours, pay is not the best",Walt Disney
1584,"""Campus Recruiter""",5.0,Working for a fortune 100 company is a great experience and will teach you how to handle being a fish in a large sea of cast members. It looks great on resumes.,"Don't forget that you are just an intern and that you will not be getting paid. You have to be ready to work, just because you're working for Disney doesn't mean that it's all fun and games. I saw a lot of ppl get burnt out that way, but as someone who loves to work to achieve goals, I enjoyed it a lot.",Walt Disney
1585,"""Great Company""",5.0,Great opportunities for advancement and movement between divisions,Lower salaries than other major Studios,Walt Disney
1586,"""Photographer""",4.0,great people great work environment. love my job .,"doesn't pay well lunch isn't free , no paid lunch.",Walt Disney
1587,"""Guest Services Representative II (Disneystore.com Call Center)""",4.0,"Slightly fun atmosphere. Opportunity to learn good office skills. An abundance of experience to gain from the many lateral movements and cross-training offered. Health, Dental, and Vision is also a plus. Free park admission is always nice.","Being a call center based in Memphis, the pay could use a boost. There are many call centers in the surrounding area that offer starting positions that pay almost $2/hr more. There is NO room for advancement...only lateral moves. Leadership creates positions for who they want, not who deserves.",Walt Disney
1588,"""disappointed""",3.0,"short hours, decent pay and friendly people","not enough hours, hard work",Walt Disney
1589,"""Once in a lifetime experiences that most will never get the chance to experience.""",4.0,Working for Disney is a great place to preform for people that came to forget their life outside the gates. You get the chance to make memories for people from across the world! You get to experience cultures from all around and work with such a well renowned company.,I work my butt off doing 40+ hour weeks and still make a little more than the minimum. Hard to move forward in life while trying to pay rent.,Walt Disney
1590,"""Level Designer""",5.0,Great place to work with excellent benefits and perks.,"Upper management are not gamers, marketing failed, leading to studio closers.",Walt Disney
1591,"""Great Co-workers, but repetitive job area""",3.0,Park access whenever I wanted was cool and the people I worked with were seriously the best.,You're working for a company that is open 24/7/365 days of the year. Do the math lol,Walt Disney
