,title,rating,pros,cons,company
1086,"""P&G--good but not great""",4.0,Great benefits and flexibility--particularly in regards to working hours Fair pay and good raises Work / Life Balance is good Competitive yet collaborative environment,"Slow to adapt to market changes Hierarchical--not easy to influence direction of projects--especially top heavy projects Too much duplication of work 401k is decent, but profit sharing is too driven by p&g stock (not diverse)",Proctor & Gamble
1087,"""Assistant Brand Manager""",4.0,"-The people hired by the company are incredibly intelligent, driven and dependable. -Large amount of training and experiences are available to build skill sets. -Flexibility to work remotely.",-Intense internal competition is distracting to delivering the business. It creates a culture of distrust and pushes company politics into hyper-drive. -Typical work week is 50+ working hours.,Proctor & Gamble
1088,"""Stable work, good benefits""",5.0,"Career growth opportunities, great people, you can develop yourself and your capabilities",There are not too many cons,Proctor & Gamble
1089,"""Senior Project manager""",4.0,Great ethical company and people are super smart.,Too much processes and layers to deal with.,Proctor & Gamble
1090,"""Ok company""",3.0,"Good medical Benefits, profit sharing","Upper Management-bad leadership skills, promotions not based on performance",Proctor & Gamble
1091,"""Culture going downhill""",1.0,"Pay rate is good for no degree, OT opportunities.","Rotating shifts, forced OT because of poor planning, horrible management. Oh and benefits are much worse now than 5 years ago.",Proctor & Gamble
1092,"""Working at P&G""",4.0,"Good Salary, a place to build strong leadership skills. Employees are able to take advantage of the global size of the company including the fact that it is in many locations - this is helps in reapplication and growth.",sometimes too big to make quick changes and too standardized across many regions to make specific changes needed for some small regions,Proctor & Gamble
1093,"""Division Manager""",5.0,"Best products in the world, R&D, Marketing expertise","Decision Making slow, a bit too much oversight,",Proctor & Gamble
1094,"""Great Interview""",5.0,"The interview consists of a site visit, where in you do a presentation followed by meeting several people 1-1. Its a good way for them to judge you, but also for you to know if this is where you want to work.","The job application sheet is very brief, with no specifics at all. So, you have little understanding of what is expected from you when you join.",Proctor & Gamble
1095,"""Retail Merchandiser""",3.0,"Flexible work schedule, easy work","Mileage only paid after 30 miles, added responsibilities after layoffs with no added compensation",Proctor & Gamble
1096,"""Consumer Comments""",2.0,Profit Sharing for retirement is a good program.,"Doing the Right Thing is lip service. Worked in Quality Assurance, found unsafe medical device, which resulted in FDA Recall Class 2. I was severely harassed by the company.",Proctor & Gamble
1097,"""Start your career with P&G""",4.0,1 - People with different backgrounds 2 - Well-established processes and clarity of roles and responsibilities 3 - Clear career path 4 - Strong brands 5 - Very good place to start your career at,"1 - Complex structure might not support the decision making process 2 - Grow from within, you can not get hired to senior position",Proctor & Gamble
1098,"""Flat Organisation""",4.0,Good reputation and Products are excellent,Opportunities are limited for people out side the top management schools,Proctor & Gamble
1099,"""It's okay""",2.0,"For hard work and some money, feels like you're doing more than what you're working for. It feels like it deserves more, but I don't think they will make a change anytime soon in Staff management","Standing, dealing with other worker that are awful when it comes to communication that rarely knows how to cooperate. They will treat you negative when working alongside them, but pretend like nothing happened when the work is done especially if you're a new worker which I find rude honestly.",Proctor & Gamble
1100,"""Finance""",4.0,"Very smart people, for the most part a collaborative attitude, intention of doing the right things, the right way","some ""infighting"" ""what's gig for the department""at times outweighs what is the smart thing to do. Increased short term focus is common across almost all companies...",Proctor & Gamble
1101,"""Intern at Procter and Gamble""",4.0,"Getting to learn the background of what the industry is and how the decisions are made in the company for selling, promotions, product brands, etc.","Not actually working inside the company, but doing the work from another city, I think I lacked the experience of the organizational culture.",Proctor & Gamble
1102,"""Brand""",5.0,Great investment in training and ensuring that fundamentals are consistent across teams.,Movement between levels/promotion is much slower than at other CPG companies,Proctor & Gamble
1103,"""New hire review""",5.0,Flexible work hours. Self-motivated learning with support from higher-ups. Competitive pay.,May have to be on call during weekends. Work-life balance a little difficult to achieve.,Proctor & Gamble
1104,"""P&G""",3.0,P&G provides the opportunity to grow and gain exposure to many different parts of the business. The company is trying to get more focused to continue it's longevity with sales and discontinuations of different products and brands. While It varies by business there is opportunity for flexible work arrangements that improves work life effectiveness. (although most high level managers or those looking to get promoted do not partake),"As the company is beginning to see challenges to deliver the results, productivity targets and has made it harder and slower to get promoted see strong pay increases and creates a broader span of work for the same salary.",Proctor & Gamble
1105,"""Sr Engineer""",4.0,"Great company and fantastic place to learn and grow. P&G invests in their people giving them lots of training opportunities. Also, good potential to work in different locations in different fields of engineering.","P&G has a process or best practice to do everything. Sometimes this stifles the creativity to try new ways and methods. Also, definitely seen an impact of the reduced spending in R&D as a function. The Open Innovation strategy was taken too far and P&G neglected to invest in the core areas. This has impacted their innovation funnel.",Proctor & Gamble
1106,"""Benefit""",4.0,Good health and retirement benefits,"Stock value is decreased, retirement plan is stock based",Proctor & Gamble
1107,"""Reasoning test""",4.0,"For entry level applicants, be sure to have a visible clock so that you can pace yourself. Otherwise, you may run out of time before completing the test. Also it is important to fill in all questions before running out of time. I failed to pace myself. I wanted a clock but didnt ask for one. The interview was okay & employees seem to be great people.",N s. D. E. S,Proctor & Gamble
1108,"""Great Company""",5.0,"Amazing people, great benefits, great salary, wonderful opportunities for personal and professional growth",Not much choice in first placement,Proctor & Gamble
1109,"""Great place to start a career""",4.0,The training and support you receive at P&G is like none other in the industry. A great place to begin a career and to learn!,"Very process-driven, especially in the core business lines. Also, management will sell off divisions that aren't strategic, so watch out that you're not in the wrong place at the wrong time.",Proctor & Gamble
1110,"""Mandatory overtime union city Ga""",3.0,Great pay somewhat friendly people lower managements were usually easy to talk to and was always there to assist any need,The OVERTIME. I know at first you'll think heck yea more money give me it all but every shift it 12 hours long and you can not sit down only on your little 45 min break. No personal life because you will work 6 days a week MANDATORY 72 hours per week,Proctor & Gamble
1111,"""Principal Scientist""",5.0,Excellent pay and compensation.,Currently undergoing reorganization and may require some time to get back on track.,Proctor & Gamble
1112,"""QC Chemist""",2.0,"Decent pay, great benefits, great coworkers","rotating shift, lack of advancement opportunities for the lab, poor management, understaffing",Proctor & Gamble
1113,"""Associate Director""",5.0,P&G has an outstanding management development program as well as an opportunity to build long-term equity. I encourage energetic and creative people to explore a career at P&G. You will not be disappointed.,P&G has been undergoing a transformation for the past 5 years which will insure it remains one of the cutting edge companies in the world and one of the best places to work. All current and former employees would like to see stronger top and bottomline results which undoubtedly will come as a result of having a strong management team and dedicated employees.,Proctor & Gamble
1114,"""Warehouse worker""",2.0,Some worker's there were great,Too much drama at Procter and Gamble,Proctor & Gamble
1115,"""Great Company; Great Culture""",4.0,Great culture & diversity. Great career opportunities.,Compensation & benefits could be better.,Proctor & Gamble
1116,"""Account Manager""",4.0,"Great Company, training and people",Subjective metrics for measuring employees,Proctor & Gamble
1117,"""Solid""",4.0,High quality people across business units and functions,Senior management has struggled and culture has declined in past several years,Proctor & Gamble
1118,"""Making Detergent""",3.0,Great fellow operators to work with. Many different employment opportunities with different departments. Great pay no matter where you go! Lots of overtime available.,Managers and Department leaders do no listen to employee input on how to better workplace. its their way and thats the only way. Many of the operators in one department are woefully unskilled and ignorant in actual floor operations that they are in charge of.,Proctor & Gamble
1119,"""Good company""",5.0,Your assignment is in your hands - you can have the career you choose,Nothing that comes to mind,Proctor & Gamble
1120,"""Section Head""",4.0,"Quality, motivated co-workers who are well-rounded with consistently high PVP's (values). Since a promote-from-within culture, continuous support for training and growth.","It is a big, complex organization that can suffer from bureaucracy.",Proctor & Gamble
1121,"""Great company to work for.""",4.0,Great pay and solid benefits for the work. Tons of opportunity for someone who's ambitious to direct their career path.,"The bureaucracy and the constantly changing policies are challenging. Leadership is expected to change roles every three years, so if you have a great manager or terrible one, either way their gone soon enough.",Proctor & Gamble
1122,"""Good overall""",4.0,"The company has descent benefits, and treats employees well. There is an overall expectation of teamwork at the site.","The company has too much bureaucracy, and therefore a lot of dead weight, which could make working here frustrating after time.",Proctor & Gamble
1123,"""Interesting technical challenges, great people""",4.0,"- Largest consumer products company in the world, with some of the best products in the market (many of which our employees are loyal consumers of ourselves) - Promote from within culture means you can try many different types of work...from engineering, manufacturing, to R&D - World wide business with lots of diversity and amazing employees - Value our PVP's","As a Millennial, I feel our company moves way too slow. Promotion takes a long time and career moves take a while as well (you own your career!). We are slow to change and slow to adapt to the market.",Proctor & Gamble
1124,"""Solid Company""",4.0,"Solid reputation, on the job training, and empower employees to take ownership","Takes a lot to get promoted, have to be willing to move with company to move up. Micro management.",Proctor & Gamble
1125,"""Great Company, slow promotions""",5.0,"Great company to work for, very good benefits (but not as good as they used to be). If you work outside of Cincinnati, expect to be downsized or sold off at some point.","Very slow promotions, as P&G is a large, mature, and slow moving company.",Proctor & Gamble
1126,"""Enough with all the changes""",4.0,P&G employees are some of the most collaborative & intelligent people you can find. My coworkers help me to become a better employee and a better person every day.,"Constant restructuring and downsizing has led to a significant change in employee morale over the past couple of years. It was a great place to work 5 years ago, however I don't feel that the company is looking out for the best interests of its employees the way it used to. Hitting financial and productivity goals is the main focus these days.",Proctor & Gamble
1127,"""great experience""",5.0,"Travel, good salary, development, perks, benefits",Overall great culture and colleagues,Proctor & Gamble
1128,"""Takes care of interns""",5.0,very structured way to help interns grow and get feedback,"slow moving, conservative, some politics",Proctor & Gamble
1129,"""Great Place to Grow Your Career""",5.0,"Abundant: Resources, Training, Leadership, Travel, Variety","Sometimes growth seems slow, and you definitely have to be willing to move for maximum promotions.",Proctor & Gamble
1130,"""seniore engineer""",5.0,Its a good company to work for,Its not a bad company to work for,Proctor & Gamble
1131,"""Section Head""",4.0,Great processes and training programs. Compensations structure was well organized and provided some flexibility for managers to reward associates.,Slow to change and make decisions.,Proctor & Gamble
1132,"""Finance Manager""",5.0,Procter & Gamble is overall great! Flexibility Growth Learning,Procter & Gamble is overall great! - but its complexity is sometimes a headache.,Proctor & Gamble
1133,"""No regrets for giving seven years of my life to P&G""",5.0,Extremely good culture. Very smart people to work with. Spends a lot of effort and money to train you. Very much systems oriented. Respects employees a lot.,Promotions are slower to come now. The direction is changing all the time. Doesn't encourage entrepreneurial spirit.,Proctor & Gamble
1134,"""converting technician""",4.0,"Good pay and benefits. Good salary, insurance, retirement. Overall a good company to work for. Union and non union positions.","Most positions require swing shift, 12 hour rotating shifts that include nights and weekends. Not a lot of flexibility in schedule or vacation time off.",Proctor & Gamble
1135,"""Business Leader""",5.0,Procter & Gamble is an International Company with Motivated people from top to bottom managment Caring for each Individual expectation and aspiration,Work life balance is hard to find because you always want to overdeliver vs your pool. But I still believe this is the best experience I ever had.,Proctor & Gamble
1136,"""great company""",5.0,Great company. Great leadership Great people,Very sloooow moving Not very flexible,Proctor & Gamble
1137,"""Service Tech""",5.0,the best thing for working at Procter&Gamble is you get the learn how to work with makeup see how its made and meet the most wonderful people from all over it was great,when they dont have work for you and you have to go home and you dont get paid for that day,Proctor & Gamble
1138,"""Category Development Manager""",4.0,"Diverse assignments, variety of business units","Inflexible career paths, lack of continuity within business units to transfer category specific knowledge",Proctor & Gamble
1139,"""Out of Touch, managed by fear, political, and bureaucratic. The emperor is not wearing any clothes""",2.0,"full of smart people, incredible access to resources, great place to learn with lots of opportunities for anyone starting their career at entry level (quickly limiited upon reaching more senior levels).","leadership (Band 5+) is out of touch with what happens on an execution level and spend most of their speeches seemingly trying to convince themselves that they understand the issues. Above the band 4 level, leaders are very hands-off yet do not empower the lower levels to make decisions leading to an atmosphere of managing through fear, and making decisions so as to avert blame in case of disaster rather than acting in the best interest of the business.. Little to no transparency as to decision making, which is slow and bureaucratic, seemingly purposely slow to the benefit of managers whose personal incentive to stay safe in their jobs is for it to remain this way. Highly averse to change.",Proctor & Gamble
1140,"""It's a corporation w detailed and extensive processes. Almost so that it's hard to be creative and make a difference.""",3.0,"Very intelligent, logical, fun people with high morals. If you like relocation a lot it could be fun for you.",Too much hierarchy. Inability to live where you actually want to live unless by luck. Inflexible vacation. Profit sharing not as valuable as it was during time of excessive growth which upper level management is benefitting from.,Proctor & Gamble
1141,"""Most valuable experience""",5.0,"great team environment, fast pace learning very supportive people",life time balance you can work long hours but if you enjoy your job it should not be a problem,Proctor & Gamble
1142,"""Awesome Summer Program""",5.0,"Pay, Nice Environment, Easy Job","Changing Shifts. Union Fees, Strict Management",Proctor & Gamble
1143,"""Always something new so you're never bored.""",4.0,"Great colleagues, cool products, lots of different opportunities, aspiring, inspiring, travel opportunities, investment in people development, global, fun, challenging, profit sharing,",Sometimes frustratingly slow decision making. Wish there was more opportunities for promotions as one is all you might ever get,Proctor & Gamble
1144,"""Assistant Brand Manager Intern""",5.0,Invaluable and professional learning experience.,Many layers of management to overcome to institute change.,Proctor & Gamble
1145,"""Purchaser""",4.0,"Great Company and management. Convenient location and good work core work hours of 9-5 allow for excellent Company benefits are reasonably priced and overall it is a good benefits package""","Very tight budgets; lots of interuptions by upper management. ""People tend to leave when there is no room to move up and to experience career growth""",Proctor & Gamble
1146,"""A changing company""",5.0,"Great responsibility at a junior level, meaningful projects, great people. One of the best companies for producing leaders in the world and known for creating world-class marketers.",Large company means many stakeholders in decisions. Any changes must be approved by several layers of senior management who may not understand the conditions on the ground.,Proctor & Gamble
1147,"""process tech/team ldr""",4.0,great company to work for,plants cloose very often with very little waring which really hurts new hires,Proctor & Gamble
1148,"""Experienced Hires look elsewhere unless it's only a paycheck your after....""",3.0,"Pay and benefits in top 3rd vs industry, flexible work arrangements for most and lots of different opportunities for interesting careers but primarily only if you are brought in as management.","Part of their pitch was need for my skills and background and thier strong culture of promote from within, convincing me that leaving my career behind was a great step forward. What they didn't share was that it only applies to campus mgmt hires and a small number of external higher level managers. The have an elusive promote to management process that ebbs like the tides but even if your top rated (I am) you cannot even look at the roles as you won't meet the role requirement (already mgmt). They consistently claim regardless of function that the process is in state of overhaul yet you see promotions being made only where it increases a managers score card metrics. Truly disappointing and indicative of their focus on image over substance. If your experienced and just want a job come on down, if your looking for a challenging career and not already an intern perhaps check out GE, Amazon or another CPG company.",Proctor & Gamble
1149,"""Good place to work""",4.0,People really belief that they are making a difference in the world. Surrounded by people smart people who work hard,"As a big company, it is hard to make changes and people tend to be conservative in the way business is run.",Proctor & Gamble
1150,"""Associate Human Resources Manager""",4.0,Some of the best training and development as a company. In addition you get to work with some of the best and brightest people while continually gaining new experiences through a rotation of challenging assignments.,"Can sometimes miss when managers shouldn't be managing people. They may be able to deliver results but aren't good at dealing with people. They also disregard a potentially large pool of employees that could fill management roles. They have an Administrative & Technical level that can be promoted to management but it rarely happens. It's an opportunity for talent that knows the company and would require far less training however they make it nearly impossible to advance from one employee ""class"" to the other.",Proctor & Gamble
1151,"""Associate Director - IT""",5.0,"Great people, leadership and strategic vision",Very much a younger employee environment and culture. Not suited well for employees after the age of 60.,Proctor & Gamble
1152,"""Best Culture and Business School""",5.0,Best culture; Learn For ever. Gain a lot of experience. never mind your background; you will learn from the beginning,You have to join as a Manager not staff,Proctor & Gamble
1153,"""Great company""",5.0,"strong leadership, development of leaders, great leadership and functional training programs","Restructure program after restructure program, wall street pressures,",Proctor & Gamble
1154,"""Department  Manager""",4.0,"Resources abound, great infrastructure, benchmark work constantly being worked against. It is a good solid company that provides resources to help you get the answers to almost any question.","Sometimes the standard stifles the creative resolution. Tried and true methodology is the standard for good reason, but the ability to be flexible can sometimes drag out longer than is needed. Organizations are sometimes burdened with too much leadership, and micromanaged.",Proctor & Gamble
1155,"""Great company but uncertain times""",4.0,One of the largest company in the world. Great learning opportunities,Currently there is a lot of uncertainty within the company,Proctor & Gamble
1156,"""P&G""",2.0,"Large company, decent benefits at the beginning, worked with good people, some interesting projects and vacation time was very good.","Benefits started to decrease, difficult to get promotion, management not always helpful, projects became less interesting and just brand extensions, not innovative.",Proctor & Gamble
1157,"""Intern""",4.0,Great company that cares about employees. It all depends on the brand you are working on though.,Location isn't ideal and moving around isn't very easy.,Proctor & Gamble
1158,"""Pay and promotion system is horrible""",2.0,"Benefits are ok. If you want more responsibility than you will get paid for, P&G Greensboro is the place for you",Don't look to advance unless you are in kissing up or throwing others under a bus to get there,Proctor & Gamble
1159,"""Big company struggles with startup""",2.0,Systems and structure are strong,Out of touch leadership needs to spend more time listening to employees in the field,Proctor & Gamble
1160,"""Great Company""",5.0,great people who are always willing to help and mentor,the structure how employee levels are determined when hired,Proctor & Gamble
1161,"""Product Supply - Transportation""",3.0,Learn a lot at a very fast pace. P&G truly invest in their employees growth. Working with different functions and learning the business will be applicable anywhere within and outside the company. Pay is good,Can be difficult working with some. We tend to over analyze and force hypothesis vs letting the data tell the story. Some leadership lacks soft skills of truly leading,Proctor & Gamble
1162,"""Solid Place to start""",3.0,Amazing training - the company invests in building capability in people Every function hires super smart - very driven people Grow from within culture Many people have families so hours are often manageable,"Very hierarchical Promotions are timing driven vs merit driven Most management jobs are based in Cincinnati ""Grow from within often promotes homogenous thinking",Proctor & Gamble
1163,"""QA Lab Technican""",4.0,"I love working for pg, I've got to meet some really nice coworkers. And I love learning new things in the position that I held.",The downside that I do not like is that I was a temp for 3 years and than they let me go.,Proctor & Gamble
1164,"""Employee's internal view""",4.0,"Family friendly, fantastic leadership training, great people","As much as the company touts pay for performance it just isn't true. Progression is seniority based, and there is not fast tracking. Can't upset the apple cart. All of the incentives are back-end loaded.",Proctor & Gamble
1165,"""Nice place to work""",4.0,Job security and decent pay,"Too hierarchical; too many meetings, leadership struggles to make decisions",Proctor & Gamble
