,title,rating,pros,cons,company
1463,"""Not a positive experience""",2.0,Co-workers were great and hard workers.,"Nursing management is poor. Heavy patient load, not enough support for critically ill patients. Compensation is ok for nursing, but for techs it is terribly and no one wants to work. Healthcare benefits are poor considering this is a hospital.",HCA Healthcare
1464,"""Good Experience So Far""",4.0,Opportunity to move up within the organization and great benefit package.,The pay may not be the best.,HCA Healthcare
1465,"""The place to be if you want to grow, learn and be part of a lifesaving community!""",5.0,"Positive culture, many training opportunities, supportive colleagues and management, many chances to stretch and grow both professionally and personally. Benefits very good and there are many corporate perks. All manner of discounts on things like software, store discounts, and free Frist Museum memberships, to name a few things. Management encourages servant leadership relationships and teamwork. It is a very uplifting environment in which to work. The company not only encourages community outreach for the rank and file, management also works right along side. It's amazing! Management listens to their employees and reacts positively and does their best to address concerns and make appropriate changes. Work-life balance is excellent.",Communication can be challenging in the corporate environment.,HCA Healthcare
1466,"""Great stepping stone""",3.0,"Great place to build experience and jump start career in the healthcare world. HCA is large and versatile with lots of room for improvements, so you'll never be bored.",Onboarding and continuous management training programs need to be in place!! There is a lack of communication between HCA physician services directors and physicians. More partnership between hospitals and physician practices is necessary.,HCA Healthcare
1467,"""Exceptionally professional and a stress free environment.""",5.0,Environment is googlesque in quality and fully redesigned. Work environment is stress free and professionally autonomous in nature.,Nothing I can think of except that you need to be educationally qualified with superior qualities.,HCA Healthcare
1468,"""Multiple hospitals within a City""",2.0,many different places to transfer to,"all have a different salary schedule, and weekend differentials",HCA Healthcare
1469,"""Supportive of staff, decent work/life balance""",3.0,"Large, reputable organization. Many advancement opportunities.","Matrix-like system, a lot of micro-managing, for-profit health care system meaning more bureaucracy and red tape",HCA Healthcare
1470,"""Great Company, great teams, and to succeed in this company, great communication skills are needed.""",4.0,Team is very supportive. You get to learn new things everyday. Opinions and suggestions are taken into consideration.,"When a team member decides to leave the company, it is challenging during the period of finding a replacement, and it's challenging to be able to transfer all the knowledge.",HCA Healthcare
1471,"""Run Away""",1.0,"COmpetetive pay, and really no others. Its horrible. Worst place Ive ever worked, hands down.","Toxic work environment, toxic coworkers and a toxic boss. Run Away.",HCA Healthcare
1472,"""Great experience in large organization""",4.0,"Opportunity to increase knowledge base, advancement opportunities if willing to relocate.","Depending on location, growth within facility may be limited.",HCA Healthcare
1473,"""Good""",4.0,Good company that cares about its employees,Sometimes too conservative in the culture,HCA Healthcare
1474,"""Great company""",4.0,Value and culture..work as a team and growth opportunity to employees to advance. Great place to work for beginners,Upper management needs to allow staff to do their jobs too much micro management. Benefits package could be better.. do not offer pension,HCA Healthcare
1475,"""Leadership does not listen.""",2.0,Decent paid leave that's about it.,Most things management is bull headed and forces you to use vacation time on holidays.,HCA Healthcare
1476,"""Micromanagement creates an extremely stressful work environment.""",1.0,The pay and benefits are generous. HCA offers many perks to appeal to new employees.,"Being new to the area, I was unfamiliar with the cleaning house that had occurred prior to my being hired. However, during my orientation, I was advised by management of how prior employees had been dismissed by this individual. My experience with HCA was very stressful, related to management's constant need to micromanage.",HCA Healthcare
1477,"""Racist down in deep south""",1.0,"Only if you negotiated good contract with them otherwise they'll take shirt off your back. Sorry, couldn't reveal the correct state but close.","My own experience and others who have first hand knowledge of their decision making, at least ones down south, but no reason to believe it's not rampant in their culture (ie they were sued for millions a while back), profit is bottom line at workers and patients expense. I've seen such a high staff turnover rate in their clinic, they don't support their own ex-employees looking to work in another locations (not talking about myself), its the color of your skin that matters and seems age is a factor too, too old you're out of luck. Clinic atmosphere of fear among staff of being fired and whispering when management is not there of their true thoughts. I have friends of all races and what I saw while working there makes me vomit. Go to HR for discrimination, haha, also don't post any anonymous reviews of them when they request as the truth it's not really anonymous. I will never work for this place, minorities beware and non-minorities you are expendable too if you're on the bottom rung of their hierarchy.",HCA Healthcare
1478,"""Great company to climb career latter.""",5.0,"This company has great transition programs in place. They provide a lot of education and like to groom their own staff for higher positions (manager, director, educator, CNO, etc.). They hire new graduate nurses.","They are focused heavily on times. How fast a nurse does all of her patient care from collecting samples, administering medications, and discharging patients is all on a rolling timer. This can stress some nurses out in a busy understaffed ER.",HCA Healthcare
1479,"""App DeV""",4.0,Great environment that supports developer's growth.,typical downside of working for a field office ..,HCA Healthcare
1480,"""I love working at Centennial!""",5.0,"Great work environment, abundant educational resources",Floating to other floors is constant,HCA Healthcare
1481,"""Great company, Great people, Great values""",5.0,"Exciting time to be in healthcare with a company committed to its core values, including quality healthcare and commitment to patients. Upper management cares about the employees, with significant attention to employee development and leadership. Executive leadership also cares about our communities, by devoting corporate resources to philanthropy and volunteering through the Caring for the Community campaign and the HCA Hope Fund which allow employees to use company time to bring our resources and talents to the community through volunteer work (on company time). This commitment to ""giving back"" filters through and is reinforced by all levels of the company that I've seen. Great stock plans and health benefits, lots of talented and energized people.","Some initiatives move more slowly than others; many people don't understand ""HCA"" as there is no corporate branding.",HCA Healthcare
1482,"""REGISTRAR-Low pay, long hours""",3.0,Great interview process. The initial interviewer was the dept Mgr. But the 2nd interview was with the members of the dept. I was told that this was to see if I fit into b the culture of the dept.,"The position was PRN (as needed), yet assert I accepted the position, I was told that I needed to work a minimum of 30hrs/wk. That interfered with my other obligations, so I resigned after only 3 mos. The training in Austin was unprofessional and drawn out to lay two weeks",HCA Healthcare
1483,"""Not a bad place to work""",3.0,Supportive corporate infrastructure. Supportive local management. Consistent management techniques.,"Centralizing most decision-making and development at corporate headquarters. Less awareness of local, field needs. Career advancement requires moving between cities.",HCA Healthcare
1484,"""x""",5.0,Great benefits and work life balance,Lots of budgetary expense work,HCA Healthcare
1485,"""My experience was fair. Could have been better.""",2.0,"Only one office was comfortable to be at. The other was very uncomfortable, and you almost felt as if everyone was talking behind your back.","They need more comunication. If they don't like something about you, they need to tell you. If you need to fix something,they need to let you know. They don't give you warnings! they just make up reasons to fire people if they don't like you. I will no longer be a patient either. Now it's to uncomfortable.",HCA Healthcare
1486,"""HCA is Awesome""",5.0,"Clear Path to the Top, Fast advancement, Multiple locations to Travel to","No Holidays off, You have to take PTO",HCA Healthcare
1487,"""Excellent methodology, deployment, support, knowledgeable team members""",5.0,"Dedicated team of professionals, fair compensation, travel, treated with respect by peers and managers","When conducting training, or implementations at newly acquired facilities, have some empathy for those new employees that are worried about their jobs and the impact that an acquisition will have on their new role with the company. Be respectful.",HCA Healthcare
1488,"""Great Company need to be more respectable to the inter office staff that works from home.""",1.0,Very stressful job with the productivity and protocol and expectations that are not realistic for employees to meet or maintain. Great opportunity for someone coming into the industry to obtain healthcare experience.,Great opportunity for a entry level person looking start career in the industry. Also they pay for your educational expenses that is related to the Healthcare needs of the organization.,HCA Healthcare
1489,"""Good Ol Boy mentality.""",2.0,Did not lay off much during the dark times of 2006-2011,"The culture is not healthy. Think of it like a sweat shop with Doctors, that will be the best way to describe what you feel everyday no matter what level of employee you are. I seen managers leave for the same reason.",HCA Healthcare
1490,"""Excellent hospital, good benefits, continually striving to better our care of patients and be a  friendly environment.""",4.0,"Good patient nurse ratios, company ICARE values- things I believe in and try to promote as a charge nurse. My management is willing to listen to concerns. Works hard to accommodate scheduling for all.",Fellow co workers show poor professionalism at times. Don't always feel some decisions made by upper management is in the best interest of patients/ staff.,HCA Healthcare
1491,"""Great company to work for with some areas to grow in middle management.""",4.0,Always busy - strong talent on every team. Easy to get guidance if you know the right people.,Some areas of middle management need some stronger leadership - can become over processed with deliverables that do not show value.,HCA Healthcare
1492,"""Was a good company at one time but has steadily gone downhill since 2012""",2.0,"Time off policies, coworkers are enjoyable people. Good place to get your foot in the door of the medical field but not the kind of place you want to stay more than 2-3 years.","Ineffective, unethical management. Corporate cost cutting is really just cutting corners. High employee turnover rate. Managers constantly bend and break their own policies for their whiny employees and blame their best workers when things go wrong or pile more and more responsibility on their best workers. Culture of rewarding those who suck up to management but ignoring people who work hard. Compensation isn't competitive.",HCA Healthcare
1493,"""Typical""",2.0,Tuition reimbursement and bonuses who made goal,"Office politics, not getting trained by the best people",HCA Healthcare
1494,"""My experience was okay..could have been better in some areas""",3.0,"Pay is decent, scheduling, benefits, yearly raises","Constantly understaffed, rude physicians, and Mediterranean charting",HCA Healthcare
1495,"""Was a great place to work in sales""",3.0,"""No Jerks"" policy. Smart, industrious people. Lots of exposure to the healthcare business and physicians. Some great people.","Many managers, few leaders. Tendency to manage by reports, not actions. Degraded over the course of the past few years. Very pharmaceutical-like now.",HCA Healthcare
1496,"""Great place to work""",5.0,Great organizational culture. Promotes from within.,Huge organization with a lot of moving parts,HCA Healthcare
1497,"""A fine hospital in a beautiful location.""",5.0,Good pay and many opportunities for career growth.,"Very, very busy at times.",HCA Healthcare
1498,"""HCA-- HORRIBLE CORPORATION of AMERICA""",1.0,"Nothing. Every employee I have spoken to there since leaving, is very, very dissatisfied and they say things are getting worse by the minute.","Back to back incoming calls with no seconds in between to wrap up and notate. They take on more call volume before replenishing staff (there is a lot of employee turnaround because of poor working conditions), making it impossible to get any sort of a respit, and you are not allowed to stand up and take a quick minute to regroup after the constant barage of incoming calls (150-180 per day). You are under constant survellience as to where you are even during lunch and break times.",HCA Healthcare
1499,"""where to start""",1.0,Tuition reimbursement and benefits are good,"SLOW H.R, awful organization, 2 month hiring process for a job that pays $9.53/hr... just ""on the job"" training, no paper materials to help you understand what you are supposed to learn. It was acceptable in my particular ""floor"" to have a bad attitude and treat others with disrespect.",HCA Healthcare
1500,"""Garbage company DO NOT WORK HERE""",1.0,Decent benefits. That's about it.,Worst place I've worked. Upper management is completely inept. I've worked retail and they treated us better as a retail grunt than hca treats employees as an RN.,HCA Healthcare
1501,"""Could have been better utalized""",3.0,Good relationships with providers Open communication with leadership,Medical Benefits get worse and worse every year,HCA Healthcare
1502,"""Good company to work for""",4.0,"Great culture and company vision. Emphasis on ethics, work life balance and continuing education support.",There is a lack of competitive compensation and promotion from within. Company policies developed to reduce employee abuse of leap frogging through promotions to gain an increase in salary have caused the inability for legitimate increases to be awarded from within and now employees question whether they should leave and come back just to be able to be hired back on at the desired promoted position for the greater amount of pay that would be offered to a new hire rather than from within. There is a disconnect to rewarding loyalty.,HCA Healthcare
1503,"""Consistently Understaffed""",2.0,They are one of the highest paying hospitals in the area. They offer free employee access to fitness equipment and classes. Covered (garage) employee parking so you never have to walk in the rain.,"One of the biggest challenges met on a regular basis is inadequate staffing leading to higher nurse:patient ratios. There is frequently a lack of basic necessary equipment. These issues combined with the company's focus on profit generation and throughput timing equal an extremely frustrating work environment. The perception among many is that ""numbers, not patients"" are what really matters.",HCA Healthcare
1504,"""Great Company""",3.0,Advancement Opportunities. Tuition Exemption and great company to work for,Very Low Pay and not very good benefits,HCA Healthcare
1505,"""Like it""",4.0,Professional Development and community care,Improve employee benefits. Not enough annual vacation / sick days.,HCA Healthcare
1506,"""No much room for growth""",3.0,Tuition reimbursement; PTO; benefits; 401k;,Seems like they pick and choose what qualifications are necessary for promotions within the company based on how much leadership likes you personally. A lot of politics and unfair advantages for people that are good at talking their way through their jobs and not very good at performing their job duties.,HCA Healthcare
1507,"""xray tech""",4.0,great location for winter travel,small cafeteria not enough time for lunch,HCA Healthcare
1508,"""Great company""",4.0,"Friendly coworkers, work-life balance is great!","Time off for vacation, sick and personal are all rolled into one bucket - not comparable to most other companies.",HCA Healthcare
1509,"""Great Company""",4.0,There are many job opportunities and a flexible schedule,Keeping up with the job demands and patient load is sometimes stressful.,HCA Healthcare
1510,"""Good place to work.  Lots of support from corporate office on variety of operational issues.""",4.0,Good support from corporate office. Comprehensive benefit package. Generous PTO benefits.,"Company always has patient quality as its first priority, but meeting financial goals is a top priority, particularly if you are a business office employee.",HCA Healthcare
1511,"""Big corporation feel""",3.0,The benefits received are decent.,There isn't much uniformity among the hospitals in the same division as far as policies and procedures.,HCA Healthcare
1512,"""Always Cared about their employees.""",4.0,HCA always worried about their employees and strive to make it a better place to work at.,You were just another number sometimes because the company is so large.,HCA Healthcare
1513,"""HCA's senior leaders are truly committed to the delivery of quality healthcare for the long haul!""",5.0,Always take the high road; investing heavily in infrastructure that is sustainable; integrity in running the most successful healthcare company in the world. Leading by example in the industry; demonstrating efficiency without sacrificing quality.,Not a place to work inefficiently. Pace is invigorating and not for those who prefer to relax while working,HCA Healthcare
1514,"""Both challenging and frustrating""",2.0,Patient interactions and coworker relationships,Poor local physician network not putting the patients first.,HCA Healthcare
1515,"""The Downward Spiral""",2.0,"The teamwork & interaction between the Nurses, Physicians & support staff has been nothing short of outstanding until very recently.","HCA's Charting in Meditech is substandard. Physicians & Nurses alike have openly stated that it is not conducive to providing quality care to patients & that it simply isn't safe. The upper management have cut staffing, cut pay & appear to have an ""increase profits now & cash out"" corporate mentality. The adoption of an ancient charting system & the recent changes in staffing are a huge warning sign for current or future employees. It appears HCA is no longer interested in providing high quality care for patients or taking care of its employees.",HCA Healthcare
1516,"""A hospital that started off treating employees greats to not really caring.""",2.0,Ok job. The facility has been updated with high end technology. I have a set schedule 3 days a week. Time off policies is a joke.,Average compensenation and policies seems to only apply to certain people. Management staff is young and lack experience. Need more employee education.,HCA Healthcare
1517,"""Former employee""",1.0,Cant think of any pros. typical for profit company.,Its all about profit here at HCA. Not much patient care or staff retention. high turnover,HCA Healthcare
1518,"""Great place!""",5.0,Environment. Hours. Work life balance.,"No place is perfect, but I really can't think of any cons.",HCA Healthcare
1519,"""Abusive workplace run by ambitious managers and leaders with low integrity. Unfair and disrespectful environment.""",1.0,Pay is at market. Benefits are fine.,"Bullying by managers and physicians is rampant. Anyone who speaks up or complains will be unceremoniously fired. The reputation in the community, if you ask around, isn't stellar. I've worked for several healthcare companies and will never work for this one again.",HCA Healthcare
1520,"""Nice, but can be improved with cultural changes.""",3.0,Accessible for new graduates to be hired. Community-based culture. Jobs are for high energy multi-tasking organized workers.,Need upward mobility ladders. Benefits average. Lean staff per depart. Need improvement in retention of employees. Schedules not family friendly.,HCA Healthcare
1521,"""Great Company""",5.0,"Great Leadership, Great opportunities. The company is very respectful to the workers and helpful with work life balancing. Benefits overall are fair.","Minimal training. Co-worker competence- lots of good smart people working for the company; however, as with any company you have to wonder how some even have jobs.",HCA Healthcare
1522,"""Enjoy my job but I want to move up in my career path and cannot.""",5.0,"Good pay, good benefits and great fellow employees",Extremely hard to move up after working nearly 12 years with a perfect record and a college education,HCA Healthcare
1523,"""Amazing People in awesome places.""",5.0,State of the Art Technologies. Amazing People. Positive environments.,Salary limitations. Not competitive.,HCA Healthcare
1524,"""Great Company to work and retire!""",5.0,Excellent learning experience and knowledge. Great opportunity to get more skills and unmatched health benefits.,Really don't know much of negative,HCA Healthcare
1525,"""Good people""",4.0,"Lots of good people work within this company. They will first promote from within so good growth opportunity. Focus is shifting to better patient outcomes and experiences and patient safety. Good benefits package but like all of America, health care coverage is shrinking.","Some higher ups like to rule by intimidation. Focus on short term goals over long term mission. When budget is not met, first thing to be done is to eliminate positions.",HCA Healthcare
1526,"""Cult""",1.0,"Organized, advanced technology, Clean facilities",Doctors talk down to nurses,HCA Healthcare
1527,"""""opportunity for growth""""",3.0,"Good salary, good flexibility (depending on your manager), opportunity for growth.",East Florida Division management is disconnected from the field.Benefits are not the best in the industry.,HCA Healthcare
1528,"""An exciting time in healthcare leadership""",3.0,"SCALE - HCA is the largest for-profit hospital operator in America, which is an obvious benefit; VISION - With breadth and depth of strategic investment, HCA is poised for robust growth; LEGACY - This is a company that was founded on principles that abide today; HISTORY - HCA has learned valuable lessons over time that allow it to lead rather than follow trends; INFLUENCE - To see all of the companies that have spun out from HCA, it is hard to deny its strength; LEADERSHIP - Having made a large, public investment in a new Leadership Institute, this is an exciting time!","SCALE - For those interested in smaller, more intimate work environments, this may be a bit too big; STRUCTURE - For those interested in more flexible or adaptable work environments, this may be a bit too firm; FIT - ""You don't join a club to change the rules"", so my only recommendation is to make sure that the culture, structure, and expectations fit your own needs if you are looking to thrive here.",HCA Healthcare
1529,"""Enjoyable Work""",5.0,Good team atmosphere. Collaborative and fun. Enjoy being there.,Would like to work from home more. Would like to have more communication from HR about benefits during enrollment periods.,HCA Healthcare
1530,"""I really enjoy working for HCA""",4.0,- They are fair with their employees and reward those who work hard. - Plenty of opportunity for career growth if you are diligent and plan a career path - They invest heavily in IT which keeps reasonably new technology around all the time. - Stable company in a relatively stable industry. Mature standards and procedures across most areas of the business - Some IT positions are allowed to work from home if you find the right one,"- Inconsistent IT standards between corporate and divisions (also amongst the divisions themselves). A lot of time is spent re-inventing the wheel or figuring out the current procedure for something - A LOT of bureaucracy and red tape for certain things. This is definitely a ""who you know"" kind of company. - Inadequate training on an on-going basis - PTO and Holidays are mixed into 1 large pool of hours due to the 24/7 nature of Hospitals - On-Call required for most IT positions for the same reason. - Highly unlikely you will get more than a 3% raise annually unless you jump around a bit",HCA Healthcare
1531,"""Bitter sweet.""",1.0,"They have a excellent benefits package, friendly atmosphere and flexible work hours. Overall it is very stable company and the exceptations are very consistent.","For some people, there are many chances to advance for others no room to advance for others management has their picks if you aren't in good with management you don't stand a chance.",HCA Healthcare
1532,"""Overall good company""",4.0,Lots of opportunity and good pay,"It is more then a job, Its a lifestyle",HCA Healthcare
