,title,rating,pros,cons,company
1465,"""CCP AmEx Elite""",5.0,Great company with FANTASTIC benefits. Superior management all around. I am truly blessed to be among this group.,"Parking can be a booger, depending on what time your shift starts.",American Express
1466,"""Systems Business Analyst (GAD/FLOS)""",1.0,Pay. Few benefits. Overtime. Big parking lot.,High high turnover rate. Micro management. Poor management. High and unreasonable workload. Favoritism. Poor life/work balance. Shifts and work on weekends.,American Express
1467,"""Customer Service Rep""",3.0,Opportunity to move up if you work hard.,Pay is lower than expected.,American Express
1468,"""Unique environment""",3.0,"Great Flexibility, marketable brand on resume, offers visibility,","Networking and being recognized by employees as valued member of team is essential to ever get anywhere...doesn't matter how great you are at your job -can be very discouraging, if you can't be super outgoing and a creative talker you will struggle with meeting the cultures expectations",American Express
1469,"""American Express""",5.0,"Versatile, high energy, evolving company with tons of vision and innovative ideas. Benefits are diverse and a reasonable cost for employees.","There is an enormous shift going on within the company which leads to uncertainty at this time. I have no doubt that once the dust settles, things will start moving forward again.",American Express
1470,"""Great opportunities for women.""",4.0,Great company to work for with opportunities for advancement.,Wish there were additional offices in new jersey.,American Express
1471,"""Lost its way""",3.0,Overall had a good positive workplace. Good culture and still has some very innovative people Great work-life balance,"My division was badly managed, had too much politics and a few bad apples. Once a shining star, Amex is now under threat from many companies who are executing better. Management was VERY slow in decision making and VERY risk-averse.",American Express
1472,"""Senior Manager""",5.0,"Great work life balance, culture, and people.",Matrixed organization makes decisions slow. Promotions are also hard to come by.,American Express
1473,"""The Good, The Bad, The Ugly""",3.0,"Great people, good work-life balance. Benefits and salary are top notch.",Poor vision by upper management negatively affects business units. Red tape and ugly inter-division friction goes against culture that is preached.,American Express
1474,"""American Express Re-Investing Itself But Much Hurdles & Challenges Remain""",4.0,"American Express is working hard on re-inventing itself to a technical & digital company. Many old processes and technologies are being revamped to newer ones. Although not fully invested in, but there is some good innovation-centered activities, including hackathons, which are taking place. Many online training resources are made available to employees. The brand is well-known and well-recognized, placing employees in a power position when interacting with vendors and other companies.","Following loss of Costco account, American Express committed to reducing $1 Billion dollars in costs. This has resulted to heavy restructuring and several rounds of layoffs. Also, the strong dollar and cheap gas has been hitting earnings and weighed on expectations about the future, keeping the stock down.",American Express
1475,"""Too concentrated in Phoenix and New York""",4.0,Depending on the area you will be encourage to develop. If you happen to be in an area where budgets get tight the opportunities and motivation will be low.,If you want to move up you need to be in New York or Phoenix all other areas are not treated the same,American Express
1476,"""Good company - High expectations""",3.0,"Good benefits, challenging work, clearly defined corporate goals","High stress level, high expectations, sink or swim attitude",American Express
1477,"""Compliance Manager""",4.0,Good place for a long term career,Losing good people with poor Executive Mgmt quality,American Express
1478,"""Best Place to work""",5.0,Wonderful learning experience Awesome people Good Salary Career Growth Work Life Balance,No Cons which I can point out,American Express
1479,"""Business consultant""",5.0,"Great benefits,pay, and family oriented. Great work life balance and opportunity for growth","Aa with most jobs in corporate America, there are always politcs and cliques.",American Express
1480,"""Amex Employee""",4.0,"Great work life balance, strong culture","Internal politics, low pay for analysts",American Express
1481,"""Amazing family oriented organization.""",5.0,Great work like balance work great amenities available to all employees. Employees are treated with respect & kindness.,None at this time. Its a massive company & the l various locations are also pretty big so its hard to meet some people but management checks in often.,American Express
1482,"""HR Executive assistant""",4.0,"Great benefits, interesting colleagues, excellent CEO","very old school approach to work - not flexible to work at home, dress code, etc",American Express
1483,"""Great Place to work!""",5.0,They really care about their employees.,Parking can be a pain at times.,American Express
1484,"""Program manager""",5.0,Best place to work,Too far distance nothing to worry abt,American Express
1485,"""Executive Assistant""",4.0,Large firm well versed in the industry. Opportunity to work from home at times dependent on role.,Constant reorganizations. This makes for some uncertainty.,American Express
1486,"""Team Leader""",4.0,Great products and service levels are excellent. Co. really makes the effort to develop employees. Always striving to improve with little investment in the business line.,Co is regulated and under strict compliance with specific verbiage that must be in each and every customer interaction. Some employees state interactions with customers are not natural and does not allow them to express their knowledge due to compliance requirements. Company continues to downsize placing additional stress on current staff.,American Express
1487,"""Sr Manager""",5.0,Great work-life balance and supportive leadership,Low pay compared to other banks,American Express
1488,"""Executive Administrator""",3.0,Brand name of company existence.,Too many reorganization at lower levels.,American Express
1489,"""Marketing Coordinator""",4.0,"Work / Life Balance. Option to work at home, flexible hours, good health and time off benefits.","Continuous business reorganization, replacing experienced employees with higher level management positions.",American Express
1490,"""Stop wasting my time""",1.0,"Global company with a lot of perks, good pay, good benefits, great people","I got laid off after hitting 150% of my quote, ranked #10 in the US out of 90 reps, generating $36MM in revenue for the company a week before thanksgiving 2015. Since then they have asked me to interview for an OPEN Consultant role, which the hiring manager had already made a decision to bring on a friend of his top performer, get this only lasted a year because they all have left to Capital One even the hiring manager. Then they call me to interview for a rare opening in GCP expansion the hiring manager says that I was the first person she thought about for the role so I interviewed. During the face to face with the hiring manager I presented my 30/60/90 day plan and all she said was you know you about the role, what do you want to talk about? I was like what?? I had been working at a company for about 3 months at the time so I let her know my previous history with AMEX. I found out to my complete shock they hired someone else with no experience. Never heard why or feedback. Now they call me for that OPEN role AGAIN. The hiring manager pretty much said why didn't I get the GCP role, I said I don't know I explained what happened, he then said he had 4 great candidates and wished me luck. Talk about being jinxed. I wouldn't recommend my worst enemy to work here. Good riddance.",American Express
1491,"""Business Analyst""",3.0,"Good benefits, lots of PTO","Limited mobility, hard to get credit for previous experience if it's not in AMEX",American Express
1492,"""Anonymous""",4.0,Good benefits and good environment to work. Work life balance.,Many changes in the company impacting employees,American Express
1493,"""5+ years analysis""",4.0,excellent work/life balance and flexibility for a working mom,not enough grown opportunity for those interested in transitioning out of the administrative support role.,American Express
1494,"""American Express""",4.0,Work Remotely on Fridays is part of departmental culture.,Disattached departments and processes. Needs updating application of functions and processes. Many unnecessary processes slow down productivity.,American Express
1495,"""jury is still out about how I feel about this company""",3.0,"great benefits, employees are nice to work with and care about their clients.",I feel micromanaged with constant evaluations of job from outside source. It almost makes you feel paranoid about doing something wrong. Pay is on the lower scale for the work done.,American Express
1496,"""Manager""",4.0,Opportunity to work in a global environment,Work environment is difficult to work in.,American Express
1497,"""Great place to be""",5.0,They pay very well and offer good opportunity for advancement. Great benefits too.,They evaluate keeping you at the end of every year so it can be a tense environment.,American Express
1498,"""sales Coordinator""",2.0,"Remote, work from home position with full benefits and a great opportunity to learn the Hedging and trading business.","Horrible. Management, inapproriate comments made by high level management along with downward communication in a very callous manner.",American Express
1499,"""Small Business Customer Care Professional (Home Based Servicing)""",3.0,Excellent Pay.. Worked from home. Excellent bonus potential based on sales goals All equipment is provided and they will setup business acct for internet service in your home (only for company use). Lots of training and team oriented.,"Very stressful job. Although you are hired in customer service , you are not told that your primary goal is sales. Extremely heavy selling is required. Pressured to sometimes be dishonest to customers you can't help so you won't get a bad survey. It pushes angry customer to next rep when they call in. Wasn't pleased with health insurance deductibles, quite expensive. IIn cst survey, cst can be pleased with you but upset with Amex and you take the hit. Not cool. Not what I expected from a top employer.",American Express
1500,"""Good company""",3.0,"Ok benefits, great vacation benefits","Company prefers to hire from outside, instead of from internal employees who already have knowledge. Very political environment, no career growth",American Express
1501,"""IT Engineer""",3.0,The company offers good benefits esp. health benefits. I found the culture and work environment collaborative and had engaging participation from all teams from different functions.,The company culture can be challenging at times due to the over-zealous time lines and budget cuts. The frequent re organization streucturing can hinder the growth of employees.,American Express
1502,"""American Express Technologies - Fire, Ready, Aim""",2.0,Great PTO / sick time benefits,"Currently not much stability / job security due to business reorgs and team realignments; the enterprise is highly siloed making inter business unit cooperation somewhat challenging at times due to leadership ""turf wars"". The current partnership with IBM has proved to detrimental the to agile culture that AET is attempting introduce / transition in that contracted change SLAs consistently blow sprint capacities. Characteristic of most Financial Services companies, salaries are below market relative to other market segments (AMEX tends to be lower I guess for the privilege of working for the Blue Box). As of late, the AMEX cultural ""Blue Box"" values of respect appear to have sunset-ed or at least shelved during times of rapid organization change. Too bad as used to be the premier employer in the Valley of the Sun.",American Express
1503,"""Director - Commercial Data Science and Product Solutions""",3.0,Good work life balance and,Confused Management. Unable to take long lasting decisions,American Express
1504,"""Work Ethics and Work Life Balance""",3.0,Good packages and benefits for employees.,"No Work Life Balance, average work week is way more than 40 hours and no plans for employees future.",American Express
1505,"""Great Place to Work""",5.0,1) Excellent company culture 2) High Accountability and visibility to senior leaders 3) Exciting projects 4) Collaborative team mates,Could have more travel opportunities,American Express
1506,"""Benefits""",2.0,Excellent 401k match benefits and overall benefits,Not many offices across the US,American Express
1507,"""CCP/Sales""",5.0,"Amazing company to work for. Flexible scheduling, benefits package, 401K, Tuition reimbursement, medical, dental, vacation, sick time, personal days, amazing card to have, best customer service ever.","If you aren't willing to provide great customer service, don't apply",American Express
1508,"""Top Client Acquisition""",2.0,Fellow employees truly get the team effort concept. Truly good people on the sales floor.,Management is deaf at times and you're just a number when it comes to an employee.,American Express
1509,"""Mostly Solid""",4.0,"Great location and people, good culture",Pay is below average overall,American Express
1510,"""Amex Review""",4.0,"Brand and product recognition, work life balance programs, opportunities for internal promotion are abundant, for a Wall Street organization, the corporate culture is relaxed and the majority of people are nice, hard working, and open to collaboration.","The normal cons of a big corporation: silos, politics to get leadership approval, constant re-orgs, high levels of bureaucracy and non-value added processes. Leaders take forever to make decisions",American Express
1511,"""Customer Care Professional""",5.0,"Great benefits. Onsite health, dental, and gym. Compensation well above average for customer service, plus there were many opportunities for bonuses. Culture from top to bottom is service based. Leaders are generally taught to be more than a boss, but a true leader.",Service center in Salt lake is no longer an option,American Express
1512,"""Commited to You and Business both""",5.0,Life and Work balance is Superior!,Bad business decisions. Need to listen to the employees too.,American Express
1513,"""AMEX -  Sadly, Not What It Used To Be""",3.0,"Great benefits. Flexible work arrangements. Excellent and competitive salaries. Dedicated, loyal and seasoned employees. Reward and recognition program. Diverse job opportunities. Cares about the community.","Constant re-engineering, re-organizations, down sizing and out-sourcing. Broken processes and systems that are frustrating to deal with. Disappointed that better efforts weren't made to reduce operating expenses in 2016 (i.e. - we could have cut or reduced: raises/promotions, bonuses, more T&E expenses, tuition reimbursement, community investments, procurement of logo'd marketing collateral [aka AMEX trinkets and trash], catering, water/coffee services, etc.) as opposed to displacing 4,000+ employees @ 1.8 billion dollars. I'm sure employees would prefer their jobs over these benefits during challenging times.",American Express
1514,"""Good Place to work""",4.0,Helps develop leadership and stratgery skills,"Limited Growth Opportunities , very political environment",American Express
1515,"""Sales""",4.0,Good work life balance. Flexibility.,Competition has changed throughout the years,American Express
1516,"""Financial Analyst""",4.0,"The people and relationships at AMEX often feel more like family than work.Diverse and plentiful network, strong negotiation and communication skills, and cold calling fearlessness",Few growth opportunities for mid range leaders.There is a lack of job security. Regular restructure initiatives.,American Express
1517,"""Great work life balance""",3.0,"Good resources, always looking for improvements and efficiency. Great leaders and good work life balance.",Marketing function seems more project management than pure marketing. Being creative and innovative is tough with so many legacy systems.,American Express
1518,"""great company""",4.0,the income is great the company cares for its employees generous benefits package,it may sound crazy but you eventually get tired of working from home,American Express
1519,"""Business Analyst""",4.0,Great work life balance,I can't think of any,American Express
1520,"""Nice atmosphere but constant focus on reducing expenses""",3.0,"Many departments have adapted to a mix of virtual and office hours, competitive vacation time. Lots of focus on employee benefits with programs to make like easier. Global business gives employees a chance to be involved in several aspects of the company which is both challenging and rewarding",Constant focus on reduction of force and re-allocation of work can leave employees in constant wonder from year to year of their role will be impacted,American Express
1521,"""BDE""",4.0,meeting with new clients on daily bass and get information of market from everyone and selling my product .,i was on 3rd party payroll,American Express
1522,"""overall a good place to work - depends upon the team really""",3.0,"Salary good, work culture good, team - choose wisely (usually customer facing teams are good) Flexible work hours which are again depending upon the teams.",Never go under an Asian manager specially Indian. Not all but mostly they are programmers who have been promoted to project managers without any proper trainings. They dont treat you with any respect at all. Age old softwares which they are never willing to change. Just patch work mostly when it comes to enhancements.,American Express
1523,"""Project Manager""",5.0,"Great culture, flexible work arrangements, supportive leadership and great place to grow & enhance your career.",There is a lack of job security. Regular restructure initiatives.,American Express
1524,"""Business Development Manager""",3.0,The company offered Great benefits and Outstanding training,Constant shifting of territories and pay plans,American Express
1525,"""Director""",5.0,The people and relationships at AMEX often feel more like family than work.,Few growth opportunities for mid range leaders.,American Express
1526,"""Great Benefits, but sending a lot of jobs offshore""",4.0,The people are great. Encourage flexible work style and offer great benefits. Have really enjoyed it. Sad to say that job has been displaced due to fall out from Costco loss.,"Over last 3 years been at the Company have seen entire groups jobs being sent to India and the US people displaced. Large majority of people at Desert Ridge location are contractors and most of those are also from India. Seem to be losing the ""America"" in American Express. Sad.",American Express
1527,"""Results Driven and People Magnet""",5.0,"Diverse and plentiful network, strong negotiation and communication skills, and cold calling fearlessness.",My only con is that I am a perfectionist.,American Express
1528,"""perfect job""",5.0,Great company. Benefits start day on,Very strict on your attendance,American Express
1529,"""Great company""",5.0,"Great company, friendly people, flexible work environment","Your network needs to be strong, compensation is not the highest in the industry",American Express
1530,"""Merchant specialist- account development""",1.0,"Amex is a great company, this is a awful department","The leadership within this department is awful I honestly can't believe that Anre Williams or the CEO Ken have not noticed the ridiculous turnover within this department. In my short time in that department I saw MANY people leave this department not just one! They work you like a sweat shop because you are required to attain 8-9 consults within a certain amount of time which you have no control over because they control salesforce and what account will show at what time. So 99% of the floor wouldn't even walk away from their desk to take a lunch because we were scared to not meet out day so some days we would work 9-11 hours a day. You are salary so for leadership they absolutely do not care you would work more then them! They make no effort to improve moral within the teams and will only work 8 hours or less. One thing everyone will notice like I did there is no tenure there because everyone quits as soon as possible and there's no career development only 3-4 people have ever been promoted out of that department. I saw many many many unfair and unethical situations within that department including racism, cheating etc! This department should be investigated, do not apply for this department anywhere else is amazing!",American Express
1531,"""Sales""",5.0,"Love AMEX, my boss and sales team are great.",This is not your 40 hour/week job.,American Express
1532,"""Customer Service""",4.0,"Good management, work from home, convienant,","long hours, poor management, management not experienced, training, sales",American Express
1533,"""Great Compant""",4.0,Great place to work at,Compliance heavy company that can be difficult.,American Express
1534,"""Project Manager""",4.0,"Great hours, Great Opportunities with working with others and collaborating to make project successful.",Do not become negative or share any negative thoughts if managers ask. They really do not want to hear that and only want a yes person.,American Express
1535,"""Leader""",5.0,Weekly pay nice people clean,Stressful painful tiredness irrational no consequences,American Express
1536,"""C/S""",4.0,"A great company all in all. Most of their emps. are very professional. Plenty of great benefits for their employees, too! They also have a lot of room for advancement within the company for their employees.","Unfortunately there are always a few bad apples in the bunch. And, when I worked for American Express, there were more than a few employees who were very unprofessional.",American Express
1537,"""Review""",3.0,Great people to work with!,Careers dont exist. Annual re-orgs/Layoff's,American Express
1538,"""Old Company with New Outlook""",5.0,"A team of dedicated, intelligent and engaging employees. Seasoned leaders who have weathered many storms. A company that has the right plan to move forward in the current environment while also ready to succeed in the future",Downsizing has occurred every year for the past 5 years.,American Express
1539,"""nothing compares even in hard times""",4.0,-great work life balance -career development -brand/prestige -culture,"-not as easy to move around and up and you are lead to believe, especially when times are tough -lot of talent is wasted writing decks and attending endless meetings",American Express
1540,"""Great company but struggling lately""",3.0,Great brand with customer focus,"Years of cost cutting has led to increased pressure on employees. As someone willing to work 60+ hours a week, lately I've felt burned out.",American Express
1541,"""Great Opportunities""",5.0,"Great place, great culture, great people","Constant change, if that is a con to you.",American Express
1542,"""Good Company if You're Into the Corporate Thing""",4.0,"Overall a good company - good corporate citizen, smart people, good work-life balance (mostly); since it's so big, you can have a varied career doing lots of different things for the company over several years.","Hierarchical, very corporate, wants to be innovative, but too bureaucratic to be disruptive at scale",American Express
1543,"""AMEX Review""",4.0,Good people. Good company values. Good work life balance,consistent layoffs over the past few years,American Express
1544,"""Great Company To Work For, But Costco could be the death of us""",4.0,"Great company to work for, they care about their employees for the most part, offer great pay and decent benefits","Constant layoffs, no future growth in site. I've worked here 10 years and its been constant layoffs",American Express
1545,"""SFA at Amex""",4.0,"Company culture cultivates and incubates hard-working and ambitious individuals, support from leaders and senior leaders was warm and welcoming, ability to work on high impact and high value projects within first few weeks","Slow turnaround on projects with effects of planning, forecasting, and recommendations not occurring for months at a time, decentralized leadership structure means that group culture sometimes overwhelms company culture (marketing vs. sales, digital vs. non-digital, card vs. non-card)",American Express
1546,"""Representative""",4.0,Great pay and there is chance for inscentive,Have to be flexible for holiday and weekends,American Express
1547,"""Great place to build a career""",4.0,"Great culture, strong focs on leadership, easy to move around divisions","Shrinking business, consensus culture means slow decision-making",American Express
