,title,rating,pros,cons,company
514,"""Flight attendant""",4.0,I’m a new hire but I’ve been able to fly to Italy very often because of my language skills,Reserve can be tough. It’s hard to plan your life when you don’t realky know when you’ll be working. Also I wish we were better prepared to be FA 1.,American Airlines
515,"""Tech""",1.0,None this job is garbage they lie to you and punish you for doing what they told you to do. They don’t know what the hell they are doing ever and forget about asking for help because you won’t get it and if your lucky if Michael the MANAGER helps you without a huge attitude. I will never work for this company ever again bye.,"A lot , no help, bad attitude, no direction, they don’t care about you period.",American Airlines
516,"""Travel Benefits Outweigh the Pay""",3.0,"The benefit of travel for yourself, family and guest",Salary is lowest in the airline industry,American Airlines
517,"""Customer Service Manager""",3.0,"Growing company, fair salary and great benefits",Advisarial relationship between labor and management.,American Airlines
518,"""Help Desk""",4.0,"Flights, flights, flights, flights, flexable,","Big organization, can get lost",American Airlines
519,"""Gate Agent""",4.0,"Great benefits, the people are awesome!",Bad weather means mandatory overtime and the bidding process for shifts is a bit cumbersome.,American Airlines
520,"""Great benefits but the union has a created an awful work environment!""",2.0,Flight benefits-without them I wouldn’t stay. Flexible schedule.,The union has created an environment where the majority of employees don’t want to work or give good customer service. They create drama with fellow coworkers and are rude and abusive to all including management. It’s all tolerated. I’ve never worked somewhere so disfunctional! Very low starting pay-$11.50 an hour.,American Airlines
521,"""It is great!""",5.0,It has an excellent work environment.,There are no cons I can think of at the moment.,American Airlines
522,"""Flight Attendant""",5.0,"Travel benefits, pay, fly to many places","Never know who you will work with, random schedules (as expected for position)",American Airlines
523,"""Most positions are seniority based. You’re schedule and vacation will be determined by it.""",4.0,"Travel privileges. Free, unlimited travel benefits for you and a guest, or you and your spouse/offspring.",Night shift. Negative co-workers. Irate passengers.,American Airlines
524,"""Gate agent""",4.0,You get to meet new people and work as a team.,Maybe be scheduling and not enough hours in a day!,American Airlines
525,"""Good, not great job""",3.0,"Space-available flights, 401K match is good.","Tuition Reimbursement, work/life balance is not great",American Airlines
526,"""looking for a good job, with good people""",3.0,"flexible schedule, with good days off","long days, weather delays, non caring people",American Airlines
527,"""Flight Attendant""",5.0,Best job in the world,Don’t have anything bad to say,American Airlines
528,"""Sr Data Analyst""",5.0,"Great Environment, flight benefits are amazing","Under pay, justify with flight benefits",American Airlines
529,"""Flight Attendant""",5.0,"Great company, great benefits, great co workers","Crazy schedule, must relocate, must be very flexible",American Airlines
530,"""Airline""",4.0,good culture at the company,small office in Hong kong,American Airlines
531,"""Home Based reservations rep""",5.0,Flight benefits are pretty great,Mandatory OT 12 hrs shifts,American Airlines
532,"""Fleet Service Clerk""",5.0,The flight benifets are the best. AA truly care about there employees.,Nothing none what's so ever,American Airlines
533,"""No qualms with brushing sexual harrassment under the rug""",1.0,"If you’re smart you don’t have to work hard, not a lot of mental prowess at the director and above level","still an old boys club, if women come forward with assertions of sexual harrassment the harrasser is protected as to not make waves. ZERO innovation - leadership is only concerned with short term financial outlook, could care less about customers and employees.",American Airlines
534,"""Flight operations""",4.0,Over 25 years of Aviation experience.,Limited to working in Los Angeles area.,American Airlines
535,"""Customer Service Coordinator""",4.0,"Flight Benefits, Union, work opportunities, transfer opportunities to other locations","No control over schedule if your new to company, too many high seniority agents running around doing nothing, hard to travel if you can't get your shifts covered, too many late night shifts",American Airlines
536,"""Aircraft Maintenance Controller""",5.0,"Great pay, benefits,401k, work schedule great",currently no cons to write about,American Airlines
537,"""Flight Attendant""",5.0,Easy job Minimal interaction with customers Flight benefits Good pay,"Pay starts when the door is closed (delays, boarding = volunteer work) Gypsy lifestyle",American Airlines
538,"""Okay benefits if you can stick it out""",3.0,"Flight benefits. Okay health insurance. Some flexibility in schedule, other times no flexibility.","Attendance policy is very strict, seniority based shift selections, newbies get worst shifts.",American Airlines
539,"""Travel benefits are why you take this job""",4.0,"Travel benefits - If you know how to work the nonrev system, this is why you take a job at AA. Being able to fly to Europe or Asia for $200-600 (depending on class of service) or for free on domestic flights, not to mention the discounted standby on just about every other airline, is a benefit you won’t get anywhere else. The rest of the job is just like anything else, you’ll have your good days and your bad days, but if you’re an airplane geek and love being around aviation, it’s all worth it in the end.","Front line employees, especially at the regionals, get underpaid. Never made sense to me how you can pay someone the same amount of money when one agent is qualified for ramp, ops, cargo, ticket counter, and gate operations and another is qualified ramp only. It’s ok if someone wants to work the ramp only, it’s the easiest job by far. But people who are trained for other aspects of the job should be paid more.",American Airlines
540,"""Fun Company to Work For with Great Benefits""",5.0,"The travel benefits are the best between the airlines. They offer some of the best health, vision, and dental insurance plans. The time away from work is also great with lots of flexibility.","The job can be stressful, very strict attendance policy, you get penalized for using your sick time, the pay is ok.",American Airlines
541,"""CSR""",3.0,I need a consistent salary,No consistency or job stability,American Airlines
542,"""Sales""",4.0,great job to work at,none to share at this time,American Airlines
543,"""Great perks""",5.0,Flying at no cost or very little cost,"Changes that have been affecting our schedule and flexibility that was limited but now it's getting harder and harder. This is not a standard job. It's a job you have to be away for days, leaving family, pets, houses and sometimes emergencies behind.",American Airlines
544,"""Mechanic""",5.0,Good company to work for,Nothing at all great company,American Airlines
545,"""Flight Attendant""",3.0,"Travel benefits, pay. Health insurance.","Long hours, management does not care about frontline employees.",American Airlines
546,"""Decent pay and benefits""",3.0,Decent pay and benefits. Similar to other airlines.,Need stronger union representation in this type of industry.,American Airlines
547,"""Great place to work with many opportunities.""",4.0,Tons of departments to learn about the airline industry,The company is very big which can create inefficiencies,American Airlines
548,"""Great Place to work""",5.0,Great benefits and flexibility,Work hours are not normal for most positions in the company!!! Hard to advance in the company!!!,American Airlines
549,"""Poor Management""",1.0,"Schedule, salary, low work load","Schedule, poor management, no consideration of employees",American Airlines
550,"""Captain 777""",4.0,"It is one of the Big 3 Majors with much oportunuity. We have the best schedule going forward. Great pilots to fly with on the line and great equipment. I think it is quite good going forward, especially after we can secure an industry leading contract in 2020..","Still living under the remnants of a Bankruptcy contract. It is actually much closer to the other major airlines overall, less the Profit Sharing which currently is quite big. Currently though, the contract lags the other Big 3.",American Airlines
551,"""PSR""",3.0,"Big name company, good benefits.",Schedule is weird if you have low seniority,American Airlines
552,"""Free Flights""",4.0,"Free flight benefits, good pay.",Some long hours and dealing with customers.,American Airlines
553,"""Sales representative""",5.0,"Health Insurance, travel privileges,",Working hours were subject to changes without any previous notice,American Airlines
554,"""Reservations representative""",2.0,"Flight benefits, time off, trading for time off.","Medical benefits, during bad weather mandatory OT to work 10-12 hours",American Airlines
555,"""American not all it cracked up to be.""",3.0,"Flight benefits, but without it’s just any other job.",Too much management. No communication. Expect a lot for little hep.,American Airlines
556,"""Working Culture""",3.0,The travel benefits are good,Salaries are low compared to other companies,American Airlines
557,"""Customer Service Supervisor""",3.0,"Great employees who really care about customer service and each other. Benefits and pay are above average,vacation,sick days, flexible work schedules, medical,401k and free flight privileges.","Long hard days standing all the time.Very stressful during irregular operations which seems to be almost every day. Working all the time by yourself at gates, loading and unloading aircraft under high pressure, time constraint situations. Right sizing has had a big effect on the airlines customer service.",American Airlines
558,"""Ehh""",3.0,The flight benefits are really good,The pay and management are lacking,American Airlines
559,"""1""",4.0,"good working environment, promote from within","pay a little low, commute a little long",American Airlines
560,"""Flight attendant""",5.0,Great benefits. Wonderful travel and benefit packages.,The company is growing. It's a great time to work for them.,American Airlines
561,"""Great experience""",4.0,Big company. Big benefits. Fun work if you like working with your hands.,Union was a drag but perhaps that’s changed,American Airlines
562,"""Good Company""",4.0,"Good benefits, good company to work for","Hours, some coworkers are lazy and not customer focused",American Airlines
563,"""Great company to work for""",5.0,Great pay with great benefits,None that i can think of,American Airlines
564,"""Retired""",5.0,Money benefits schedules training people,Commuting long days people commuting,American Airlines
565,"""Great  company""",4.0,"Flight benefits, work hours &amp; management","Mandatory overtime , mandatory 5 work days",American Airlines
566,"""Nice People""",4.0,There is something for everyone.,Swim against the current to get noticed,American Airlines
567,"""Steady reliable job""",4.0,"Benefits start first day of employment You start at about $10-$13 and get an annual raise per union contract You work in a call center and there is a lot of flexibility trading shifts, time off, vacation Steady paycheck and potential to make a lot by picking up hours Amazing Travel Benefits","You work all major holiday 24/7 call center means first, second, and third shifts Shifts are given by seniority so junior people get the worst shifts no weekends Career growth opportunities are limited Probation period with strict attendance policy",American Airlines
568,"""QA""",4.0,"Free Travel, nice work culture, collaboartion",Way too many internal applications,American Airlines
569,"""Customer service""",5.0,Is fun work at the airport,Best job is work around the planes,American Airlines
570,"""Reservation Agent""",4.0,"Working from home,flight benefits,working with a great group of people","would have liked a better health plan,although not bad,not as good as in house representatives.",American Airlines
571,"""Do not support front line employees. Union Representative states they have other plans""",1.0,Flight benefits if you get on a flight,Do not report on the job injuries,American Airlines
572,"""Too Busy To Travel""",2.0,Free Flights and ability to travel on other airlines for next to nothing,Good luck getting on a flight to anywhere decent. Company rules vary depending on management.,American Airlines
573,"""Great People""",4.0,Great company culture. Be prepared to go above and beyond the daily job duties,Just like any other big company. Knowing how to make the right relationships is important,American Airlines
574,"""Revenue Management Analyst""",3.0,"Flight benefits, Average age 30 yrs old in rev man","pay is below industry, vacation time is not good, and paid time off not flexible",American Airlines
575,"""Sr. Commodity Manager""",5.0,"Great travel benefits, company culture is great",Only 2 weeks VC for first 5 years,American Airlines
576,"""Stay Away!""",1.0,Fly for free (space available only),"Low pay compared to other DFW area companies. HR / People Dept policies are selectively enforced (some employees are ""more"" equal than others). Benefits are pretty much middle of the road. PTO is below par compared to other DFW area companies. 401K company match at 5.5 is low even compared to other airlines (like Delta).",American Airlines
577,"""great""",5.0,the flying benefit is great to fly,The pay is not very good,American Airlines
578,"""Seriously Going for the Great""",5.0,American is undergoing so many initiatives to provide a great customer experience. Wouldn't be a surprise if it becomes the greatest airlines in the world soon.,Lots of Hierarchy which slows down initiatives,American Airlines
579,"""Great Company To Work For""",4.0,"I love the culture, the community, the free flights, the salary, and all the benefits that come along with being such a large company",Difficult to advance in the company,American Airlines
580,"""Flight Attendant""",4.0,Flexibility with your schedule is great.,Sometimes you have to miss important dates like Birthdays and graduations,American Airlines
581,"""Awesome place to work""",4.0,"Good salary , culture,place to work",No cons from my side,American Airlines
582,"""Flight Attendant""",3.0,Best airline to work for. Great benefits,"Delays, long work hours and rude people",American Airlines
583,"""FSC""",4.0,"loved the company, great benefits work environment dysfunctional but we loved each other like family.",Outsourced after 20 years laid off - have yet to return waiting on recall -company under US AIR. from what I've heard lack of work ethics and knowledge of Aircraft over all AA has no seniority over US AIR employees. AA does not care about the hard work and dedication from long Term ee's.,American Airlines
584,"""Terrible....""",1.0,Only pros about this place is the travel benefits and the pay.,"Management will micro-manage you on anything, especially when you're extremely sick.",American Airlines
585,"""Flight attendant""",4.0,Great flight benefits and a lot of flexibility,"Management wasn’t always present, schedules weren’t too great.",American Airlines
586,"""Captain A330""",2.0,Dream job was to fly for a major airline. Made it.,"Worst of all the major airlines. Worst pay and work rules. Managment team is used to violating work rules routinely and without apology. Poor employee morale results in lack of professionalism far too often. No reward for trying harder as a pilot. Instead, management continually tries to undermine pilot authority. Pilots work more days for less money than any of the other successful airlines.",American Airlines
587,"""Not a dream job at all""",2.0,Free travel but the flights are always full so good luck on that and with what they pay you you can’t afford to travel anyway,"The pay, long days with short rest/layovers, the passengers, the super 80 planes which are old and disgusting, greedy management",American Airlines
588,"""Flight Attedant""",4.0,Very flexible and a fun career.,You will miss out on a lot of things at home from traveling so much.,American Airlines
589,"""stylist""",5.0,love the hours and helping people.,Not always steady and consistence short days.,American Airlines
590,"""Love this company and industry!""",4.0,"Great health insurance, 401(k), company culture, leadership, direction, etc.","Non-union employees don’t seem to make much money, in my experience. They’re still working through merger woes, but it seems to be downhill from here.",American Airlines
591,"""Flight Attendant is the Best job I have ever had. On medical leave and miss it SO much!""",5.0,"Work schedule flexibility, benefits, the people, traveling to exciting places, EVERYTHING positive!",None my experiences as a flight attendant were so great.,American Airlines
592,"""Management""",3.0,Well established company and name recognition,Trying to be like Southwest but culture too engrained with 50+ years of legacy policies and management,American Airlines
593,"""Compensation""",3.0,"Steady job, slow and laid back atmosphere.","Very much average salary, not competitive.",American Airlines
594,"""Great Company""",3.0,"Great Benefits, Free Flights, Good Salary","Bad promotion opportunities, you have to move around to move up",American Airlines
595,"""Flight Attendant""",4.0,Good health benefits and travel privileges,Strict scheduling demands make it hard to use travel benefits,American Airlines
596,"""IT""",3.0,"Good benefits - soft, travel when available seats","Upward mobility requires a lot of kissing up, tough to move up, flight benefits are ok but worse now since you have 100k employees plus their family to compete with.",American Airlines
597,"""Operational Analyst""",5.0,You can travel the world!,This can be a very stressful industry to work in.,American Airlines
598,"""Very great, Fun place to work daily""",5.0,Travel benefits & on job training,Learning new software & programs,American Airlines
599,"""Passenger Service Gate Agent""",2.0,The job can be fun but only if you love a challenge and are an adrenaline junkie which I am. Sitting in first class on my own vacation is lovely if/when it happens.,Policies &amp; procedures are embarrassing since the merger with US Air. I used to wear my uniform with pride as AA was known to be a class act. Those days are over. Agents no longer have any discretion to help people. Our flight benefits are practically useless as the flights are always full and you can never get first. On board the service is like a budget airline post merger. The pay vs what is expected of you and what the job takes out of you phyicslly &amp; mentally is not worth it. Also you need a second job to nay for your cost into the medical plan. It has gotten out of control,American Airlines
600,"""Administrative Assistant""",4.0,"flight benefits, medical benefits","you do a lot of work for little pay, hard to move up, schedule/responsibilities constantly changing",American Airlines
601,"""Flight Attendant""",5.0,They were extremely welcoming and friendly during the interview process.,The schedule was too intense to maintain family life.,American Airlines
602,"""Great Benefits, Lousy Management""",4.0,"The work is ""easy,"" not non-stop work There are always new things to learn There are different places to work within the job","Working outside in the weather (rain, snow, heat, etc.) Mandatory overtime",American Airlines
603,"""American Airlines (Corporate) is great if you love politics, traveling, and low pay.""",1.0,You get to travel (on open flights),1) The promotions are 100% political. 2) The pay is terrible. 3) American will protect its investment in its MBA employees (they get paid double) by promoting them to management level over people who are much more qualified. This leads to incompetent management. 4) Management is not aboveboard with employees at lower levels. Managers and above will talk positively/poorly about an employee and never tell the employee where he or she stands. 5) Vacation time is very limited. 6) It is more difficult to move between departments within American than they will tell you.,American Airlines
604,"""Reservations Agent""",4.0,The benefits are everything. The flexibility is a life saver.,"The customers often find their travel plans ""unacceptable"" and you are not always given the tools to help them. The back to back calls on bad days will crush your soul, so it helps if you don't start with one. There areally very few opportunities to advance locally.",American Airlines
605,"""Customer Service Rep""",3.0,Amazing benefits and great people in the atmosphere,Horrible balance for work life. Not very understanding of emergency situations. Attendance policy is horrendous,American Airlines
606,"""Fly with Career Confidence""",5.0,"I did my training while pregnant and I tell you this was the best job because it's so diverse, you get a lot of knowledge.",FMLA required being there 1 full year,American Airlines
607,"""great career, especially if you are young and have time to build up señority.""",4.0,"Great travel benefits, and competitive pay for the industry.","The union isn't the best, and the quality of flying has deteriorated in the last 10 years. New hires start out making close to what they started making in the late 90s.",American Airlines
608,"""Flight Standards scheduler""",4.0,"Flight privileges, flexibility. Lots of jobs to choose from.",A company with ups and downs.,American Airlines
609,"""Superb""",5.0,"""Very professional with handling any issues""","""Strict company guidelines to follow yet appropriate for field""",American Airlines
610,"""Great benefits""",5.0,"Free flights, good people to work with",Long hours and no room to move up,American Airlines
611,"""Customer service agent""",4.0,Great Benefits and people management helps you out,Low Pay not enough staff,American Airlines
612,"""Product Owner""",3.0,Travel benefits and decent benefits,Low pay and management doesn't truly have a grasp on what employees want and need.,American Airlines
613,"""Administrative Assistant""",5.0,Flight benefits and constantly changing environment,"Low pay, expensive health insurance",American Airlines
614,"""Too top heavy.""",2.0,Health insurance and flight benefits.,Stress levels for the real “do-ers” can get extremely HIGH while pay stays LOW.,American Airlines
615,"""Flight attendant""",4.0,"Great salary, meet a lot of people, get to travel the world for free.","Pays not great, only get paid wheels up to wheels down.",American Airlines
616,"""no contract""",4.0,flight 401 k vacation Travel friendly coworkers,management is hard to deal with say one thing and do another still no contract,American Airlines
617,"""Live the American Dream""",4.0,It was worth the time . They are very respectful and helped me out immediately.,Fast lifestyle . Makes you be on your toes,American Airlines
618,"""Revenue Management Analyst""",4.0,Full of young people of similar age Free flight benefits and making friends,Airline pays lower than other industry,American Airlines
619,"""Flight Attendant""",1.0,"We are not valued even though we have stayed with America West, U.S. Air and now THE MOST UNFORTUNATE OF ALL AIRLINES, AMERICAN",30 years and they hope to get rid of their senior flt. attendants by making them go on a schedule of reserve which give them 2 hrs. to get to work and do any terrible trip AA chooses. Seniority means nothing. We earned nothing all these years.,American Airlines
620,"""Flight attendant""",3.0,"Great pay, great destinations, good benefits, somewhat flexible depending on seniority &amp; base",Some of the other people you work with can be not so nice. The company over all is going through a merger &amp; it’s difficult integrating 2 systems into one smoothly.,American Airlines
621,"""Fine""",3.0,Time to travel the world,called away on reserve often,American Airlines
622,"""Good Experience""",3.0,"yes, The Flight benefits forsure.","workload, schedule by senority",American Airlines
623,"""CAR""",2.0,Health and flight benefits available. Flexible schedule if you can afford to pay people to work for you.,Understaffed at the airport leading to unhappy passengers and employees. Management does not see the daily challenge so doesn't see the need for help. Not much too for movement within the company in the Phoenix area.,American Airlines
624,"""Adminstrator""",5.0,"Flight benefits, 401k, promotion opportunities","Busy work load, work demands",American Airlines
625,"""A Liveable Wage""",2.0,Flight Benefits and the credit union,The salary for customer service reps is so low...(how low is it?)...it is so low that when you use your flight benefits all you can afford to do is stand inside the airport you flew into!!,American Airlines
626,"""Staff assistant""",4.0,"Flight benefits, company is growing, health benefits, working with great people.","Work schedules, constantly changing, little communication, little pay with lots of responsibility.",American Airlines
