,title,rating,pros,cons,company
0,"""Great Company to work for""",5.0,"Great culture. Customer Focused, and challenging problems",None Really. I have worked here for 10 years and have been enjoying every bit of it.,American Express
1,"""GREAT COMPANY TO WORK FOR""",5.0,"They really care about their employees, great pay, great benefits and great company values that they uphold.",I really can't think of any cons about the company.,American Express
2,"""Software Engineer""",5.0,"They have fantastic pay for the position you're in, and they teach you interesting and engaging utility of modern technology mixed with legacy fundamentals. I've learned quite a bit while AmEx while getting paid more than fairly - I'd recommend a stretch here to whomever may be reading this!","The Company is huge, and at times it may take more than a little time to get recognized for your abilities and the growth you've had. There's a reason there is a ""only way up is out"" reputation exists for some enterprise companies...",American Express
3,"""Exciting Opportunities, Very Bureaucratic""",4.0,"Company heavily investing in cutting edge technology trends Very relaxed team culture, great Quality of Life Excellent experience with manager (at least mine is really awesome) Plenty of parallel opportunities","OK benefits; expected more incentive and better health insurance Extremely meeting heavy Difficulties following basic best practices regarding code life-cycle Information seems to be in ""silos"", recommend befriending colleagues fast and getting heavily involved in learning upfront to save grief later Lacking role models for practices and learning",American Express
4,"""Depends on Team...""",4.0,"Good culture, relaxed, lots of free food and swag, clear progression","Questionable promotions, and hires into company, work-life balance depends on team",American Express
5,"""Positive work environment""",4.0,Good work life balance and leaders who care,Political and a large organization to navigate,American Express
6,"""Good""",5.0,"Good benefits, 9th best company to work for in 2020.",Take time to build expertise and career. Good for people with patience.,American Express
7,"""Great place to work""",4.0,Excellent desktop platform via Salesforce 1 Plus,Must continue staff at all levels training for desktop of the future via asked cycle.,American Express
8,"""Marketing""",4.0,Great place to grow your career,Bureaucracy - process that gets in the way rather than enables you to do your best work.,American Express
9,"""Top Notch""",5.0,Great Company with lots of room for advancement.,Moving jobs can be a challenge,American Express
10,"""Great Company with Great Talent""",4.0,"So much opportunity for those who are intelligent, and have thick skin.",Career paths can be limited depending on where you live across the globe.,American Express
11,"""A great 20 years journey so far.""",5.0,"Great Place to Work, lots of growth and development opportunities and tools, global footprint and global mindset.",Some compensation benefits @ industry level could be better.,American Express
12,"""Excellent benefits""",5.0,Almost 6 weeks pto for manager starting off with 6 days of sick time that roll over each year. So basically 7 weeks. Maternity leave is 6 months and there is flex time in the summer! Huge pay earning potential and great company to work for,Very competitive sales environment that is hard to keep up with,American Express
13,"""Worst boss ever""",5.0,"Meet different people , and build a relationship with some . Making your customer smile after interacting with them.",Poor team work from management question their integrity.,American Express
14,"""Ok place to work""",2.0,Large company with good benefits.,"Not well organized and leadership is below average. Unfortunately the middle management leaders(director/VP) are often not qualified in the role they are in which hurts direct reports growth. Also be prepared for layoffs every year or two. Again because of poor management, planning is not considered for long term employee benefit.",American Express
15,"""Fun""",5.0,Great leadership development and great place to start your career.,At lot of politics.,American Express
16,"""Fantastic Work From Home""",5.0,"pay, benefits, bonus, human resources, almost everything",I love american express Fantastic,American Express
17,"""Good for WLB""",2.0,5 dedicated working days in a year for learning Fair bonus If you find right team than you can really do Product Management Good WLB Good maternity/ paternity leaves (5 month!),Fully Engineering focused organization Highly limited growth for Product ppl Product mindset is a challenge still,American Express
18,"""Great Company - Choose Division Carefully""",3.0,The benefits are great and the array of what you are eligible for is impressive.,"Having an open office with out any sound barriers makes it difficult to focus, pay increases are non existent - you're lucky to get a 2% every year and the culture is generally passive aggressive. Mid-level leadership is inconsistent - junior level VPs don't get a lot of support and are often a barrier to improvements.",American Express
19,"""Successful company with very strong culture of service and internal politics.""",5.0,Great work-life balance and collegial atmosphere.,Very hierarchical approach to decision-making.,American Express
20,"""Great Company""",4.0,Great opportunity to learn and grow,Management needs to adjust their training methods when mass hiring/training,American Express
21,"""Depends on your leader""",4.0,"great work life balance if you have the right leadership, flexibility to work at home",trying do hard to be Google!,American Express
22,"""Benefits are good but departments are racial ghettos""",4.0,"Vacation days, medical, dental all good. Some good value extras like Life and legal insurance and commuter program too.","Constant re-orgs, flip-flopping processes / structures back to where it was 2 years ago, leaders never hanging around for longer than 18 months, series of leaders that come in ruin everything then promoted onto the next role before the shhh hits the fan with those they leave behind left to clean up",American Express
23,"""Ccp""",3.0,Can make bonus very easily,Not good shifts To choose from,American Express
24,"""Nice place to work,   Very competitive""",4.0,"Process oriented, respect for people , fast paced",Extremely competitive. And ha e to wat h your back,American Express
25,"""Great people""",5.0,"Everyone is nice, work at home, flex hours, full time in under a year",lots of people which I dont like,American Express
26,"""nice!""",5.0,amazing work culture and good career opportunities.,no cons as such !,American Express
27,"""Sales salesSales""",2.0,State of the art building,"Sales expectations too high, too Much walking due to size of campus",American Express
28,"""Great work life balance""",4.0,Great work life balance and benefits,Slow career growth at management levels,American Express
29,"""Great Place to work""",4.0,Great work life balance Opportunity to grow,Dependencies with in the organization makes it very slow for any change to be adapted,American Express
30,"""Nice company""",4.0,great learning experience and opportunities,too much work pressure at workplace and after work hours,American Express
31,"""Very busy, lots to learn, interesting, pays well""",4.0,Meeting/ greeting new people on the phone. Learning about different aspects of the business that I never knew.,Trying to find different avenues to convince the customer to pay while reaching your goals of dollars collected for the month,American Express
32,"""Great place to work with great people!""",5.0,Very collaborative and friendly environment. Great work life balance. Lots of support from leadership. Tons of opportunities to learn and grow. Amazing benefits!,Very difficult to even get an interview and decision making process is lengthy.,American Express
33,"""AmEx Review""",3.0,"work life balance is great, it's possible to just work a 9 to 5",lack of department culture and identity,American Express
34,"""Great Benefits, and work/life balance""",3.0,"Great Benefits, and work/life balance.",Hard to advance within org.,American Express
35,"""They overwork you  make you sell and steal your pay""",1.0,Base pay is above minimum wage,"You are only a number here they push to sell on every single call even problematic calls other departments (overseas) gives lots of pushback, inaccurate information or simply passing the buck if they don't disconnect you, customer service is not the main focus here to pitch something requires you to read scripty and lengthy disclosures all day to get an accept or decline alot of the time customers don't have time and just say forget it because it's so long, then on the sales you actually do close on they find ways to take your commission back from you based on how certain numbers stack against your peers creating a savagery environment which is not fair",American Express
36,"""must love customer service""",3.0,bonuses salary work from home sales opportunities,very micro managed too many metrics schedule survey constant changes,American Express
37,"""Good Company""",3.0,"Excellent benefits, easy to move to different organizations.",Difficult to get promoted. A lot of politics,American Express
38,"""Good place if don't want to grow""",3.0,"Work-life balance, Less work,","Low growth, high tenure useless mgt team",American Express
39,"""Great company overall""",5.0,"Great balance, good benefits, friendly environment",Slow and bureacratic. Little growth opps,American Express
40,"""Financial Analysis - Legal Entity Controllership""",4.0,Work life balance is good,Criteria for promotion id not very merit based,American Express
41,"""hostile work environment""",1.0,good pay decent benefits established hr nice building free coffee,sexist coworkers lots of business politics too much management too many meetings,American Express
42,"""nice experience""",5.0,"great company ,nice benefits, flexible",nothing bad that i can think of,American Express
43,"""Must drink koolaid to succeed""",3.0,"Flexible schedule, great ceo","Strong emphasis on “ fake it till you make it” , and doing your own PR",American Express
44,"""Partnerships""",5.0,"work life balance is great, and benefits are great for working mothers",low salary compared to competitors,American Express
45,"""Challenging but great company to work for""",5.0,Respectable and visionary executives / upper management. Treats employees with respect. Great pay-for-performance management system. Numerous opportunities to move around to different areas of the company. Excellent brand.,High expectations for always-on work life balance. Demands for technology development projects to be done quickly and dates set by business and upper Mgmt more than tech team.,American Express
46,"""Best Place to Work""",5.0,"Amazing parental leave policy, employees are supported 100%. You can really learn a lot here and do so in a positive environment. Great work life balance, great people. Can't imagine a better place to work.",Your overall experience depends on your direct management.,American Express
47,"""***beware***""",3.0,"Great company, great compensation if you come in from the outside",People will back stab you to make themselves look good. Management do not take care of their people. I got a verbal for something I did and 3 days later they fired me for the same thing.,American Express
48,"""Average""",4.0,Location in the prime of NYC,Management it right but traditional,American Express
49,"""No growth and diversity""",1.0,Flexible mat leave work from.home flexibiliy,It is not what you know who you know. No diversity and inclusion.,American Express
50,"""Management turnover""",2.0,Working for a well established name brand,Too many changes in management. Continually having to prove yourself.,American Express
51,"""Outstanding company!""",5.0,Outstanding company to work for; great benefits! Flexible work arrangements!,No cons; great company to work for.,American Express
52,"""CUSTOMER CARE""",2.0,Work from home. Pay. Schedule. training environment.,"micromanaging, very strict metric and forceful selling on every call required",American Express
53,"""Balance""",5.0,"-Great Culture (depends on team) -Amazing work life balance (depends on team) -Real work learning opportunities such as coding (SQL/Python) -Upwards mobility specially if coming in as a Analyst/Sr. analyst Over all an amazing company to work in. Although some things depend on what team you are in, my Pros apply to most of the company. Have not really seen bad culture/work life balance teams, but have heard of them through word of mouth. Great learning Financial Service opportunity without the hyper A Personality culture of the industry.","-PTO days do lack a little when starting as an Analyst. Due to the fact that holidays must be taken from your PTO totals. Also PTOs do not roll over or get paid out (You can buy PTOs and you get your money back if not used during the year). For me this balances out due to the work life balance I have. -Health insurance has a high deductible even when getting the most expensive (even then not too expensive if Single or Married). This does balance out by being offered a HSA which the company contributes a sum at beginning of each year (which depend on your doctor would cover your copays). -Layoffs and Reorgs. Like many companies you hear of layoffs and Reorgs which suck and it is a con. What many people do not tell you is that Layoffs usually occur at VP or higher levels and a Reorg usually gets a couple months notice and a package if you do not find anything. Again does not feel good if you end up in this situation (and hope I never have to be in it), but it is not like the movies where the same day you pack your things and go.",American Express
54,"""I can help customers to build at credit score""",5.0,I would like to enjoy and get knowledge in America Express and learn about skills of the work and how businesses work .,Knowledge and experiences and to meet new people to know about the work,American Express
55,"""Wonderful Company""",5.0,"Excellent work life balance, flexible, great people to work with",Promotions seem to be driven by having a sponsor,American Express
56,"""Couldn’t imagine working anywhere else""",5.0,"Paid time off, schedule flexibility, work life balance, great benefits including 6 months paternal/maternity leave, 6% 401k match, profit sharing, and annual bonus","Frequent lay offs, lack of job advancements in local market",American Express
57,"""Great place to work -- enjoyed it""",5.0,Lots of opportunity for growth and development,Creative limitations due to regulated industry,American Express
58,"""Run!""",1.0,Pay and benefits are decent.,"Too many to list, overworked, bullied by management, micromanaged! Sales is their only motto and all they care about.",American Express
59,"""If you like sales, this is the job for you""",3.0,Pay was decent and benefits too,"Things really changed when Amex lost the Costco account. It because a sales job first, and customer service second. The supervisors didn't care about anything except sales, sales, sales. If a customer called in to dispute a charge, pay a bill, ask a question, the rep was expected to make a sale somewhere during the call. The metrics were impossible. Once Amex lost the Costco account, they were scrambling to keep customers. It was sad. I asked in my initial interview if this was a sales job, and was told it was not. Within 2 years, it was a sales job. Very little training, but they had such high expectations that it was impossible to meet them. I had such high hopes for this company, but they because just another credit card company, and nothing special.",American Express
60,"""Great for the right person...""",4.0,"-Great pay, PTO and health insurance benefits. -Friendly and innovative environment. -In depth training. -Growth opportunities. -Booking travel.","- Call center position, which means you'll be sitting all day taking inbound calls. - ATS metrics are high and almost difficult to reach. - Lots of system updates and systems that you have to go back and forth with. - Strict policy and procedure since they are a financial institution. - Repetitive work that doesn't give you the opportunity to really connect with your clients. - 11 week training isn't enough time (crazy I know) for all the information and systems they throw at you.",American Express
61,"""Getting better""",4.0,The people you work with are friendly caring and hard working.,"There has been a trend there lately, if you have 25+ years then tend to try and push you out of the company. There are really great leaders at Amex and really bad leaders, the trick is to find the great ones, cuz the bad ones will try and destroy you.",American Express
62,"""Great job""",5.0,Treat you like an adult,A big corporation that moves really slow,American Express
63,"""Travel""",2.0,"Travel perks, decent money, nice coworkers",Typical corporate company everyone is a number.,American Express
64,"""Good place to work""",3.0,Good place to work for managers and directors. VP salaries are good.,Hard to rise up to VP level. New open work environment is painful and hard to get used to. Lots of senior internal fighting results in layoffs of losing team.,American Express
65,"""Working at Amex""",4.0,Good place to work if you are interested in learning new technologies.,Politics makes growth a little difficult.,American Express
66,"""Best Place to Work!""",5.0,Amazing Benefits/Flexibility/Opportunity for growth/On going education.,I can' think of any.,American Express
67,"""Fantastic company to work for""",5.0,Best company to work for,None that i can think of,American Express
68,"""PTO could be better""",4.0,Flexible and focused on technology and customers. Great culture.,PTO is deceptive because the number of days they give also includes all holidays. So you are required to use PTO for any holiday. Other banks will give you about 20 days plus all federal observed holidays. That's around 27 days off per year. Amex only gives about 23 days so that's translates to 16 days if holidays are not counted.,American Express
69,"""Pay goof nothing else good""",3.0,Pay co workers location train extras,Management shifts extras train boss,American Express
70,"""Great Company, but small divisions lack leadership and oversight""",4.0,"Great Brand, Customer Focused, trying to remain relevant","Weak benefits, recycled leaders and small pockets that lack oversight",American Express
71,"""Two different cultures at Amex""",3.0,"Overall, a great company to work for. Flexible hours, remote work, they understand that life happens. A great place to learn new technologies. If you have a great manager who actually cares about you enough to invest in you, appreciate your work, and want to see you succeed, that can make all the difference.","I genuinely have no idea how some people are managers. Doesn't a manager have to actually manage? Some managers cannot be contacted and never actually show up. Lots of backstabbing and leaders who only care about themselves - it's really unfortunate to know that leadership doesn't have your back. Technology jobs being moved overseas more and more. FTE's and temps, working side-by-side on the same team, doing the same exact work. Complete and total reluctance to ever hire temps for years and years. You see, there is no room to add to headcount - oh, expect for these 10 new positions in India",American Express
72,"""Best workplace""",5.0,I absolutely love working for American Express. Please see reasons why below: -Nice getting to work remotely -Great leadership -Leaders and colleagues are there to help when I need it -Opportunities for advancement -Mentorship programs -Opportunity to make a lot of money,Not any cons that come to mind.,American Express
73,"""Rampant Discrimination""",2.0,"Work-life balance, onsite gym and cafeteria, good lineup of guest speakers, affinity groups, occasional free food","Blatant discrimination, racism, cronyism, pay below industry average, outdated technology, old fashioned, little innovation, bureaucratic, very slow decision making, the opposite of Agile. I was told that the diversity at Amex was a facade when I first started. I ignored the warning and didn't believe that an industry leader such as Amex could partake in discriminatory and exclusionary practices. There's a reason that discrimination is mentioned in Glassdoor reviews. It's prevalent. Amex claims diversity and inclusion in their Glassdoor intro and beyond for marketing and recruitment efforts only. They're checking a box because it's trendy and upheld by law, but there's nothing done in practice. HR does nothing to stop discrimination when reported and will protect their racist managers even when showing proof of discrimination and harassment. The racial tension that's on display throughout the country right now is alive and well at Amex. You'll be shocked by the amount of stories that you'll hear about former employees leaving because of the discrimination they faced while working there. This is the reality. You've been warned.",American Express
74,"""Depends who you work for..""",3.0,"Nice offices,locations, casual work environment, Can buy additional vacation days max 5 days","Very political, supervisors can be vicious to each other behind their backs, some people not professional, but they get away with it..I was told I was in a dysfunctional group, with bad senior management..",American Express
75,"""A great start to a careet""",4.0,The experience and time here was valuable and helped me grow for more oppurtunities,The workload can be slightly tiring and can get excessive,American Express
76,"""Work""",5.0,"Work culture is great, flexible.","Career advancement, frequent management changes",American Express
77,"""Loved jt""",5.0,Great company to work for,None that I can think of,American Express
78,"""Good for work-life balance, not so much making a dent in the universe""",4.0,"- Great brand and fundamentally sound business model - Excellent benefits + work-life balance, especially if you are raising a family - Offers lots of opportunity to gain experience across business units and functional areas",- Fairly risk averse and bureaucratic decision-making structure - Very much a 'bank'; technology seen as a cost center not a sustainable source of competitive advantage via innovation,American Express
79,"""Good benefits""",4.0,Good benefits like PTO and flex time,If you take them you can be penalized,American Express
80,"""Software Engineering Intern""",4.0,Work life balance was really good at American Express and they treated their interns very well.,Sometimes the internship program was not organized well but I expect that to improve over the years.,American Express
81,"""Working""",3.0,"Work flexibility, great people to work with, and openness to adopting new technologies",Lack of competitive compensation for work,American Express
82,"""Great place to work""",3.0,The great work-life balance they offer remote work capabilities a few days a week and the management there is very understanding and flexible.,Slow-moving technology. Hard to feel an individual impact. Lots of conflicts among technology teams and business areas.,American Express
83,"""Terrible place to work""",1.0,Good access to training,Male dominated leaders. Women do all the work and men take all the credit. Promotes a bullying mentality. Women can get promoted if they are also toxic.,American Express
84,"""Best Place to Work""",5.0,"Competitive salary and benefits, Work/Life balance, Diverse and Inclusive culture","Big company=Big red tape, Decisions take too long",American Express
85,"""Exciting time to be working in Technology at American Express.""",5.0,"- Truly attempts to uphold what Amex calls ""Blue Box Values"". Not just lip-service. - With recent transformations especially using the Technology-first approach, the company has molted from its state in the first decade of the millennium. - Like with any very large global corporation, cannot expect the agility of a startup but company places very high value on agility and speed of decision making. - You are treated as a person, not just a body with a brain and hands. - Senior management takes employee feedback seriously.","- Very large matrixed global multinational (couple more adjectives) corporation. Makes it a challenge to get a grasp on the who's-who in the company. - Being a bank-holding company, technology decision making does get impeded due to strict government regulations around the finance sector.",American Express
86,"""This is a tough gig that requires you to be sharp and present on every call.""",4.0,"A lot of pros at AMEX: -Base Pay -Incentive/Commission structure (payouts) -Employee Benefits are one of the best you’ll find -The Sunrise facility has a lot of nice resources such as cafeteria, lounge/game areas, fitness space, daycare, Starbucks, and concession areas -On-site nurse, physical therapist, and more things that I’m probably not aware of.","Customer service call centers are high-speed, high-stress environments and every move you make is being coded and recorded towards a compliance metric. Something as simple as taking off your headset to go to the restroom at your own discretion is not so simple at AMEX. You’re taking 50-80 calls a day and when you’re making that much contact with different people all over the country with their own issues and sass , it can be overwhelming, exhausting, and daunting.",American Express
