,title,rating,pros,cons,company
557,"""Manager""",5.0,"Great Culture, team and career options",I don't have anything negative to say about the company,Proctor & Gamble
558,"""AmaZing company""",5.0,"Very structured company, everything works and job is challenging. You can have international opportunities even though its not offered to all. P&G loves to reinvent and innovate!","Growth is not too fast, and millenials can get frustrated. A little conservative in Decision Making which makes operation slower.",Proctor & Gamble
559,"""Finance Manager""",4.0,"Company 's emphasis in Purpose, Value , & Principles, Honesty & Integrity",Slower decision making process compared to smaller companies,Proctor & Gamble
560,"""Really meaningful work from day 1""",5.0,"Great people and interesting problems to solve. If you play your cards right and get to know lots of people, you can get pulled into additional fun projects.",Lots of people with an opinion. Sometimes it feels like there are too many cooks in the kitchen. It can seem as though everyone has some thoughts for you,Proctor & Gamble
561,"""Amazing benefits""",5.0,Paternity leave is four weeks! Profit sharing is 100% funded. Medical is good. They have benefits for every category. Relocation package is absolutely killer.,"Locations, such as Iowa, Ohio, Utah, etc.. No 401k match. 401k is traditional. Not for technical engineers. Interview process is intense and long.",Proctor & Gamble
562,"""Good starting place - little to no upward mobility from non-management to management""",3.0,The company has good benefits and offers plenty of flexible work arrangements. Wok/Life balance is a priority in most areas of the company. Provides many opportunities for collaboration amongst teams and across functions. Many opportunities to explore different career paths without having to start over in a new company. Good tuition reimbursement program and other benefits.,"The ""promote from within"" concept only goes so far. If you are hired in as ""non-management"" plan to stay there as promotions out of ""non management"" and into ""management"" are few and far between. Promotion to management typically involves being open to relocating to very little pay increase. Pursuing additional education or certifications outside the company will not help with advancement. Company has many over qualified A&T's (non-management) with MBA's that want to get promoted and the company does not provide an open and encouraging path to make that happen that does not require moving. The pay scale bands leave many employees capping out after 7-10 years with very few opportunities to see continued salary increases.",Proctor & Gamble
563,"""Dope""",5.0,"Flexible hours, good pay, nice environemtn",only hired on for one year,Proctor & Gamble
564,"""STILL a Great Place to Work""",4.0,"Smart people, strong values, great brands, good career development.","Slow decision making, risk averse.",Proctor & Gamble
565,"""Associate Director""",3.0,Very stable will learn a lot,"Culture is slow to change, not agile",Proctor & Gamble
566,"""Unless you're an engineer look elsewhere""",3.0,"Benefits are good, vacation is okay,","Zero worklife balance, chronically understaffed, zero opportunity for advancement unless you're an engineer",Proctor & Gamble
567,"""It's a job""",3.0,"The money is good and the time off is generous, the safety standard is higher then anywhere else I've ever worked.",The job is stressful sometimes requiring night shifts and the management consists of brand new engineering graduates the have no idea how to actually manage people.,Proctor & Gamble
568,"""Site integrated planner""",5.0,Great work life balance. Good benefits.,Nothing really. The company is great.,Proctor & Gamble
569,"""Good experience however slightly dissapointing""",4.0,"Great perks, huge office, young culture.",Short term contracts may not have a possibility of long term employment. Difficult to get in contact/training/reviews from some management.,Proctor & Gamble
570,"""The Doorway to a Career""",5.0,"P&G provides a solid foundation for any career. With strong leaders, clear processes, principles and the best people, the experiences and learnings helps both fresh faces straight from school and experienced hires with best practices.","P&G has been in a period of transition and evolution for many years. Even as the business changes and the organization adapts, the management, principles and processes provides strong guidance to ensure the P&G culture persists.",Proctor & Gamble
571,"""Fine but with opportunities""",3.0,In general the company is good and would recommend. Good life-work balance and some very good benefits,They have opportunities when it comes to making faster decisions and also protecting the talent to go to look for new opportunities in the market.,Proctor & Gamble
572,"""Good employer""",4.0,"Dynamic environment, helping and understanding mentoring",The working process could be less bureaucratic,Proctor & Gamble
573,"""Process engineer""",5.0,"Great benifits, and great company. Very organized interview process that is easy to review online. Have to basically be extroverted","I really don't have any cons to share. Great company and great people to work with, I really love working here",Proctor & Gamble
574,"""Distribution""",5.0,Great benefits and people at the company,Large company bureaucracy inhibits innovation,Proctor & Gamble
575,"""Production Line Leader""",4.0,Leadership experience at early stage of career. People are willing to help you grow.,Expectation of long hours--- but does not translate into salary.,Proctor & Gamble
576,"""A good place to work.""",4.0,P&G has as much opportunity for career advancement as any company in the world.,The business is struggling with organizational complexity.,Proctor & Gamble
577,"""Mostly good""",4.0,-high degree of autonomy -lots of flexibility with work schedule -can work on things that interest you as long as business need as being met; opportunity to pursue interests -many opportunities for training and skill-building -great benefits,"-promotions are difficult, especially if you don't fit the ""proctoid"" mold -engineers are valued on a higher plane than science majors; first promotion for bachelor engineers as same level as 3rd promotion for bachelor scientists",Proctor & Gamble
578,"""Abysmal Advancement Opportunity""",3.0,Good name to have on your resume. Not a terrible place to work if you just want to run out the clock until retirement.,"The advancement opportunities are so bad that half the organization is only promoted one time. Many low performers allowed to hang around forever, clogging up the talent pipeline. Company still desperately clinging to past glory.",Proctor & Gamble
579,"""Procter & Gamble - still trying to turn around""",3.0,"Great Experience, Fantastic People, Global Responsibilities",Struggling to redefine itself and find a path to growth again.,Proctor & Gamble
580,"""Working at P&G""",4.0,P&G is a great training ground for people seeking to learn and grow. People are generally nice and helpful. The company also believes in doing the right thing. Great culture.,"Promotions may be slow - especially since most people stay for a long time. It is also a promote-from-within company, so you will need to start from the bottom to reach the top.",Proctor & Gamble
581,"""Job experience""",4.0,A great company to work for good management excellent benefit and safe environment to work in Paid time of like vacation,Sometimes ship arrive later than schedule and also meeting too soon at New port.relief person may come late causing some inconvenient,Proctor & Gamble
582,"""You learn a lot""",4.0,Exposure to great hands-on training and.,"Swing shifts. Switching between 1st, 2nd, and 3rd every 2 weeks isn't easy.",Proctor & Gamble
583,"""Great Company""",5.0,"Great people, great total compensation and benefits, great and challenging work!",Majority of hires are entry level. The hiring of people with experience is rare and typically not very successful.,Proctor & Gamble
584,"""Brand Managrr""",5.0,Great training. Good upward mobility. Great brands,Marketing skills becoming outdated compared to what the market needs. Behind in eCommerce and leadership development.,Proctor & Gamble
585,"""Solid company""",4.0,"Competitive pay, opportunities for advancement, values diversity, solid ethics, flexible work arrangements, treats it's employees well.","No bonus opportunities for lower management levels. With such a big company, policy trumps all else. Can get ""lost in the shuffle"".",Proctor & Gamble
586,"""Excellent company to start your carrer""",4.0,- Principles & values - trainings: variety of programs to build the best professional you can be - people: dedicated & passionate professionals who will become life time friends - salary,- a little bit too bureaucratic - undergoing massive change in leadership and things are a little bit confused,Proctor & Gamble
587,"""Do not work for manufacturing""",1.0,Free products once a year.,Pay is below standard. Rating system is flawed. One manager stressed data manipulation in order for numbers to look good.,Proctor & Gamble
588,"""Not what it used to be""",3.0,"Flexibility, good balance between work/life","Uninspired culture, management has no direction and is out of touch, no room for career growth",Proctor & Gamble
589,"""Great teaching ground""",4.0,P&G is a great company to work in brand management to learn general management business skills,The work pace is very hectic and busy. Work life balance must be strongly controlled or you can easily work 60+ hours a week.,Proctor & Gamble
590,"""Engineering Intern Review""",3.0,You are doing real work you are getting paid a lot of an internship,Little opportunity to move up in the company in engineering,Proctor & Gamble
591,"""High Profit, Slow Growth Company""",3.0,Exceptional brand builders with talented people,Slow decision-making and fear of failure,Proctor & Gamble
592,"""Large company with many opportunitied""",4.0,Large company with lots of opportunitues. Pay is good compared to many companies. Great if you can get in straight out of college.,"Different attitude toward employees from acquired company. There is definitely a P&G way, which sometimes makes its employees feel superior to acquired employees.",Proctor & Gamble
593,"""Good S&P 500 Company""",4.0,"Smart people, good total compensation and benefits, challenging work! People focused managers.","Workload on employees is above 40 hrs/wk. Slow decision making, need leadership approval for all executions.",Proctor & Gamble
594,"""Great place to work""",5.0,"Great training, lots of responsibility, takes care of employees","Cincinnati, Slow to change and last to market/innovate",Proctor & Gamble
595,"""Great Benefits & High Stress""",4.0,"Great culture for women. Many women in leadership and company intentionally focusing on diversity. Company truly works to follow purpose, values & principled. Not just lip service.",Long hours. Can be tough work life balance. Everyone is used to being the best and are competitive so we all end up working a lot!,Proctor & Gamble
596,"""No career""",3.0,- Lots of overtime - great benefits,-overtime often forced -no upward career path (can't move to management unless hires into management) -managers never seem to care about their employees,Proctor & Gamble
597,"""Decent Company""",4.0,"promote from within culture, good benefits","slow and very political, stuffy",Proctor & Gamble
598,"""Great company to work for""",5.0,"Great people to work with, well paid, and you are given responsibility from the beginning. Meaningful work.",None that I can think of.,Proctor & Gamble
599,"""Long hours, incompetent management""",1.0,They buy you dinner if you work past 7. (which is often),"Leadership, Co-workers, Vision, Formal business attire, Marmon",Proctor & Gamble
600,"""Procter and Gamble Warehouse Tech""",5.0,Good people Nice Wage Good advancement opportunities,"Bureaucracy, Long training, Rotating Schedule",Proctor & Gamble
601,"""Good Company""",4.0,"Good people, good pay and benefits",Young people don't stay due to lack of promotions,Proctor & Gamble
602,"""Up and coming business.""",4.0,Nice team atmosphere. Business and owner are proactive and team oriented.,Sometimes there are growing pains and need to work through. It is all about commitment.,Proctor & Gamble
603,"""Sales administrator""",2.0,"11 holidays and 3 personal holidays, decent health insurance",What they offer can be really different to what you get when you are inside. There's a barrier between banded personnel and A&T well inclusiveness and equality does not exist,Proctor & Gamble
604,"""Associate Director of Package Development""",4.0,"Global footprint, strategic, high quality employees, consumer driven innovation, execution with excellence, quality, good benefits, opportunity to interact across functions, learning culture, supply network.","too big, slow decision making, too political, internal accountability",Proctor & Gamble
605,"""New to the Retail World""",3.0,Some benefits for part time such as a 401k,Promises of full time fall short,Proctor & Gamble
606,"""Regional Busiiness Manager""",5.0,Anatomy to run your business,Work life balance for all departments,Proctor & Gamble
607,"""Rl03""",2.0,Plenty Of overtime opportunities Bonuses,Poor management from upper level supervisors,Proctor & Gamble
608,"""Great Learning Opportunity""",5.0,P&G is great at developing leaders and providing challenging opportunities for employees to work on. They have a great respect for a persons life outside of work. The benefits are better vs the industry average.,"Slow decision making, if you are aspiring to climb the corporate latter quickly then you will not find it here as P&G still tends to favor more years of service vs actual results delivered. Because P&G is a very nice company they tend to not fire people, but move them in to different positions, which means there is some dead weight that you will just have to deal with.",Proctor & Gamble
609,"""Great job, Poor Career""",4.0,"solid salary, opportunities to gain skills","lots of overtime, no career progression",Proctor & Gamble
610,"""IT Executive""",5.0,"Procter provides a Tremendous learning and growth environment. You are a urrounded by top talent/high achievers so you find that you're constantly ""elevating your game""","The above dynamic is a double-edged sword"" -- outstanding people are made to feel ""average"". Virtually everyone who leaves rediscovers their relative worth outside of P&G",Proctor & Gamble
611,"""Director""",4.0,"Highly admirable values and principles guiding how the company runs. Considerations of the consumer, and ethics are highest priority.",Legacy of only promoting from within in most parts of the company; starting with the company can be at entry level only in most functions.,Proctor & Gamble
612,"""P&G""",5.0,Great company to work for.,No cons to speak of from my experience.,Proctor & Gamble
613,"""Sr. Scientist""",4.0,"Good benefits, good trainings, good pay","Slow advancements, no other cons",Proctor & Gamble
614,"""A fun part time job!""",3.0,Nice people and lots of opportunities.,Very big and typically bureaucratic.,Proctor & Gamble
615,"""Technician""",5.0,Profit sharing 401 k insurance overtime,Shift work long hours never home,Proctor & Gamble
616,"""Manager""",5.0,no vaacation and poor manager,"good money ,love the culture",Proctor & Gamble
617,"""associate""",5.0,nice place to work thanks,long hours and nothing else,Proctor & Gamble
618,"""Company Review""",3.0,"A solid ""good"" company, with good benefits and training opportunities.","Not what it used to be; the company has benchmarked on everything, taking previously best-in-class attributes such as salary and other compensation to a level that is average at best. Forget about promotions and advancement, as they simply do not occur anymore.",Proctor & Gamble
619,"""Good company""",4.0,Good company to work for,A lot of red tape and politics,Proctor & Gamble
620,"""Site integrated planner""",4.0,"Dividend day, flexible work schedule, decent pay, benefits.",Training is very broad and sometimes trainers know nothing about your business.,Proctor & Gamble
621,"""Excellent company""",5.0,Excellent benefits and compensation plan.,There are no cons I can think about,Proctor & Gamble
622,"""Cbd""",4.0,Great company to work for :),Not too many come to mind,Proctor & Gamble
623,"""Plant Technician I""",4.0,"Decent pay, overtime is x2 on Sunday (standard x1.5 all other days), most management is easily approachable, PTO is ok, but could be better. Company is very safety focused in a way I have never seen before (all companies pay lip service to safety, few are as dedicated as P&G). For a manufacturing plant it is very clean and quiet (relatively speaking).","Insurance is not the best, high copays. Some animosity between shifts. Forced overtime is common, though they are working to avoid it. Work/life balance can be difficult as you aren't sure when overtime might hit. The CEO makes more in a day than I do in a year (I get that this is standard, but it's irksome)",Proctor & Gamble
624,"""Extremely Political  & stressful culture""",1.0,Good benefits and competitive salary. Diverse culture.,"Your career is completely dependent on your Manager. If you are unlucky to have a wrong manager, there is no way for you to get out of the situation. Your work performance is never enough, your progress depends on how your Manager is projecting you. Extremely unhappy and stressful culture.",Proctor & Gamble
625,"""HR Specialist""",5.0,Excellent culture and best training of leaders in the world.,Lower salaries than competitive companies,Proctor & Gamble
626,"""Procter""",3.0,Empowerment People focused Coaching Perks and benefits Open door policy,Slow Highly structured and less flexible,Proctor & Gamble
627,"""Specialty Account Manager""",5.0,Great Company until my division was sold,Division was sold to Coty,Proctor & Gamble
628,"""I still like to work here despite right-sizing and feeling a bit uncertain about P&G's future.""",4.0,I just happen to have great management. I am recognized for my contributions. I am challenged and I have fun doing what I do.,"Whenever I had bad management in the past, they did eventually move on. P&G is a big company that is still trying to find out how to grow and succeed.",Proctor & Gamble
629,"""Best School!""",5.0,People Principles and Values Compensation and Benefits,Lack of Flexibility Programs - particularly outside HQ,Proctor & Gamble
630,"""25+ Year Employee""",5.0,"PVPs (Purpose, Values, Principles) truly mean something at P&G. Fantastic benefits and high quality people.",Normal things at a 100k employee global company.,Proctor & Gamble
631,"""Not as good as it use to be. Would not recommend to a friend.""",2.0,Semi stable company. Ok retirement. Top brands.,Cost cutting last 2 years has created low moral for core teams. Management keeps reducing staffing and increasing work load on employees. Teams are very stressed. People are burnt out both physically and mentally. When brought up to management they respond with that's the way it is. Health care is terrible anymore. But the CEO does get a nice bonus every year though.,Proctor & Gamble
632,"""Associate Director CMK""",5.0,"Very smart people, great training, high standards, strong brands,","slow decision making, bureaucracy, tendency to over-intellectualize rather than move to action",Proctor & Gamble
633,"""Awesome experience""",5.0,Great company to work with. Great benefits. Company has great benefits,None have I seen yet. Have not been in here for long yet but hoping to find a home here,Proctor & Gamble
634,"""Plant Technician""",4.0,"Co-workers, Pay, Gift Boxes, Scheduled allowed you to take 2 days off but have 7 off","Shift Work, Mismanaged, Lots of OT due to lack of staffing and no hiring",Proctor & Gamble
635,"""Great environment and genuine opportunities for advancement""",4.0,Intelligent co-workers. Work from home opportunities. Plenty of internal training opportunities for self improvement. Global reach. Very affordable cost of living in the greater Cincinnati area.,"Slow burn. Agility is not our core competency, so unfortunately our norm is to take any new idea or proposed change of action and make it a long drawn out process fraught with seemingly endless discussion. End result being the output is too late.",Proctor & Gamble
636,"""Great people""",5.0,"They hire the best, and it works",Tough to advance without moving,Proctor & Gamble
637,"""Best Benefits available in area""",5.0,Ethical colleagues and promote from within; plays to your individual strengths,Fast paced work and highly competitve,Proctor & Gamble
638,"""Manager""",5.0,Team work and company benefits,Slow to market some times,Proctor & Gamble
639,"""PVPs are REAL.""",5.0,"The Company's ""Purpose, Values and Principles"" are lived and breathed by employees around the world. At least at the Corporate level, one never needs worry if the Company will do the right thing. They will.",Two areas: the Company is generally risk averse... and a wonder if too many colleagues are getting too complacent or apathetic with their work... not pulling their end of the work-employee contract.,Proctor & Gamble
640,"""Information Technology Manager""",5.0,"Highly ethical culture, great pay, unlimited career growth from within",Large company size sometimes causes slow execution.,Proctor & Gamble
641,"""Mix emotions...""",2.0,"The hours we are able to get on top of our regular hours, are great when you need to take care of extra business.","The staff don't appreciate the work you do for the company, don't take our concerns into concediration... Not organized, NO HR team...",Proctor & Gamble
642,"""Sales""",5.0,Fantastic Company with strong values,none - it's a great place!,Proctor & Gamble
643,"""Business Development""",4.0,"Great training (invests in talents) Intelligent people Strong PVPs (Purpose, Values, Principles) Promote from within culture Good benefits Early Responsibility",Bureaucratic Tough to advance without moving,Proctor & Gamble
644,"""Onboarding Second to None""",5.0,P&G makes a serious investment in employees. I spent the first year training at my full salary. Very challenging work. Great peers and coworkers.,Work/life balance in operations is difficult.,Proctor & Gamble
645,"""ABM""",4.0,"employee policies, work process, compensation and perks, employee development programs","work culture (hours), slow decision making",Proctor & Gamble
646,"""Great employer""",5.0,The benefits and opportunity are great,"Do your job, many others want it.",Proctor & Gamble
647,"""Good Steady Company""",3.0,"Good benefits, opportunity to move around, broad range of jobs available","Large company, pace of decisions, risk adverse",Proctor & Gamble
648,"""Associate Cascade""",5.0,"Guaranteed Benefits, Flexible Hours, Good Management",There Really Aren't Any Cons But Know That Hours Come With A First Come First Serve Basis Cannot Be Late Or You Will Accumulate Points And Be Terminated.,Proctor & Gamble
649,"""Used to be collegial atmosphere, now its just grim""",4.0,"They used to mentor, pay for education at top business schools, you get the P&G pedigree, work hours are not long, contractors do most of the heavy lifting, you are mainly there to provide leadership, not do grunt work","After assistant brand manager, it is mainly up or out. Many postings are to remote corners of the world, which may require either years long parting from the family or your spouse to give up his or her career. Lately with the shedding of the brands, its like layoffs all the time, without the actual layoffs occurring at P&G, those are taken care of by those purchasing the brands.",Proctor & Gamble
650,"""Work in Global Finance""",4.0,The people you get to work with,Lack of upward mobility truly depends on your original hired in classification,Proctor & Gamble
651,"""account manager""",4.0,"good pay, treat others with respect",many brands and companies targeting their market share. Private Label a big threat,Proctor & Gamble
652,"""Good Part time employer""",3.0,"Flexible schedule, paid mileage for personal vehicle usage, yearly raises, Christmas gift box of Procter & Gamble products, opportunities for full time employment.",Part time employer for Field Technicians.,Proctor & Gamble
653,"""Opposite Policy""",1.0,Benefits received from day one.,"Extremely racist. If you do not know someone that already works there, you're screwed. Your benefits are given to you from day one, but are not allowed to use a sick day the first SIX MONTHS! Please don't waste your time in Iowa City. The pay is not worth your misery.",Proctor & Gamble
654,"""Operations Manager""",5.0,Great company culture and strong values,Competitive Salaries and slowness to react to change,Proctor & Gamble
655,"""Great Company""",5.0,"Intense technical mastery, amazing opportunities to move within company, and systems in place to help employees grow.",Large company so slower moving projects (more roadblocks).,Proctor & Gamble
656,"""Great Experience""",5.0,Learned a lot and had great internship,Big companies comes with natural red tape,Proctor & Gamble
657,"""Brand Manager""",5.0,Great Values and Great People,Very process driver and very slow on decision taking,Proctor & Gamble
658,"""IT Manager""",5.0,Very professional environment. Lot of support coming from every direction if you need/want to utilize it. Clearly defined processes keeps things organized and streamlined.,"Very hard to be hired externally as an experienced hire (not intern/co-op) but do-able if you are in their database and can pass the assessments. If given the opportunity, take it!",Proctor & Gamble
