,title,rating,pros,cons,company
1028,"""Ledys review""",4.0,"good company, benefits and communication.",too far from my house.,HCA Healthcare
1029,"""Good Company to work for. Flexible team""",5.0,Great flexible hours and also good benefits. Good place to also move around to gain more experience.,Too old and conservative. Not a lot of room for innovation,HCA Healthcare
1030,"""Great place to work""",5.0,The pay is great People are nice,The cafeteria food is the only negative,HCA Healthcare
1031,"""South Bay""",2.0,Nice Homely feeling. Nice people overall,You wear many hats because it is a small facility,HCA Healthcare
1032,"""Pharmacist""",4.0,Flexible schedules are a plus,Sometimes difficult to keep up with too many changes,HCA Healthcare
1033,"""Excellent Employer""",4.0,"Good Benefits, staff and technology",Little Advancement in clinical opportunities,HCA Healthcare
1034,"""Corporation Profit Driven""",2.0,Decent salary. Some of the staff were exceptional.,Cost of insurance and quality of insurance is poor. Cuts in benefits to drive profits. Rigid system. Cliques rule.,HCA Healthcare
1035,"""Clinical supervisor and instructor""",2.0,Staff friendly Works with your schedule,No advsncement No training for supervisors,HCA Healthcare
1036,"""RN""",4.0,Great staff!! Great team work! Great hospital to work for.,Nurse to patient ratio can be up to 1:7 on night shift.,HCA Healthcare
1037,"""PT Salem""",4.0,"Good people to work with, reasonable schedule with good patient diversity ample opportunity for job role/setting changes if that is what you are interested in, many different types of therapy under one roof/company","Pay is not as competitive as it should be across the board in all departments, many people leave to seek higher rates of pay, constant fluctuation in staffing protocols leads to burn out with employees",HCA Healthcare
1038,"""Great place to work!""",5.0,"Ethical company, great benefits, great people","Working remotely is harder to interact with your direct reports as much as you would like, and is harder, but not impossible to develop the relationship that I want with each employee.",HCA Healthcare
1039,"""Account manager""",2.0,Large company with hospitals all over the country,Benefits are less than to be desired and not a lot of opportunities to advance,HCA Healthcare
1040,"""Worst Company""",1.0,Large company with lots of locatiosn,"All they care about are profits, not patients or employees.",HCA Healthcare
1041,"""XxN""",1.0,Most vacancies bc it is a horrible entity,"Terrible leadership, back stabbing, all about the bottom line not patient outcomes and certainly not employees satisfaction",HCA Healthcare
1042,"""Line cook""",4.0,"I enjoy cooking,love making the customers happy",It can be stressful at times,HCA Healthcare
1043,"""Hca""",4.0,Very progressive in employee satisfaction,Not competitive pay to local area,HCA Healthcare
1044,"""Rcp""",3.0,Good place to work. Co workers are friendly and willing to help out with anything.,Workload can be a bit overwhelming sometimes.,HCA Healthcare
1045,"""Great place to build your career""",4.0,"Great culture, large company with diverse career opportunities and many locations to work. There is a strong preference to hire internal employees. Charitiable giving and community involvement is huge, all employees are encouraged and give the time to particiapte. Extremely strong financial performance and company growth.",It is tough to get in a higher levels due to the strong preference internal promotion. In operations a willingness to relocate is needed to climb the career ladder beyond a certain point.,HCA Healthcare
1046,"""Nice place to work!""",5.0,"Medical Benefits, Stock purchase, paid time off, educational classes, competitive pay grades, 401 K, OT pay over 40 hrs,","It's a hospital 24 hours a day, 7 days a week, working weekends, holidays, nite shift",HCA Healthcare
1047,"""RN""",2.0,"Don't have to pay for parking, they do have a nurses union but that can be very political. They are just now going to micromanagement, before they left a lot of that to the charge nurses. Your either really like it or hate it.","Building is old and dirty, the equipetment is always broken. The beds are so nasty I pray every time I get a new admission they don't look down. The food is so bad a lot of patient's just want eat it. They company is one of the largest total hospital chains in the world, and they are a multi-billion dollar company, they pay their staff like we were slaves. pure corporate greed.",HCA Healthcare
1048,"""Way to Big""",3.0,Work life balance. Paid training. Discounted meals in hospitals.,Lots of red tape. The wrong people are promoted based on gender.,HCA Healthcare
1049,"""Intern""",5.0,They are wonderful ! I have enjoyed my internship so far.,I cannot think of anything right now...,HCA Healthcare
1050,"""Business Development""",1.0,"Flexibility, work-life balance, accessibility, good platform for entry level wanting to learn the business.",Goals of Admin. are not in line with corporate objectives.,HCA Healthcare
1051,"""HCA""",4.0,Good core values and dynamic projects,Time off is lacking and healthcare benefits,HCA Healthcare
1052,"""Revenue Coordinator""",4.0,Great team to work with. Flexible schedule and opportunity to work from home.,Limited opportunity for career growth if you do not have a nursing degree.,HCA Healthcare
1053,"""Decent company""",4.0,Good salary compared tp the competitors,Management can be difficult to deal with,HCA Healthcare
1054,"""HCA Corporate""",4.0,"Large number of long-term employees with deep knowledge of healthcare expertise at the corporate level. Location which is close to, but not in the middle, of downtown. HCA's efforts to stay connected in the community, and encouragement of employees to be involved with community service, is 2nd to none in Nashville.","Some bureaucratic processes associated with a large organization. With recent growth, parking can be a challenge during normal business hours.",HCA Healthcare
1055,"""Instructional Designer""",3.0,Lots of opportunity in many areas. Work/Life balance was good for me. Flexible scheduling. Work from home.,"My manager was not open to new ideas. There was one way to do things - Her way. There were experts in many fields in my group. Unfortunately, time was not allotted to cross-train. There was never enough funding to attend seminars, but my boss could go to seminars in Las Vegas",HCA Healthcare
1056,"""Trainer""",3.0,"Good work life balance. Flexible scheduling. Large company, many opportunities in other areas of company",Manager was a my way or the highway type. Gave conflicting advice. Did what she told me not to do.,HCA Healthcare
1057,"""Great""",5.0,"Great corporation, great culture, respect all employees","very big, hard to form relationships",HCA Healthcare
1058,"""PTO""",5.0,"Competitive pay, sign on bonus, coworkers are nice","night shift no nursing assistants, HR is hard to get to, processing hr related issues is difficult.",HCA Healthcare
1059,"""Nice job""",4.0,Decent pay. Steady work.,Management issues. Under staffed.,HCA Healthcare
1060,"""HR Manager""",4.0,Great benefits and great company to work for.,"Can't think of any, it is a great company.",HCA Healthcare
1061,"""Keep seasoned nurses""",3.0,In the areas I work in staff help each other. That's very important for excellent patient care and morale of all.,"Management less than caring for some staff, yet helping others significantly more. It's sad to feel like it's ran by a Jr high mean girl some days. Staffing. Nurse/staff ratio has increased some. Add in a considerable increase in the duties of the bedside nurses, this job is becoming more and more difficult. More work + same or less staff increases the risk for inadequate or even unsafe care. You can only be so fast without risking as accident. Add in that everyone is working and exhausting 12+ hours and there danger only multiplies. Add in unseasoned nurses taking care of the sickest patients without a seasoned nurses nearby to bounce ideas off or add a trained had and it can be disastrous. We can help. We've done it so long on mind automatically knows most everything that needs to be done. When you're inexperienced you have to go from 1 to 5 step by step. There's not time for that when a patient is crashing. Those girls will get if they have a bit of guidance and time. If they don't you can bet they'll quit or there will be law suits.",HCA Healthcare
1062,"""Lab Assistant/Phlebotomist""",3.0,If you work PRN/Per Diem you have the opportunity to pick up plenty of hours.,The staff is stretched thin; many early morning labs are not drawn and left over for next shift which normally only has 2 phlebotomists for and entire hospital and they also have to respond to certain codes on floors and in ER.,HCA Healthcare
1063,"""Great Job but has pitfalls""",4.0,"Great co-workers, employer offers great tuition reimbursement, and flexible shifts.","Very ""clichy"" at times which makes it hard to be noticed.",HCA Healthcare
1064,"""Great benefits""",5.0,"HCA had great Medical benefits, however what is with the no copays for doctors visits? work life balance, corporate on site amenities, growth potential, and job security.","Terrible PTO policy, nowhere to voice your opinion to executive management and little to no interaction from executive management with staff.",HCA Healthcare
1065,"""FANS CLerk""",4.0,"Stable work environment, good staff, and growth opportunities.",Difficulty maintaining good staffing and it is a difficult process to get rid of bad employees.,HCA Healthcare
1066,"""Registered Nurse""",3.0,"Coworkers, Workplace Environment, Occasional employee incentives (massages, free meal cards, employee appreciation), Benefit package","Impossible workload, horrible RN pay relative to location",HCA Healthcare
1067,"""Great place to work.""",5.0,"Benefits, culture, willingness to promote from within.",Salaries are generally low against market.,HCA Healthcare
1068,"""Pretty Good""",3.0,Flexibile schedules and decent pay,No upward mobility or chance for advancement,HCA Healthcare
1069,"""Med Tele RNn""",4.0,Education Incentive Flexible Hours Supportive of Personal Goals,Staffing Issues Patient Load and Acuity,HCA Healthcare
1070,"""Needs better benefits""",3.0,The people are great to work with.,Old style corporate management. People become very greedy.,HCA Healthcare
1071,"""Intern""",5.0,This company had a great culture and they really helped understand what you wanted in your future to help recommend the right career path.,There is nothing bad to say about this company. All around a great company to work for.,HCA Healthcare
1072,"""paramedic""",2.0,"benefits, fair pay, discounted scrubs","always changing responsibilities, clueless nurses.",HCA Healthcare
1073,"""Facilities Director""",5.0,Great company to work for.,Local management only focused on year end bonus potential.,HCA Healthcare
1074,"""Fix Divisions""",2.0,Great people for the most part.,Divisions inside of IT don't always work as a team.,HCA Healthcare
1075,"""Great company with lots of internal job mobility""",4.0,Management is truly invested in your success. There are lots of job opportunities for transfer within the company.,Human Resources department is often disjointed and inconsistent.,HCA Healthcare
1076,"""Great company""",4.0,Great people who truly care about patient care & physician satisfaction. Honor work/life balance and fair industry pay.,Can't say anything bad about this company.,HCA Healthcare
1077,"""Corporate Medicine""",3.0,"There are many divisions, departments and other people to consult with in regards to getting your job done. Continued education is a priority and there are some great computerized resources.","If you come from the private sector into a corporate setting it is very much different. Different politics, much more red tape to get through and very confusing. I am a practice manager II and the work load is insane. Between the webexs, conference calls, emails and the tasks that each department gives you it is impossible to work a 40-45 hr week- I generally work 50+ hours. When you average this with your salary...",HCA Healthcare
1078,"""cafeteria worker""",5.0,I've been treated with respect,"It's strict on the overtimes, because we need it especially when we are very short on staff.",HCA Healthcare
1079,"""RN""",4.0,They take care of their employees pretty well here in Las Vegas.,"It is a for profit company so if they don't meet their financial goals, you will know about it.",HCA Healthcare
1080,"""Fantastic Company!""",5.0,"It's such a caring, ethical company Matching gifts for charities Lots of good benefits Volunteer opportunities Great, smart coworkers High salaries","It's a huge company, so sometimes things can move slowly as they progress through all the proper approvals.",HCA Healthcare
1081,"""Risk and Insurance Prossional""",4.0,"Excellent corporate culture. Solid benefits. Cutting edge technology. Business model is diversified therefore can withstand market fluctuations, making it a stable employer. The company's emphasis on clinical excellence is demonstrated in training and capital investments. Team collaboration is valued.",Deinfling office space and parking at corporate headquarters. Large scale makes widespread change complicated.,HCA Healthcare
1082,"""Registrar""",4.0,So many opportunities and great people honestly,Super by the books but you have to be when you work for a multi billion dollar company,HCA Healthcare
1083,"""NICU RN""",4.0,"Good atmosphere, nice leaders, great specialty.",Only 10 days vacation the first 2 years. No guarantee for summer vacation.,HCA Healthcare
1084,"""Administrative assistant""",5.0,Customer service operations,Poor morale to boost morale for the hospital overall,HCA Healthcare
1085,"""Manager""",5.0,Good flexibility and work environment,Parking is rough & no manager offices,HCA Healthcare
1086,"""Clinical staff supervisor""",4.0,"Good benefits, tuition reimbursement. Good focus on quality programs with attention to compliance. Pay was less than average, hard to keep nursing staff.",Not much room for career advancement at that level,HCA Healthcare
1087,"""Disparate treatment between HCA interests.""",2.0,Nice people and cheerful CIO.,"Far West Division IT&S provides nearly half the recognized holidays, 25% lower pay and dismal benefits compared to HCA hospital employees! Lip service is paid to work life balance but quite opposite in practice. Simply put working for HCA IT&S is dismal compared to working for a hospital under the same Corp. Those who have provided positive reviews in these areas clearly haven't done their homework to see what similar positions within the same corp umbrella get compared to this part of the company.",HCA Healthcare
1088,"""Application Engineer""",4.0,"Great working environment, diverse atmosphere, telecommuting, newest technology applications, benefits, and great competitive pay.","Slim advancement opportunities, limited voice with changes to company.",HCA Healthcare
1089,"""Great Company""",5.0,"Good professional environment, competitive Salary, flexible timing.","Health service providers has different requirement as compare to other industries, so if you are coming from a different environment it will take some time to get use to and adjust in hospital/medical environment.",HCA Healthcare
1090,"""Money is the bottom line""",2.0,"Great people on staff, but high turnover rate. No security for most with higher level of experience.","They would rather hire new grads than experienced, more costly staff. The patients care ultimately suffers. I wouldn't recommend pursuing a career with HCA",HCA Healthcare
1091,"""Excellent Benefits, Great Manager""",4.0,Excellent culture and management at my facility. Would recommend.,Corporate falls into the customer service mentality rather than focusing on great patient care. I blame this on the government's compensation model for Medicare patients.,HCA Healthcare
1092,"""Hospital CFO""",3.0,Autonomy at hospital level. Opportunity to advance.,"Pay is average. While upper mgmt provides lattitude is running your facility,you are a corporation and that ""freedom"" can disapear",HCA Healthcare
1093,"""Physical therapist inpatient rehab""",5.0,"Awesome coworkers, flexible start time within reason, awesome benefits including 401k stock purchase.",Some lack of communication from administration through the supervisors.,HCA Healthcare
1094,"""HCA / Parallon / Revenue Cycle Point Solutions""",3.0,Part of a very large company with corresponding benefits. Job opportunities are many and nationwide.,"Organizational changes have greatly impact the Louisville office, making what used to be a very unique and dynamic culture much more traditional.",HCA Healthcare
1095,"""Clinical Pharmacist""",4.0,"organized company, good benefits, good professional experience","stressful job, corporate driven mentality, not flexible",HCA Healthcare
1096,"""Great healthcare organization, bad IT compensation""",4.0,"Flexible work environment, generally nice employees","No way to move up without jumping around and leaving the company, IT rates never catch up to the industry.",HCA Healthcare
1097,"""SW student intern""",5.0,Different levels of care and vast experiences to learn.,Staff is overworked and reported feeling burned.,HCA Healthcare
1098,"""If you want to work for a big healthcare corporation""",4.0,"Great company to work for, located in multiple locations around the US. Incredible benefits and competitive salary. HCA is a great place to work if you want to affect care delivery.","Well-established company that has too many politics. Wish there were more growth opportunities at the corporate office, that weren't directly tied to project management.",HCA Healthcare
1099,"""Fa""",3.0,"Good benefits, good people, they provide food to employes during lunch. They are flexible, I'm able to work from home and good culture.",Hard to transfer. Bad management avoid confrontation. When you express concern nothing happens. Employee are expendable. Rather let a talented employee go then counter offer for better pay. However it's okay to hire new employees at a higher salary.,HCA Healthcare
1100,"""Surgical Technologist""",5.0,Employees treat everyone e the same. Pleasant place to work,I don't have anything negative,HCA Healthcare
1101,"""Pharmacist""",4.0,"Good pay, job security, professional workplace","understaffed, could be much more effective at clinical operations with enough staff",HCA Healthcare
1102,"""NURSE""",4.0,A lot of hospitals in other state / country if you wish to transfer to. HR is unified: actually has 1-800 number and interactive web page Benefits are ok,Staffing at times At times not easy to request time off,HCA Healthcare
1103,"""Great place to work""",4.0,Small hospital with 1:1 patient care Caring hospital staff. Good benefits. Decent pay comparable to surrounding facilities. Top inpatient rehab facility,45 minute commute from Nashville More complicated patients go to the larger hospitals. Pay is lower than other settings. Small town politics,HCA Healthcare
1104,"""Senior Financial Analyst""",4.0,There is a great amount of opportunity within HCA. The company is large in size and has positions all over the US. They do their best to train employees. Staff is genuine and talented.,Getting task accomplish can be difficult because of the size of the company. Things often go through multiple departments and can get lost in the mix.,HCA Healthcare
1105,"""hca""",3.0,Secure job High turnover leads to many open positions in competitive areas,For profit hospital=low reinvestment into facility and staff High turnover rate,HCA Healthcare
1106,"""case manager""",1.0,nurses were great to work with,corporate changed role into data collector,HCA Healthcare
1107,"""Embracing Change""",5.0,Love that they are leading the charge with change initiatives. I feel that I am making a difference in the lives of others. Management respects those with ideas and suggestions for improvements.,Change isn't for everyone and some employees struggle with ambiguity.,HCA Healthcare
1108,"""Good place to work""",4.0,"Work in IT. Good culture, flexible managers, relatively stress free",Promotion and compensation poorly managed,HCA Healthcare
1109,"""patient registrar""",5.0,I really liked working for the hospitals and registration. I liked a lot of the people that i worked with.,it is very difficult to move up if you befriend anyone that you work with at all. the pay is also not as good as it should be.,HCA Healthcare
1110,"""Good benefits - great opportunity for new nurses""",4.0,"You can be new and they have a nice residency program, the patient population always you to work with patients with a variety of healthcare issues. Great ongoing education. Have theportunity to make more money working OT and bonus shifts.","Workload on some days can be pretty crazy, but I believe this is likely true in most places. The pay scale is not as good base pay wise, but you have plenty of opportunity for OT shifts.",HCA Healthcare
1111,"""Intern""",4.0,Very nice people around the office and everyone seemed happy to be there. The facilities have recently gotten renovated and are now state of the art,The pay was competitive but probably could have gotten better from somewhere else,HCA Healthcare
1112,"""Lewis Gale Medical Center HCA Salem Virginia""",2.0,Higher pay than most local hospitals. Decent Health Plan benefits and 401K match.,"Chronically short staffed and over worked, very political where it is who you know that gets you the next job",HCA Healthcare
1113,"""Pushes HCA company ""culture"" ruse when really over worked and underpaid""",3.0,"Your team members are often what helps get you through the day and stressful environment, Decent PTO is offered, decent work-life balance for hourly employees, access to education materials like CBT nuggets (Company will pay for your certs)","Despite a large concentration of HCA facilities in the Tampa-Bay area there are little to no job opportunities. West Florida division has stagnant IT employees who sit in entry level jobs for several years not allowing others opportunities for advancement. Field IT managers would rather hire from outside the company than hire a service desk analyst with company knowledge and exp. Despite all this company does to push it's ""culture"" The service desk works out of a small, dirty office always under-staffed and under funded. Daily workload is often too high for SDAs to keep up with. Very high turn over makes it difficult to keep things stable.",HCA Healthcare
1114,"""Small hospital, lots of politics""",3.0,Small hospital. Try to meet staff needs. Always looking for improvement.,A lot of micromanaging. Budget concerns often weigh out staffing,HCA Healthcare
1115,"""charge entry specialist""",2.0,Doctors & manager were nice.,"Terrible new hire process. I had no idea what the company structure was, and there wasn't new hire orientation. Little room to troubleshoot issues without having to go through a million and one managers from multiple areas. Also was mislead in the interview process. Was to do billing/coding but got stuck doing reception duties. Unless you're part of management, your thoughts or contributions don't matter.",HCA Healthcare
1116,"""Nice place to settle""",4.0,Great working atmosphere. Some departments are good with work life balance.,Not very progressive or aggressive with career advancement,HCA Healthcare
1117,"""Analyst""",3.0,Good health benifits and 401,Don't care about employees as a person,HCA Healthcare
1118,"""Great Place to Work!""",5.0,"Culture, work envrionment, on-site amenities, people","Raises, other than cost of living, are generally not given unless you change positions",HCA Healthcare
1119,"""LNA, EKG TECH, PHLOBOTOMIST""",4.0,There is a lot of educational support and funding towards advancing your education . You work with a variety of professionals. Patient care is highly valued and every effort is made to keep all patients safe & recovering.,"It is very physically demanding, due to the needs of the patients. You will find that you are on your feet for your entire shift. You don't get breaks frequently enough. Privacy to do paperwork is frequently not available.",HCA Healthcare
1120,"""Social Worker""",3.0,flexible scheduling for weekend staff,no raises within my year of working as a per diem,HCA Healthcare
1121,"""Building palaces""",3.0,Great professional atmosphere for IT organization,Far too much drama and control. Always looking for someone to blame.,HCA Healthcare
1122,"""Greed""",3.0,Good compensation for nursing staff in general. Great transfer ability almost anywhere in the USA and some locations outside of home sweet home.,Raises are negligible at best at the staff level. Clinical ladder is a joke.,HCA Healthcare
1123,"""VP Human Resources""",4.0,HCA is leading the charge with the use and development of technology to enhance patient care.,Technology and metrics tend to overshadow the fact that humans are the ones doing the work.,HCA Healthcare
1124,"""Advanced Practice Provider""",3.0,I love the clients I work with. The majority of people whom I work with are wonderful and exceptional. A lot of potential for the company to act on good faith.,"I'm a productive NP with little recognition from management. Benefits, salaries and PTO are not competitive within the market. Raises do not keep up with cost of inflation nor increase insurance. Management sets the tone for how employees get treated and quite a few of the management that I have run across place NP's in the back of the bus. It is disheartening.",HCA Healthcare
1125,"""Great work environment""",5.0,Nice people to work with Good location,Limited opportunities for advancement,HCA Healthcare
