,title,rating,pros,cons,company
1008,"""Great company to work for""",5.0,"Travel privileges are definitely one of the biggest perks this company has, and it's hard to not take advantage of them. There are some amazing people to work with at this company, and that makes all the difference in the world of making me want to come to work every day. Great work/life balance available in my area.","Union groups seem to be getting big pay raises while management gets left out of those, so I don't base my job satisfaction solely on pay.",American Airlines
1009,"""Good experience""",4.0,"big company, great, good thing to work there! !!!!!!!!!!!!!!!!!!!!!!",big companies you get lost sometimes!!!!!!!!!!!!!!!!!!!,American Airlines
1010,"""Project Manager""",3.0,flight benefits are really great !!!!,overworked most of the time and under paid,American Airlines
1011,"""American Airlines Aircraft mechanic""",5.0,"Free flights, free food at work, friends.","when you fly you could get bumpped out, not enough time for free time.",American Airlines
1012,"""Good Employer""",5.0,Ok Benefits. Good Culture. Good people. very friendly environment to work. people treating each other with respect,"Bad Pay , not many growth opportunities",American Airlines
1013,"""Review for AA""",4.0,"Great benefits.Co workers are nice, cool place to work. Use ur flight benefits if u can.","A lot of flying, passengers can get annoying.",American Airlines
1014,"""flight service""",1.0,"Free flights, that's about it.",Poor pay. no respect unless white or latino in my department,American Airlines
1015,"""Flight Attendant""",3.0,Rest customer service and up to date training.,Scheduling was a severe problem.,American Airlines
1016,"""Great Company""",4.0,The opportunity for professional growth and to be a part of a globally recognized brand is invaluable.,Every company deals with internal politics and personality adjustments. This is also true of AA.,American Airlines
1017,"""Culture  change needed""",3.0,"Newer aircraft, good hard working people","The culture needs to change, at some point you have to let go of the past and move on. Lots of mistrust on both sides.",American Airlines
1018,"""March""",5.0,"Elite company, time, flights, co-works, management","work, Scheduling, weather, heavy, slow pace",American Airlines
1019,"""Flight Attendant""",5.0,-Great Benefits -Awesome People -Great Airline Working at AA is awesome is you love to travel and love to never be home. I see new countries and new cities everyday and I absolutely love my job. Just be prepared that it is not the prettiest nor easiest life style,-Long Hours -Starting pay is okay but for how much we work and our long hours we should be getting paid more -Miss a lot of holidays!! When you first start out be prepared to be working or on call every single holiday. And if you do get off a holiday when first going in be very greatful,American Airlines
1020,"""Great Place""",5.0,Not to say. Free flying,Great place. Stressful work,American Airlines
1021,"""Major Airline Employment Opportunities here""",4.0,"Largest airline in the world, job security, new and growing fleet.","Lowest pay of all major airlines, toxic relationship with management.",American Airlines
1022,"""Great place to work!""",5.0,"Free travel, people and opportunities",No real cons just a lot of change but it is exciting!,American Airlines
1023,"""More than I expected""",4.0,"Overall attitudes of employees toward co-workers was unexpectedly pleasant, benefits - even for part-time workers, comfortable atmosphere while keeping professionalism, great in-house cafe at headquarters, many clubs/organizations formed by employees available.",Demerit system (or something like it) for attendance.,American Airlines
1024,"""Great Company""",4.0,"Good treatment of employees, even during a downsizing and station closing.",Not good enough management at the upper level; Meaning we were always at least 90 reviews in arrears.,American Airlines
1025,"""flight attendant""",5.0,"travel, easy schedule changes, time off","bad uniform problems, sometimes hard to change schedules",American Airlines
1026,"""Pilot""",3.0,They are hiring pilots and will continue to need pilots since the retirement rate is going to continue to increase. This increases the potential for career advancement.,It is a very large company With contentious employee groups and an adversarial relationship with management at times. Don't look or expect warm fuzzies from some of your fellow employees or management.,American Airlines
1027,"""A job for parents or recent college grads""",3.0,"This is a work from home position that's great if you have kids or fresh out of college where you are able to be in one place and earn money without spending much because you're at home, so it's a good job to save some money",Con is even though you can save some money the pay is not great at all and after taxes and all the other nonsense they pull out of your check you'll be begging for overtime only to see that the extra 10-15 hrs you picked up only adds an additional 50$ to your check,American Airlines
1028,"""Flight Attendant""",3.0,"Good people to work with, you do get to go see some amazing places if you're lucky enough to get called for those trips. Compared to other airlines American is great to their new employees.","Money. You do not make very much at all, it is extremely hard to live off of. The job is not exactly as it seems to be, the perks are not as great as you would think. The free flights are OFTEN overbooked so you cant travel to many of the places you would like to; you always have to fly standby.",American Airlines
1029,"""EC Business Analyst""",5.0,There is room for growth.,The travel is a hassle.,American Airlines
1030,"""n/a""",4.0,great benefits at American Airlines,Hours are short when you first start,American Airlines
1031,"""Benefits are everything""",3.0,"benefits for you and family, insurance, flexibility (after you attain some seniority)",schedule is near consistent reserve sucks need better sick coverage pay,American Airlines
1032,"""Usual Corporate Politics""",3.0,Great traveling benefits Great community service/outreach opportunities Great flexibility in call center,Favoritism Strict Attendance Stat driven Could use better facilities,American Airlines
1033,"""Flight Attendant""",1.0,Decent medical and retirement benefits.,Low starting wage. Lots of per diem hours. Seniority system also makes working conditions very difficult for new hires.,American Airlines
1034,"""customer relations representative""",4.0,benefits are awesome and employees are great,management can be difficult,American Airlines
1035,"""Good for the flight benefits""",3.0,"Ability to trade shifts, flight benefits","Stressful, have to work nights, weekends, holidays",American Airlines
1036,"""Decent""",3.0,"Union, benefits, swaps, call outs, sick days, and cake.","Union, poor entry wage, meaningless work, boring, ramp rats are a disease.",American Airlines
1037,"""Fleet Service Agent/Ramper""",4.0,"Flight benefits, full medical, dental, and vision insurance. 401k and/pension, profit sharing, 2 weeks of paid vacation for first couple of years then will increase, sick pay, and opportunities to grow. You also receive alot of training, get to work on the grounds with planes, and receive uniforms that look and feel nice.","Very physically demanding, and can be a rough work environment from the weather to employees not working as a team.",American Airlines
1038,"""Excellent company, excellent opportunities""",5.0,"Flexible work environment, upper mgmt. encourages challenging the status quo to push the company to greater heights. great place to work!",Not much vacation to start,American Airlines
1039,"""AA""",5.0,Benefits along with many opportunities for transferring and advancement,Feeling of being just a number among many other employees,American Airlines
1040,"""Miss the old American""",3.0,"Travel Benefits, Good Memories, Laid back environment","LUS management, LUS culture, merger.",American Airlines
1041,"""Business Technology Team Lead""",5.0,"Very good, supportive culture and executive managment","Large Organization, many aspects to understanding overall business",American Airlines
1042,"""Fleet Service Clerck- CLT""",4.0,"Flight Bennifits, can make the money if worked the hours, good health care.","Hard to work your way up in this position, In need of newer and better equipment and machinery, and there is too many people who don't do anything.",American Airlines
1043,"""Old management not good. New management I'll tell you in a few years.""",4.0,We fly for free and have decent benefits. Its a job that not everyone can do. Its exiting i love it.,Flights are always full so its hard to fly standby and benefits are really expensive. Other groups treat us like dirt.,American Airlines
1044,"""Techical Support AA.Com""",5.0,Flexibility. Great Pay. Opportunity to advance. Travel Galore.,Confined to 8 hr day with two 15 minute breaks and one 30 minute lunch.,American Airlines
1045,"""Flight Attendant""",4.0,great team environment. Flight Attendants treat you like family and so do the pilots.,relocation can stressful. Company doesn't involve themselves in the process.,American Airlines
1046,"""Station Agent""",4.0,Flight Benefits are great!! Feel free to travel when you can,none that I can think of,American Airlines
1047,"""Good""",4.0,Good time for the industry. Travel benefits. A lot of new projects. It never gets boring. Friendly people in the company.,The pace is sometimes a little fast but I do not think of any other thing that is that negative.,American Airlines
1048,"""Aircraft Maintenance Technician""",2.0,Somewhat stable...Longevity as an employee is attainable...Exciting work but can be very physical...,Employees will be on nightshift for very long time if they are Aircraft Maintenance Technicians...Work rules have been eroded due to past bankruptcy...Benefits are average... Management Team is inexperienced and rather combative...Recent takeover has left all work groups struggling to regain their footing...There is a lot of responsibility but the wages do not reflect it...Work group is represented by a weak and ineffectual Union.,American Airlines
1049,"""Analyst""",3.0,ability to learn lots of skills,it is hard to move up,American Airlines
1050,"""Aircraft Maintenance Technician""",4.0,I'm a gear head so fixing stuff is in my blood. I really love working on airplanes.,"Politics. People complain all the time. You have a choice, quit. Should have listened to your parents and stayed in school.",American Airlines
1051,"""It specialist""",3.0,Good job security and benefits,Low pay for my job experience,American Airlines
1052,"""Customer services""",5.0,"Team work , Hospitality and love work and hear other people opinion..","Unfairness , unpoitey and disorderly behavior.",American Airlines
1053,"""Home Based Reservations Rep""",4.0,"work from home, flexible hours, flight benefits","have to stay under 2 occurrences, get occurrences for using sick time, not the best pay",American Airlines
1054,"""Employees were great and Mgt was ok""",4.0,The people were great my coworkers were great. The traveling was fun. And I was paid well for the job I did,My supervisor never worked in the position she oversees and she acts like she knew it all. I had to go to training for it for 3 months and she had no training. But we had a good relationship.,American Airlines
1055,"""Flight Attendant review""",4.0,"Travel for free, get to explore new places, and ability to provide friends and family discounted flights.","Always being on-call, working weekends and holidays, not having a set schedule, and working a full time job for part time hours and compensation.",American Airlines
1056,"""agent""",3.0,pay and benefits flexible schedules,like herding cattle not customer focused,American Airlines
1057,"""Flight attendant""",3.0,Great benefits good pay once you get seniority,Management is pitted against employees,American Airlines
1058,"""Piedmont wholly owned Anerican Eagle""",4.0,Wholly owned. Crew meals. Paid cx. Family like atmosphere. Interview process was fun.,Management didnt really care about customer feedback cards.,American Airlines
1059,"""Benefits Delivery Operations""",4.0,"Great benefits, and opportunities for employees to participate in volunteer work.",Low pay. information is not readily available or shared.,American Airlines
1060,"""Solid""",5.0,Lots of opportunities for engaging work,always getting bigger and more bureaucratic,American Airlines
1061,"""Reservation Agent""",4.0,loved being able to work from home and the flight benefits,schedule was always changing and hours were sometimes awful,American Airlines
1062,"""reg latest latest""",5.0,"its very friendly environment to work ,,pleasant atmosphere and recreation benefits for employ is very fair",poor junior / contract employ by someof the senior permanent employ,American Airlines
1063,"""Good people, disorganized company""",2.0,Many of the people are excellent to work with and feel like family.,The company treats contractors like office equipment. Positions are filled from within and contractors are not considered within. Contractors are not allowed on any internal opportunities regardless of position or length of employ.,American Airlines
1064,"""Salary""",4.0,The flying benefits are amazing! You fly for free anywhere in the US and only pay taxes internationally.,Dealing with angry customers when flights are cancelled or delayed.,American Airlines
1065,"""Fleet Service Clerk""",3.0,Largest Airline in the world. Many cities to move around to.,No opportunity for advancing at Hub. Further skills training not approved. Low pay for largest airline (13.44 starting). Low profit sharing for largest airline (3%). You are just a replaceable number.,American Airlines
1066,"""Snr. Infrastructure Engineer""",4.0,Great relaxed atmosphere to work in.,Takes up alot of your time.,American Airlines
1067,"""Run Away!""",1.0,I can not think of any,"No work/life balance, low pay, mandatory OT that can last for 6 MONHS",American Airlines
1068,"""Captain""",4.0,Great People to work with!,It is a very large company and needs to keep salaries up with other Legacy Carriers. We were starting to fall behind the other main tier of carriers such as Delta and United.,American Airlines
1069,"""Operation Disaster""",2.0,Pay is decent and flexible work schedule,Very unprofessional. Favoritism. No accountability. Non existent HR which means nothing happens to anyone. It's like working in the Wild Wild West. If you don't know anyone you don't get promoted.,American Airlines
1070,"""A Rollercoaster that never ends""",2.0,Consistent employment for most with time,"Management ineptness at all levels, broken contractual guarantees, nepotism hires and don't believe anything, bottom line it's just about profits...... period",American Airlines
1071,"""Crew Scheduler""",3.0,Flexibility and good time off,"Pay, stress, management saying one thing doing another, constantly being held over shift with little notice. Flight benefits are good IF you can make a flight.",American Airlines
1072,"""Agent""",3.0,Good attitude among fellow empoyees,Bought by American Airlines when on verge of bankruptcy,American Airlines
1073,"""Fleet service clerk""",4.0,Professional services to travelling public,Customers' complains due to unexpected problems.,American Airlines
1074,"""Laws""",5.0,Great coworkers and manager good benefits,"Schedule simetimes are hard times to work, very early in the moorning",American Airlines
1075,"""Customer Service""",4.0,"It is a great company to work for, but i want to work on my profession. I am currently looking for engineering jobs.",Nothing bad to say about American Airlines.,American Airlines
1076,"""It has been a great experience so far.""",5.0,Friendly people to work with.,None to this point in my employment.,American Airlines
1077,"""Good job""",4.0,Great benefits and flexible hours,Doesn't pay well and it's hard to get a promotion,American Airlines
1078,"""Cool workplace""",4.0,Flight benefits Pay Just stay positive and ignore the negative people. All airlines have pros and cons. You have to start at the bottom and work your way up as a flight attendant.,Reserve Delays Just make sure to take care of yourself first,American Airlines
1079,"""Work in OPS and it's the worst job I've ever had""",1.0,"Adequate pay, easy to swap/trade shifts, flight benefits","Bully-down management, labor relations feverish, no growth opportunities, built on politics, no union for schedulers and abusive management and pilots. Hiring is clueless, no one is qualified for their job, training is inadequate, HR has lost control. Almost all of our scheduling for the world's largest fleet is done with paper and pencil. Mandatory OT happens.",American Airlines
1080,"""Yield Management""",5.0,"Great training program takes you from day one, until you are doing your job! Great benefits as well, including unlimited travel benefits around the world!",Salary is relatively low compared to other industries! Others get paid more based off their degree rather than their contribution to the department (most are still valuable employees),American Airlines
1081,"""Good Company""",4.0,Lots of growth and job security at this job so you don't have worry about being fired,They have a lot of union issues and contract issues regarding your pay and benifits,American Airlines
1082,"""Sanitation agent""",3.0,I like to work with customer and I will lie to help anyone and protect the company. About downsides,Abuat downsides of working at American airlines for me is not respect the rules.,American Airlines
1083,"""Account Executive""",5.0,Nice people and great benefits.,Left due to the long commute.,American Airlines
1084,"""customer services""",4.0,I love the benefits ARE GOOD,the money IS SMALL can pay better,American Airlines
1085,"""IT""",4.0,"Great breath of technologies, room to move inside of company","Silos, politics. Due to that, It will be a challenge to implement new ""DevOps"" concepts",American Airlines
1086,"""Great if you only want to travel""",3.0,"Best job if you have no roots or don't care to have any. You fly anywhere from 1 flight to 5 flights a day, and will work one day up to 4 days in a row depending on the trip you get. You get ample time off with a guarantee of 11 days off a month. Typically, you get more than that. You are able to fly for free when you are off, as long as there is an extra seat on the flight. You can take advantage of this and travel the world. If you are a travel bug, this is the job for you.","Basically, you get paid very little. It raises some every year, but not based on performance, just on seniority. Seniority is everything. As the years progress, you may actually get a planned out schedule each month, but until then be ready to fly by the seat of your pants. You are on call each day and have to be ready to fly in an hour's time at any given time. You make very little money starting out because you only get paid for flight hours. This means that you only get paid when the door of the airplane is shut. So checkins, waiting for planes, waiting for connections, the time you work boarding passengers, and deplaning is all done for free. You could work a 12 hour day, but technically only get paid for 5-6 flight hours. You also have to move to your base, because commuting is extremely hard to do. You end up living almost three separate lives. 40% of time in the air, 20% of time at the places you layover, and 40% of time spent waiting for your next flight in your ""base city"" or on your off days visiting family and friends. This is not a good job for anyone interested in starting a family. It is not conducive to that type of lifestyle.",American Airlines
1087,"""Retired""",4.0,A great company for many years. Travel for free Good pay,Burn out Dealing with irate passengers Unpredictable schedule,American Airlines
1088,"""Good experience, professionally run""",4.0,"Very professional, all the resources you need to get the job done right, flexible schedules, well respected if you get your stuff done","After the merger with united, management kind of went down hill, less professional, they want to change too many things to the way United did stuff which didn't work as well as the way American does things",American Airlines
1089,"""Pilot scheduler""",1.0,Their are non in pilot scheduling stay AWAY management is CRAZY!!!,Everything and flights are always full and unless your a union employee your profit sharing is crap!!,American Airlines
1090,"""Good Company""",4.0,Lots of entry level positions. Always new openings for people wanting to move upward. Take opportunities for special project assignments. You will then be seen by managers who may want to mentor you.,Huge company with many types of personalities. Must use discretion and keep confidences. Some people may not share the high level of integrity you should have.,American Airlines
1091,"""Below average pay and benefits - and working harder.""",2.0,"Ability to swap schedules/trips with other employees resulting in a high degree of personal schedule flexibility. Highly Unionized workforce provides for some degree of Worker's Rights and Protections that you just don't have in ""At will"" jobs. Great job if you have other income streams or are a ""trustafarian"" - then you might be able to actually afford to work here.","Long duty days. Sometimes you may be at work 16 hours and then only get a 9 hour rest break /layover. The worst part is you aren't getting paid for the full 16 hours you were on duty. You are only paid for the hours and minutes the aircraft is actually moving. The travel benefits have become increasingly worthless. It is the main reason people go to work for the airlines in the first place. But today with the Internet being used as a last minute clearing house - every flight is full every day of the week to every destination - making your travel benefits very difficult to use if you are able to use them at all - and you will be sitting in a middle seat in Coach if at all. Deteriorating work rules and labor contracts have really destroyed what was once a proud occupation. Employees used to receive Pensions. Those were ""frozen"" in 2012 Chapter 11 Reorganization and Retiree Health Care was also jettisoned. You are better off working for another industry with better pay and just purchase your tickets. You can fly today for under $ 300 round trip to just about anywhere. Soon the airlines will pay the public to travel !!!! Retiree Travel has also been downgraded. As a 30 year employee I have enough seniority to make the job tolerable for the next few years until I reach retirement age - but I would never, ever recommend anyone going to work for this airline unless you are being hired directly into an Executive Level position. The front line employees, the Flight Attendants, Agents, and Ground Staff get little respect and pay increases that do NOT keep ahead of inflation so you are constantly losing purchasing power in ""real"" vs. ""nominal"" terms. That affects your standard of living and future greatly.",American Airlines
1092,"""Purchasing Assistant""",5.0,Great atmosphere / Great people / great hours,I have no cons at the moment about AA,American Airlines
1093,"""American review""",4.0,Awsome benefits travel alot work when you want,Almost none strict on being absent to work and a little hassal with security,American Airlines
1094,"""Awesome Airline to work""",5.0,Excellent flight benefits better than United,none that I can recal,American Airlines
1095,"""Supervisor""",5.0,"The mission of American Airlines, The Benefits, Salary, ocations.","Working Holidays, and weekends but it par for the course.",American Airlines
1096,"""Staff Assistant""",2.0,"Flight benefits, 401 k, health, dental, vision insurance","No work morale, supervisor does not know how to talk to her staff, no work like balance, do not try to make the environment better for the employees, lack of organization, you do not know your schedule ahead of time and it changes month to month. Supervisor also discuss with other people about her employees.",American Airlines
1097,"""New-Hire experiance""",5.0,"I've recently been offered a position with American Airlines as a Customer Assistance Representative. I interviewed one day and received my offer letter the next! I'm super excited! The process is moving pretty fast. They've made the hiring steps really convent and easy. Reading over the packet has inspired me even more. The culture of the company, the great benefits and perks they offer are great. I'm soo happy to be apart of the AA team!",I haven't experienced any cons thus far.,American Airlines
1098,"""Flight Attendant""",5.0,"Seeing the entire United States + various international destinations, wonderful people to work with, flexible hours, positive job environment, great salary with the ability to earn more by flying extra trips, lots of adventure!","Initially, not being based where you'd prefer (but you eventually can get there!), being junior on the seniority list the trip selection choices are hard to gauge, getting used to the variable hours (early sign-ins one day, late the next, etc.). Just go into the position with a flexible mind, knowing that you're 'low man on the pole' and you'll enjoy the opportunity!",American Airlines
1099,"""It was an ok company to work at.""",4.0,They give you breaks after some trips.,You have to work in all kinds of weather.,American Airlines
1100,"""Corporate communication specialist""",5.0,"Open to communicate, dynamic, easy to work, creative",not really have any shortage,American Airlines
