,title,rating,pros,cons,company
0,"""Good Place to work""",5.0,Most of the People here are Great.,"Level-ism, if a person at a higher level is Positive or Negative about you or your work, then it is True for Most. But, there are some, who will make certain the truth is known.",Proctor & Gamble
1,"""Good benefits and compensation, but competitive pressure to overwork yourself""",4.0,"salary, benefits, flexible vacation and work arrangement options","competitive, limited promotion over career",Proctor & Gamble
2,"""When you have the right manager - GREAT COMPANY""",3.0,Great culture overall Great pay &amp; benefits,Older managers set in their ways and unwilling to rock the boat to welcome new ideas to embrace efficiency.,Proctor & Gamble
3,"""Great Company for a Career""",5.0,Clear path to growth which is great,Could make the assignments bit more challenging,Proctor & Gamble
4,"""very good place""",4.0,very goop place to work,There is no cons at the place,Proctor & Gamble
5,"""Union is a joke""",2.0,No pros for the Oral Care site,"Union at Oral Care hurts the site. The beauty care site didn’t have a union and has better benefits, wages and hours. You are a robot at work.",Proctor & Gamble
6,"""Amazing people, amazing company""",5.0,-Truly amazing people -Great employee retention -Clear career planning -Good compensation,"-Expected to move a lot if in sales -As with any big company, it's hard to feel like your daily job moves the needle",Proctor & Gamble
7,"""Spent 3 years applying to company, 3.5 years working for company and quit.""",3.0,"Security of P&amp;G umbrella, stable company, can relocate within company, given a lot of autonomy.","Slow to innovate (slower than competitors), locations are typical very rural, terrible work life balance, band curve compensation with no financial incentives till 7-10 years in the company and terrible hiring experience.",Proctor & Gamble
8,"""It’s an okay place to work at, but I don’t see a future there.""",3.0,"It’s okay place to work, if you’re interested in looking at and inspecting packages all day. It can be boring at time, but the great part about this place is that everyone seem to be really nice.","Working as a temp... you only make $7.90. I get that the job is bare minimum when it comes down to work, for 12 hours? Yeah, the pay could definitely be better.",Proctor & Gamble
9,"""Great Company""",5.0,Very professional work ethic in all aspects,"Very by the book work ethic, no bending in any way",Proctor & Gamble
10,"""Great company to work for""",4.0,"Great to learn, different experiences across business units. Overall positive work environment. Fair compensation.","Few levels so takes many years 5-10 to get a promotion. Not a lot of HR involvement to manage performance, very discretionary based.",Proctor & Gamble
11,"""Great Place to Work""",5.0,flexible work hours great benefits &amp; health insurance very supportive of attending conferences and trainings P&amp;G works hard to bring diversity to the company lots of opportunity to find the best role fit within the company,nothing that I can think of right now,Proctor & Gamble
12,"""Overall Good Co.""",3.0,Solid learning curves &amp; possible rounded experience,Career sponsorship has hit or miss element despite being critical to growth,Proctor & Gamble
13,"""Finance""",5.0,"Benefits, salary, work, company, time","Stress, hard work, hard projects",Proctor & Gamble
14,"""management is horrible""",1.0,Vacation time (even though you blow through it while working a 2-2-3 rapid rotation),"Where do we start? Managers think they know everything and they don't, lets speed up the lines for more throughput of product but lets not fix the issues with the lines themselves, lets cut staffing on the lines while we speed it up and have issues. Lets move someone with an engineering background into a supply chain leader role who knows absolutely nothing about the position. Then takes advice from a line leader (a line leader that is only in that position because they threw everyone under the bus to get themselves there and takes credit for everyone else's ideas. ""cost savings"" is a joke,(because our multi-billion dollar brands and not to mention Procter and Gamble as a company makes how many billions a year?) technicians can't do this or get that because it costs too much and we're trying to save millions while managers go on thousand dollar excursions across the pound to Europe for ""benchmarking"" . Retirement is now down to 9% while they are making billions and management is getting millions of dollars in bonus'. Do they want there workers working till they die? Pay and progression system, where do we start with that, it'll take you 15 years minimum to get fully paid? or how you know longer have incentive to learn quickly? You're stuck at a pay level for 2.5 years that you should honestly get to before your year probation is even up. And you wonder why people are leaving and going to other companies.",Proctor & Gamble
15,"""Very Poor Culture""",1.0,Decent job that will lead to something else.,"Contractors are considered beneath P&amp;G employees. Very entitled P&amp;G employees who have no idea what they are doing, constantly meddle with work they don’t understand.",Proctor & Gamble
16,"""good company""",5.0,"good company, with good career development","a lot of work to do, especially trainee",Proctor & Gamble
17,"""Good company""",5.0,Flexible good values good pay,Very Bad locations bad work life balance,Proctor & Gamble
18,"""Great long term career company""",5.0,"Great pay, benefits, people. A company you stay at long term",Long application and interview process,Proctor & Gamble
19,"""Long time employee""",5.0,"Good people,good management, good products.",Too much talent makes advancement difficult.,Proctor & Gamble
20,"""Culture of curiosity, transparency, and learning. Everyone strives to support one another and win.""",5.0,"Culture of curiosity, transparency, and learning. Everyone strives to support one another and win.",Advancement requires sustained and consistent performance.,Proctor & Gamble
21,"""Supply Chain""",3.0,"Fast pace, flexibility, global travel, great products","Coincided people, self serving for their own careers, cares more about numbers and targets then employees. Very long hrs. Always a flood of new hires.",Proctor & Gamble
22,"""Good job""",4.0,Good pay and good benefits,They dont care about there employes,Proctor & Gamble
23,"""Positive experience working at a great company""",4.0,"Work with great people, interesting challenges, never boring",Not much of a work life balance,Proctor & Gamble
24,"""Simply P&amp;G""",4.0,Good benefits and great pay,"Minimal formal training, support of colleagues in competition",Proctor & Gamble
25,"""Good company overall""",4.0,"Great people, lots of opportunities","Poor work life balance, have to play the political game",Proctor & Gamble
26,"""Well paid, interesting work. Cincinnati is okay.""",4.0,"They pay you very well for what you do, you have a ton of responsibility.","Cincinnati is Cincinnati, at the end of the day.",Proctor & Gamble
27,"""Good Company""",4.0,Many opportunities for growth and development.,Location - headquarters is located in Midwest.,Proctor & Gamble
28,"""Great Experience""",5.0,"So far I've been very happy at Procter &amp; Gamble. Great coworkers and bosses, with the opportunity to move around between roles and areas. I've not found the bureaucracy to be stifling either.","If you have to work in a manufacturing plant, the locations are not always the most attractive...",Proctor & Gamble
29,"""Procter &amp; Gamble is a fantastic place to work""",5.0,"Great place, they care about you as a person, great work life balance","At times there can be bureuacracy, but for a company of its size it is wonderful.",Proctor & Gamble
30,"""Procter &amp; Gamble""",5.0,"hours available to work, Easy tasks to complete, friendly co workers","weather conditions, work available when days are slow",Proctor & Gamble
31,"""Good compensation package""",5.0,Upward mobility and progress with excellent overall package,None to offer. Its a GOOD COMPANY,Proctor & Gamble
32,"""Your Success Depends on Who Likes You, Not Your Work""",2.0,"Benefits are good, flexibility is great, they're very community oriented, if you drink the Kool-Aid, you'll do well","The culture is absolutely horrific and no one wants to put the actual effort into improving it. They say they do, but never want to actually do what they need to do to make it happen. Typical of the corporate world, a lot of backstabbing goes on. Transparency is something they tout, but do not appreciate or follow. If you call someone out on a PVP violation, they find ways to ding your performance and push you out. Sometimes FMLA requests are gifted with letters from your boss threatening to fire you because you're not there. Science backgrounds are underappreciated and also no longer welcome in the company. Promotions are slow for most and are not given because of performance, but rather how your boss sells you, or how much you suck up. You could have a great career for years, have multiple bosses that have praised you the entire time and give no complaints about you, and then get one person/boss that doesn't like you and your career is screwed- and it doesn't matter if you have been there 5 or 25 years. The people are encouraged to be this way since the company still uses a rating system for performance, which has long been counterproductive. It is only meant to be used as a temporary weed out system but it has been at least 25 years that this system has been in place and is truly no longer effective. Diversity of the mind is also not appreciated, if you don't think like the majority, then they treat you like you're stupid. There is a glass ceiling, and for some levels, you will never be able to grow your career because they will stifle and block you from doing it.",Proctor & Gamble
33,"""Great Company to start!""",4.0,"Great organization, helpful people who genuinely want you to succeed, company invests so much in your development/training. Love coming in to work everyday.","Plant locations , set ways of doing things so change is a little hard.",Proctor & Gamble
34,"""Elitism runs high""",3.0,"Amazing benefits health, legal, and free products","Elitism is HUGE there. You need a 4 year degree to be viewed as some what competent and if you’re not with a manager who believes in you, kiss yourself career good bye.",Proctor & Gamble
35,"""Good company""",4.0,Work process and systems are good,High stress work environment - too many projects on top of each other,Proctor & Gamble
36,"""Great company to work for overall""",5.0,"Flexible work schedule , good work environment",Political and less promotion space,Proctor & Gamble
37,"""Strict and challenging work ethic""",3.0,Good brand and decent culture,Less transparency when it comes to promotions,Proctor & Gamble
38,"""Working on a line""",3.0,I work third shift,The pay is not enough,Proctor & Gamble
39,"""Good company, pays poorly for Boston""",4.0,"Promote from within, large cap $300B CPG, flexible hours, work from home, 3-6 weeks vacation. Bonus, Profit sharing, 401k but no match",National pay scale with HQ in Cincinnati so Boston office is underpaid versus local market.,Proctor & Gamble
40,"""Great place to work for""",4.0,"Excellent company to work for and learn alot about supply chain, strong systems and tools","the decision making is a bit slow, but it is improving alot",Proctor & Gamble
41,"""They are gutting everything to cut cost, the stock is up but does nothing for you""",2.0,Vacation time in the door is 2 weeks with the option to buy 3 other weeks,You will not be paid what you know.,Proctor & Gamble
42,"""Great place great culture of winning""",5.0,"Great career possibilities, challenging practical work","Lot of red tape, politics hold most projects back from success.",Proctor & Gamble
43,"""Good for career growth (if you perform within the forced-rating system), not good to have work-life balance""",4.0,"Very high compensation (if you perform well). Career development is impressive. Managers are well trained in general (influenced by promote by within culture). The org culture is exceptional as hiring is done meticulously to ensure everyone is a good ""fit"".",Forced ranking on rating performance drives short-term results focus. Not ideal to have a work-life balance if you plan to perform well inside the company.,Proctor & Gamble
44,"""P&amp;G""",4.0,Tremendous diversity of opportunities and roles available,Conflict of internal objectives create frustration and inefficiency,Proctor & Gamble
45,"""They have you jump though hoops!""",3.0,"Retirement, Pay (if you can get there).",Will have you doing multiple jobs while others do nothing!,Proctor & Gamble
46,"""Good People""",3.0,In general every thing is good,Please hire more diverse people,Proctor & Gamble
47,"""Review on P&amp;G DC POV""",3.0,Company has good principles and cares for their employees.,"New to distribution centers, work can be frustrating.",Proctor & Gamble
48,"""Great company to grow but very competitive""",4.0,A lot of opportunities,Little work life balance due to lot of work,Proctor & Gamble
49,"""P&amp;G""",5.0,great culture and working team,slow career progression in certain functions,Proctor & Gamble
50,"""Great starting out company""",4.0,Great benefits and work life balance,No cons identified at this time,Proctor & Gamble
51,"""Great experience that left me enriched""",5.0,Work culture. Responsible corporation. Great city. Work-life balance,Slightly old school management. Scope of company's growth is limited and not exponential.,Proctor & Gamble
52,"""Great training""",4.0,Powerful global brands Long term investment approach,Large organization Location of global HQ,Proctor & Gamble
53,"""Project Leader""",4.0,Good work life balance,Mundane and very hierarchy,Proctor & Gamble
54,"""Great place to work if you're willing to work hard &amp; be willing to learn""",5.0,"Very smart people, fun work environment, &amp; a good opportunity for advancement.",You're expected to always work at a very high level. This shouldn't be a surprise given the competitive pay and benefits. If you're not willing to put in the hours and do a great job then P&amp;G isn't for you. If you are then you'll be compensated accordingly and have an exciting experience along the way.,Proctor & Gamble
55,"""All about the consumer/innovation""",4.0,Very focused on consumer/innovation. Insights led to the core.,"Very large, can take time for decisions to be made.",Proctor & Gamble
56,"""Good environment, prepare with deadline.""",4.0,Seniors and Managers are very supportive.,"Just a heavy deadline, although not every quarter.",Proctor & Gamble
57,"""You get out what you put in.""",4.0,"If you have an open mind, can be very rewarding work. Responsibility levels are high but you do get input from many cross functional teammates and managers.",Work load and time pressures,Proctor & Gamble
58,"""Invest and Value employees""",5.0,Promote from within means budget to improve your skills Competitive compensation and benefits Most managers provide autonomy,Benefits are good but have continued to shrink toward the mean,Proctor & Gamble
59,"""Great company to work for""",4.0,"Smart People, Invest on People development",Slow at decision making due to its size and bureaucracy,Proctor & Gamble
60,"""Good Benefits Weird Culture""",4.0,"Good pay, Great benefits, Salary options, Free lunch most days.","Inflexible schedule, Authoritarian culture, Quite a few ineffective supervisors",Proctor & Gamble
61,"""Sucks if you have dreams in life""",1.0,Good pay good benefits. Nothing else,"Micromanagement, fake roles fake people",Proctor & Gamble
62,"""Great Training""",4.0,"Excellent training ground, many resources available to advance your career","Not growing, jobs consolidating as a result",Proctor & Gamble
63,"""Good job""",5.0,"Hire good people, good starting pay and benefits","Pay and progression at a new site, is unclear and very difficult for the time being",Proctor & Gamble
64,"""Retired after 21 years at P&amp;G""",4.0,Had great benefits and stock options,"rotating shifts, too political, if you want to get ahead just need to talk the talk. benifits are not what the use to be. culture went down the tubes. lot of overtime",Proctor & Gamble
65,"""Procter and Gamble""",4.0,"A lot of opportunities for growth and advancement, excellent benefit package","Very demanding— work weeks 60+ hours, work life balance is difficult depending on the role.",Proctor & Gamble
66,"""Why is is this needed""",2.0,Fantastic coworkers and a great cafeteria,not so good salaries and bad environment,Proctor & Gamble
67,"""Career growth opportunities""",4.0,A lot of trainings were given to enable career growth. Relocation to advance career is always an option and it's nice to have multiple sites across the country and the world.,P&amp;G is a big company and changes can seem slow at time. Life at manufacturing plants tends to be harder than that at corporate P&amp;G in Cincinnati. Managers also tend to be overworked.,Proctor & Gamble
68,"""Work life balance""",4.0,"Work life balance, autonomy, flexible hours",work life balance also allows some to take advantage of the system,Proctor & Gamble
69,"""Your life does not matter, production is king.""",3.0,"Training, starting pay, some of the people",Work/Life balance. Promotions. Association of Employees,Proctor & Gamble
70,"""Great Place to work and grow!""",5.0,"Great place to work, great work life balance!","A couple buyouts were rough, but those should be all done now.",Proctor & Gamble
71,"""None""",4.0,It's a good company to work for,None that I can think of,Proctor & Gamble
72,"""Technology Section Head""",5.0,Great diverse enabling work culture,"Large complex organization, Slow decision making",Proctor & Gamble
73,"""Great company, multiple career paths""",4.0,"Good Benefits, pay is fair, flexible work schedules available","Too many layers of management, do not value mastery, to move up you will have to relocate to a plant for a portion of your career. Very political to get promoted",Proctor & Gamble
74,"""Ok if you drink the koolaid""",2.0,Good healthcare benefits. Good vacation pay. Culture is great in theory.,"Culture isn't followed through on. Minimum wage for the industry average. Don't miss more than 40 scheduled hours no matter the reason! You will be penalized and you will not be able to advance in your career for 6m-1y. Little to no support for training. Favoritism, lots of it. Cult like atmosphere and love for the brand. Feels like joining a pyramid scheme. Vague answers to questions, no straight answers. Vague feedback on performance. Leaders are taught to lie to level 1 employees. (See above) Promotions and they way you are treated is totally luck of the draw with what is needed at the time you are hired. If a line is opening soon and you are hired as a tech, don't plan on moving up even if something is open. If you have manufacturing experience, again, don't expect to advance past running a line.",Proctor & Gamble
75,"""great benefits""",4.0,Great Benefits - gym on site,"Not optimal paid time off, but acceptable",Proctor & Gamble
76,"""Great place to work""",5.0,"good benefits, good culture and atmosphere, work from home 50% of the time, personal growth and development, and management that is invested in your future.","Tough to move into management once employed as ""entry level"", very competitive, salary is basic to begin with, but raises are fair and based on level of work.",Proctor & Gamble
77,"""Great Company""",5.0,"For highly motivated, independent thinkers who love problem-solving to create fast moving consumer goods that delight consumers, this is an R&amp;D experience worth pursuing.",Fast paced work experience keeps you on your toes and is more than a 9 to 5 job -- it's a lifestyle and career of like-minded professionals -- this is only a watch-out if not what you are looking for.,Proctor & Gamble
78,"""Strong Career Development""",4.0,Finance personnel is highly respected and valued.,"You can work long hours, but not constantly.",Proctor & Gamble
79,"""Rewarding job with many opportunities to learn new skills""",4.0,opportunities exist if you are a go getter,Overload on workload due to streamlined staffing strategies,Proctor & Gamble
80,"""Great place to thrive on collaboration and communication""",5.0,"Great collaborative environment, great benefits, great work-life balance","Divestitures are common, management roles limited",Proctor & Gamble
81,"""Great place""",5.0,"Great retirement benefits, good pay","Constant management change, work life balance",Proctor & Gamble
82,"""Depends on your Manager""",3.0,"Pay Competitive, Willing to relocate you will move up fast, you get to travel and can add personal trip into a business trip and they will cover a lot of it, you will make good friends.","Inexperience Managers, Pressure to Deliver, walls are thin and everyone knows everyone, there are favorites in the company, not good with outside hires most people intern and have only worked for P&amp;G. Training is terrible ""you drink from a fire hoes"" I hate that saying because it shouldnt be like that. If you are not willing to move it will stop your career advancement.",Proctor & Gamble
83,"""Long term Career""",5.0,"Great people, a lot of experienced employees, long term commitment from the company to develop your talent","Slower careers, less promotions, some internal complexity related to the size of the company and it's processes",Proctor & Gamble
84,"""Great Company Adapting to New Challenges to Continue Winning""",4.0,Leader in it's category. Great company with very good pay and benefits. Talented team members.,"Matrix design, bureaucrats and layers of decision making lead to slow and painful process to make changes at times",Proctor & Gamble
85,"""Great place to learn""",4.0,learn something new everyday at work,slow to move and make decisions,Proctor & Gamble
86,"""Proud to work here!""",5.0,They offer great flexibility and opportunities to work in different business units.,It can be challenging to get promoted.,Proctor & Gamble
87,"""Great Place to Learn and Grow!""",5.0,"Everyone is purpose driven, valued and principled.",It takes hard work to be the best!,Proctor & Gamble
88,"""Stay away from Dayton if they offer you a position""",1.0,-Good brand for a resume -Some leaders care,"Do not agree to a position that sends you to a mixing center. These centers are completely dysfunctional. The pay for any technician is far below industry standard. Leadership does not have a grasp on any of the real issues facing the mixing center or their employees. They force managers to work production lines, folding cardboard for 8 hours a day on weekends. No progress is ever made toward any of the ""strategic"" goals. Any new technology the company explores cannot be cost justified because they pay their employees minimal. Leadership will tell you the rotation is only 2 years, but then expect you to sign up for an extended obligation.",Proctor & Gamble
89,"""P&amp;G""",3.0,Gives you what you need to learn job and all tasks.,"Management, rotating schedule, still new so not very organized, hurry up just to wait, and tedious tasks to keep you busy.",Proctor & Gamble
90,"""Great""",5.0,Invest in employees and excellent benefits,I can think of no cons,Proctor & Gamble
91,"""Great Employer""",5.0,"P&amp;G has a healthy corporate culture and employees are treated with respect. Policies vary across business units and functions, but the organizations I worked for all had excellent work life balance and employees were able to take advantage of flexible work arrangements. Performance expectations are high, but not unreasonable by any means. Pay is excellent.","Because P&amp;G is a huge company, there are a lot of processes and procedures to follow, so things can move very slowly at times.",Proctor & Gamble
92,"""Great Company""",4.0,"Great Benefits, good salary and Medical/Dental plan is very good",Work life balance and favoritism,Proctor & Gamble
93,"""Don't Get Stuck in Utilities""",1.0,"Pay. Pay check. Health, dental, life, etc insurance",Sexist culture. Racists culture. Partisan threats and hate language used regularly. White male dominated. Horrible hours. This is is mainly in Utilities.,Proctor & Gamble
94,"""Great company to work for""",4.0,Lots of autonomy/responsibility. Rewarding work.,Layers upon layers of management review. Could be streamlined. Work/life balance can be challenging.,Proctor & Gamble
95,"""What its like to work for a large company""",4.0,"Lots of opportunity within, great benefits, profit sharing, good atmosphere.","It is extremely difficult to be promoted from within, especially if you are wanting to promote to management (PTM). They are more likely to recruit college students for management roles and pay them more money before promoting an employee with years of experience.",Proctor & Gamble
96,"""Unrealistic expectations""",3.0,competitive pay and good at some diversity measures,The company expects a new employee to be an expert in the role on your first day,Proctor & Gamble
97,"""Start up phase is very disorganized""",2.0,-decent starting wage -good benefits -shift work is good work-life balance,-cult like culture -favoritism to the point of no advancement -tenured employees who are milking the system awaiting retirement. -random placement of new hires.,Proctor & Gamble
