,title,rating,pros,cons,company
1332,"""Lacks Flexibility in Scheduling""",3.0,-Employee discount is amazing -Co-workers and management team are good for the most part -Cool company -Did I say employee discount is amazing?,"-Lack of flexibility for a PART-TIME position. You are only allowed to switch shifts TWICE every 30 days (not every month), and they create schedules 3 weeks in advance! I was a college student at the time, so I don't plan my daysthat far in advance, and this rule was such a pain. It ended up forcing me to skip work plenty of times.",Nike
1333,"""athlete""",5.0,"Good discounts, and flexible with school schedule. Get to wear workout clothes to work.",Standing on feet all day.,Nike
1334,"""Full Time Nike Athlete""",5.0,it's an amazing place to work,some of the people drive you crazy,Nike
1335,"""Great Culture""",4.0,"Running, Team Mentality, Corporate Culture, Opportunity to Develop your Career/Move Jobs is real","Inequity in compensation, opportunity is very dependent on company performance, which can drive good talent out during downturns",Nike
1336,"""Technology Director""",4.0,Many of the people that work there are very hard working and caring individuals. The benefits package was very good.,You have to be very careful to have someone in the leadership to look out for you or you will likely have very limited opportunities,Nike
1337,"""Nike Seasonal Athlete""",3.0,Cool people to work with Great product Hours Technology,"Feel like an ant Little if no room to climb Pay If you don't LOVE Nike, gtfo",Nike
1338,"""Retail Brand Marketing Operations Manager""",4.0,"Great work culture, unique place to work especially if you LOVE SPORT",Pay in industry lower than others,Nike
1339,"""Nike Athlete""",5.0,Flexible hours that worked around my schedule,seasonal position meant that there were many other workers which meant less hours given each week,Nike
1340,"""One of the best retail companies to work for""",4.0,"They care about their employees; breaks, lunches, benefits, PTO, ESPP, 401k, matching funds, etc etc. Even the smallest NIKE Stores carry a large staff and get significant foot traffic. Even with the retail tide turning to e-commerce, footwear is still something people need to try on and therefore these stores are always busy. The company has managed to stay relevant and be an industry leader for the past 30 years. No signs of that changing anytime soon.",Like most American companies they have reduced full time benefited positions in lieu of part time under 18 hours a week employees. It has decreased the amount of truly knowledgeable sales associates available compared to a few years ago.,Nike
1341,"""Customers service rep""",5.0,Great company employee store access access to paid gyms on campus,Really hard for temps to get on as black badge employees,Nike
1342,"""Fun environment""",4.0,"Good Discount Nice mangers Nice employees Fun and easy My mangagers really care about everyone, they try to accommodate everyone and will work with your schedule.","You start as part time and you will stay part time for almost a year and then your pay will go down because of more hours. Almost impossible to move up because of so many empoyees. And again, pay is pretty low for the amount of work and great service you give.",Nike
1343,"""Part time athlete NIKETOWN NY""",3.0,good pay 1 hr lunch 40% off staff dress,sets unrealistic goals wants huge availability but little shifts management sucks,Nike
1344,"""Worth the Job""",5.0,The people you work with make the company! It is a good place to work hard and enjoy the benefits.,Some of the management changes are pushing the company to a new direction which is not always positive.,Nike
1345,"""Just do it""",5.0,Connection to sport Great product Career development opportunities,Managers can be hit or miss,Nike
1346,"""Awesome job""",5.0,Great facility great pay fun,Long walks long hours changing schedules,Nike
1347,"""Employee Discount""",4.0,Swoosh discount consist of 40% off online at nike.com,The return policy is annoying and the customers are always complaining.,Nike
1348,"""Good Working Environment""",4.0,"Upbeat, Exciting, Fast paced, and opportunities for job growth.","Pay, Hours, Availability, Scheduling, Training, Downtime",Nike
1349,"""Amazing company, still retail""",4.0,"The discount is amazing, the culture is engulfing... its structured pretty well, movement upwards is based on store sales not individual sales. Work uniform is super casual, non-commissioned work, and people are usually pretty outgoing and fun. Good benifits, i.e. 401k etc","on boarding at every level is extremely lacking, dept managers play games with the athletes and it's all a game of who knows who, hard working people get left behind extremely easily, Only athletic individual get attention, on feet all day, at the whim of crazy consumers, Customer always right attitude, lack of support for individual growth",Nike
1350,"""Great experience!""",4.0,"Most of the managers are very professional yet approachable, they always try and motivate you while sharing more and more pieces of the Nike story.",You can't really shift your shifts :) You always get the same shifts which makes things kinda boring at times.,Nike
1351,"""Great job""",4.0,I like to work there,The bosses are really affecting to me,Nike
1352,"""Nice company to work for if you're willing to try and stand out.""",4.0,The give a yearly bonus Great healthcare plan 401k Opportunities for growth.,It's easy to fall between the cracks. Nepotism is a thing here in some cases.,Nike
1353,"""San francisco womens nike""",4.0,"Great team, good benifits, helps you stay fit and active. competitive work environment.",You sell really good with no commision,Nike
1354,"""Pay is too low for living expenses""",4.0,"benefits are good, company is good",Pay is too low for living expenses,Nike
1355,"""Overall good job for college students. Poor management at my specific location.""",3.0,Fairly good discounts for you and your immediate family. Added benefits such as paid time off even for part time.,Management only focuses on negatives and ignores what you do for the company. Consistently emphasized the job was more important than my family and future.,Nike
1356,"""Former employee""",4.0,It's a fun place to work and the company is one of the best out there,Scheduling can get annoying sometimes,Nike
1357,"""Great""",5.0,"Great room to Grow, discount is great, and opportunities to do special events.",If you are part time under you don't get many hours.,Nike
1358,"""Perfect part time job""",3.0,Nike discount on all nike products,Growth is limited and pay is not that great,Nike
1359,"""IT Manager""",4.0,"The Nike culture is great, plus the salary and benefits package is comparable to the market...If you love sports and love the competitive culture, it's a great place to be. Enjoyable environment to work in day to day and great teammates who support each other regularly. Overall Nike is a great company and I would recommend anyone who has the opportunity, to work here, just not in the IT organization.","I can only speak from the IT organization within Nike, but to be frank, common sense does not prevail. You need to be loud and obnoxious if you're looking to be heard, get promoted or looking to advance in your career either within the organization or outside. Communication is not very open or honest. It's a political power grab with some very disconnected leadership starting at the top of the IT organization and trickling down to middle management. If you don't know the right people or aren't a ""yes"" person, it's tough to grow. It's a large corporation where you are ultimately a number and everyone is expendable regardless of your contributions or impact.",Nike
1360,"""Pure chaos all the time""",1.0,Great benefits. If you get the right job you can spend your day at the gym or out running.,"Nothing gets done in tech. Meeting after meeting, POC after POC. Roadblock after roadblock. Kiss behind and all is good. Try to do the right thing and your work life is difficult.",Nike
1361,"""Big corporation does it right.""",4.0,Great place to work and so many opportunities.,It can be difficult navigating the complexity of the organization.,Nike
1362,"""Store Manager""",4.0,"Good Benefits, Good Team, Flexible Work Schedule","Be Consistent in HR decisions,",Nike
1363,"""Was great, then went downhill.""",4.0,"The discount is awesome, the employees who stick around are fun to work with, the schedule is flexible if you change your availability on time.","Turnover is high, lack of training for new employees, management chooses favorites who get to bend the rules, no discipline for call offs so no one shows up to work.",Nike
1364,"""DONT""",2.0,Nice campus to work at,"The greatest differentiator at Nike was their culture...unfortunately this is dying a quick death with the influx of young ""directors"" who don't know or care about the culture, don't seem to know about the business, or care, just there to get their 100K, bonus and stock options and leave. Nike used to be the best place in the world to work, people cared and gave 110 percent every day. Now...not so much",Nike
1365,"""Awesome pt job""",5.0,"free shoes, free shirts, free shorts yearly. Awesome discount",Its nike so people are messy but what ever,Nike
1366,"""Director""",5.0,Great work/life balance. Progressive corporate culture. It's Nike.,"Food is expensive and mediocre, location is bad unless you like the suburbs, and deep reporting structure and matrixed organization can't get out of it's own way sometimes.",Nike
1367,"""GREAT COMPANY to work for and move up in""",5.0,Great benefits and hours were given,There were not any cons I can think of,Nike
1368,"""Not the best place""",2.0,"Running trails, sample sales, nice campus,","Bad management, clicky, meetings on everything, constant meetings, no work-life balance",Nike
1369,"""Factory Store""",4.0,A great atmosphere while facilitating customer needs. Speedy service and also customer engagement.,Poor leadership in new stores. Failure to help advance athletes when past experience shows the push for advancement.,Nike
1370,"""Nike Factory Store Employee""",5.0,"Loved it, worked here for about 4 years.",Sometimes you do a lot of work for less pay than you'd expect.,Nike
1371,"""Swoosh""",2.0,The discount rate is good.,Poor treatment of managers and little accountability with respect to employees performance.,Nike
1372,"""Not a bad start""",4.0,"Good staff, fun environment, and colleagues were nice.",Hours were random and changed by the managers frequently,Nike
1373,"""General Maintenance""",4.0,"Weekly pay, good work place","No over time ,privileges are for permanent workers pinky",Nike
1374,"""WAS the best company to work for""",2.0,Benefits are comparable to other large companies. Employee Store benefits Able to work remote Beautiful facilites,"Too much Politics! I was with Nike over 15 years. The first 9-10 were fantastic! Felt like a second home when going into work. Worked with great co-workers. You were valued as an individual bringing your talents together to accomplish great things. And you Did the Right Thing. Advance 5-7 years. Nike is no longer the same company that it's founders started. It's now a big, money hungry corporation who cares more about how they ""appear"" than about the tenured employees who have spent years loyally supporting the Brand. When is enough ENOUGH? How much money is ENOUGH? The bigger they become, the more distance the top elite will become from the ""little man"", or the people who have been there for years. Just because we have been there for years doesn't mean we aren't excited to stay innovative and evolve to the next vision! Like others have said, if you speak up for what is RIGHT, you are a trouble maker and unless you brown nose, you have a target on your back. Just like I feel happened at this last ""Re-Structuring"" (aka layoff) session. where I would bet that a majority of the folks were long time employees. Definitely the WRONG THING!",Nike
1375,"""Help plan and execute meetings and events""",3.0,"Decent benefits, Employee Stock purchase plan, 5% 401k match, LGBT supporters, nice campus, expanding campus headcount, tried to be green.","Very little promotion opportunity, lots of construction with little care of parking impact, still employ Tiger Woods, employee dining not subsidized enough.",Nike
1376,"""Nike Athlete""",5.0,- Great Culture -Good discount -Growth opportunities for the most part -Solid company,-Not as good of pay -Competition is at an all time high,Nike
1377,"""Athlete""",5.0,"Fun enviornment, great company discounts and perks","Long hours, not much room for moving up within company",Nike
1378,"""Part Time Sales Associate""",3.0,Good discounts available for friends and family,Pay isn't enough for the work and hours available,Nike
1379,"""Good company to work for with opportunities for growth and career development. Multi faceted skill requirements""",5.0,"Opportunities for growth, education and exposure across business and department types, exposure to leaders and opportunities to hire and develop team members",Matrix organization with too many decision makers and slow approval / direction processes. Challenging alignment between corporate hq and in country leadership.,Nike
1380,"""sales associate""",5.0,great benefits relaxed and friendly environment relaxed work attire free shirts and free pair of sneakers every six months awesome coworkers,"there are no cons that I have, Working at nike was by far my favorite job. I left due to college. I have no negative experiences there",Nike
1381,"""All show off and no work makes Nike digital dumb""",2.0,1. some really great people to work with 2. good technology stack 3. good technical forums and tech talks,"1. horrible politics, I mean I was astonished, surprised, and what not! ugly, real ugly. 2. favoritism 3. zero chance to grow(up the hierarchy) unless you are pompous about everything!AND a friend of the manager!! 4. favorite people move into more challenging teams by befriending their managers. 5. If you suck at something you are looked down by everyone 6. Ugly cafeteria, ugly food, ugly coffee 8. coffee also sucks! I mean you could have atleast spared the coffee!!",Nike
1382,"""Athlete (Sales)""",4.0,"Fast Paced, chill for the most part, decent pay, discount",Some of the leaders can be annoying,Nike
1383,"""IT""",5.0,Great people that love to collaborate.,Long hours and big teams.,Nike
1384,"""Athlete""",5.0,Great people and environment and learning opportunities,busy stores can get very hectic at times,Nike
1385,"""Former Nike Tech Employee""",4.0,"Lots of opportunities within larger organization, solid IT opportunities for serious techies",Sr. Mgmt. doesn't drive vision or strategy downwards,Nike
1386,"""A big machine with the pros and cons you'd expect""",3.0,"Benefits, job security, promotion opportunity, fun industry, good budget","High stress environment, too many people trying to do the same work - very disorganized and slow",Nike
1387,"""Sales Associate""",4.0,"Friendly, easy and quick to learn job responsibilities","Lots of standing, managers were lazy as a whole",Nike
1388,"""Athlete for Retail Store""",5.0,"Great place to work, loved it!","There weren't any cons, great place to work.",Nike
1389,"""Great Company""",5.0,Opportunity for advancement and really good benefits after a part time position,Takes awhile to move up in the company,Nike
1390,"""Footwear Analyst""",4.0,"Great environment and culture, Nike perks, best sports brand in the world.","Long hours, slow advancement, busy busy busy",Nike
1391,"""Loved the experience! Great Company!""",5.0,They will drive you to be better!,Only allowed 40 hours within a work week,Nike
1392,"""Culture has changed significantly""",3.0,"Good people, passionate about the brand, pay is competitive, good, benefits with time","leadership has lost the ability to communicate vision and mission, some fear mongering, and ""good old boy"" networking needed to advance",Nike
1393,"""sales associate""",3.0,made some really good friends and had some good times too,the management could be better,Nike
1394,"""Demand Planning Director""",3.0,"Great product, industry leader, overall good culture","Getting siloed, political, overly corporate and stifling to creativity...""swim in your lane"" is heard often",Nike
1395,"""Nike""",5.0,Great customee service and friendly staff,Very busy during typical busy seasons,Nike
1396,"""Great place to learn""",5.0,Great location on newbury st Better products Staff dress,"None, working for NIKE is a fun environment",Nike
1397,"""Just do it!""",1.0,Product discount Talented designers HQ is a very beautiful,IT infrastructure is outdated but getting better Difficult and cumbersome to get work done. There is an unimaginable amout of socialization and spin that wastes time and resources. Be prepared for the culture. Jocks rule the school. Its not what you know its who you know.,Nike
1398,"""Sr SAP BSA""",5.0,"Good people, summer hours, benefits, pay.","Can be stressful, politics, not really a technology company, behind.",Nike
1399,"""Creativity-numbing processes, bureaucracy and politics.""",3.0,"- Excellent salary, benefits, and work-life balance! - Plenty of people actually work 4 hour days (+ a few hours at the water cooler or starbucks)","- If you are a person driven to make a difference, and see your difference in action, this is not the place for you. There's probably a process in place that you can't mess with. - Countless 10+ year Nike-lifers in cushy jobs that spend more time protecting their jobs than achieving in them. They've found a way to outsource or pass-off everything to others. It's apparent the company is aware of this but doesn't know how to transition people out of the company in order to bring in fresh blood.",Nike
1400,"""PT Over Athlete""",4.0,Culture! I loved the people I worked with and the flexible hours. Offered Benefits,Difficult to become full-time. Pay too low to afford benefits.,Nike
1401,"""Nike experience""",4.0,Work at Nike is very challenging. It keeps you on your toes. Management is open to any training you think is needed for your career,There is a sense of Mistrust since the layoffs on June 2017. Management can work on installing trust in employees.,Nike
1402,"""sales associate""",1.0,Great discount that you can use at anytime,Not enough potential to grow with company,Nike
1403,"""No Work Life Balance""",3.0,"Good Benefits, decent salary, stability",There is no work life balance for upper management. In order to get promoted you must be single w/ no family obligations. All upper management staff who have families either get bi passed for a promotion or are forced to leave. ESPECIALLY AT NIKETOWN NY.,Nike
1404,"""Thanks for the unnecessary stress and the shoes""",3.0,"Benefits(ESPP, PSP, 401k) were decent, Teammates were awesome and knowledgeable when called upon, Deliver cool product and services to the world","Politics, Isolated from rest of company, Lack of self-awareness from management, Uninspiring leadership, complacency and stagnation from veteran resources(""We've always done it this way, and we won't change"")",Nike
1405,"""Not too bad to work for""",3.0,"Fun environment to work in, team based hierarchy.","Not very appreciative of hard work, politics and friendships help move you up the ladder more so.",Nike
1406,"""Great Company to Work for""",5.0,"Fun atmosphere, great co-workers, high energy","Short shifts, Not always enough hours, not always flexible with time off",Nike
1407,"""Okay first job""",2.0,Hire young people and great product,Micro management and rude management,Nike
1408,"""Love The Company""",4.0,Great culture and campus is beautiful. Great benefits,"Too many H1B Visa workers, and when they move on the knowledge goes with them. They would rather hire contract workers than full timers.",Nike
1409,"""Athlete""",3.0,"co workers are great, can be a fun place to work at times","Micro Managing, do not follow through with policies.",Nike
1410,"""Nike review""",4.0,Innovation and growth company. Exciting products that you can believe in.,big company and hard to see yourself making a meaningful impact.,Nike
1411,"""Security""",3.0,*Athletic minded culture *Approachable leadership *Flexible work hours *One of a kind culture,"*Every group/function is not created equal to include culture, support and leadership",Nike
1412,"""Category Analyst""",3.0,"There are a lot of perks including discounts on apparel and clothing, sample sales, great employee benefits including 5% 401K matching, employee stock discounts, and tons of on-campus celebrity and athlete sightings. The company leverages relationships with athletes and asks them often to host lectures for employees, which is very cool. The company has created a very collegiate atmosphere. There is generally a culture of professional development and some really great people within the company.","The company hierarchy is very strong and the politics are consuming. Ultimately, this is a publicly traded company and it's about the bottom line. Management is rarely strategically selected and often has little experience or skill managing teams, particularly at the mid-levels, which is the reason a lot of young talent is driven away. While it's a great company, it wears its age (45+ years old) and that is reflected through outdated processes and systems, and there is a male-dominated culture that is very apparent.",Nike
1413,"""Entry level manufacturing not worth your time or effort""",2.0,"Discounts on Nike products, if that's your thing. Condensed work week (3 on-4 off, 4 on-3 off).","The pay sucks (just over minimum wage when all other manufacturers in the area start out at least $3 more per hour). No sick time, cost of company insurance is high, treated unfairly compared to salaried employees. Little room for advancement unless you are buddy-buddy with those higher up than you.",Nike
1414,"""inspiring""",5.0,serve athletes everywhere; amazing coworkers,large org; can be very beaurocratic,Nike
1415,"""Dead end if you aren't playing the game.""",2.0,"Higher pay than many companies, decent benefits, some really great people, a chance to get some large profile projects under your belt.",Nepotism runs rampant. If you are not friends with someone high up you will never gain traction no matter how successful your work is. Design is not respected in any way shape or form. Many directors will tell you exactly what they want you to rip off and if you advise against that well...,Nike
1416,"""Sales Director""",5.0,"Discounted product, culture of health and wellness, beautiful campus and work environment",Slow to make decisions and get much done,Nike
1417,"""Demand Planning""",5.0,competitive innovative culture. Collaboration and relationships,Challenging to stay in an innovation mindset 24/7,Nike
1418,"""Nike is full of it""",1.0,When I first started I believed everything they said and was looking forward to moving up within the store,"Nike racial profiles their consumers, as well as they are very racist and all the good they say in the interview is lies. They embezzled my volunteer money and gave it to the charity of their choice and not mine.",Nike
1419,"""Part time athlete""",3.0,"Fun environment, good discount, team bonding events","Poor management, high turnover, not flexible, only promote favorites or those who suck up, very few hours unless you become part-time over",Nike
1420,"""Constant Change""",4.0,"If you don't mind constant change, evolution and figure-it-out-as-you-go routines, this is the place for you.","If you do mind, this is not.",Nike
1421,"""Sports Enthusiasts Apply""",3.0,"For sports nuts, this is a great company to work for - lots of opportunity to get involved with sports and see different parts of athletic wear, shoes, clothing equipment",its a very large company with many departments that may not be able to communicate with each other on a given topic,Nike
1422,"""Growing into big Corporation""",3.0,"If you're a sports fan, great place. If you're competitive, great place.","It's a dog-eat-dog company and definitely a boys club. It was once a big company with a small company feel, but now it's just all corporate, including politics.",Nike
1423,"""Retail Sales Associate""",3.0,The discounts are really great and usually the environment you work in is fun and you get to meet great people! The culture behind the company is outstanding.,Working weekends is a must but sometimes you get lucky and they will not schedule you weekends if they have so many employees but usually you will cause it gets very busy on the weekends.,Nike
1424,"""Great Company""",5.0,"If you thrive on access to the best athletic footwear, apparel, accessories, and information, Nike is the place for you.",Sometimes familiarity in people's roles causes them to be unprofessional,Nike
1425,"""Portland Community Store""",5.0,"Fun work environment, and staff","Only part-time, wish I could have worked full-time",Nike
1426,"""Sales Associate""",4.0,I worked here during school and they were very flexible with my schedule. Management actually cared about your future interest.,"The profit sharing takes 5 years to become 100% vested, but they put a good amount in there for part-time employees.",Nike
1427,"""Just retail""",4.0,The environment when I first started was good.,Hours were very inconsistent. People who did not carry their weight did not get dealt with by management.,Nike
1428,"""Area Manager""",3.0,"Stable, approachable leadership, very employee centric",inconsistency makes production goals challenging,Nike
