,title,rating,pros,cons,company
1474,"""Fly by night, bartend by day""",3.0,"Well, the most obvious pro in the airline industry is being able to travel, anywhere, for free. First class is also available for a fraction the full fare price. Medical, dental, vision, life, and various other insurance options are plentiful and decent. 401k match is respectable, credit union is great, employee portal and benefits access is clear and user-friendly. Closely-knit community of employees sharing in the common struggle. Working inside of security checkpoints obviously makes for a safe workplace environment. Switching, covering, or giving away shifts is easy and without need of managerial approval, unless the employee is sanctioned for a previous infraction. Generous retirement plans, seniority scheme works well for employees willing to stick it out.","The travel privilege is an amazing perk...if you ever get a chance to use it. Staffing and head counts are always in flux. Schedules are tailored to marginalize employees, stretch part timers as thin as possible thus not allowing them the time to seek supplemental employment, or remove the ability to double/cover because of unnecessary shift overlaps. Legally entitled sick days are punishable absences. Advancement is based on seniority and subversion over merit and work ethic. Managers often sweep critical issues under the rug to dissociate responsibility. No consistency in upholding of policy. Pay is meager, and pay scales are not adjusted to accommodate for areas of high-cost living, unless the local minimum wage laws dictate.",American Airlines
1475,"""Analyst""",4.0,Nice place to work great flight benefits,None that I can think of,American Airlines
1476,"""love it""",5.0,flexible hours and time off..good wages,gone a lot and hard to have a consistant pay check,American Airlines
1477,"""F/A""",4.0,"Great travel opportunities, and fantastic people to work with. Flexible schedule, very much a work on your own atmosphere.","A lot has changed with the merger. Duty rigs need improvement, the contract needs to be honored for both front end and cabin crew. Profit sharing should be considered since airlines are making record profits and the folks working the front lines are on the low end of the pay scale.",American Airlines
1478,"""Flight Attendant""",5.0,Flight perks and benefits were great,Erratic schedule with reserve situation,American Airlines
1479,"""reservations rep""",5.0,It is an awesome place to work,They lay off people to quickly.,American Airlines
1480,"""Great place to work but...""",3.0,"-Flexibility ( this depends on your job position, I'm a home based representative) -Flight benefits","-Pay - When I started I had one job/department for my pay which was fine, now we're getting trained to handle multiple types of jobs without any increase -Union - Basically we have a contract but management violates it and the union doesn't care. -Healthcare - Our department right now has a core healthcare option through united healthcare which is $80 a month for the employee and basically covers nothing -401k match is 5.5%, it could be higher",American Airlines
1481,"""loving to travel""",5.0,Travel Benefits and flexible schedule. also recently recently received a new pay scale.,The union. Worried about changing health benefits.,American Airlines
1482,"""A Critical Review of American""",3.0,Pay is decent for sitting on your rump and answering phones. People are decent; for the most part (see con). The job offers lots of flexibility. You can take off ANY day you want.,"Don't come here as a dedicated employee. You will be worn down. Attitudes kill this company. Any time you contact your help desk, all you get are attitudes. People you have to contact in order to get a record straightened out. There's A LOT of people that work here in the rainbow movement. I HATED being hit on by other men. Women are catty at work, and like to start false rumors. Stay away from females. Dont get sucked into the ""you have a future at AA speeches."" There's always better places to work. Management likes to instill fear in their employees. Don't ask for help. You're not going to get it, but you will get an attitude. Because management most likely doesn't know the answer. MASS confusion, and you're not going to understand that until you work here. Career opportunities are there, but you must be part of the Rainbow movement. Dont be honest or get to know your employees; whatever you do! Learn the hardway. That's what I did. Health benefits must be improved. Senior management is decent but most is talk. Company culture is terrible. Again, attitudes kill this company. So does the LGBT movement. It's heavily induced in this organization. I can't tell you how many times I've been hit on by other men. And i never said a word to anyone because I didn't want to start any problems at work. or be viewed as a snitch. You catch points, or occurrences, which means after 2.5 points they start to slowly walk you out the door. Giving birth? Better have someone to cover your shift. Sick and saving to do cancer treatments? Still catch points. They treat employees like crap here.",American Airlines
1483,"""Great way to see the world...""",5.0,Travel benefits that will allow you to see the world and meet amazing people. Minimum sleep 8 hrs on overnight.,"Low pay, seniority based schedule. Can be stressful during inclement weather and maintenance issues. Must stay on your feet most of the day.",American Airlines
1484,"""Senior Manager""",4.0,"Being in IT, the position provides great flexibility to build excellent relationships with the Business units in addition to being a solution partner to them.","You are only limited by what you are willing to put in!. If you put your time in understanding the Airline business, then you will have a fruitful career. The questions become - where do I start and how long will it take? Airline business is vast, so seek mentors and pace your career. If that is not you, then maybe not the industry for you.",American Airlines
1485,"""Life at the New American""",4.0,"Is a good paying job, with the option to work as or less as you desire, excellent benefits when you compare to what's out there right now, Travel Benefits is 5 star perk, the ability to travel anywhere in the US for free and International paying only the country's taxes is a good incentive, including first class, all the discounts available for the industry.","You are putting your body on the line, when you hit 15 yrs or more your body will start to feel it. No matter the weather you have to keep working,",American Airlines
1486,"""Ground Operations Agent""",5.0,Very stable in terms of financial and also very flexible as far as job opportunities,"Not a whole lot, but primary challenge is to keep customers going to a different Airline for service.",American Airlines
1487,"""flight attendant""",4.0,good job with great benefits,recurrent training every year with no pay,American Airlines
1488,"""Engineer""",4.0,Almost free personal air travel,Management needs to show that employees matter. Always felt disconnected,American Airlines
1489,"""great company""",5.0,great management team lots of opportunities to move up. A lot of training,hard to transfer to other cities,American Airlines
1490,"""Fabulous Airline-Wonderful Place to Work""",5.0,Deep Sense of pride working for AA.,I cant think of anything negative,American Airlines
1491,"""CTO""",2.0,"not at airport, much more relaxed and many more friendly, repeat customers",little room for advancement; not much recognition if you do not have that magical XY chromosome combo (male),American Airlines
1492,"""Former employee""",3.0,If you like to travel the ability to fly stand by is tough to beat and definitely a major incentive. There is a lot of variance by department but in general the work-life balance is good.,There are a lot of legacy employees who are just biding there time till retirement and that can be frustrating when you are trying to accomplish anything. The company was going through a lot of cultural changes due to the merger when I left.,American Airlines
1493,"""Reservations Rep""",5.0,Very flexible hours and time off options.,none that I can think of. Company is great even working as the bottom of the bottom,American Airlines
1494,"""Reservations Representatives""",5.0,Option to work from home or in office. Unlimited hours can pick up shifts for people. Start off at good pay.,"Even though it is unlimited hours, its not overtime unless the company offers it. Deal with the rude phone customers on the other end. Have to have a strong back bone because customers will call you all types of names.",American Airlines
1495,"""Director""",3.0,Travel Benefits are nice to have but standby travel is challenging. The US Air team has made great strides in turning the company around,"Significant amount of work without equal compensation particularly for women. There is still a large factor of ""untouchable"" AA employees that need to go as they say bad apples can spoil the lot and management will not/does not make the changes that are necessary",American Airlines
1496,"""crew chief""",4.0,"Good people, good atmosphere. Benifits.","Lots of regulations, no smoking area for employees.",American Airlines
1497,"""An Interesting place to work""",3.0,"Good benefits (free flights, hotel deals, car rental discounts), was compensated fairly well. I worked in a group that allowed me to work a 7 on/7 off schedule. Was sent to yearly offsite training at Boeing and other vendors.","Was stuck working midnight shift for ~5 years. At first I enjoyed it, but as I moved into my mid to late 20's, it got old fast. I only managed to make it to daylight shift by threatening to quit. My immediate management was fantastic. They were attentive to our needs, knew what challenges we faced, but our directors and above were completely lost. They didn't know what their people did or what they needed to efficiently do their jobs. Resources and tools were constantly taken away while you were asked to take on more responsibility. The corporate culture took a significant nosedive once the US Airways - American merger was completed (Started out with US Airways). Legacy US Airways employees had a great working relationship that only aimed to get the aircraft fixed and flying on time. Engineeing, MTC and MOC all understood what the others had to deal with and respected the others choices. AA only cares about pushing planes out as fast as possible and they don't care who's toes they step on to get it done. AA management is also only concerned with making sure they look good, to the point of blaming other groups/stations/managers to avoid being blamed for a delay.",American Airlines
1498,"""Worth it....?""",3.0,"Great Travel perks. Relatively easy to commute from other cities, depending on where youre coming from. I commute from Denver, CO to Charlotte, NC and it is very smooth. Great people to work with. I have never met such wonderful people in any other line of work than I have at this job, although I believe this is across the board for all flight attendants with all airlines.. There are just some really amazing people out there to work with.","In the middle of a merger, it has just been hard to manage your schedule as a reserve. I have very little control over my life. I also am not compensated adequately for the amount of time and stress that it takes to put daily bids in to try to make a plan for myself. The scheduling system is just not working now.. and it was implemented over a year ago. I hope they can sort it out soon, because it regularly causes me anxiety attacks.",American Airlines
1499,"""Flight Attendant""",1.0,I have a job. If there is ever a seat left over on a flight that wasn't given away for peanuts on kayak or Travelocity I'm able to take it. Yay. For a service charge of course.,Wish I'd picked a different airline to work for 30 years ago. Graduated with an MBA so i know what I'm doing..... But could have never possibly imagined a more acrimonious working environment,American Airlines
1500,"""Customer service Supervisor""",5.0,American Airlines was a very nice place to work as my co-workers and the environment was a very accepting one and made it a pleasant place to work,"Other than the rate of compensation, I have no cons to speak of.",American Airlines
1501,"""Finance Analyst""",4.0,Flight Benefits and Good Corporate Structure,Working Remotely is not usually an option,American Airlines
1502,"""Not What I Expected...""",1.0,Ability to work from home.,"Management make it seem its easy to advance in the company but it is very political. Advancement is based upon who you know and your race - not your education and credentials. Reservations agent are treated terrible when it comes to pay, time off and work load. The perks are lame cause there is no guarantee you will get on a flight and if you do you sit in the back near the bathroom. You can't work from anywhere if you are home base, you must be 75 miles from office. If you are seeking advancement, good luck!",American Airlines
1503,"""Fleet Service Clerk""",5.0,Really strong union with a high top out pay. Just don't be late!,Could be represented by different union if TWA loses to IAM in negotiations.,American Airlines
1504,"""Not the American Airlines your Father worked at""",4.0,"Because the airline industry is so dynamic the work environment is very fast-paced and no two days are the same. American's travel benefits are some of the best in the industry, too.","Although most of the departments are now fully integrated, there still seems to be a bit of bias toward employees from one carrier the or the other for reviews, advancement, etc.",American Airlines
1505,"""Much to be desired""",2.0,"Jumpseat agreements are great, flexibility, dropping/trading trips, many days off a month on line months, ability to bid.","Old planes most not having in flight entertainment, bad trips, only being able to fly domestic routes for a long time unless you speak multiple languages, management doesn't care, horrible vibe from company. Union is a mess.",American Airlines
1506,"""Aa former""",2.0,Travel benefits Work at home,Lack of pay Dept standards suck,American Airlines
1507,"""Great Flight Benefits; No Regard for Work/Life Balance""",2.0,*Flight Benefits *Home Based *Ability to Trade Hours *Advanced Leave,"*Mandatory Overtime (disregard for work/life balance) *Monthly In Office Meetings (changed recently from monthly conference calls for Home Based) *Low Pay in comparison to knowledge needed and job difficulty *Micromanagement (can't go to the bathroom, if you're not on break) *Resolution Help Desk/Mean Coworkers *Home Based Reps receive less benefits and are penalized for sick time",American Airlines
1508,"""Great Benefits""",3.0,The health and travel benefits are awesome.,It is not very family oriented and not flexible at all...... Not a recommended job,American Airlines
1509,"""Flight Attendant""",1.0,None. Non rev travel is NOT what it used to be. Very difficult to get on as a standby passenger.,"No star rating. Terrible working conditions. Due to poor treatment by company, unhappy work group. All benefits of the job, you have to fight for, resubmit documents, and endure harassment. Most stressful job I've ever had. Not one good thing to say about the experience. The merger with US Air was awful.",American Airlines
1510,"""IT Project Manager""",3.0,Great Co-workers and some work from home.,"Post merger woes, legacy AA management vs. legacy US management fighting to keep their software applications and tools. Long process to be converted from a contractor to an employee, even after proving yourself.",American Airlines
1511,"""Fleet Service/Expediter""",3.0,"It used to be a great place to work..after Crandall left,the company has steadily gone downhill (the mgmt part,mostly,but that filters down to the lowest levels of the company). .Us air is so micro-managed ,who (70%)run AA now, that nit picking is the norm...the money is there (wages)#only# because economies of scale force them to pony up,as a good cover covers the true intentions-they don't care about the customer,only the bottom line","Long time employees are not listened to,and if asked opinion only because going thru the motions,mgmt only hears what they want to hear. ..example Ceo Parker said he'll give employee's industry leading contract..minus bonus or profit sharing,while other airlines give their employees something similiar....when queried he responded ""it's something we aren't going to do""...So much for management promise of ""industry leading contract ""...Too young to retire,10 yrs left",American Airlines
1512,"""Great place to work!""",4.0,FREE travel and good health insurance,"Crazy work schedule, takes a little time to get use to it.",American Airlines
1513,"""Poor Compensation""",3.0,Flight privilege when you can actually get on the plane. Insurance premiums are affordable.,"Compensation is low for the positions and the hiring process is slow, even if trying to move internally.",American Airlines
1514,"""Finance Manager""",4.0,They look at the big picture. Taking into how one decision affects the different areas.,With the merger they are not valuing the skills of the internal candidates. Also it feels like a lot of over lap that will need to be dealt with in the near future.,American Airlines
1515,"""Good career""",4.0,"As a flight attendant, the days can be long but the perks of travel far outweigh the cons.","Crew resources staffing, scheduling, availability could be better",American Airlines
1516,"""Network Planning Analyst during the merger""",4.0,"Incredible pool of talent and people passionate about the industry, including industry experts that have been with the company for many years.","A lot of uncertainty during the merger resulted in challenging times for employees, especially middle management and analysts who do the bulk of the work.",American Airlines
1517,"""Mixed Feelings""",3.0,"Full Benefits, Free or very low cost travel, paid vacation","Very low pay, trip schedules are changing and becoming exhausting/hard on the body, treated poorly by company and passengers",American Airlines
1518,"""Overall Rating for Employment""",3.0,Great people to work with!,Very Large company to work for.,American Airlines
1519,"""captain""",3.0,"set schedule, good working conditions, pay","management capabilities, airline tied to economy and oil pricing",American Airlines
1520,"""Fleet Service""",2.0,I retired from American Airlines in 2008.,There was no accountability as far as Transport Workers Employees. I blame the company for not having the lazy ones fired. The good workers got tired of carrying the loafers. The pay also could been better. The flying benefits are useless if you don't have enough money to enjoy your trip.,American Airlines
1521,"""Love my job""",5.0,"Travel to places you never thought you would get the chance to see (i.e. London, Paris, New York) Travel to places you never thought you would even want to see. (Boise Idaho, Burlington Vermont, Spokane Washington) Eat amazing food Get to visit friends and family all over the world 11 days off (at least) per month, compared to 6-8 days off that most 9-5 working people get.","Reserve can last who knows how long. New hire pay is tough when you're just starting out. 6 week long Training isn't paid, BUT, you are provided housing, and all meals so you aren't making money but you also aren't spending money. It is a very different lifestyle, this could be a con to some people.",American Airlines
1522,"""The Work Place""",3.0,Flight Benefits when flights are available Flex schedules offered giving individuals options of a four day work week Location in the perfect location for commuters Leased work buildings for the most part are nice,Slow to catch up with technology Salary range vs. responsibility very low - this company would keep their staff longer if the salary range was based on experience and the dead weight(those staying because they are grandfathered in) would get out of the way of progress,American Airlines
1523,"""Customer Service Manager""",3.0,"Flight benefits, advancement opportunities are available if you're willing to relocate.",Too reactive not proactive. Promotions and accountability are tied in with whom you network with not actual job performance.,American Airlines
1524,"""Pilot""",5.0,American has made a good move in the merger w USAir.,It was shameful that Management went back on their word regarding large cuts of Pilot wages forcing the merger.,American Airlines
1525,"""Marketing""",3.0,Great if you want to travel and see many places.,"Inconsistent work arrangments (remote, work from home, etc) depending on the manager/department. Lack of employee development/training.",American Airlines
1526,"""Aircraft Technician Commercial Airlines""",5.0,Very professional and paid great and great opportunity for promotion with in the Company and great place to work,They should always have more vacation,American Airlines
1527,"""American Airlines""",3.0,"Flight Benefits, flexible hours, Diversity focus,","Flight benefits (hard to get on flights stand by), lack of support for corporate management (focus tends to be on front line employees), lack of direct path for career growth, salary gap among employees is inconsistent.",American Airlines
1528,"""Flight Attendant""",3.0,Great Company to work for,Low Salary for it's employees,American Airlines
1529,"""Reservation""",1.0,"Work from home,only had meeting through telephone",Not a good employee to employer contact,American Airlines
1530,"""Opportunities""",4.0,Flight Benefits Ability to move up quickly Exposure to upper management Great people to work with Location allows you to live in either Fort Worth or Dallas,Lack of focus on work/life balance Base salary is average and there are few bonuses Integration is a long process and the company is still going through it,American Airlines
1531,"""Good internship experience""",4.0,You learn a lot and you fly a lot!,"It's a big company. If you want to create a change, it will take a while!",American Airlines
1532,"""Business Analyst""",3.0,"Good work balance, lots of exposure to variety of areas, opportunity to rotate to different departments","Very difficult to get promotion. The industry itself is cyclic, which means there are good years followed by bad years. Tension with union members always exists.",American Airlines
1533,"""Still a Boys' Club""",2.0,The flight benefits are great and I love the technical nature of the work. The projects are interesting and ever evolving technology ensures constant critical thinking and a delightful lack of routine. I enjoying putting together analyses that have so many moving parts and playing detective in an effort to pin down the unknowns.,"My one complaint is a big one, that is destroying an otherwise extremely fulfilling job. As a female, I am paid 25% less than men with similar education and experience, despite being considered a lead and even training one of the new guys who earns 25% more than I do with less experience and otherwise equal qualifications. I've discussed this discrepancy with my manager and the response is always the same - ""we're working on it"".",American Airlines
1534,"""Ok company it could be better""",3.0,"ok company, good travel benefit",low pay new management style good employees are not valued,American Airlines
1535,"""Best Aviation Company Around""",3.0,"Everyone focus was team building. Great atmosphere, fun times.",A lot of long nights with very little sleep. Salary increases was expected but never offered.,American Airlines
1536,"""Customer Service Agent""",4.0,"Great work atmosphere. Flexible hours, good pay, friendly employees and excellent travel benefits.",Can not find any cons. open on holidays but we know this going in.,American Airlines
1537,"""What to expect""",3.0,Not a bad company to work for. Flight benefit is great! Lots of opportunities for growth being that large.,Management does not care so much about competence and knowledge. Preference for promotions are given to friends and lunch buddies. Diversity is far-fetched.,American Airlines
1538,"""AA Review""",5.0,Great Place to work i have never had a better job.,"First full time job, can't think of many cons.",American Airlines
1539,"""Cabin Service Director""",5.0,Oh the places you will travel.,The constant changes with management and their lack of training and support.,American Airlines
1540,"""Flight Attendant""",3.0,Loved to travel with American Airlines,Got laid off and was never able to get rehired,American Airlines
1541,"""Flight attendant""",4.0,"Great benefits, lots of flexibility, fun job, tracks the world","Lots of upheavel with the US AIRWAYS and Anerican Airlines merger, brand new scheduling processes",American Airlines
1542,"""Why not!""",4.0,"Met some amazing people and made friendships for life, paid training, and it's different","Dealing with snobby people, extended hours, seniority based",American Airlines
1543,"""Sales Associate""",4.0,Great colleagues and great boss,Glass Ceiling for women and no mentoring,American Airlines
1544,"""Flight attendant""",4.0,great benefits and the schedule is extremely flexible. work as much or as little as you want,"Seniority is everything so when you first start, getting the exact days off you want may not always be an option. Expect to work holidays.",American Airlines
1545,"""Flight attendant""",4.0,Travel and flexibility. No day is the same. No cubicle,Pay not high. Away from home. Work with public,American Airlines
