,title,rating,pros,cons,company
1611,"""Great leadership development, diversity of people and experience.""",4.0,Lots of smart people to work with Great profit sharing Very good benefits Lots of opportunity to contribute beyond your role,"As anywhere, politics can be a challenge Many people are very specialized and protect turf rather than do the right thing Review process favors relationships more than contribution",Proctor & Gamble
1612,"""I haven't been there long, but I absolutely adore the job""",5.0,"Relaxed environment, fun employees, great management, opportunities to move up are continuously appearing, simple yet busy tasks are given on a regular basis","There really are no cons to working here as of late other than the early hours, but with any job, early hours are to be expected",Proctor & Gamble
1613,"""Great place to start a career. Horrible place to continue one.""",2.0,"Excellent at project management and lots of resources at your disposal to execute good ideas. Great training for smart people right out of college on strategy development, execution and analytical evaluation. P&G is great at identifying young professionals with high aptitude and then training them to be leaders.","If you didn't start your career there, you are basically treated like a domestic servant. You're needed, but you'll never be part of the family, and thus, your career very quickly will bump into a glass ceiling that you will never raise. If job security is what motivates you, you'll be happy. If advancement opportunities are desired, you will be very frustrated.",Proctor & Gamble
1614,"""Great company, fantastic people""",5.0,"You are surrounded by a very high caliber group of coworkers everyday, with a strong sense of shared purpose and values.",It's a very large company and it can be difficult to drive change or move quickly.,Proctor & Gamble
1615,"""Great place to work.""",5.0,"Flex working hours, you get recognized for your work, growth potential, above all else, there is great innovation that happens at P&G which is awesome!","Sometimes it feels like a popularity contest, and you can be in one week out the next. The actual cash could be better, but they claim that your ""compensation package"" adds up. Sometimes the perks aren't always necessary, some of us would rather the actual income.",Proctor & Gamble
1616,"""Good pay and benefits, can be bureaucratic and risk averse""",4.0,Good benefits and compensation; good experience to work across business units and international boundaries,"difficult to move work forward due to the process oriented, bureaucratic, yet democratic, culture. Often takes a long time to get a decision or to roll out a product.",Proctor & Gamble
1617,"""Corporate Culture and recognition is more due to politics""",2.0,"Benefits, other reps I had made during training",Not numbers focused as everyone gets an automatic raise and recognition within the company can get skipped over due to politics and sadly not numbers focused for a sales representative,Proctor & Gamble
1618,"""Great company to start your career""",4.0,"So many brilliant people at all levels of the organization. A lot of opportunity to learn best in class approaches to building brands. Global mindset. Culture instills great values, structure, work ethic, and rigor.","The company lost its luster. It used to invest in it's employees and view them as future leaders - it does this less and less. The department I worked in tended to make big deal out of nothing, lots of fire drills. In Finance, hours tend to be long and work life balance is rough. I recall working weekends a lot.",Proctor & Gamble
1619,"""great and consistent corporate culture..great place to work""",4.0,great career and professional development opportunities... respects and encourages diversity... mutual respect among the colleagues and employees... great relocation opportunities... job security and sustainability... compensation and benefits are competitive vs. peers. overall great company and culture to work for!!,slower decison making and risk taking as in other larger companies.. P&G is till much relatively better than peers but room to get better via shredding smaller brands to become leaner and simpler... We are hopefull that that will further help to get better in this.,Proctor & Gamble
1620,"""Great experience with a wonderful company.""",4.0,"work/life balance, benefits, challenging projects, smart people","slow to change, too many layers of reporting/tracking vs. thinking and creating new ideas",Proctor & Gamble
1621,"""To be painfully honest...""",2.0,"In terms of compensation, P&G treats people extremely well. If you produce things of value to the company, or are perceived to do so, you can succeed at P&G. There are also generous opportunities to learn. The benefits package has historically been superior. Many talented people work for P&G. Top management - with some exceptions and with many bumps along the road - knows how to execute to win in the market. Overall, I am confident P&G will endure and succeed for its' stockholders (and I am one of them). However growth will likely be slow.","The simple truth is that the stated core values of the Company are essentially not followed by - I daresay - most employees. This may not have always been true, but I believe this is a ""built in"" problem created by ""the way the system works"". The internal culture will not admit mistakes and basically people are force-rated by their colleagues who are organized into departmental 'silos'. The basic motivations are tribal: to protect one's own group and ""fiefdom"" within the organization. But - as a ""value"" - this isn't the same thing as working for the greater good of the Company itself. So when mistakes are made (as they inevitably are), they are often covered up. It gets worse insofar as long as you fabricate a positive result for ""the good of the group"" you can literally be rewarded even though almost everyone knows what you claim just can't be so. I tried to talk about this with my management and I was repeatedly told - basically - to just go away. Many true-believer employees believe that P&G can do no wrong. They also think loyalty means doing whatever you are told (even if it is both unethical and bad for the Company n the long run). These people tend to stay. In effect, they make up the core of the Company. So a lot of unethical practices and internal manipulation of data is just laughed off, or called an ""opportunity for improvement"" (with a smile as if to say - we know it really won't be improved). If it were only a few cases of such behavior, given the talent at the Company and the long-term rewards, a reasonable person might just decide to overlook these cultural problems. However, at P&G, you can do well without being ethical or fair and many people know it. Then, core values become deeply eroded when there is really no punishment for violating them and people know it. Over time one learns the company is far more fearful of negative publicity than internal dishonesty. So the structure of rewards, ratings, and organization means a certain level of dishonesty is literally advantaged. For me, over time, this was a real problem. It affected my sleep, my work, and my sense of pride. I am glad to have left.",Proctor & Gamble
1622,"""Great company to start your career!""",4.0,"Global brands to work on. Major résumé booster. Awesome coworkers. Work life balance. Travel internationally. Really great, positive culture. Support groups for minorities.",Location - HQ in Cincinnati. Old school culture. People that are not super rock stars at work can be stuck in the same band level for life. The system can be very political at times are tough to navigate. It's all about the appearance of your work and building relationships rather than the true value of your work.,Proctor & Gamble
1623,"""Great opportunities""",5.0,"respected by other companies, can easily get another job",difficult to get initial job here,Proctor & Gamble
1624,"""Great corporate values""",4.0,"P&G continually challenges you to learn new things. You are never allowed to get stagnant, whether it's delving deeper into one function, or gaining a wide breadth of experience. You'll never be allowed to just do the same thing for years! The people at P&G have tremendous integrity, they are passionate and always focused on doing what is right for the consumer and the company.","Lately P&G has centralized too many functions. This has led to a tremendous amount of interfaces and too much time spent on figuring out ""who's"" role it is to do something. Previously more attention was spent first on aligning on what needed to happen, identifying who had the skills to do what needed to be done - then focusing on what the standard process is. We've lost our agility.",Proctor & Gamble
1625,"""Depends on the function""",4.0,"Great brands, smart people, and amazing culture","Inconsistency in practices, slow systems, favorability of certain functions/neglect for others",Proctor & Gamble
1626,"""The functions are winning, and the business is losing""",3.0,"Good comp and incredibly smart people. Everybody is smart and professional. Very good standards and systems in place - good, structured training early on in a person's career. Very polite culture. Has a legacy of being a meritocracy and sometimes results still matter. Can often be generous with work life balance opportunities - work from home and flex work. At the Director level there are several instances of key leaders working location free (one director lives in New Mexico while her team is in Cincinnati, and another director lives in Connecticut with her business unit in Baltimore).","Lack of sales growth has resulted in an exclusive focus on cost cutting and productivity. Most managers who are comfortable with risk have self selected themselves out - leaving a mature management generation that is highly risk averse. The functions have gained too much power, and there is often pressure to do ""what's right for the function"" vs. doing what's right for the business unit. The business is so big that it is often not clear who is accountable to deliver results and many of the VP and above leaders are out of touch with how work get's done. The key requirement for promotion has become cheer leading and stroking management's ego (versus it used to be measurable results).",Proctor & Gamble
1627,"""Rewarding experience""",4.0,Inspirational leaders Concept based company Outstanding strategic thinking Ongoing learning curve,"Decision making leadtime Process Data, data, data.... Too many people involved in decision making",Proctor & Gamble
1628,"""Satisfied while there""",4.0,Competitive compensation and nice benfits,Mgmt more concerned about personal advancement than success of overall business unit,Proctor & Gamble
1629,"""Great Company IF You come in at a Management Level""",3.0,"Recognizable brands, mostly smart people, well respected company, good culture, tuition reimbursement, work from home opportunities, slightly better than average pay, flexible work hours, pleasant working environment. Benefits are decent.","Promote from within culture is only true at certain levels. Moving from A&T into management roles is next to impossible, regardless of your rating, and only becoming more difficult. The company is leaning out, which has resulted in more work with less people. Highly rated D level employees are now doing work that was classified as Band 2 (two BIG promotions above D) as recently as a year ago. Often times leadership considers employees ready for management level work and responsibility, but not ready for management level pay. Additionally, lackluster employees are given too much slack and are often passed from organization to organization. This leaves top performers picking up the slack from layoff's as well as carrying some of their dead weight teammates. Movement in mid level management is too frequent and breeds a culture of constant change and unfamiliarity with roles. Some VP and directors are too far removed from the businesses they lead, this can result in their goals being force fed to the rank in file, regardless if the goal align with buisness needs.",Proctor & Gamble
1630,"""Great Training and Experience""",5.0,"I truly believe I have one of the best jobs in my peer group due to the opportunity I have to develop as a business leader while allowing for a good work/life balance. Since P&G is a top destination company and builds from within, I work with intelligent individuals who have developed a mastery of their business function. Working with and learning from these individuals allows me to improve my business acumen and apply my understanding to new situations. P&G's ability to enable collaboration and develop business leaders is seen by its strong brands, but also though the number of individuals that started success companies after leaving the organization. Other Pros: * Ethical Company * Fortune 500 Company: Global and Safe * Competitive Compensation and Profit Sharing Program * Ability to change functions","Due to the size of the organization and number of brands involved, it takes a long time and significant amount of analysis to make business decisions. This process can be frustrating at times when the project has been approved, but then resources are pulled due to needs in other businesses.",Proctor & Gamble
1631,"""Excellent company to work for!""",5.0,"This company wants to see you succeed! I have not experienced micromanaging at P&G and as long as you stay on top of your work you will be able to work freely including two days from home a week. With a company this size it is possible to change careers without having to change employers, which is a great way to stay motivated throughout your career.","Working your way up can be a challenge as the leap from admin level to management level is very difficult to make. However, if you work hard enough anything is possible.",Proctor & Gamble
1632,"""machine technician""",4.0,* good amount of freedom *no close supervision which allows you to just focus on your job * always a task that needed to be done *good environment,there were no cons to the job,Proctor & Gamble
1633,"""Big Company""",3.0,Tons of great people at this company,Several not so great people,Proctor & Gamble
1634,"""It's the People that make the Company.""",4.0,"A company that truly does value safety, quality, standards, leadership. This is 'The' company that will challenge you, train you, and expect a lot from you. If you ever do voluntarily leave P&G, you will be one of the most marketable managers in the world. Total compensation is good to above average. Base salary + benefits + vacation/holidays + profit sharing is an overall very competitive package, especially after 5+ of employment. Pay raises are consistent, usually annual. And in general, work-life balance is good, but it greatly depends on the type of role you have. But P&G leadership overall supports a family atmosphere; whether it's big or small events or issues that you or your family are going through, they will work with you as much as possible. Our PVPs (principles, values, purpose) are lived everyday. It's not just a saying. Without them P&G would just be any other large corporation. And if you take the intuitive, you can build an amazing mentor network throughout the company, within many leadership levels. It's invaluable. Overall, P&G is part of my life, but not my whole life. Plus I have been able to support a very comfortable life for my family and I, and I value (and feel valued) for my contribution to the company.","Yes, your working for P&G, but in the beginning of your carrier your really working for (and hired for) a specific location. This is especially true in manufacturing- each one is a company it itself. Newer managers (millennials and Gen Y new hires) can be frustrated by this. A general expectation is to do 3+ roles (~2yrs per role) before getting support to apply for roles at another city or site. Just make sure you understand the expectations before you accept your offer. Perks- no traditional perks such as bonuses until a Band 3 position. Profit sharing %'s have dwindled for new hires over the past 10 years, which is a shame since this is the biggest financial incentive to stay with the company for your entire working career... Especially since there is no matching 401k contribution. Plus, profit sharing is 100% P&G stock, which has been flat for 7 years. Career planning: you have to learn the delicate balance of leading it yourself, without being pushy and unrealistic. And lastly, the consumer products business sometimes isn't the most exhilarating... We're not producing Porsche's or iPhones here. We aren't located in the most exciting cities, and we honestly haven't really had any big innovations in a while. But we are 'stable', in a world that seems to be constantly moving forward.",Proctor & Gamble
1635,"""Great training and experience""",5.0,I would recommend this company to everyone. It is a great place to work with the opportunity to step change your training and experience. If you are motivated and flexible you can navigate to keep stretching your skills. It is especially a great company to learn marketing but from a well rounded general management position ensuring your business management skills are developed. * Great training programs * Strong on the job training * Ability to move and gain new experiences,As with most big companies the complexity of decision making elongates the process and at times it is not clear who is the decision maker. * Very set and established processes * Large company thus long time to make decisions,Proctor & Gamble
1636,"""Amazing experience. Lots of learning""",5.0,Ethics. Learning. People. Promote from within.,Too centralized. Too many people asking questions and very few providing answers.,Proctor & Gamble
1637,"""It's not nearly the best company to work for, but it is one of the better ones.""",4.0,Great benefits package. Salaries are within top 10% of comparable companies.,Performance criteria is not administered consistently across assignments,Proctor & Gamble
1638,"""Finance Manager""",4.0,"Work life balance, pay, location","Many layers; bureaucracy, slow moving at times",Proctor & Gamble
1639,"""Great place for leadership training""",5.0,Lots of leadership and autonomy upfront. Lots of team work and collaboration. Great office culture where your colleagues are your friends. Lots and lots of training. P&G is known as the company with the best marketing and brand management training.,Very bureaucratic. Very slow to market. Every initiative takes months and months to launch and you have to align everything with too many stakeholders.,Proctor & Gamble
1640,"""Great Marketing Company""",4.0,Spend time and resources for great training,Too many bureaucracies which may slow innovation especially if your not patient.,Proctor & Gamble
1641,"""Great Learning Ground- Fight till you learn the most-if you dont grow use your knowledge outside""",4.0,"Most people you work with are decent, trustworthy. Good compensation, the company takes good care of you. Fairly flat organization. You can do whatever you choose to as long you connect it to the business and deliver. Amazing foundational value system called PVP. Very high ethics...","Too soft on low performers. Too many ""leaders"" and very few ""followers"". Everyone wants to lead and few wants to really work and deliver something. Some have rigged the system, so by simply playing enough politics they grow until they hit the wall...too much rope...they do finally hang but only after too much damage...even if you are a top performer, promotions are very slow...middle management is essentially powerless...Technically shallow...too much internal competition",Proctor & Gamble
1642,"""Great learning and growth opportunity.""",3.0,"Good benefits package, good pay, good opportunity to learn new skills","Leadership changes every 3 years thus does not provide stability and experience to the organization - not enough time, instead upset the processes and stability. Leadership does not always represent the company values instead are concerned about their career and movement, leaving the non-exempt workforce in their wake.",Proctor & Gamble
1643,"""very good company. Difficult to navigate because of size.""",4.0,Good company that does things right. great training,very big. difficult for promotion.,Proctor & Gamble
1644,"""Good but no longer great""",4.0,P&G is based on an incredible set of core values. It has great brands and a fabulous reputation for leadership development. It is a great place to be if you want to be challenged with a lot of responsibility and opportunity to growth.,"In some areas of the company, work life balance is out of whack. I have also seen several examples seemingly in contrast with the company's core values lately.",Proctor & Gamble
1645,"""Senior Scientist""",4.0,"People are wonderful, the pay and benefits are good, there are a lot of opportunities to move between business units or job functions.",The workload is challenging and the pressure to deliver is great. It is difficult to maintain a work-life balance even though there are many flexible work arrangements available.,Proctor & Gamble
1646,"""Great people to work with""",3.0,"Great leaders, lots of learning","Too slow, beauracratic, lots of politics, no longer people centric",Proctor & Gamble
1647,"""Don't practice what they preach.""",2.0,"Profit Sharing, vacation time, not much else is worth a pro","Poor Management, Pay in inconsistent with pay policies. Management has no respect for the operators abilities.",Proctor & Gamble
1648,"""Growing business by developing people""",5.0,"Focused on growing people, very demanding and the best in the industry",At times slow and bureaucratic,Proctor & Gamble
1649,"""comfortable culture, lacking speed""",4.0,"fantastic people, organization cares for employees. coworkers are self-motivated, with strong sense of ownership.","Bureaucracy, complex structure, self-constrained in innovation",Proctor & Gamble
1650,"""Great Company, Slow work""",5.0,"Great company, good people, good pay....","Work is not all that exciting, can be slow, political, and structured.",Proctor & Gamble
1651,"""Heading in the wrong direction""",3.0,"Good benefits, competitive salary, incredible history/stability",Decision making is slow at best. Middle management is rewarded for taking risk instead of delivering results. Company likes to say they hire the best employees when in reality they hire the best employees who are willing to live in Cincinnati.,Proctor & Gamble
1652,"""All about it""",1.0,"Good products, brands and distribution","Company is very hierarchical, slow in decision making and it works in your favor base don who you know and not what you know.",Proctor & Gamble
1653,"""Good company, lots of politics.""",4.0,"Good training and current benefits. Respected in industry, sense of company pride. Lot of job/location flexibility. Lot of responsibility in roles. Learn skills that can be applied in any future industry/role.","Slowly decreasing benefits and pay raises. Heavy time demands, poor rating structure for promotions. Not enough autonomy for leaders. Some good initiatives, but not a lot of satisfaction selling expensive consumer products.",Proctor & Gamble
1654,"""Outstanding people and principle-based company""",5.0,Global roles available. Great benefits including retirement plan that you don't have to match. Frequent change means that roles open up almost daily.,Frequent layoffs in certain parts of the company. Low morale because too much work for too few people. Be prepared to work often on nights and weekends.,Proctor & Gamble
1655,"""Good work experience, not the company many claim""",2.0,"Benefits are good, although they are getting more expensive. Nice people, culture is decently relaxed","Pay is awful. Management makes it sound enticing, but when you find out other companies pay 20-30k more for the same postion its a bit demoralizing. Absolutely no room for advancement. If you arent hired as a manager, its just about impossible to become one.",Proctor & Gamble
1656,"""Good Company to Work For""",5.0,"Salary, Team, Leadership, Professionalism, Benefits","Overworked, travel, yearly review, advancement, rating system",Proctor & Gamble
1657,"""Good job, horrible hours, no room for advancement, horrible politics""",2.0,"Great salary, a lot of paid time off for holidays, good benefits package, great company to work for","Terrible hours, mandatory 3 shift weekly rotation, no room for advancement, no positions available with a steady shift, forced overtime",Proctor & Gamble
1658,"""It is a great company to work for!""",4.0,"Great career and development training. It is great company to start your career because you will have the opportunity to work with a multifunctional team and have great projects. Also, the company constantly reinforce the importance of having diversity of people.","This company is soo big that some time it takes too much time to make decisions and people tend to be very internally focused! Also, when you are in the middle of your career it may be better to move to another company because it takes forever to get promoted despite of giving excellent results - you have to be extremely connect it to get it!",Proctor & Gamble
1659,"""Love my job here!""",5.0,Great people and values I trust no matter what part of the business I'm in.,"Very beurocratic, and caught up in sysrems and process which are general enough to be global in scope and not specific enoufh for anyone.",Proctor & Gamble
