,title,rating,pros,cons,company
539,"""Disappointing Leadership and Work Ethic""",2.0,Pay Work itself Good experience to leverage elsewhere,Immediate leader focused on getting ahead and little on own staff or quality of work Highly critical and judgmental leaders who themselves lack self awareness and humility Unethical behaviors by immediate leader Poor benefits overall compared others Long waiting period for benefits,HCA Healthcare
540,"""Registered nurse""",4.0,"Good pay and benefits, friendly atmosphere",Computer charting needs to be updated,HCA Healthcare
541,"""Assistant Director - Critical Care Services""",5.0,"Fantastic Company with amazing growth opportunity. S/O also works for HCA, plan to make career within HCA until retirement.","Growing facility, many areas of opportunity, but do not see this as a con!",HCA Healthcare
542,"""Pretty good overall, definitely room for improvement""",4.0,"Supports employee growth, flexible work from home policy","Low PTO, benefits get incrementally lowered each year",HCA Healthcare
543,"""Staff Accountant""",4.0,It is a really good culture.,The promotion system is vague and broken.,HCA Healthcare
544,"""Director""",4.0,Plenty of patients who need us,Limited staffing leads to high nurse patient ratios,HCA Healthcare
545,"""Director""",5.0,continous opportunities for growth within the company,don't have any cons about the company,HCA Healthcare
546,"""A good company""",3.0,Benefits and pay are good. I like that I can still contribute to my 401 if I switch to PRN. They really try to keep you in the system and work with you (retention wise). After orientation there is a breakfeast where you (as a fresh set of eyes) are invited to give your ideas for areas of improvement to management.,"Typical staffing issues, there are seasons when we work just barely getting by.",HCA Healthcare
547,"""Project Manager""",2.0,competitive pay Fortune 50 stability Solid entry level opportunity for new grads looking to get into healthcare/IT.,Extremely weak and problematic division management in the project management space. No project process maturity or standardization. Extremely limited opportunity for advancement. Extremely high turnover. No opportunity for either formal or informal professional development.,HCA Healthcare
548,"""Director""",2.0,Good intro job for admin .,Lack of focus and clinical integrity.,HCA Healthcare
549,"""Great company to work for!""",4.0,HCA provides opportunities to learn and excel. There are many promotional options available.,In some areas educational support is lacking.,HCA Healthcare
550,"""Division Compensation Director""",5.0,"Supportive culture, authentic and genuinely nice caring/professional people to work and build with, job opportunities, training, mobility, benefits, leadership all the way to the top that truly cares about all employees and each voice of each employee. I LOVE this company and the people who work for it, I have been here 2 1/2 years and I can't say enough good things. I am humbled I get to work with the people at HCA every day. There is not a company with more heart, and who gives more to communities and charities not only monetarily but also with paid volunteer days...the company and leadership are the mentors professionally, socially, and personally, that we all wish to follow the lead of.","Bigger companies can move a little slower than smaller companies, but rest assured that when we do move, we move deliberately and know exactly how we are moving and in which direction we are going.",HCA Healthcare
551,"""Stay Clear if you can!""",1.0,I enjoyed some of the people on my team. I was good at my job.,"Management, salary, raises, benefits, PTO, everything else. Upper management does not make decisions that are in the best interest of their teams. Turnover is extremely high. Someone was leaving every few weeks. It was a revolving door. Salaries are offensive. $14 an hour for an analyst position with a yearly raise of about 25 cents. Yes, 25 CENTS. (And some only received 20 cent raises) I was offered a similar job in Northern Va making 63k a year. I only wish my former coworkers would take the hint and find something better. No advancement opportunities and had to use PTO for holidays and whenever the building closed for bad weather.",HCA Healthcare
552,"""Sub par""",4.0,A wonderful transition into the expansion of knowledge as a PCT.,"Seems to have a tough time keeping employees, including management. Make it a more team oriented place to work.",HCA Healthcare
553,"""Patient Safety Manger""",3.0,Good Benefits and competitive pay,Difficult to form relationships between staff and managment,HCA Healthcare
554,"""Very good company""",5.0,"Good platform, good work environment",I can't think of any cons,HCA Healthcare
555,"""RN""",4.0,"Great teamwork , everyone is willing to help and answer any questions you may have. Lots of opportunity to grow as a nurse","Too much pressure for HCAp scores, pay could be higher. More opportunities for paid certifications would be nice. Better incentives",HCA Healthcare
556,"""Medical office""",3.0,"Good benefits , 401k matching great",Not a lot of room for moving up,HCA Healthcare
557,"""There for the love of my patients""",3.0,This company is willing to train newly licensed also take students in and extra small benefits to add as an incentive.,This company is proud of running on a slim staff and always short of staff and pay is lower than some competitors,HCA Healthcare
558,"""Csr""",2.0,Great atmosphere new building clean place,"Bad management , no communication turnover rate high",HCA Healthcare
559,"""Love my work family and positive environment.""",3.0,"Love the staff I work with, positive attitudes, happy patients. Flexible scheduling - we have input into. Love my director!","Salary in the lower range, tiny raises. Salary caps for long time employees. Food and restaurant options are poor at the facility.",HCA Healthcare
560,"""Good place to be""",4.0,"High caliber colleagues, great physical work environment (gym, cafeteria, etc), good flexibility, great company reputation in the community.","There is some focus on pedigree and/or politics can drive advancement opportunities. Also, there is some tendency to fill highest level positions with external candidates.",HCA Healthcare
561,"""HCA""",3.0,Steady workflow in the department,Condescending management. They have their favorites and will come together to get you out of the door.,HCA Healthcare
562,"""It's HCA....""",2.0,good benefits. flexible schedule. n/a...,poor management styles. corporate structure. lack of support.,HCA Healthcare
563,"""Registered Nurse""",1.0,Trauma center with small town feel,Below market standard pay. Difficult to learn hospital workings to prepare for promotion. Stagnant management.,HCA Healthcare
564,"""Unsafe nurse/ patient ratios""",1.0,Great nurses to work with. They hire wonderful people,Unsafe nurse/patient ratios. No raises,HCA Healthcare
565,"""Cath Lab Tech""",1.0,There is always a job opening!,Turn over for staff! The hiring of not qualified management runs off good employees.,HCA Healthcare
566,"""Making us take 7 at nights regularly""",3.0,"love my coworkers, schedule is flexible",7 patients frequently too few techs new charting system is terrible,HCA Healthcare
567,"""Excellent Place to Work!""",5.0,"Opportunity within the company to advance and develop, many hospitals around the nation, care for patients and employees",positive comments to share right now,HCA Healthcare
568,"""The corporation itself is great but it's only as good as its weakest lank.  To many negative alms rude employees.""",5.0,"The OR Director in Lake Worth , Fl is fanatical. I would move anywhere to be on her staff. HCA is very lucky to have Beverly Lindsay.",As with any large company lack of communication. Communication with such a diverse population can be very difficult.,HCA Healthcare
569,"""RN""",1.0,there are no pros to this company,they do not respect licenced creditialed proffessionals,HCA Healthcare
570,"""Healthcare""",4.0,"My facility is friendly, and cares for its employees. I am satisfied working here.",It sometimes takes a little while to get approval to fill vacant positions.,HCA Healthcare
571,"""Tech""",4.0,Great environment friendly and nice,Busy but Ok all work is busy in a way so it’s ok,HCA Healthcare
572,"""RN""",4.0,Education reimbursement and opportunities to transfer,Cost of health insurance,HCA Healthcare
573,"""Great company""",5.0,Very friendly and helpful staff,Shift dif. Including nights and weekends,HCA Healthcare
574,"""Retired""",5.0,Enjoying my retirement for a long time now.,Gets bored at times and I desired to return back to work.,HCA Healthcare
575,"""Leadership Challenges""",3.0,"Flexible hours if in role/department that allows it, tuition reimbursement","Leadership turnover, multiple projects with unmanageable deadlines.",HCA Healthcare
576,"""I love the PNCU at HCA Forest!""",5.0,I really enjoy working on the PNCU as I have gained an abundance of knowledge and have amazing support from my coworkers and management.,"Offsite parking, No free lunches",HCA Healthcare
577,"""Specialist""",5.0,Flexibility with hours and days,No cons at this time,HCA Healthcare
578,"""Medical Assistant""",4.0,I like the company and manager,"Low wage for how much we do, low raise each year. Always get declined off",HCA Healthcare
579,"""Analyst""",3.0,Opportunity for growth within the company,Time off during Holidays for none patient care could be better,HCA Healthcare
580,"""Some things in life are still free!""",1.0,There is free parking for employees.,Employees park several blocks away and have to take a shuttle in to work (or hike).,HCA Healthcare
581,"""RN""",3.0,"great pto, retirement, and health insurance (if you use HCA facilities)","company focused on money before patient care, seem to rush patients in and out",HCA Healthcare
582,"""Lucky to work here.""",4.0,Hca is king in the industry so you get to learn a lot of you work at Hca. Awesome experience.,"No bonus, Pay rise is very less, HR Department is little hard on H1B employees. I have no more complaints",HCA Healthcare
583,"""Great place to work""",4.0,"Wonderful people to work with. Great schedule. Clean, professional, modern facility. Very good patient reviews. Caring and competent supervisors. Nice garden.","Low pay for experienced RN’s. So-so cafeteria. Having to work with mountainstar’s transfer center is a nightmare. Feels like instead of working with us, they are working against us.",HCA Healthcare
584,"""Patient Access""",4.0,Fast paced. Good coworkers.,"Lots of chiefs, so frequently getting conflicting direction.",HCA Healthcare
585,"""Review""",3.0,Great coworkers and physicians. Good schedules,Management issues. No consistency.too many politics.patient care should always come FIRST.,HCA Healthcare
586,"""Horrible Company""",1.0,There are none to report,Their ethics line is a joke Management can treat employees however they like and nobody will do anything about it,HCA Healthcare
587,"""Instructional Designer""",4.0,Fun and caring people; they really want to make a difference,Things move slow on decisions from management,HCA Healthcare
588,"""Good learning experience, not for long term.""",2.0,"Great training and learning experience. Co workers were great to work with, always willing to help each other. Overtime was always available if you wanted it.",Acuity of patients and staffing rations felt unsafe and very stressful. Management is more concerned with “pt surveys” then actually helping pts.,HCA Healthcare
589,"""Rn""",2.0,Union working to solve problems but it takes a long time to turn a culture of money first to patient first Possible to work as much ot as you want.,Mandatory overtime. Can run as much as 22 hours straight. Weekend call in operating room is 16 hrs average per day,HCA Healthcare
590,"""Director""",5.0,The people and company are great.,There are no cons to working here.,HCA Healthcare
591,"""Good place to work under the right leadership""",4.0,Company really cares about their patients and providing high quality health care. Benefits and pay are decent. Employee appreciation activities are held a few times per year and it’s nice to feel appreciated.,"Too often leaders are chosen because they are good at, or certified in their field, which when working in medicine does not always equate to a good leader (especially if their field of interest is not at all patient facing or required any social skills - like in a lab for example).",HCA Healthcare
592,"""RN""",4.0,"salary, benefits, patients and families",some of the culture in certain departments,HCA Healthcare
593,"""Psych RN""",5.0,"Good people , nice facility , great benefits",Lack of continuity of care focus,HCA Healthcare
594,"""Great until it wasn’t...""",2.0,If you want to work in the medical field HCA is a decent place to start. There are opportunities to move up or transfer within the company which is nice.,"Most of the cons are specific to the practice I worked in but I think it stemmed from the head- which is a for-profit medical corporation. There is extremely low pay/yearly raises for experienced employees. I personally saw patient and employee safety at risk. When concerns were brought to management nothing was done even though several employees asked management several times for a response. When corporate compliance was brought in, nothing happened either even though a swift follow up was promised. In the situation I witnessed, HCA covered for an incompetent management team that put patient and employee safety at risk. Our practice had 5 managers in 3 years and most employees who could leave the practice, did just that. Our practice was then short staffed and the few employees who remained were expected to sacrifice their sanity and personal lives for the good of a practice that did not care about them.",HCA Healthcare
595,"""OTR/L""",3.0,HCA has alot of locations and options for employment.,Management had too much time on their hands and was not forthcoming.,HCA Healthcare
596,"""Sub-par public company""",2.0,The usual benefits one would expect from a large publicly traded company.,"Hourly employees are limited to 40 hours per week with no OT offered period. Salaried employees work 70+ hrs a week. No work life balance. It takes almost 3 months to get benefits (medical, vision, dental, PTO) which is longer than most.",HCA Healthcare
597,"""Meh for my division""",3.0,Not a lot of work to do other than busy work. As a PM it's all about babysitting people.,Babysitting people that get paid hourly. As a manager it's tough being in between the doctors and corporate superiors. Working with doctors who don't really care about how the clinic is managed.,HCA Healthcare
598,"""Not sure yet""",3.0,Hired direct out of school to resident training program which is great for new graduate nurses. Nurse staffing ratio seems better than other facilities in the area. Starting pay for a new nurse directly out of school was reasonable. Union facility.,"New graduate training program needs to focus more on usable information. Pay should be comparable to area rates. Patient safety is said to be top priority including hourly rounding yet we often do not have appropriate staffing to accommodate this. since we usually do not have CNAs, I spend so much time chasing the hourly rounding call lights in addition to regular patient requests that all I do is chase call lights all night. VERY limited time to actually provide nursing care or education. The medical benefits are horrendous especially for a health care facility. We should have some of the best healthcare coverage available since plans require use of our own facilities. I had better healthcare coverage working at a non-healthcare related company.",HCA Healthcare
599,"""Great place to work""",5.0,"Great culture it feels like you are part of a family. It is a beautiful facility, lots of opportunity to grow within the hospital and the extended HCA network.",Far from home but is in such a beautiful location by the water that the drive is worth it. Would like to see another food option on campus.,HCA Healthcare
600,"""Mercy Hospital""",4.0,family friendly environment beautiful location great views,Cafeteria food could be better Location is far from home,HCA Healthcare
601,"""Rn icu""",5.0,Good place to work at.,No con a good place to work,HCA Healthcare
602,"""HR""",4.0,Great Company. Great Pay. Work Remote. Work Life Balance,Nothing to Share. Positive all the way around,HCA Healthcare
603,"""Tech""",3.0,"Nice, hard working people working there. Everyone knows your name.","Pay is below average. They say that HCA has equal pay, but I am still making less than entry level is today. If asked about it, upper management says, you must leave for better pay. No loyalty in this facility. Amazing talent is leaving every week for better pay and recognition.",HCA Healthcare
604,"""HCA""",4.0,Good company culture. Good mangement.,Average salaries and benefits. Difficult to recruit good talent.,HCA Healthcare
605,"""RN""",2.0,"Big corporation perks, transfer opportunities","low pay, lacks upkeep with facilities",HCA Healthcare
606,"""Work Environment""",3.0,"Friendly staff, non-threatening environment overall",Meditech EHR needs an overhaul,HCA Healthcare
607,"""Potential for Greatness Unfortunately Falls Short""",2.0,"Health, 401K, Tuition Assistance, and positive impact on patients.",Middle & Upper management lack operational experience and industry related certifications/degrees.,HCA Healthcare
608,"""Director""",2.0,HCA is a large organization with deep pockets. It has staying power in the uncertain healthcare area.,"HCA spends far too much time on vanilla and trying to make every hospital identical. While I understand how much easier this makes it for the upper echelon to micro manage their facilities, it takes away from an organizations ability to provide exceptional care to the community it serves. It's a difficult place to survive as a middle manager.",HCA Healthcare
609,"""Division Consultant""",5.0,benefits growth ability to repocate,large network navigate difficult,HCA Healthcare
610,"""HCA experience""",3.0,"HCA is a huge corporation all over so if you decide to move, you can transfer to another HCA facility and not loose vacation, PTO, benefits Friendly, helpful and positive atmosphere","Total cares with 5-6 patients is not safe for the patients or the nurses, aides are needed at least at the beginning of shift until things settle until half shift",HCA Healthcare
611,"""Talent Acquisition""",5.0,Patient safety is one of their main priorities. They offer tremendous career advancement. They are quick to support employees and their families in light of disasters like Harvey and Irma.,"Not necessarily a con but as HCA grows they need to ensure that they do not lose sight of what really matters, the patient",HCA Healthcare
612,"""Resident Physician""",4.0,good benefits in network and supportive staff,large organization with little bargaining power,HCA Healthcare
613,"""Certified Medical Assistant""",4.0,Great company to start off and learn.,"Lack of merit increases, no bonuses.",HCA Healthcare
614,"""Sourcing Team""",5.0,I love working for HCA. They are committed to making a great working environment for all of their staff and truly care about their employees. I have never worked for a company that was so committed to the educational advancement and training of their employees. Additionally they have so many opportunities for advancement. They also give back to the community and their own employees. They have given generously to community causes as well as being committed to their own employees that have faced crisis with the hurricanes recently. Really inspiring place to work.,Don't have any complaints at all. I love what I do.,HCA Healthcare
615,"""Director of Chaplaincy; Chaplain; Clinical Pastoral Education Supervisor""",2.0,Freedom to operate and direct the Chaplaincy program,Contracted employee for three years. False promises of full benefits never fulfilled.,HCA Healthcare
616,"""Saint Petersburg General Hospital do not go there horrible""",2.0,Decent pay great coworkers decent benefits,Severely understaffed most of the time. If you cherish your nursing license or CNA license don't go there. This is a very scary place to work for the patients especially,HCA Healthcare
617,"""Recruiter""",5.0,Excellent Organization with much growth potential,I can't think of anything.,HCA Healthcare
618,"""Registered Nurse""",3.0,Great team work with most doctors and fellow coworkers.,"Pay, not enough people to provide adequate care, no change in broken processes, high turnover rate.",HCA Healthcare
619,"""Great benefits & environment - high stress""",3.0,Worked with excellent people and had wonderful benefits.,The company culture is a very cold corporate culture and is a high-stress environment.,HCA Healthcare
620,"""Mammography Technologist RT. (R )(M)""",1.0,Great place with future possibilities,Technical Quality out Dated and the same since 2010,HCA Healthcare
621,"""ARNP""",4.0,Great hospital to work for,"Far from home, commute too long",HCA Healthcare
622,"""Rn""",4.0,Hca is a Great company,Need more staffing to work,HCA Healthcare
623,"""Rn""",4.0,"People, benefits, OT, Seasonal Contract","Pay, staffing shortages, patient load",HCA Healthcare
624,"""One bad apple really can ruin the whole bunch""",3.0,"Great benefits, pretty good bonus structure.","Leadership was poor and did not respect their subordinates. This unfortunately, reflected poorly for a company that , overall, wasn't too bad",HCA Healthcare
625,"""registered nurse""",2.0,good benefits good pay good supervisors good team work .,letting people go absentee policy work force reduction lay-off.,HCA Healthcare
626,"""Nice first or second accounting position""",3.0,Learn a lot with a ton of support,"Such a large company, you may only gain experience in one aspect of accounting.",HCA Healthcare
627,"""Good Company""",4.0,Professional atmosphere and excellent work environment,Senior Management to be more in touch with staff,HCA Healthcare
628,"""Corporate is in the name, but Family is the reality.""",5.0,"The environment at HCA is like family. The management is extremely supportive, down to earth, and greatly encourages you to continue rising in the company. HCA has great benefits including healthcare, matching your 401K at a very competitive rate versus other companies, and even pays thousands for your education every year. There is a ton of opportunities to building or continuing your career at HCA and management always encourages you to find the position that suites you most and doing what you love to do. I did not enjoy my first position (although I loved my coworkers and management) and I was able easily transfer within the company and find another position.",HCA is driven for cost effectiveness and efficiency which is great for the company but can sometimes overwork their employees.,HCA Healthcare
629,"""Lab Assistant""",2.0,Corporate benefits with quality hires.,Workload increase does not equal more staff....lots of turnover and burn out throughout hospital. M.D. groups are quitting HCA...gotta wonder why...,HCA Healthcare
630,"""Cheap""",2.0,Great co workers. Qwerty qwerty the way home tonight at walmart and would love to all is well,Run so different than any where else. They flash all day long. Can't get enough hours. Send you home asap.,HCA Healthcare
631,"""Manager""",3.0,Not a fun company to work for,They only care about numbers,HCA Healthcare
632,"""Coders are treated with zero respect""",2.0,"Good benefits, work from home","If you are a medical coder you are at the bottom of the food chain and HCA makes you work long month end hours because they can't get the providers to put in their charges regularly - so they are all dumped at the end of the month and the coders have to work furiously, even on holiday end of months and weekends - no exceptions and time off is denied for end of month.",HCA Healthcare
633,"""Area Practice Manager""",3.0,lots of jobs in other cities/states,"benefits, PTO, medical, vesting, management out of touch",HCA Healthcare
634,"""Experience""",3.0,Gain experience about different procedures and different exams. Care with regards to those procedures. Gain clinical experience and coordination of care.,Too little flexibility in getting day off and no set schedule. They pay you way less than other companies. You have to pay for the health insurance and it is not good at all.,HCA Healthcare
635,"""Great Company""",5.0,Mission driven company that also excels at operations. This company takes care of its employees too. Very friendly and almost family like culture even though it is a huge fortune 100 company.,I have no cons identified after working for this company for over 15 years.,HCA Healthcare
636,"""Registered Nurse""",1.0,Comprehensive benefits and competitive salary.,"Patient care and safety are secondary to paperwork and billing. A greater emphasis was placed on discharge than on whether the patient had systems in place for at home care. ""Not my problem!"" attitude. Charting programs are behind the times. Would not feel safe as an employee or as a patient.",HCA Healthcare
637,"""CPA""",4.0,"Great people, good pay and noble service.",More clarity on upward career path.,HCA Healthcare
638,"""Pct""",4.0,Good health insurance and eye insurance,Low wage and over worked,HCA Healthcare
639,"""TriStar Southern Hills Medical Center""",5.0,"Great work environment, with great friendly co-workers, state of the art technology and communication devices.",ER could be enlarged and wait times shortened.,HCA Healthcare
