,title,rating,pros,cons,company
0,"""Great job""",5.0,"Nice environment and every is friendly, weekly pay",I don’t know if they give you the option to go to day shift,Fedex
1,"""great place to work""",5.0,great coworkers and management is awesome,very low pay with little consideration for increase,Fedex
2,"""Great company""",5.0,"Advancement, Benefits, pay, diversity, culture",No cons that I’ve ever thought of,Fedex
3,"""great company, leadership needed in mid-level management""",4.0,"Good benefits, good internal collaboration","Post sales support weak. Pressures from ""soft global economy"" hurting US but really lingering TNT integration issues.",Fedex
4,"""Fulfilling job""",4.0,"Great benefits, good brand, great people Good brand... Great people",Long hours Not diverse Pricing is a huge issue,Fedex
5,"""Nice""",5.0,Great place to work at,I couldn't find any cons,Fedex
6,"""Fast pace , but well organized""",5.0,Safe and friendly atmospherem with the big responsibility,Do you have to be fit it’s a hard heavy demanding job,Fedex
7,"""fed ex""",5.0,good place to work for,i don’t know love it here,Fedex
8,"""Great""",5.0,Hours not enough for the market,Money not enough for the market,Fedex
9,"""Work was not worth the pay""",3.0,Flexible hours and decent benifits,Low pay for work required,Fedex
10,"""Work was not worth the pay""",3.0,Flexible hours and decent benifits,Low pay for work required,Fedex
11,"""Controlling""",3.0,The people here are amazing.,"In ten years u only receive the annual 1-3 percent raises as a gen x single woman I live paycheck to paycheck. The beauty of the job was freedom and room to breathe. They now micromanage u to death and monitor your every move. So if u have a headache at 5 pm and want to enter your calls the next day. Forget it they will hound u to a point that the lack of financial improvement is no longer tolerable. Also, sent my director an email how I made another operating company at the company another 100k that I don’t get credit for and he ignored me. As a woman u r treated less than because u r not part of the boys club. Now this is just my region. Everywhere else I feel woman r respected. No one cares if u closed a 5 mil account net rev because that was yesterday. No one ever recognizes what u do however it is noted to go somewhere else if u don’t like it.",Fedex
12,"""Good place to work""",5.0,Good work environment and culture,"Less Vacation, more premium for Health insurance",Fedex
13,"""Great Company""",4.0,This company has great benefits,I have no cons about this company,Fedex
14,"""Package handler""",5.0,Fedex is a Good company,Few hours most of the time slow,Fedex
15,"""Great Place to work""",5.0,Great managers fair but good demanding,over worked exceptions are very great,Fedex
16,"""FedEx jobs""",4.0,Great insurance for a part time job,Need more hours not enough,Fedex
17,"""50/50""",3.0,Keeps you in a shape and fit,Not enough money for the amount of physical work you put in,Fedex
18,"""Great benefits and culture, lacking growth opportunity.""",4.0,"Stability, Benefits, culture, work life balance.","Difficult to make bonus, micro managing, not much incentive to sell.",Fedex
19,"""Great company to work for""",5.0,Good salary and benefits. Stable company,There are no great con's that I can thinks of,Fedex
20,"""Driver""",4.0,okay job to work at,leave out late morning and get back late,Fedex
21,"""Fedex freight""",3.0,Decent pay and Monday though Friday holidays off,Cut times are very strict gets stressful,Fedex
22,"""Fed ex""",4.0,Not long hours good for college students or to have as a second job for extra money,Waking up extremely early in the morning,Fedex
23,"""The core is sinking""",2.0,"401k, benefits (although medical getting bad)","Strong assets not appreciated, the lazy incompetent are going no where.",Fedex
24,"""ok but could be much better""",3.0,"decent hours, although they were not always consistent","instead of hiring more people, they increased current workers work loads, which at time could be too much for one person. And the [ay was not that great for the amount of work you had to do.",Fedex
25,"""Cool place to work""",5.0,everything is good here no problem,no cons at the moment,Fedex
26,"""Decent Job Weird Hours""",4.0,Pay is good for starting out. Very forgiving for being late and works with you well.,2 hours or shorter shifts. Rarely got over 10 hours a week. Long commute made it not worth it.,Fedex
27,"""Good benefits""",3.0,"Good benefits, structure, proven successful company","Split shift hours, seniority based vacation planned at beginning of year, yearly raises were about 3%",Fedex
28,"""accounting support staff""",5.0,career opportuniities are posted internallly,advancement relies on hiring panel consensis,Fedex
29,"""Questionable practices""",2.0,Got to help customers make their project ideas into reality!!,Constantly forced to skip lunch,Fedex
30,"""Good Company""",5.0,"ability to move up, Great benifits","Long Hours, cold warehouse, dangerous",Fedex
31,"""Fortune 500""",4.0,Decent pay and benefits,Below competitors salaries and no Union,Fedex
32,"""Cat and mouse""",3.0,The pay is decent The insurance is awesome,Stay part time to long. Sometimes only17 hours a week . Kinda hard to pay bills like this,Fedex
33,"""Ok pay for the job""",3.0,"ok pay, part time, benefits from day one, room to grow","so cold in the winter, was constantly sick even after bundling up, definitely need to get some type of climate control system",Fedex
34,"""uunjuunnu""",5.0,fun flexible chill good hours not to busy,mad custmers boring happy sad,Fedex
35,"""Great Company....until recently""",3.0,"Wonderful co-workers, good overall culture, good benefits on par with other companies), interesting work","Upper management, low wages, little room for growth unless you relocate to HQ thanks to recent changes by upper management",Fedex
36,"""Actually not that bad, juss cold during winters""",5.0,"Overall light lifting, some heavy",Not a climate controlled facility,Fedex
37,"""Fast-paced, think on your feet""",5.0,"Opportunities to move up, Benefits and Structure",Contractor business model Variables of dealing with Contractors Your Novembers and Decembers are focused on FedEx,Fedex
38,"""Pay is not worth it""",3.0,SOME coworkers help each other out and the managers do not treat the employees below themselves. Management genuinely cares about employees and get to know everyone.,There is too much work and not enough people showing up to work. Sometimes working 3 hours a day. There are HEAVY boxes so use proper lifting or your back will be hurt.,Fedex
39,"""Great place to work for""",5.0,"The pay, the insurance and people",Nothing that I can think of,Fedex
40,"""Dont work too hard, previous store manager""",3.0,"If you're under the right manager, you'll learn and promote fast. The pay is great coming in as a external hire, which sucks for people who have there for years because 9 times outta 10 you are making more than them and THEY are training you. Their benefit packages are great, vacation, sick days, floating holidays, 401k, medical and dental. You can grow with the company.","They will fire you quickly! There is no loyalty, doesnt matter if you've been there 5 days, 5 years or 25 years they will get rid of you. Like I mentioned before new external hires are coming in making more than current employees which has brought down the moral. It's a very fast paced environment and they aspect soo much of you, sometimes the pay doesnt seem worth it. The com6is CONSISTENTLY rolling out new procedures and products so you always have to make sure you are on top of it, because if you're not they will discipline you.",Fedex
41,"""Pay and Hours not worth the Labor""",3.0,The people you meet and work with make the job less dreadful,No room for growth Pay is not worth it they do not care to give raises no matter how long youve been there if injured on the job they try to make it seem like it was your fault in order no to pay you compensation.,Fedex
42,"""Excellent""",5.0,Great job and place to work,"None, the atmosphere is great",Fedex
43,"""backend java developer""",4.0,"flexible work day, friendly environment",other developers in memphis are most likely to get more pay and vacation,Fedex
44,"""...""",4.0,Pay is okay after training,No benefits At all contract position,Fedex
45,"""Great Place to Work!""",5.0,Company culture is great. They really care about their people.,There are no cons in my experience,Fedex
46,"""Never work here""",1.0,Pay is good and paid weekly,Management is the worst out of all jobs I have ever had,Fedex
47,"""Good job""",4.0,"Pay, room for growth and pay",Micro managed. No hours or overtime,Fedex
48,"""Its was pretty fun""",4.0,You could dubble when you wanted to pick up and extra shift,they over work the good workers,Fedex
49,"""Great!""",4.0,"Benefits are great, pay is good. Paid vacation and sick time is standardized to start at 2 weeks paid vacation, 6 floating holidays, and 80 hours of sick time, and gain more the longer you work there. Annual raises.","You don't get many holidays off besides the major ones. People can be a bit difficult to deal with internally, but you get through it. Takes FOREVER to actually get you through the interview process and started working there. Just decreased their annual raise amounts to 2%.",Fedex
50,"""Drivers are paid great""",5.0,Job is great good pay,Really not thing bad about the company,Fedex
51,"""Fedex""",5.0,"Fair wages, good management, and lots of possibilities for growth. They really put a lot of focus on development.",Has the normal sort of cons of all retail jobs due to their nature.,Fedex
52,"""You Know What you signed up for""",1.0,They are always hiring and pay decent,They're about saving Money more than respecting employees. Hours are Short. Communication can be poor.,Fedex
53,"""Progress4""",1.0,Excellent service - full menu of shipping services,Not a lot of team commeratory,Fedex
54,"""Fedex""",4.0,Benefits Hours Flexibility Work on your own,Management Pay No communication No accountability,Fedex
55,"""Solid Company""",5.0,Take pride and ownership of all customer relationships.,No cons to report of.,Fedex
56,"""Pretty good place to work""",5.0,Managers are really nice and helpful. Pay is decent too.,It’s physical work. Sometimes boxes are really heavy,Fedex
57,"""FedEx is a Great place to work!""",5.0,FedEx still offers great benefits!,Make sure employees have a healthy work life balance.,Fedex
58,"""great benefits""",5.0,"amazing benefits even for part time...tuition reimbursement, ability to apply for jobs in the US &amp; around the world","no cons, overall very pleased",Fedex
59,"""Fedex Express Dangerous Goods Agent""",4.0,Competitive pay and benefits even for part time.,Lack of involvement from leadership.,Fedex
60,"""Good""",4.0,"Nice benefits, good pay, work load","None at this time, neutral",Fedex
61,"""Courier""",3.0,The benefits ok but gets worst each year,"Company Management is horrible, don't care of about employees anymore. Courier pay is not competitive .UPS drivers make more than $10 per hour than we do ...Take forever to top out and its get worst each year with penny on dollar raises although living expenses rises",Fedex
62,"""Great Company""",5.0,"401k, Health ,Vision, Dental Education Promotions",None at the moment,Fedex
63,"""Do not work here""",1.0,There are no pros to working here,"The pay is horrible for the work you do, no benefits, contractors do not have your back with FedEx management, and the list could go on.......",Fedex
64,"""It's what's to be expected""",3.0,No one on your back,Expected to be there everyday,Fedex
65,"""Physically tough""",3.0,They Promote from within so it's a foot in the door.,"Its Extremely physically demanding. Depending on your area, it could be heavy packages that you'll lift all day.",Fedex
66,"""good place to work""",3.0,great work environment optimistic people,long working hours being psychically tired,Fedex
67,"""Good and bad points here""",3.0,Opportunity to travel or relocate,Compensation is not on par with competitors,Fedex
68,"""Good as a bridge to new career""",2.0,"Lunch break, paid holidays and PTO","Unreliable work schedule, unreliable pay",Fedex
69,"""have to look out for yourself! Managers are mainly worried about meeting daily goals!""",2.0,"tons of over time available, priority goes to full timers",either early morning hours or late evening hours! and high turnover so you may see someone one day and not the next!,Fedex
70,"""It's a job""",3.0,It's a job that brings in a check,Not enough hours to live off of,Fedex
71,"""Excellent""",5.0,Lots of learning from down level to grow up.,Working hard but easy to work.,Fedex
72,"""Great""",4.0,Great place to work + awesome benefite,None listed for fedex currently,Fedex
73,"""Taking care of more than 100 employees""",4.0,"Good benefits, Good Opportunities, Good pay Huge Building",Less hours Long Route Less Staff,Fedex
74,"""Decent Job""",3.0,You can make some money and a career there if you're dedicated.,"Depending on what you're doing it can be back breaking work. Some people work, some people don't. Be prepared to take up others slack.",Fedex
75,"""Okay place to work""",3.0,"like a family, most people are nice and helpful. Others are tough but willing to help.",Strenuous. Not great if you bruise easily.,Fedex
76,"""Terrible""",1.0,Steady work no pros for this ompany,Terrible manager who mistreated employees,Fedex
77,"""Sucks Balls""",1.0,Not a dam thing is positive,Worse placed I've ever worked in my life,Fedex
78,"""Low pay fun job going""",3.0,Something new everyday meeeting new customers,Pay and long hours,Fedex
79,"""Pay""",4.0,Good pay meet new people,Long hours no benefits offered,Fedex
80,"""Lots of toys, not enough toymakers""",4.0,Lots of systems to work with along with many specific interactions with each.,A somewhat disorganized support map for many applications,Fedex
81,"""Well Balanced work-life""",4.0,"Flexible timing, Unlimited WFH, Transparent Management, Work-life balance","Technology Stack, Lengthy approval process for new technology or product",Fedex
82,"""Package handler""",1.0,Many schedule options Great job for students or people looking for extra work,4 hour shifts get cut down to 2 or 3 hours a lot. Get treated like you are expendable no matter how hard you work. Low income opportunity.,Fedex
83,"""Good company to work for""",3.0,"401k, small raise every year.",Wish pay was more for what we do.,Fedex
84,"""Good Company, Needs diversity in management""",5.0,"Good Job, Pay was good",There are plenty of other ethnic groups that are qualified to be managers. Give them a chance and the business will grow.,Fedex
85,"""Honest days pay, hard work.""",4.0,Everyone works hard in a team environment,Unrealistic expectations some managers have on progress.,Fedex
86,"""..""",4.0,Good culture to work at.,Low pay at this company.,Fedex
87,"""postal clerk""",5.0,because it has fastest delivery post system in around the world at large.,I just want to say they have to need competent people to help efficiency on the job,Fedex
88,"""Cool entry level job""",5.0,"Short hours, consistent schedule, Management was nice",Early morning hours. hard work,Fedex
89,"""Great Opportunities for Advancement""",4.0,Great Pay &amp; Benefits Amazing Training Respected Brand,Difficult Incentive Pay Layout Too many meetings,Fedex
90,"""Ok""",4.0,Ok for time the being,Nothing really just work on time,Fedex
91,"""Great place to work""",5.0,"Good and fair pay, get payed weekly, good management","Minimal hours, maybe 17-23 a week",Fedex
92,"""Security service""",5.0,Good job pay it right,None very easy after a while,Fedex
93,"""Great company with good benefits""",4.0,Amazing Culture to work in,Lots of bureaucratic red tape,Fedex
94,"""Local Management is Key""",4.0,Great Coworkers Team Atmosphere Good Benefits Superior Brand Recognition,"Sales is responsible for everything- from billing issues, lost packages, driver issues and integration.",Fedex
95,"""This place sucks""",1.0,"None. Well maybe the exercise, but nothing else.",Too much to say. I can see why the company is going down the tubes.,Fedex
96,"""Great place to work""",5.0,"Team Atmosphere, Advancement Opportunities in Memphis",Consolidating some operations to Memphis,Fedex
97,"""Fast paced""",4.0,Good pay and benefits. The hours were good so I can go to school in the day,"Subject to poor Weather/very physical,",Fedex
98,"""Great Place to work""",3.0,The culture in the company is great.,None at this point of time,Fedex
99,"""Good company in total""",4.0,friendly environment; work life balance,low salary; easy works; lots of elder workers spend more than 20 years,Fedex
100,"""Good job""",4.0,Good job and decent pay,Management sometimes plays favorites with employees,Fedex
101,"""Great Opportunities, Great People""",5.0,"The people make the culture, and there's always opportunities to connect with other folks in the IT areas. Technology drives the ability to help deliver for the company.","Delivering on projects is key to the teams' success and in trying to beat the competition to the market. It's sometimes demanding on work/life balance, but management really helps in those situations.",Fedex
102,"""It is what you make it""",3.0,Good work-life balance Room for growth,"Your career progression depends on your manager. If you have a solid management chain, you can be promoted quickly, if you put in the work. All too often, managers only base promotions off year off experience, not merit. Luck of the draw.",Fedex
103,"""Challenging Career""",5.0,Working in FedEx was interesting. You will meet any kind of people with different attitudes towards you. What’s challenging? Is when you change their bad mood into moderate to great.,In any unusual situation can be divert to something that you want to be.,Fedex
104,"""New Drivers get stiffed on hours""",2.0,Good starting pay and Health insurance.,Top 10% of drivers get overtime every week. While the bottom gets less than 27 hours a week.,Fedex
105,"""Richard Smith will be CEO soon""",1.0,"Stable company, takes care of employees",Limited growth for everyone while the Chairman's son has risen through rapidly. He will be CEO soon while other qualified candidates are pushed aside.,Fedex
106,"""not bad""",3.0,u work alone and at your own pace,pkg handlers are horrible so u will reload ur whole truck when u get there ; sometimes time works against u during route,Fedex
107,"""Benefits of working at FedEx""",5.0,There are many positive aspects to life at FedEx. The company is constantly evolving and preparing for the future. It is refreshing to work for an organization that prepares for the future not reacts for the future,There are many changes and some can see that as a negative but in reality the evolution is a necessity.,Fedex
108,"""Hard work""",3.0,Option to transfer to other stations or departments,Pay doesn’t reflect the amount of work needed to do.,Fedex
109,"""Driver""",3.0,Decent pay for no experience,Poor work hours and management,Fedex
110,"""IT Advisor at FedEx""",3.0,"Great work/life balance, WFH when needed. Solid company, rarely ever lays anyone off. Job security if you do your job is never in doubt.","Annual merit increases are tiny. Company has gotten too big, takes so long to get anything done.",Fedex
111,"""It’s good""",4.0,"I have some health problems and each time I’ve had to call in, they are very understanding. Same with vacations that were planned in advance.",The early shift but I prefer that over the evening shift.,Fedex
112,"""I help delivery drivers mark packages and load their trucks daily to ensure proper deliveries are made.""",4.0,Learning how to handle any conditions in a workplace.,Working the day after holidays.,Fedex
113,"""Good paying work""",3.0,Good pay Cafeteria Benefits Clear-cut directions Opportunity for advancement,"Physical work: good posture goes a long way and being healthy Rude co-workers or management: people can go off sometimes and really start some drama Time off: You get Monday off gauranteed, and then one more day that isn't Friday, Saturday or Sunday and people rarely get Tuesday off. 2 weeks vacation after a year. You only get a handfull of missed days allowed. Start time varies: When it's busy in the winter around the holidays, start times can be at 6:30 or earlier (I've had a 4:45am start time), and some days when it's slow it doesn't start until 10:45am and then gets out at 2:15 on slow days and 5:00pm or later on busy days. Hours can lead to great paychecks, but slow periods can be slow.",Fedex
114,"""Account Executive""",5.0,Great company to work for,Job duties are very demanding,Fedex
115,"""Good for Starters or Out of Job""",4.0,Management treats you good. Perks are good. New Employee have to wait a while before trying to climb up the ladder,Part time means part time and dont expect to get full hours .,Fedex
116,"""Great place to work""",4.0,The pay is very good,Benefits are not that good . The price goes up every year .,Fedex
117,"""Fed ex part time courier""",5.0,It was good to work,It was bad for time,Fedex
118,"""my thoughts""",5.0,The environment was family like. I loved my staff members. Friends till this day,During parts of the year thing will get hectic.,Fedex
119,"""Great Job and Benefits""",5.0,The learning experience and benefits,Employees aren’t giving a set schedule,Fedex
120,"""Great job""",5.0,Great pay and workers are nice,Not enough hours and boring,Fedex
121,"""Dock worker""",5.0,The job pays well enough,Weather not always the best,Fedex
122,"""Physical Job""",2.0,"Paycheck every week, fast-paced, friendly people",5-6 hours of repetitive work.,Fedex
123,"""Hard work""",3.0,"Lots of work to keep you busy. Great workout, simple instruction, get in get out.","Repetitive work, can be exhausting. Repetitiveness can make the day drag.",Fedex
124,"""Driver portal""",2.0,Driving is good for me,Oncall us not convenient for everyday life,Fedex
125,"""Operation Administrator II""",5.0,part-time hours are great - it is what I wanted,"hours 5-10 am - really early, need to wake up at 4 am",Fedex
126,"""Good""",5.0,Very busy and nice place to work,My downstairs of fedex is they put one person in a truck sometime which of course it’s not just good at all,Fedex
127,"""Good Benefits""",4.0,Good work/life balance and team culture,No career growth for women developers,Fedex
128,"""n/a""",3.0,breakroom was super cool and chill,not enough hours for me.,Fedex
129,"""Overall Quality Workplace""",3.0,Straightforward work. Enthusiastic Managers.,"Tough hours. The nature of the work creates some lazy, negative co-workers.",Fedex
130,"""workout""",4.0,work out good manger fast pace,low hrs stress it's a workout,Fedex
131,"""It's Ok""",3.0,It's a job that pays,It's just a job that pays,Fedex
132,"""Required""",4.0,It is like getting paid to exercise,It was working in the middle of the night.,Fedex
133,"""GOod job""",5.0,Job security despite economy being how it is.,Low Balling yet job security solid,Fedex
134,"""Good place""",5.0,Great hours pay great people,None that I can think of at this tome,Fedex
135,"""Package handler""",3.0,good money and great people,can be physically demanding but fun,Fedex
136,"""good company""",3.0,benfits family growth people loacation,hours location AC tier politics,Fedex
137,"""Excellent""",5.0,"Customer Oriented, Engaged, Brand Loyalty",None that I can think of,Fedex
138,"""Hard work but doesn't require specialized skills""",4.0,"Pretty good entry level pay. Benefits include Healthcare and tuition reimbursement after working 1,000 hours.",Very physical job. Your body gets beat up.,Fedex
139,"""Fedex niles""",2.0,Good work out if you’re trying to lose weight,Hard work heavy boxes no room to move up unless it’s a manager,Fedex
140,"""Enterprise Sales""",4.0,You get to meet with some of the best companies in the world. Learn their business and absorb so much knowledge. Amazing benefits. Amazing people. Work from home. Great wok/life balance.,Pay. Sales professionals are seriously underpaid for the amount of business we bring to the company. Bonus checks are quarterly and the top reps handling $100M annual business that are over plan are lucky to get 10k/quarter (before tax). Along with base salary. FedEx base salary is also below industry standard.,Fedex
141,"""Unloading and loading freight with a forklift or pallet jack""",4.0,"Relax management, great co-workers, descent pay",Policies that workers disagree with. Higher-ups usually blame the worker rather than the system placed.,Fedex
142,"""FedEx""",3.0,"Competitive pay, benefits, discounted flights","Poor management , stressful environment, hard to grow",Fedex
