,title,rating,pros,cons,company
987,"""Soul Crushing""",2.0,"Big company, well-recognized brand, rich history, nice downtown NYC office and convenient location, pay is good but not great. Weekends off. Lots of people ""work"" from home on Fridays.","Game of Thrones level politics, complete with factions, cliques, alliances. It's the worst at the VP level - those trying to make it, those trying to keep it. It's a huge distraction to the people who are simply trying to do a good job, work smart, improve our products, and do what's right for the customers.",American Express
988,"""Great work-life balance with a culture that promotes development.""",5.0,Your leaders are empowered to help you grow. Upper management pays attention to the pulse of the their teams and strives to provide a pleasant working environment. Some teams have the flexibility to work from home a few days a week.,Big corporate machine is not as nimble to get products and creatives to market. There tends to be a passive aggressive undertone that is present all around the company.,American Express
989,"""Very Good Company to work for""",4.0,"Great Culture, Great Benefits, Career Growth",There are random downsizing in the organization that occur too often.,American Express
990,"""An absolutely wondef  place to work""",4.0,"Pay, benefits, bonus structure, and paid time offf are all so generous. It's also a huge perk to get to work from a virtual office, many of their positions are work from home.","Although the pay and perks are amazing (e.g. 4 weeks vacation for a manager, starting immediately), the company expects A LOT from employees. You've got to be a major self promoter to make it here - and have thick skin. The company is always going through reorgs, cuts and the goal structure for sales and Account Development is very challenging.",American Express
991,"""Manager Business Development""",4.0,"Can make nice bonuses, work from home","Highly competitive market, requires lots of hours.",American Express
992,"""Sofware Engineer""",5.0,"Company Culture, Benefits, Flexible Schedule","Nothing I can think of, maybe location.",American Express
993,"""Director of Technical Delivery""",2.0,Aggressive bonuses for Director and above based on productivity (Cash & Stock). Great benefits outside the norm. Company culture focused on ethics and doing right by customer.,"Technology group undergoing massive change, I experienced 9 new leaders in 3 years. After becoming a bank, company saw increased regulation taking many departments by surprise. As a result, new applications needed to be developed via extreme programming causing high turnover as you cannot expect qualified resources to work 12-15 hour days with no end in sight compounded by no VP cover during inevitable escalations.",American Express
994,"""Changed work culture""",4.0,"It used to be vendor driven, super static and chaotic.Not anymore! Impressed with the change in working culture and process. Agile/Scrum, employee driven!",Not very competitive in salaries..Too crowded work places. They took it to the extreme and noisy everywhere.,American Express
995,"""American Express""",4.0,"Good benefits, diverse staff, becoming better at providing work/life balance","Once or twice a year, American Express goes through a restructuring that affects many departments and results in layoffs. This constant fear of being laid off creates a stressful culture for everyone - even those not laid off are impacted from the stress and additional work resulting from lay offs.",American Express
996,"""Associate""",3.0,Good benefits/ work-life balance and steady pay,nothing negative about this company,American Express
997,"""Account Management""",4.0,"Great spirit, leaders usually live their ""blue box values"". Salary and Benefit structure strong.","Revolving door with leaders, company is too structured and lack of flexibility impacts customer relatonships.",American Express
998,"""Business Analyst""",3.0,"Good work culture, good work ethics, good pay",Not sure mass layoff can happen anytime,American Express
999,"""Assessment sucks""",1.0,"American Express sounds like a Wonderful job but you have to pass the crazy assessment test. Any customer service position should only ask questions about you, your experience and maybe some math.","Change the assessment test to be a little easier and pertains to customer service. Other than that, the job sounds great.",American Express
1000,"""Manager""",5.0,"Flexible, work life balance, engaging",Corporate Inertia and outdated employee rating system,American Express
1001,"""Business Consultant- Commercial Acquisition Group""",4.0,"Incredible flexibility, uncapped earnings, upbeat atmosphere. Great company to work for, decent benefits, most of the leadership is good. Can be lots of fun","High pressure, cold calling sales job. High highs and low lows. Hardest job I have ever had: very stressful if you are not doing well.",American Express
1002,"""Long time American Express employee""",4.0,Great company to work for,Lots of politics at American Express,American Express
1003,"""Buinesse Analyst""",1.0,Pay. Free gym. Meet different people,Turned into a call center. Unprofessioanl managers. Poor management. Poor communication. Extreme slow remediation to every single outage/system error. Escalated calls make us helpless because there is never any solutions.,American Express
1004,"""great to work at american express""",4.0,- high flexibility - good work/life balance,- no stocks profit for lower bands - not competitive salary - org keeps changing,American Express
1005,"""Senior engineer""",3.0,"Good compensation,pay good salary and bonus Food leave policy",Too much politics and competition,American Express
1006,"""CENTURION RELATIONSHIP MANAGER""",5.0,American Express is a great company to work for.,I personally have not found anything negative about working for American Express,American Express
1007,"""Difficult""",3.0,"If you get a good team leader, it's a great job.",After a shift bid. I was stuck with a horrible team leader. The problem is American Express lets the team leader do whatever they want. I complained to HR and my leaders boss to no avail.,American Express
1008,"""Company is Ok to work for, however is changing""",3.0,"Gave me a very long career, Pay for performance, opportunities if you are a techie etc.","No longer a ""long career"" based business, Due to mistakes from upper management had to shrink work force trying to save money.",American Express
1009,"""Worked very large capability development and installation driving operational efficiency and customer satisfaction.""",4.0,Well known international brand. Commitment to external customer satisfaction. Very good benefits package. Salaries targeted to be in top 30 percentile for financial services companies.,Funding for capability development often cut if company is not making quarterly Wall Street targets. Company on a 1 Billion operating expense reduction meaning reductions in force are BAU.,American Express
1010,"""Not the most cutting edge in engineering, but hours are flexible""",3.0,"The hours are very flexible depending on your director, resulting in decent work life balance. Decent opportunities if your willing to learn and take initiative.",The office political can work against you. Performance is too reliant on useless metrics. This is a finance company so you won't be working on the latest technologies. Pay is average to below average for an engineer position.,American Express
1011,"""Senior Infrastructure Engineer""",5.0,"Great Benefits, Great people to work with, Great leadership",Competing priorities can kill productivity rather than focusing on whats good for the company rather than the micro-organization,American Express
1012,"""Senior Manager - Risk Management""",4.0,good work great culture work life balance,less pay limited opportunity for growth,American Express
1013,"""Information Security Specialist CISSP-ISSAP,CISA,CISM""",3.0,Opportunity to advance career with commensurate meritocracy,Currently right-sizing the organization and staff,American Express
1014,"""Sr. Marketing Manager LAC""",4.0,"Work life balance, flexibility, ambient","Career opportunities , too many reorganizations",American Express
1015,"""Amazing benefits""",5.0,Amazing PTO and parental leave,"Slow to change, especially with technology",American Express
1016,"""Good company to work for""",4.0,Employee focused. Great benefits. Great training as well. Compensation was well balanced too.,"Long hours, ten hour shifts.",American Express
1017,"""AMEX""",4.0,Decent benefits with generous amount of paid time off. Good career progression. Flexible work life balance.,Long work hours for exempt employees. Uncertain job security.,American Express
1018,"""Great company, but may layoffs""",4.0,"Impressive benefits package, job flexibility, the ability to work in many aspects of the company","There have been many layoffs and they don't seem to be very targeted, more like ""we need to drop X% of costs."" It sometimes feels like the company is so focused on being diverse that not being a minority is a liability.",American Express
1019,"""Great""",5.0,Really Great benefits and work,Really Big company alot of layers,American Express
1020,"""Software Engineer Intern""",3.0,Very big company with a dedicated agile methodology atmosphere and good pay.,Very bureaucratic and a lot of the teams don't really work together.,American Express
1021,"""The best work / life balance I’ve experienced yet""",5.0,"Great starting salary. Work / life balance. Growth opportunities. Transferring to other areas is encouraged (Canada, UK, etc.). The utilization of mentors is preferred if you want to move around in the company. They will help you achieve what you are looking to do long term.","Parking can get a little hectic. Nothing unbearable, though. Just make sure you arrive a little earlier than your scheduled shift to give yourself ample time to park, walk to the building, and log into the system.",American Express
1022,"""sales""",3.0,money was always good for me,co workers were scetchy in my opinion,American Express
1023,"""2016 snapshot""",2.0,1) Great work life balance 2) Good pay and benefits 3) Low risk as accountability and responsibility goals not aligned,1) Quality of talent in PHX in strictly okay!.... Herd mentality 2) Heavily reliant on low rate low quality tier 2 Indian tech firms,American Express
1024,"""Tech Internship""",4.0,"Amex is keeping up pretty well with tech and has interesting projects for interns...lots going on with integrating ML and big data, as well as on their web/mobile presence","A bit slow, but it's a function of any big company",American Express
1025,"""Team Leader""",4.0,"Great benefit, pay, some positions are virtual.",The last few years have been a little more difficult as a company with the loss of Costco.,American Express
1026,"""Travel Consultant""",3.0,SOME traveling and hotel benefits.,"ZERO home/work balance. Completely tied to the desk, tied to the phone. Getting time off is like tricking the matrix",American Express
1027,"""Best company to learn new technologies""",5.0,good for a starter / fresher,i did not find any cons,American Express
1028,"""Great""",5.0,Great company to work for,Can not think of any,American Express
1029,"""Absolutely life draining - Don't do it""",1.0,"Money, benefits. The money you make is crazy and absolutely no where else can beat that, but it is not worth it.","Management, Metrics. Even in a regular customer service area, you are FORCED to sell. You also have to think about 7+ metrics that include sales, surveys, call time etc and you WILL be micromanaged if you are disliked.",American Express
1030,"""Project Manager""",4.0,"Collaborative work environment, overall a good culture, treated with respect, pay for performance culture, great colleagues, excellent PTO, decent benefits, good flexibility","No part-time opportunities, limited career options if you are not mobile (especially to NYC), work/life balance has eroded over time, slow to enact change",American Express
1031,"""Amex is a great company to work for if you don't mind large organizations and everything that comes with it""",4.0,"The Benefits (maternity leave has been increased) and the Friendly environment (I can't speak about every team, but our team is really open)","Like every other big organization, it takes a long time to make decisions with a lot of approvals to go through before anything gets done",American Express
1032,"""Administrative Assistant""",4.0,Great place to work at and excellent work/life balance.,Professional and talented people but depends the department you work for.,American Express
1033,"""High Risk Fraud Analyst - Great job!""",5.0,Great leader Great PTO Tuition Reimbursement School Schedule flexibility Mentor available Hours of operation: Mon - Fri 7 am to 7 pm Gym on-site On-site nurse Not very many angry customers,The bonus compensation structure needs to be fixed. Bonuses cap at $450. Uncertainty about future in SLC.,American Express
1034,"""Invest in the employees more and less in reorganization""",3.0,"There are a lot of opportunities to learn and grow your skills through various avenues networking, training, and mentoring as long as you choose to take advantage of it.",Unfortunately with the numerous reorganizations in the last few years a lot of the management has decreased and it can feel like the employee and their opinions are not always important.,American Express
1035,"""Corporate Services Operations""",4.0,Great company to work for,Displacement is constantly happening since they are a global company,American Express
1036,"""inconsistent management and workhouse in operations like most large TMCs""",3.0,"good benefits; opportunity to work virtually, adequate training, ability to earn more for after hours shifts","micromanaged like most call centers, managers changed frequently, some were nonexistent presence, some were on your tail about everything; confusing process for agents. Afterhours team felt very impersonal.",American Express
1037,"""Interesting""",4.0,Working from home office is great,Not as flexible as one may think,American Express
1038,"""Work Environment is very nice""",4.0,Work Environment is very nice,"Low Salary, need to improve",American Express
1039,"""Sales Consultant""",5.0,Opportunity to make a lot of money.,Senior management have made bad decisions over the past few years.,American Express
1040,"""Technical Project Manager""",4.0,Fast paced work environment - Agile Great benefits Excellent Work Life balance,Too many VPs and personal agendas / egos,American Express
1041,"""Pricing Manager""",4.0,Work from home is great,Could use higher pay for role,American Express
1042,"""See resume""",3.0,Work life balance is generally good depending on your manager,Huge bureaucracy and slow decision making,American Express
1043,"""Company with stable work environment""",4.0,Work life balance and Decent benefits,Top heavy organization with Slow promotions,American Express
1044,"""Great place to work and achieve work/life balance""",3.0,"There are many different organizations within Amex, that provides you the ability to learn different skills. You can work within the Business organization to learn business processes and functions like Analytics, Modeling and Technical organization where you can learn about Enterprise Architecture, .net, java, Big Data, Data Management, Quality Assurance, and many others.",Amex is a Bank and it must adhere to regulatory and compliance policies. Sometimes these policies get in the way of moving innovative ideas fast to market.,American Express
1045,"""Assistant Manager""",5.0,Good exposure to solve complex business problems. Leadership is very supportive.,Slow growth and less compensation compared to other competitors.,American Express
1046,"""Call Center""",3.0,Great benefits nice campus decent cafeteria,low pay for back to back phone calls from customers who verbally abuse you because of bank fees and interest.,American Express
1047,"""Senior Manager""",4.0,good work life balance and great people,slow to make decisions and not quick to innovate,American Express
1048,"""Operations Manager""",4.0,Great over all company to work for and benefits,"Depending on your organization, it can have a very clickish feel and if you are new, you may not fit in. Especially if you come from another company with a different culture. This doesn't rep the whole company. Just the organization I worked in.",American Express
1049,"""Great Credit Card and Company""",5.0,It is a very fun and friendly environment.,The hours are a little long but worth it,American Express
1050,"""Compliance Analyst""",4.0,"Great co-workers, good benefits, flexibility","No room to grow, promotions are few, pay raises are few or very small",American Express
1051,"""Been at the company for 7 years""",3.0,"Flexibility, focus on work-life balance. Strong place to learn marketing.","Too much focus on alignment, decisions making is slow. and is too political. Salary is on the low spectrum compared to other financial service companies.",American Express
1052,"""Excellent company to work for - great benefits, work life balance.""",4.0,"Powerful global brand with excellent products and services, as well as a great service ethos. Smart, driven and diverse staff.",The company is overly matrixed and bureaucratic often with an eye on short and mid term goals rather than long term vision.,American Express
1053,"""Director""",4.0,"Fantastic brand, strict adherence to ethical business behaviors, strong internal resources, will-to-win culture","Way too many meetings, analysis paralysis at times, lack of long-term visionary thinking in the payments space, internally centric",American Express
1054,"""Good Work, Needs more structure""",4.0,Great work and opportunities to learn,Skill to job mapping is sometimes inaccurate,American Express
1055,"""Has the potential to be a great place""",3.0,"Tuition Reimbursement, Training/Certifications, Diverse Workplace, Many Opportunties","No longer values the perspective of tenured employees. Too many talking heads, Too many silos, Brutal internal politics, Many sycophants.",American Express
1056,"""Finance Forward""",5.0,"- Wonderful work life balance - Good pay, competitive benefits package - Mobility to move around the firm every 18 months - 2 years - Flexible work schedule",None at this point in time,American Express
1057,"""Loan Admin, or sales for the product:  American Express""",5.0,Reputation for class and quility,Could be a long drive from my home?,American Express
1058,"""Great work-life balance, but day-to-day can be incredibly frustrating""",4.0,"Great work-life balance, benefits, and mostly competitive salaries","A lot of red-tape, not much innovation since there are very few recent graduate hires, unable to retain best talent. Experience is highly dependent on your direct leader, which can be a pro too, but more often a con.",American Express
1059,"""Working at Amex""",5.0,Employee centric organization & good work life balance,It is a large company and decision making can be slow,American Express
1060,"""Merchant Analyst""",4.0,Good company to work for,Can be cliquey within the departments,American Express
1061,"""Great leaders, lots of politics""",3.0,"String leaders, collaboration is strong, benefits are good, some units have a great deal of flexibility in working hours.","Politics, hard to introduce change, innovation in some areas are lacking",American Express
1062,"""Everyone is waiting for their golden parachute.""",1.0,"Severance, severance, severance, severance, severance.","Too many VPs, siloed teams that are not motivated beyond their Goals. Exploit H1 Visa's to bring their off-shore model on-shore. Dishonest leadership has the backing of HR to lie and slander direct reports.",American Express
1063,"""Account Development Consultant""",5.0,"Loved the career. Easy to scale company. Reputable brand, personable CEO, upper mgmt is pristine.","None whatsoever, everything has been a blast.",American Express
1064,"""Vice President, Operational Risk""",3.0,Flexibility to work at home and understanding of work life balance.,Continuous cycle of cutbacks and layoffs without really reengineering of processes. Just expected the few remaining to do more with less. Significant turnover in the good senior leaders and what's left are those that were mediocre senior mgmt. limited opportunity once you reach first level VP if you aren't in NY.,American Express
1065,"""Great Company, But Very Bureaucratic""",4.0,"Great Hours, get to work from home on Fridays, fantastic coworkers who truly are about your well-being","Sometimes the line between work and personal life gets meshed, often have to but heads with upper management to drive interest in your projects, lots of approval necessary to get anything off the ground.",American Express
1066,"""Director Global Compensation""",5.0,"Work life balance, good leadership","Flat structure, limited benefits.",American Express
1067,"""Miss it there""",5.0,"work life balance, great work, great people","slow to promote, salaries on the low side",American Express
1068,"""The best company I have worked for""",4.0,"Incredible customer focus, actively reinventing the business to remain relevant, very strong brand, work life balance is a core value, and the people are genuinely nice to one another and great to work with","The pay is lower than what tech talent can make elsewhere, the annual review process is at complete odds with the collaborative culture",American Express
1069,"""Disaster Recovery and Business Continuity""",5.0,Great atmosphere to work in. Management cares!,Culture changed after being less of a wholly owned subsidiary.,American Express
1070,"""Good if you like sales""",4.0,"Good coworkers, commission structure, good food","Stressful, hard to get people on the phone at times, if you're not doing well they fire you after a while, no real training",American Express
1071,"""Great Company""",4.0,Hard to get fired.Have fun learn.,Job gets boring.Do after work activities.,American Express
1072,"""Good place to work""",4.0,Strong culture and collaborative environment,Large company with frequent organizational changes,American Express
1073,"""Young folks""",3.0,Chilled out environment to work,Business and tech don't talk,American Express
1074,"""Credit card undewriter""",3.0,working at home twice a week,micro management and sexual harassment across the company,American Express
1075,"""Good company""",5.0,Employee and customer friendly Good benefits Strong history,Going through tough times as I write this Lay-offs,American Express
1076,"""Good benefits, impossible goals""",3.0,"Really good benefits, it's stable. I really liked my coworkers and made some good friends. My manager was cool, too.",The goals are so aggressive they make it so you can't hit your bonuses or make extra money. Not an encouraging environment.,American Express
1077,"""Sr Engineer""",4.0,"Excellent work culture, Flex timings","Frequent layoff's , future growth concerns of the company",American Express
1078,"""Project Manager at AMEX""",4.0,"Good campus, benefits, leadership, flexible hours,","Compensations, many goals and reviews",American Express
1079,"""Industrial Engineer""",5.0,"Great benefits, great work life balance. Lots of opportunity for growth. Great projects to work on","Lot of reorganizational changes, as with any big company. Lots of levels to pass through when receiving tasking. Low end pay",American Express
1080,"""Great place to work... except""",4.0,"The culture is amazing, with very talented and savvy people.","The biggest con is that every 3-5 years they look for ways to cut back, and it's always by cutting people. I worked there at total of 17 years, and was the victim of ""reduction in force"" five times. Three times I found a new job within. One time I left and was gone for three years. The last time happened last year, and I think this time it's for good. I've heard that they're hiring again, but it is a constant cycle and one you have to be aware of and learn to not take personally if you want to stick around for the long-haul.",American Express
1081,"""Fallen out of favor for the past few years""",3.0,Flexible work arrangements Ample paid time off allocation,Work-life balance Way too much political nonsense Some people lose paid time off because they are unable to take the time off,American Express
1082,"""Manager""",3.0,"good pay, benefits, work from home",I didnt like working virtual. Felt isolated,American Express
1083,"""AMEX - CSR""",2.0,Compensation was acceptable. Company culture was good.,Benefits Package was not as competitive as other companies of the same size. Growth Opportunities were lacking.,American Express
1084,"""Software Engineer Job""",3.0,Very flexible work hours. Very laid back culture. Not too tasking/ too much overtime. 6% company match is nice.,"Not very interesting work if you are interested in creating the next big thing or using newer technologies. Not a lot of structure in the org. Tons of questions on responsibilities due to lack of needed roles. Despite firing lots of contractors, there is still ~50% of developers as contractors. Not as competitive pay. Tons of work on legacy system / code.",American Express
1085,"""Excellent company to work for""",4.0,Work/life balance; excellent parental leave; ongoing support for working parents; leaders supportive of individual development,"No company is perfect. Overall, this is a great place to work.",American Express
