,title,rating,pros,cons,company
1084,"""Huge industry name""",3.0,"Excellent company name, competitive pay, great coworker and easy location for commuting.",One thing that disturbs me about this firm which is the lack of diversity in the front office. I have worked front office at other major investment banks and you can literally count the number on one hand in the NYC office. It certainly is not an issue of not having qualified candidates because I have been part of many interviews with perspective employees. Morgan Stanley has a very extensive hiring process in which you will meet with a minimum of 10 people. I was actually shocked when certain people would be hired over others based on minor facts around how certain questions were answered vs the candidates proven track record of excellence.,Morgan Stanley
1085,"""Associate""",4.0,Great company to start your career in financial services-provides a good learning environment and a strong culture.,Lot of support and maintenance work.So one needs to proactively manage their growth.,Morgan Stanley
1086,"""Analyst""",4.0,"Strong firm culture, and competitive salary and benefits for an entry level position straight out of college","Like any job in the finance world, there can be long hours",Morgan Stanley
1087,"""Operations""",3.0,Good benefits and vacation days (20). Remote in from home regularly.,"Pay could be much better, temporary employees are alienated. Work Life Balance is non existent.",Morgan Stanley
1088,"""Experiences Vary by Division""",3.0,If you have a great manager you will have a better experience but if you don't prepare to suffer with very little recourse.,"Very elitist, can be a lonely place for people who are used to a friendly atmosphere.",Morgan Stanley
1089,"""Associate""",5.0,"Great firm, great collegues, great technology, great projects, great benefits, great work life balance more words more words more words","Sell side, large company, risk reward, training, pressure to perform constantly, stressful day to day job more words more words more words",Morgan Stanley
1090,"""FAA Program""",3.0,"Good resources, support, technology, etc.","High pressure sales environment, prioritizing clients vs. firm is difficult in fee-based environment",Morgan Stanley
1091,"""Review""",3.0,"Strong company rep, financial advisors are among the industrys top professionals. Resources are available, research in particular is stellar. Wealth management services are endless","Company initiatives forced on employees. Uptight dress code, very high workload. Compliance policies are overbearing and cumbersome. Internal systems can use improvement.",Morgan Stanley
1092,"""CSA""",5.0,Smart people that were great,No pension but retirement was up to par,Morgan Stanley
1093,"""Intern""",4.0,Felt right at home with the office,The work can be repetitive,Morgan Stanley
1094,"""Private Wealth Management Client Service Associate""",5.0,"A really incredible company to work for. They really want to make sure employees are taken care of in every aspect. The environment is so welcoming and there is so much to learn. As a CSA in your first 2 years you make a base salary of $55,000 in my case. I am also eligible for over time as well which is a great plus! Great job right out of college and great way to get into a top bank.",Have not received a bonus this year which is surprising. The only thing I have received is $500 added onto one of my paychecks. This can be a tough job to grow in as most of these teams have people running them who have been around the firm for a long time. When they retire they typically hand their books over to the next oldest advisor on the team that isn't retiring.,Morgan Stanley
1095,"""Analyst""",5.0,Morgan Stanley provides their employees with a great work environment as well as senior employees that truly care. Great benefits.,Some times the hours can be demanding due to market hours. People can let high intensity environment change the way they act.,Morgan Stanley
1096,"""Morgan Stanley""",4.0,Great company with diverse areas to grow within the company.,Depending on the branch manager equal opportunities are not for everyone.,Morgan Stanley
1097,"""Morgan Stanley really taught me a lot about software engineering""",5.0,I loved my team at MS. They were all very helpful and it was not the cut throat wall street environment that I expected. Would love to be hired again!,At times the work wasn't as interesting as I was hoping but I really learned a lot by doing the grunt work and handling the backend side of the company's internal web tools.,Morgan Stanley
1098,"""Good employer, good work environment""",4.0,I like that there are plenty of resources to enable the employees to be successful in their line of business,It is such a large environment that sometimes things fall through the cracks and it becomes difficult for people to communicate.,Morgan Stanley
1099,"""Generally a good place to work""",3.0,Great brand to have on your resume,Lots of office politics and things moved slowly,Morgan Stanley
1100,"""good experience""",5.0,Morgan Stanley is a great name to work for and gives you a lot of flexibility with what you want to do if you ever decide to leave. Great perks.,Sometimes boring and not enough work to do,Morgan Stanley
1101,"""The Good, the Bad, the Ugly""",3.0,"More the most part everyone is really nice, and everyone gets along. The office building is nice, and there is a gym available for those that want to use it.","Getting supplies is very hard, people have to hide Letterhead and when you do ask for it you only get a few sheets at a time. They only get basic supplies and if you need or want something particular you have to pay out of pocket. They don't pay for parking, which is over $200 a month no matter where you park.",Morgan Stanley
1102,"""An Absolute Joke""",2.0,Vacation time- 4 weeks total including a mandatory 2 week vacation Overall company culture is great including the emphasis on volunteer work Great CEO,"It's an absolute shame that employees that help your firm make money is paid severely below market value. In addition, upper management seems to look down upon the Baltimore office ( a very A team/B team mentality at play). Upper management does not seem to care about employees' career paths- they'll ask you because they're supposed to but mine have never acted upon the things I mentioned in those meetings. If you are interested in coming here- do your best in your given role, learn as much as you can, and leave for another company that will pay you correctly and support you as an employee.",Morgan Stanley
1103,"""Business Strategy Consultant""",4.0,High level individuals that are great to work with.,Work schedule is not balanced.,Morgan Stanley
1104,"""good place to work for""",5.0,was good place to start,no cons for me now,Morgan Stanley
1105,"""Good Experience""",4.0,Very Professional - They were attentive and listened to me.,No cons for Morgan Stanley. Good Experience,Morgan Stanley
1106,"""Software Engineer""",3.0,"Good benefits, nice culture. Room for growth",High turnover. Management under pressure to deliver results,Morgan Stanley
1107,"""Average experience""",3.0,Smart coworkers and interesting projects,Bonuses are on the low end,Morgan Stanley
1108,"""advisor""",5.0,great people to work with,large company not a small company feel,Morgan Stanley
1109,"""Great place to start career""",4.0,"Great training, mentorship, network and opportunity for advancement",Long hours can be rough,Morgan Stanley
1110,"""Associate SRU""",3.0,"Great work/life balance, autonomy, generous PTO",Pay is not competitive,Morgan Stanley
1111,"""Great people and good training ground""",5.0,Learned a lot. Never would have gotten my current job without the training I received here.,Worked long hours and lots of bureaucracy.,Morgan Stanley
1112,"""Strats""",5.0,"Great core values, sound compensation, interesting people",Work life balance could probably be better for entry level positions,Morgan Stanley
1113,"""Silly Policies""",2.0,People who you work around are nice and helpful,Crazy polices in place that made it impossible to move up,Morgan Stanley
1114,"""Great Company""",4.0,"Great Company, with great values .",Healthcare benifits not as per most other companies.,Morgan Stanley
1115,"""It is pretty good""",4.0,show respect and quite work-life balance,"not very free-style, and focus on business",Morgan Stanley
1116,"""Financial Advisor Associate""",3.0,"Good resources, decent work-life balance.","Low pay, job entails cold-contact sales, salary declines over 36 months.",Morgan Stanley
1117,"""Great company on its downward path for technology""",3.0,good work life balance overall,compensation is very poor and still going down. more jobs being offshored,Morgan Stanley
1118,"""Not good if your new""",2.0,Best resources available in the industry,"Throw you to the wolves, no manager support- if your new and don't have a book of business your wasting your time. Management sets you up to fail from Day 1",Morgan Stanley
1119,"""Okay place to work""",3.0,"Good pay, good vacation benefits.",No team work or team mentality. Everyone is out for themselves.,Morgan Stanley
1120,"""Educational Internship""",5.0,"Good exposure to different desks, pretty personalized","Less time on desk means less time spent doing projects, and you end up doing less complex things than you might otherwise over the summer",Morgan Stanley
1121,"""Not a meritocracy, questionable decisions made at sr lvl""",1.0,"Interesting work, some smart people you can learn a lot from. The benefits - free access to museums, etc are on par with industry.","Long hours, more than happy to work you to the bone without compensating that (it’s expected) or even a thanks, penny pinching (e.g. no means to formally recognize an individual or team, no holiday parties, etc), raises and bonuses small/non-competitive. Also, you need to be very ok with grey areas, doing things you’re uncomfortable with for wrong reasons. Appearance/politics most important - for example, on a regular basis, mgmt would rather make a wrong decision quickly without accurate info or enough facts and even when better decisions are proposed at the same time by the team or by an individual behind closed doors. Why? Mgmt would rather appear to be decisive, save face, stand by their decision, and have the team waste time by following that bad approach/decision...inevitably, when it’s beyond clear the bad decision is bad, mgmt proposes a “new” (I.e. original suggestion by the individual/team) decision as their own, doesn’t apologize or admit their mistake (ever) and the team starts all over again. In spite of that, mgmt still wants the work yesterday and demands the team meet the same deadline (even though they caused several days to be wasted already). This is almost always announced at 5 or 6pm even though they’d already changed their decision that morning! Similarly, mgmt is more comfortable with communicating incorrect info both internally and externally for appearance (rather than getting back with an answer - because then it doesn’t appear as if they’re all-knowing) and so they can take the opportunity to “look good” in front of peers and those more senior. Employees I worked with at the time and former employees I’ve since met have the same gripes.",Morgan Stanley
1122,"""Financial Analyst""",4.0,Large organization with a plethora of investment research materials at your disposal. Most of the staff so far are also quite civil.,Lots of red tape. Can be particularly challenging to get things down if you are trying to produce a customized solution.,Morgan Stanley
1123,"""Summer Intern""",4.0,Good atmosphere and people were nice,Didn't do any meaningful work,Morgan Stanley
1124,"""big company, good benefits, bad culture""",3.0,"good safety net with benefits package, relative job security","competitive culture, long hours, highly competitive internally",Morgan Stanley
1125,"""Project Manager""",3.0,"Good working environment, good learning opportunity",Aggressive. Other than that it is pretty good to work here,Morgan Stanley
1126,"""Conservative, talented""",4.0,"Very smart people and can learn from each other. Well oiled machine with very mature processes and procedure. Culture of consensus, teamwork and respect.",Parts of the firm are under staffed leading to a stressful environment. Career and pay is based more on politics and less on performance. Out of touch with the external world especially in the technology divisions.,Morgan Stanley
1127,"""Financial Advisor""",4.0,Management invests a lot of resources and really cares about your success.,"It is obviously a giant corporation, and every little thing has to go through multiple regulatory channels, and works against efficiency.",Morgan Stanley
1128,"""Wealth Management Intern""",5.0,"Culture, Work experience, overall positive morale","Early hours, administration work, stressful",Morgan Stanley
1129,"""Good Job""",5.0,Paid Series 7 Licensing Paid salary while gathering your book of business,Alot of hours No Job Security,Morgan Stanley
1130,"""MSIM Politics""",3.0,MSIM Specific - Good Location close to train,Management turnover at MSIM every 3 to 4 years. Promotions all political,Morgan Stanley
1131,"""Financial Advisor""",3.0,"Top-notch in terms of available resources, from firm technology to market research to investment models/managers/products. Strong reputation and brand recognition. Reasonable incentive-based revenue model.","Very little (if any) guidance or mentoring to incoming financial advisors, especially in re: prospecting and building a book of business. Unless you are joining an established team, you are very much on your own. On the other hand, joining an established team can leave you with very little leverage over revenue split agreements, etc.",Morgan Stanley
1132,"""Software Developer""",5.0,"Great pay, great vacations, great benefits",No idea for now since I dont have for now,Morgan Stanley
1133,"""Largest Wealth Management firm""",4.0,"Excellent compensation, great professional skill development and networking opportunities","Work life balance, upper management is disconnected from issues that branch staff face, back office support is inconsistent with answers and reliability",Morgan Stanley
1134,"""FAA program""",2.0,There name. It's a big name to an extent more people are familiar with Merrill lynch in anchorage. The branch manager in anchorage is very helpful.,Very little guidance or resources coupled with super High hurdles with limited time and constant pressure you will be fired. Race and gender issues.,Morgan Stanley
1135,"""Excellent company with positive outlook""",4.0,"Smart peers, good corporate culture. Decent work life balance (gets crazy sometimes but that's banking). Good benefit package/401K and good senior leadership.",Stingy/no raises and always get excuses on comp at end of year. Ops is constantly getting squeezed to do more with less (people and $$$).,Morgan Stanley
1136,"""Operations Analyst""",4.0,Great opportunity with potential to advance,Pay increases seem to be limited and based on overall revenue for the company,Morgan Stanley
1137,"""associate""",3.0,Good people and culture good flexibility,"overhead , changing focus, org structure",Morgan Stanley
1138,"""Good as any other""",4.0,Sense of community and strong management,Highly competitive and hard to fit in with coworkers,Morgan Stanley
1139,"""Operations""",3.0,"Good benefits, 4 weeks vacation per year.","Underpaying, bureaucratic, working environment needs improvements",Morgan Stanley
1140,"""Client Service Associate""",4.0,Good corporate culture.,Not everyone in the office was on the same page. Everyone competes with one another for business as they are all on difference teams.,Morgan Stanley
1141,"""Great culture; Low Pay""",4.0,Excellent culture; colleagues very respectful to each other Great hours- no useless long hour business Really smart people-some of the smartest on the street! Great brand value,Below standard compensation even for top performers No raise/ minimal raise on promotion even at higher levels! Red tape when making important urgent decisions.,Morgan Stanley
1142,"""Internship""",4.0,"Learning on the job, nice people","not always a lot to do, a lot of intern tasks",Morgan Stanley
1143,"""Wasted 5 years of my life here""",1.0,"Big name, easy job",Terrible pay for the industry. Excuses every year when it comes to bonus time. Awful middle managers that have no power or ties to compensation. No training or opportunities for advancement. Layoffs pretty much every year around Christmas time regardless of company performance. A truly soul less company that treats their employees like a number on a sheet. 6 out of the 11 people on my team have quit in the last 2 months. I came in to MS as a bright eyes optimistic analyst and am leaving depressed and hating people and corporate culture.,Morgan Stanley
1144,"""Associate""",4.0,Ownership on the projects and products working on,Poor compensation/ bonuses in technology departments No incentives/ perks Less focused on bringing in new technologies,Morgan Stanley
1145,"""ok""",4.0,nice friendly place and enviorment,not much to say great team,Morgan Stanley
1146,"""Wealth Management Compliance""",4.0,"Strong culture, collaboration, community oriented, charitable/volunteer opportunities, good opportunities to grow within Firm.",Flawed employee performance scale and bonus structure.,Morgan Stanley
1147,"""Financial Advisor""",4.0,"Good Growth Opportunities, Good Benefits",It is a Large Company,Morgan Stanley
1148,"""FAA Program is a scam""",3.0,Decent salary up front is appealing,"Training is horrible, they bring you in to be a phone bank, pay at a nothing rate, and the service is so spotty you always have to take the blame for errors or rejections in accounts that you could have never known about.",Morgan Stanley
1149,"""Analyst""",4.0,1. Enjoy the analyst culture 2. Great pay and paid vacation 3. Learning opporunities,1. Tough work-life balance 2. Takes longer to climb to MD than other banks,Morgan Stanley
1150,"""Morgan Stanley Bank""",5.0,Great work environment. Good work work - life balance. Lots of company benefits. Work can be challenging and diverse. Great coworkers.,Raises aren't great and bonuses are hit / miss. Work can also be a bit monotonous at times. The SLC office has its own culture than that of NY. This can be a pro and con depending on the situation.,Morgan Stanley
1151,"""Failing FAA program, but great training for beginners""",5.0,Great platform Great resources Great training Great co workers Great autonomy,Failing FAA program Revolving door Not enough accountability Goals increase way too fast,Morgan Stanley
1152,"""Never ending changes.""",3.0,The people who work in operations are amazing. Always willing to help if needed. The pay is above average.,"Policies change on a whim. Whoever is making the changes in corporate obviously don't care for opinions from those working on the frontlines, nor the clients for that matter. Also, the service center is incredibly understaffed. They seem to bring on temporary employees every few months and then let 99% of them go, just to go on another hiring binge..",Morgan Stanley
1153,"""Analyst""",5.0,Team oriented culture. Crash course in becoming an investment professional.,Programs don't allow mobility or growth.,Morgan Stanley
1154,"""Smart team and great firm""",4.0,"-loved the work environment -dedicated, smart team - good ethics",-hours were difficult -inflexible scheduling,Morgan Stanley
1155,"""Morgan Review""",3.0,"Salary, location, benefits, status,","Micro managers, no raises or performance bonuses",Morgan Stanley
1156,"""Like any other wirehouse""",4.0,If you associate with a high-producing broker (at least $2million in gross per year) then you can make pretty good money. There are a lot of branches nationwide with many support staff openings if you ever need to relocate.,Benefits are all mediocre. They're goal seems to be simply to match what the other wirehouses offer.,Morgan Stanley
1157,"""Compliance Anyalst""",5.0,Stressful in regards to working in that particular department.,Good company to work for.,Morgan Stanley
1158,"""Vice President""",4.0,Mobility is encouraged after 18 mos,Bureaucratic at times and reviews are not consistent,Morgan Stanley
1159,"""Excellent leader in wealth management""",4.0,"Great people, good training and streamlined work culture.","Common to the wealth management industry, ultimately it's about the numbers and what you bring in.",Morgan Stanley
1160,"""Hiring Process""",2.0,"Name value, one of the best financial firms in the world",Operation part needs to develop,Morgan Stanley
1161,"""Morgan Stanley Investment Management Legal Dept""",2.0,Job security Strong Brand I like my peers,compensation weak management/leadership quality of work legal dept held in low regard by business unit,Morgan Stanley
1162,"""Worst of Corporate America""",1.0,Strong brand name. Not much else.,"Meritocracy doesn't exist. Promotions are given to those who don't threaten upper management, not to those who work hard or produce innovative ideas or who put the client first (which is ironic, since this is a stated company value). The company claims to be a thought leader but proposing or fighting for new ideas is the best way to limit your career at the firm. Group conformity is encouraged over the desire to genuinely help the company and its clients. In my experience the least talented people were the first to get promoted, which is the complete opposite of the meritocratic culture I experienced in every other culture in which I worked in which hard work and innovative ideas were valued. The culture is toxic. Meritocracy doesn't exist. Conformity is valued over ""doing the right thing."" Over time your skills, drive and ability to develop new ideas will diminish due to the pressure of the organization to conform to standards of mediocrity (at best). After working there I'd never recommend the firm either as a place to work, as a partner with which to do business or as a place to manage my assets.",Morgan Stanley
1163,"""Pros and Cons""",3.0,"Brand recognition, (if you run into a client with good experiences), product selection, and not much else.","Management does not have your back, you are only as good as your last production month, horrible payout structure.",Morgan Stanley
1164,"""I am 10year old my 50doller bill got rip I half and I love kids""",3.0,I'm getting pad of doing what I like to is very cool and there some people that I babysit and there parents say I am supper great at it,I don't have a car so my dad has to pick me up and I have to go to school for now until summertime comes,Morgan Stanley
1165,"""registered associate""",3.0,"wealth management business is growing, excellent access to market research and insights, on-going Tech training, opportunity to learn about all facets of the business, treat clients as top priority, great service to customers",management is not actively involved in making sure it is a workplace of respect and integrity. the firm always does the right thing for the client but not always for its own employees. certain advisers are very disrespectful and management does nothing to change it because the advisers are tied to revenue,Morgan Stanley
1166,"""Best Place I've Ever Worked""",5.0,Ops Management - Stellar management Autonomy - Freedom to run with your ideas (if they are good ideas) Growth - Utah is a fast growing business state and it's looking like much of their growth will be directed to Utah,"While my job specifically is not this way, I've heard much of the ops work can be monotonous. They are trying to automate much of that monotony out, but a lot of the work is still monotonous. 18 Month Lock In - One you accept a position, you are supposed to remain there for 18 months before moving laterally or vertically",Morgan Stanley
1167,"""Overall solid working experience""",5.0,"tone at the top, moral/ethical values, work / life balance, training and guidance from internal / external parties","marginal increases in salary, high turnover",Morgan Stanley
1168,"""Good learning experience but became very bureaucratic post 2008""",4.0,"Smart people, interesting work. You will learn a lot in a short period of time",Long hours and became very political/bureaucratic after the financial crisis.,Morgan Stanley
1169,"""Fianace analyst""",4.0,Morgan Stanley provides great mobility and has a great culture,The pay is decent,Morgan Stanley
1170,"""Good start for college grads""",4.0,Decent salary with plenty of room for growth if you know how to navigate the system,"It can be a Stressful environment, petty staff, demanding at times. It can be very challenging and you'll live for Friday's",Morgan Stanley
1171,"""FA Associate Program""",5.0,"Great benefits, great staff, many advisors are genuinely looking to help.",individualistic culture. One is not given any leads. One has to develop all business organically from nothing. So join only if you have natural network of at least 30mil for you to succeed after 3 years.,Morgan Stanley
1172,"""Great Solid Company""",4.0,"Awesome team to work with, great supervisors and team morale",Cold Calling if it's not your thing,Morgan Stanley
1173,"""Associate""",4.0,"I have worked with Morgan Stanley for 14 years. I have no regrets. I have learnt so much in all my years, my experiences are so innovative, my skills have increased. I will work again for Morgan Stanley",It is hard to find,Morgan Stanley
